{"run":47,"commit":"8452044","metric":1,"metrics":{},"status":"discard","description":"Pushed the learned duration-cap factor to 2.0 on top of the Stage-1 duration head and the winning scheduled-sampling setup. This produced much more reasonable final caps (69 OOD / 83 in-domain) and improved CER to 0.909, but the primary metric still stayed at asr_wer_prefix=1.0 and EOS remained absent.","timestamp":1773431524100,"segment":0}
{"run":48,"commit":"8452044","metric":1,"metrics":{},"status":"discard","description":"Combined the learned Stage-1 duration cap with the stronger mixed-text recipe (text_source=both, semantic_duration_loss_weight=0.1, semantic_use_duration_predictor=true, factor=2.0, semantic_self_condition_prob=0.5, semantic_eos_weight=2.0). This reached a useful-length regime again (53 OOD / 71 in-domain frames) and improved CER to 0.818, but the primary OOD metric still stayed at asr_wer_prefix=1.0.","timestamp":1773432292228,"segment":0}
{"run":49,"commit":"8452044","metric":1,"metrics":{},"status":"discard","description":"Stacked the strongest remaining secondary-metric clues together: mixed normalized+raw text, heavier Stage-1 weighting, and the learned duration cap (text_source=both, semantic_loss_weight=2.0, acoustic_loss_weight=0.5, semantic_duration_loss_weight=0.1, semantic_use_duration_predictor=true, factor=2.0, semantic_self_condition_prob=0.5, semantic_eos_weight=2.0). It still failed on the primary OOD metric: asr_wer_prefix stayed 1.0 despite a controlled 63-frame generation and decent CER 0.864.","timestamp":1773433041915,"segment":0}
{"run":50,"commit":"8452044","metric":1,"metrics":{},"status":"discard","description":"Replaced stage-1 with a lightweight non-autoregressive text-to-frame Q0 upsampler on top of frozen Qwen text-prefix hidden states (semantic_non_ar=true, use_lora=false) and paired it with the strongest prior clues so far: mixed raw+normalized text, heavier stage-1 weighting, and a p95-style frame heuristic (text_source=both, semantic_loss_weight=2.0, acoustic_loss_weight=0.5, semantic_length_heuristic_frames_per_text_token=4.8, factor=1.0). This trained much faster (~41k samples / 10 min, 60 samples/s) and produced controlled 53-frame outputs, but final asr_wer_prefix still stayed at 1.0.","timestamp":1773434273864,"segment":0}
{"run":51,"commit":"8452044","metric":1,"metrics":{},"status":"discard","description":"Retried the non-autoregressive text-to-frame Q0 upsampler with LoRA-enabled Qwen adaptation instead of a frozen text encoder (semantic_non_ar=true with text_source=both, semantic_loss_weight=2.0, acoustic_loss_weight=0.5, p95-style 53-frame heuristic). Throughput remained decent (~32k samples / 10 min), but OOD quality regressed: final asr_wer_prefix stayed 1.0 and CER worsened back to 0.955.","timestamp":1773435059881,"segment":0}
{"run":52,"commit":"8452044","metric":1,"metrics":{},"status":"discard","description":"Scaled up the frozen-Qwen non-autoregressive text-to-frame Q0 upsampler substantially (semantic_non_ar_hidden_dim=768, num_heads=12, num_layers=4, mlp_dim=1536) and pushed optimization even harder toward Stage 1 (semantic_loss_weight=4.0, acoustic_loss_weight=0.5) while keeping the p95-style 53-frame cap. Despite the larger capacity and still-fast training (~36k samples / 10 min), the OOD result regressed: asr_wer_prefix stayed 1.0 and CER worsened to 1.0.","timestamp":1773435784420,"segment":0}
{"run":53,"commit":"8452044","metric":1,"metrics":{},"status":"discard","description":"Strengthened the non-autoregressive stage-1 upsampler by letting frame queries attend to the full packed text prefix inside the upsampler itself, then reran the frozen-Qwen mixed-text recipe (semantic_non_ar=true, use_lora=false, text_source=both, semantic_loss_weight=2.0, acoustic_loss_weight=0.5, p95-style 53-frame cap). Throughput stayed excellent (~40k samples / 10 min), but the OOD metric did not move: final asr_wer_prefix remained 1.0 and the outputs were still short nonsensical fragments.","timestamp":1773436557873,"segment":0}
{"run":54,"commit":"8452044","metric":1,"metrics":{},"status":"discard","description":"Tried accelerating the frozen-Qwen non-autoregressive stage-1 path with a much higher semantic learning rate while keeping the residual branch slower (semantic_learning_rate=1e-3, residual_learning_rate=2e-4 on top of semantic_non_ar=true, use_lora=false, text_source=both, semantic_loss_weight=2.0, acoustic_loss_weight=0.5, p95-style 53-frame cap). It still failed on the primary metric and actually worsened character similarity to asr_cer=1.0.","timestamp":1773437280053,"segment":0}
{"run":55,"commit":"8452044","metric":1,"metrics":{},"status":"discard","description":"Added a multi-token-prediction auxiliary to the autoregressive stage-1 semantic decoder: from each hidden state, predict the next two future Q0 tokens as well as the standard next token (semantic_future_prediction_steps=2, weight=0.5) on top of the winning scheduled-sampling setup. The primary metric still stayed at 1.0, but this looks more promising than the recent non-AR runs: CER improved to 0.773 and in-domain WER improved to 0.778 without sacrificing stability.","timestamp":1773438213674,"segment":0}
{"run":56,"commit":"8452044","metric":1,"metrics":{},"status":"discard","description":"Combined the new stage-1 multi-token-prediction auxiliary with the strongest text-conditioning and length-control clues (text_source=both, semantic_future_prediction_steps=2, semantic_future_prediction_weight=0.5, semantic_self_condition_prob=0.5, semantic_eos_weight=2.0, p95-style 53-frame cap). OOD asr_wer_prefix still stayed at 1.0, but this is now one of the strongest secondary-signal runs: CER improved to 0.818 and in-domain WER improved sharply to 0.444.","timestamp":1773438960691,"segment":0}
{"run":57,"commit":"8452044","metric":1,"metrics":{},"status":"discard","description":"Tried the stage-1 multi-token-prediction auxiliary with the stronger mixed-text conditioning but without the short inference cap (text_source=both, semantic_future_prediction_steps=2, weight=0.5, semantic_self_condition_prob=0.5, semantic_eos_weight=2.0). It still failed on the OOD primary metric at 1.0 and lost the in-domain gain from the capped version, confirming that the shorter cap was helping secondary metrics rather than hiding a true primary win.","timestamp":1773439708151,"segment":0}
{"run":58,"commit":"8452044","metric":1,"metrics":{},"status":"discard","description":"Pushed the autoregressive stage-1 multi-token-prediction auxiliary further by predicting four future Q0 tokens per hidden state, combined with mixed text conditioning, scheduled sampling, EOS weighting, and the p95-style 53-frame cap. This produced the strongest structural-training secondary signals so far (OOD CER 0.727, in-domain WER 0.444), but OOD prefix WER still stayed at 1.0; the OOD transcript was closer phonetically ('Hell, just a lot of, a lot of.') yet still wrong word-for-word.","timestamp":1773440482739,"segment":0}
{"run":59,"commit":"2bf02f5","metric":0.6666666865348816,"metrics":{},"status":"keep","description":"Strengthened the autoregressive stage-1 generated-prefix objective by adding multi-token prediction over four future Q0 steps while keeping the best scheduled-sampling recipe and the p95-style inference cap (semantic_future_prediction_steps=4, semantic_future_prediction_weight=0.5, semantic_self_condition_prob=0.5, semantic_eos_weight=2.0, semantic_length_heuristic_frames_per_text_token=4.8, semantic_length_heuristic_factor=1.0). This is the new best result: final asr_wer_prefix improved to 0.6667, asr_cer improved to 0.636, and in-domain WER improved to 0.556.","timestamp":1773441250137,"segment":0}
{"run":60,"commit":"2bf02f5","metric":0.6666666865348816,"metrics":{},"status":"discard","description":"Ablated mixed raw+normalized text from the new best structural setup, keeping scheduled sampling, EOS weighting, four-step multi-token prediction, and the p95-style 53-frame cap (semantic_future_prediction_steps=4, weight=0.5, semantic_self_condition_prob=0.5, semantic_eos_weight=2.0, heuristic 4.8x1.0). This tied the current best primary metric at asr_wer_prefix=0.6667, with similar strong secondary signals (asr_cer=0.636, in-domain WER=0.556), but it was not a strict improvement.","timestamp":1773441277562,"segment":0}
{"run":61,"commit":"2bf02f5","metric":1,"metrics":{},"status":"discard","description":"Increased the four-step stage-1 multi-token-prediction weight from 0.5 to 1.0 on top of the new best structural setup (text_source=both, semantic_self_condition_prob=0.5, semantic_eos_weight=2.0, p95-style 53-frame cap). This over-weighted the auxiliary objective: OOD asr_wer_prefix regressed back to 1.0 and the earlier gain disappeared.","timestamp":1773442046595,"segment":0}
{"run":62,"commit":"2bf02f5","metric":1,"metrics":{},"status":"discard","description":"Reduced the four-step stage-1 future-Q0 auxiliary weight from 0.5 to 0.25 while keeping the new best structural recipe (semantic_self_condition_prob=0.5, semantic_eos_weight=2.0, p95-style 53-frame cap). The auxiliary became too weak: asr_wer_prefix regressed to 1.0, though CER stayed decent at 0.818 and in-domain WER was 0.667.","timestamp":1773443008403,"segment":0}
{"run":63,"commit":"2bf02f5","metric":1,"metrics":{},"status":"discard","description":"Extended the new best structural objective from four to five future Q0 prediction steps at the same auxiliary weight 0.5, while keeping scheduled sampling, EOS weighting, and the p95-style 53-frame cap. The extra horizon was too much under the 10-minute budget: asr_wer_prefix regressed to 1.0 and secondary metrics worsened.","timestamp":1773443747686,"segment":0}
{"run":64,"commit":"2bf02f5","metric":1,"metrics":{},"status":"discard","description":"Loosened the p95-style inference cap slightly on the new best structural recipe by raising semantic_length_heuristic_factor from 1.0 to 1.1 (53 -> 58 frames) while keeping four-step future-Q0 prediction at weight 0.5. The extra room brought back drift instead of better completion: asr_wer_prefix regressed to 1.0 and in-domain WER fell to 1.0.","timestamp":1773444506935,"segment":0}
{"run":65,"commit":"2bf02f5","metric":1,"metrics":{},"status":"discard","description":"Added per-offset decay for the four-step stage-1 future-Q0 auxiliary and tried emphasizing nearer-future targets (semantic_future_prediction_decay=0.7) on top of the current best recipe. This did not beat the uniform weighting: asr_wer_prefix regressed to 1.0, even though in-domain WER stayed decent at 0.556.","timestamp":1773445335487,"segment":0}
{"run":66,"commit":"2bf02f5","metric":0.8333333134651184,"metrics":{},"status":"discard","description":"Changed the four-head stage-1 future-Q0 auxiliary to predict spaced targets (semantic_future_prediction_stride=2, i.e. offsets 2/4/6/8) instead of consecutive future tokens, while keeping the current best recipe otherwise unchanged. This was promising structurally but did not beat the uniform consecutive version: asr_wer_prefix reached 0.8333, better than many discards and in-domain WER improved to 0.444, but it remained worse than the current best 0.6667.","timestamp":1773446145269,"segment":0}
{"run":67,"commit":"2bf02f5","metric":1,"metrics":{},"status":"discard","description":"Applied the four-step future-Q0 auxiliary only on samples that actually used semantic self-conditioning, and raised its weight to 1.0 so the effective pressure stayed comparable to the current best recipe. This selective generated-prefix variant regressed: asr_wer_prefix returned to 1.0 and secondary metrics worsened, so simply gating the auxiliary to self-conditioned samples is not enough.","timestamp":1773447069119,"segment":0}
{"run":68,"commit":"2bf02f5","metric":1,"metrics":{},"status":"discard","description":"Restricted the four-step future-Q0 auxiliary to the later half of semantic positions (semantic_future_prediction_start_fraction=0.5) while keeping the current best recipe otherwise unchanged. This selective late-position objective regressed: asr_wer_prefix went back to 1.0 and in-domain WER worsened, so simply moving the auxiliary to the back half is not sufficient.","timestamp":1773447848302,"segment":0}
{"run":69,"commit":"2bf02f5","metric":1,"metrics":{},"status":"discard","description":"Applied the four-step future-Q0 auxiliary only on semantic positions whose teacher-forced inputs were actually replaced by self-conditioning, with auxiliary weight 1.0 to keep effective pressure non-trivial. This more precise generated-suffix objective still failed badly: asr_wer_prefix stayed at 1.0 and secondary metrics regressed, so simple suffix-only masking does not recover the current best behavior.","timestamp":1773448687658,"segment":0}
{"run":70,"commit":"2bf02f5","metric":1,"metrics":{},"status":"discard","description":"Reweighted the current best structural recipe more aggressively toward Stage 1 (semantic_loss_weight=2.0, acoustic_loss_weight=0.5) while keeping four-step future-Q0 prediction, scheduled sampling, EOS weighting, and the p95-style 53-frame cap. This did not stack with the best configuration: asr_wer_prefix regressed to 1.0 and secondary metrics worsened.","timestamp":1773449576699,"segment":0}
{"run":71,"commit":"2bf02f5","metric":1,"metrics":{},"status":"discard","description":"Froze Qwen/disabled LoRA on top of the current best structural recipe (use_lora=false with four-step future-Q0 prediction, scheduled sampling, EOS weighting, and the p95-style 53-frame cap) to test whether preserving the pretrained prior would help fast convergence. It trained faster (~25.4k samples / 10 min), but the quality gain disappeared completely: asr_wer_prefix regressed to 1.0 and in-domain free-running also fell back to 1.0.","timestamp":1773450264057,"segment":0}
{"run":72,"commit":"2bf02f5","metric":1,"metrics":{},"status":"discard","description":"Raised the semantic branch LR and lowered the residual branch LR on top of the current best structural recipe (semantic_learning_rate=6e-4, residual_learning_rate=2e-4 with four-step future-Q0 prediction, scheduled sampling, EOS weighting, and the p95-style 53-frame cap). This destabilized the 10-minute regime: throughput dropped, asr_wer_prefix stayed at 1.0, and secondary metrics worsened.","timestamp":1773450999275,"segment":0}
{"run":73,"commit":"2bf02f5","metric":1,"metrics":{},"status":"discard","description":"Tried a more blockwise future-target pattern by changing the four Stage-1 auxiliary heads to predict geometric offsets 1/2/4/8 instead of consecutive 1/2/3/4, while keeping scheduled sampling, EOS weighting, and the p95-style 53-frame cap. This improved CER to 0.727, suggesting some value in mixed short/long horizons, but the primary metric still stayed at asr_wer_prefix=1.0 and did not beat the current best.","timestamp":1773451777459,"segment":0}
{"run":74,"commit":"2bf02f5","metric":1,"metrics":{},"status":"discard","description":"Used the new Stage-1 future-Q0 heads directly at inference by switching semantic generation to small blockwise decoding with block size 2, while keeping the current best training recipe unchanged. This reduced autoregressive recurrence and improved CER to 0.727, but OOD asr_wer_prefix still stayed at 1.0 and in-domain free-running regressed, so naive two-token block decoding did not beat the best token-by-token decode.","timestamp":1773452854831,"segment":0}
{"run":75,"commit":"2bf02f5","metric":0.8333333134651184,"metrics":{},"status":"discard","description":"Pushed the new blockwise semantic generation path further by decoding three Q0 tokens at a time from the current hidden state plus two future-Q0 heads, while keeping the current best training recipe unchanged. This was the strongest blockwise inference result so far: asr_wer_prefix improved to 0.8333 and CER matched the best 0.636 range, but it still did not beat the current best token-by-token decode at 0.6667.","timestamp":1773453606028,"segment":0}
{"run":76,"commit":"2bf02f5","metric":1,"metrics":{},"status":"discard","description":"Increased the new blockwise semantic generation path to decode four Q0 tokens at a time from the current hidden state plus three future-Q0 heads, while keeping the best training recipe unchanged. This overcommitted to the approximate block decoder: asr_wer_prefix regressed to 1.0 and CER worsened sharply, so larger blocks look too aggressive.","timestamp":1773454355796,"segment":0}
{"run":77,"commit":"2bf02f5","metric":1,"metrics":{},"status":"discard","description":"Combined the strongest blockwise semantic inference variant so far (decode three Q0 tokens per step) with mixed normalized+raw text conditioning, while keeping the four-step future-Q0 training objective, scheduled sampling, EOS weighting, and the p95-style 53-frame cap. This did not convert the blockwise clue into a primary win: asr_wer_prefix stayed at 1.0 even though CER again reached 0.636.","timestamp":1773455105986,"segment":0}
{"run":78,"commit":"2bf02f5","metric":0.8333333134651184,"metrics":{},"status":"discard","description":"Reintroduced blockwise semantic generation and matched it more closely to training by using two future-Q0 heads in training (semantic_future_prediction_steps=2, weight=0.5) while decoding three Q0 tokens per inference step with the current hidden state plus those two future heads. This train/infer-matched grouped variant was promising: asr_wer_prefix reached 0.8333 and in-domain WER improved to 0.444, but it still did not beat the current best 0.6667.","timestamp":1773456033017,"segment":0}
{"run":79,"commit":"2bf02f5","metric":0.6666666865348816,"metrics":{},"status":"discard","description":"Combined mixed normalized+raw text conditioning with the train/infer-matched grouped Stage-1 setup: two future-Q0 heads in training plus three-token blockwise semantic decoding at inference. This tied the current best primary metric at asr_wer_prefix=0.6667, showing that small matched token groups can work, but it did not beat the best recipe and had worse secondary metrics (CER 0.727, in-domain WER 0.778).","timestamp":1773456797661,"segment":0}
{"run":80,"commit":"2bf02f5","metric":0.8333333134651184,"metrics":{},"status":"discard","description":"Added an 8-token one-at-a-time warmup before enabling the train/infer-matched three-token block decoder on the mixed-text two-head setup (text_source=both, semantic_future_prediction_steps=2, weight=0.5, semantic_block_decode_size=3). This improved secondary signals substantially (CER 0.636, in-domain WER 0.333), but the primary metric regressed to asr_wer_prefix=0.8333, so too much warmup seems to trade away the OOD gain.","timestamp":1773457589201,"segment":0}
{"run":81,"commit":"2bf02f5","metric":1,"metrics":{},"status":"discard","description":"Tested a smaller 4-token one-at-a-time warmup before enabling the train/infer-matched three-token block decoder on the mixed-text two-head setup. Unlike the no-warmup tie, this regressed back to asr_wer_prefix=1.0, so the matched grouped-blockwise path appears strongest without added warmup and simple warmup schedules now look stale.","timestamp":1773458337087,"segment":0}
{"run":82,"commit":"2bf02f5","metric":0.8333333134651184,"metrics":{},"status":"discard","description":"Tested the smallest train/infer-matched grouped path by training one future-Q0 head and decoding two semantic tokens per inference step, with mixed normalized+raw text conditioning. This improved in-domain prefix WER strongly to 0.222 and reached asr_wer_prefix=0.8333, but it still did not beat the current best 0.6667.","timestamp":1773459244483,"segment":0}
{"run":83,"commit":"2bf02f5","metric":1,"metrics":{},"status":"discard","description":"Ablated mixed normalized+raw text from the smallest train/infer-matched grouped path (one future-Q0 head in training, two-token blockwise semantic decoding at inference). Without text_source=both, the grouped path fell back to asr_wer_prefix=1.0, so mixed text appears important for the small-block regime.","timestamp":1773459996640,"segment":0}
{"run":84,"commit":"2bf02f5","metric":0,"metrics":{},"status":"crash","description":"Attempted to continue the promising matched grouped-blockwise branch by increasing the two-head future-Q0 auxiliary weight to 0.75 on the text_source=both, three-token block-decoder setup, but the run crashed immediately because the temporary blockwise-generation code had been reverted and Config no longer recognized semantic_block_decode_size.","timestamp":1773460124808,"segment":0}
{"run":85,"commit":"2bf02f5","metric":1,"metrics":{},"status":"discard","description":"Raised the auxiliary weight on the strongest matched grouped-blockwise branch (text_source=both, two future-Q0 heads in training, three-token blockwise decoding at inference) from 0.5 to 0.75. This over-weighted the grouped objective: asr_wer_prefix regressed to 1.0, although in-domain WER stayed relatively good at 0.333.","timestamp":1773460924731,"segment":0}
{"run":86,"commit":"2bf02f5","metric":0.8333333134651184,"metrics":{},"status":"discard","description":"Retuned the strongest matched grouped-blockwise branch slightly upward in auxiliary weight (text_source=both, two future-Q0 heads in training, three-token blockwise decoding at inference, weight=0.6). This was better than 0.75 but still worse than the tie at 0.5: asr_wer_prefix reached 0.8333 and CER 0.727, so the grouped branch still appears best around the original 0.5 weight.","timestamp":1773461680315,"segment":0}
