{"run":379,"commit":"108b98b","metric":0.5,"metrics":{},"status":"keep","description":"Ran a third benchmark of the new lower-mass sampled 3:1 weighted branch (`text_source=both_weighted_sampled`, normalized/raw weights 3/1, `text_source_weighted_sampled_passes=2`) after mapping its immediate neighbors. The branch bounced back to `asr_wer_prefix=0.5` again with CER 0.500, EOS on both prompts, short generations (~33/39 frames), and full throughput (~30.3k samples / 10 min). This matters because the surrounding sampled-mass neighborhood is now sharply pruned: 1 pass failed at 1.0, 3 passes failed at 1.0, and the older full 4-pass sampled formulation had already failed at 1.0. So the live sampled weighted branch now looks narrowly centered on the 2-pass setting, with an observed distribution of 0.5, 0.6667, and 0.5 rather than a one-off spike.","timestamp":1773757635419,"segment":0}
{"run":380,"commit":"108b98b","metric":1.0,"metrics":{},"status":"discard","description":"Mapped the weighted ratio inside the live sampled 2-pass family by lowering `text_source=both_weighted_sampled` from 3:1 to 2:1 normalized/raw while keeping `text_source_weighted_sampled_passes=2` and the aligned four-head grouped-prefix recipe. This failed cleanly at asr_wer_prefix=1.0, so the sampled branch does not broaden toward the milder 2:1 ratio.","timestamp":1773767282600,"segment":0}
{"run":381,"commit":"108b98b","metric":1.0,"metrics":{},"status":"discard","description":"Mapped the other side of the live sampled 2-pass family by pushing `text_source=both_weighted_sampled` from 3:1 to 4:1 normalized/raw at `text_source_weighted_sampled_passes=2` on the aligned four-head grouped-prefix recipe. This also failed cleanly at asr_wer_prefix=1.0, so the sampled branch is not simply improved by pushing farther toward normalized text either.","timestamp":1773767282601,"segment":0}
{"run":382,"commit":"108b98b","metric":1.0,"metrics":{},"status":"discard","description":"Reran the plain live sampled branch (`text_source=both_weighted_sampled`, normalized/raw weights 3/1, `text_source_weighted_sampled_passes=2`) on the aligned four-head grouped-prefix recipe after mapping nearby ratios. This time it collapsed cleanly to asr_wer_prefix=1.0, showing the new sampled branch is real but not yet a reliably sub-1.0 backbone.","timestamp":1773767282602,"segment":0}
{"run":383,"commit":"108b98b","metric":1.0,"metrics":{},"status":"discard","description":"Tested whether the live sampled 2-pass 3:1 weighted clue transfers off the grouped-prefix decoder by ablating grouped decoding and running the same `text_source=both_weighted_sampled` branch on the aligned four-head exact-decoding backbone. This failed cleanly at asr_wer_prefix=1.0, so the sampled stochastic-mass clue currently looks grouped-prefix-specific.","timestamp":1773767282603,"segment":0}
{"run":384,"commit":"108b98b","metric":0.8333333134651184,"metrics":{},"status":"discard","description":"Ran another grouped-prefix benchmark of the plain sampled 2-pass 3:1 branch (`text_source=both_weighted_sampled`, normalized/raw weights 3/1, `text_source_weighted_sampled_passes=2`). It recovered only to asr_wer_prefix=0.8333, which was better than a full collapse but still worse than the earlier 0.5/0.6667 hits, so the branch remains noisy rather than stable.","timestamp":1773767282604,"segment":0}
{"run":385,"commit":"108b98b","metric":1.0,"metrics":{},"status":"discard","description":"Probed assignment sensitivity inside the live sampled branch by reintroducing a deterministic sampled-assignment salt and rerunning the same grouped-prefix `text_source=both_weighted_sampled`, 3:1, 2-pass recipe at an alternate seed. This failed cleanly at asr_wer_prefix=1.0, so the branch is not just pass-count- and ratio-sensitive; the specific utterance/pass assignment also matters.","timestamp":1773767282605,"segment":0}
{"run":386,"commit":"108b98b","metric":1.0,"metrics":{},"status":"discard","description":"Ran yet another plain grouped-prefix rerun of the live sampled 2-pass 3:1 branch after the first alternate-seed failure. This also fell back to asr_wer_prefix=1.0, further confirming that the sampled branch is bimodal/noisy rather than a settled new baseline.","timestamp":1773767282606,"segment":0}
{"run":387,"commit":"108b98b","metric":1.0,"metrics":{},"status":"discard","description":"Retried the assignment-sensitivity probe on the live sampled grouped-prefix branch with a second alternate deterministic sampled-assignment seed. This also failed cleanly at asr_wer_prefix=1.0 despite good in-domain behavior, sharpening the conclusion that the current sampled clue is tightly localized around the original seed-0 assignment.","timestamp":1773767282607,"segment":0}
{"run":388,"commit":"108b98b","metric":0.8333333134651184,"metrics":{},"status":"discard","description":"Tested a new coverage-aware sampled weighted-text variant on the live sampled grouped-prefix branch: added `text_source=both_weighted_sampled_noreplace`, which keeps the same 3:1 normalized/raw weighting and 2-pass total mass as the live sampled recipe but samples without replacement inside each deterministic weighted cycle so 3:1 no longer produces double-raw example assignments. This did not help. The grouped-prefix run landed at asr_wer_prefix=0.8333 with EOS on both prompts, short generations (~33/38 frames), full throughput (~30.4k samples / 10 min), and decent in-domain WER 0.444, but it was clearly worse than the seed-0 sampled-with-replacement branch. So the live sampled clue does not seem to come from simply removing double-raw assignments or enforcing per-cycle weighted coverage.","timestamp":1773767282608,"segment":0}
{"run":389,"commit":"108b98b","metric":1.0,"metrics":{},"status":"discard","description":"Tested whether the reproducible fuller-LoRA fallback can stabilize the live 2-pass sampled 3:1 grouped-prefix branch by keeping `text_source=both_weighted_sampled`, normalized/raw weights 3/1, `text_source_weighted_sampled_passes=2`, and the aligned four-head grouped recipe but expanding LoRA targets to `[q_proj,k_proj,v_proj,o_proj,gate,up,down]`. This failed cleanly at asr_wer_prefix=1.0 with EOS on both prompts, short generations (~32/37 frames), slightly lower throughput (~29.1k samples / 10 min), and degraded gt-ASR sanity 0.118. So fuller LoRA does not rescue the narrow sampled stochastic-mass branch either; like the older fixed-duplicate weighted family, this sampled path also seems to prefer the plain default LoRA target set.","timestamp":1773767282609,"segment":0}
{"run":390,"commit":"108b98b","metric":1.0,"metrics":{},"status":"discard","description":"Tested a new low-mass anchored weighted-text variant on the aligned four-head grouped-prefix recipe: added `text_source=both_plus_normalized_balanced`, which keeps only two total passes by combining one full normalized pass with one balanced normalized/raw pass for an overall 3:1 normalized/raw mass. This was meant to keep the sampled branch's low total mass while forcing every utterance to retain at least one normalized anchor and removing raw-only assignments. It failed cleanly at asr_wer_prefix=1.0 with CER 0.682, EOS on both prompts, ~42/38 frames, and full throughput (~30.2k samples / 10 min). So the sampled 2-pass clue is not explained by a simple normalized-anchor-plus-balanced-raw formulation either.","timestamp":1773768615611,"segment":0}
{"run":391,"commit":"3a7651e","metric":0.3333333432674408,"metrics":{},"status":"keep","description":"Found a new live stabilizer inside the narrow sampled stochastic-mass branch by adding `text_loss_weight=0.1` on top of `text_source=both_weighted_sampled`, normalized/raw weights 3/1, `text_source_weighted_sampled_passes=2`, and the aligned four-head grouped-prefix recipe. This tied the best recorded overall result at asr_wer_prefix=0.3333 with excellent CER 0.318, EOS on both prompts, and short generations (~34/41 frames). The tradeoff is the same one seen on older text-loss branches: throughput dropped sharply to ~23.0k samples / 10 min and in-domain WER stayed mediocre at 0.667. So `text_loss_weight=0.1` is still not a generic upgrade, but it is now a genuinely live sampled-branch-specific stabilizer worth exact rerun.","timestamp":1773769553649,"segment":0}
{"run":392,"commit":"3a7651e","metric":1,"metrics":{},"status":"discard","description":"Exact reran the new sampled-branch text-anchor keep (`text_source=both_weighted_sampled`, normalized/raw weights 3/1, `text_source_weighted_sampled_passes=2`, `text_loss_weight=0.1`, aligned four-head grouped-prefix recipe). The first run had tied the overall best at 0.3333, but this rerun collapsed hard to asr_wer_prefix=1.0 with catastrophic full-WER/CER while throughput stayed similarly low at ~22.9k samples / 10 min. So the `text_loss_weight=0.1` rescue is real but highly fragile: it currently looks like another sharp sampled-branch spike rather than a reproducible new mainline.","timestamp":1773770327879,"segment":0}
{"run":393,"commit":"3a7651e","metric":1.0,"metrics":{},"status":"discard","description":"Tested whether the sampled-branch text-anchor spike prefers a milder setting by lowering the new sampled recipe to `text_loss_weight=0.05` while keeping `text_source=both_weighted_sampled`, normalized/raw weights 3/1, `text_source_weighted_sampled_passes=2`, and the aligned four-head grouped-prefix recipe. This failed cleanly at asr_wer_prefix=1.0 with OOD EOS disappearing again and the utterance stretching back to the 53-frame cap, while throughput stayed in the same slowed regime at ~22.9k samples / 10 min. So the sampled text-anchor clue is not a broad low-weight family; if there is any real gain here, it currently looks specific to the fragile `text_loss_weight=0.1` spike.","timestamp":1773771198935,"segment":0}
{"run":394,"commit":"3a7651e","metric":1,"metrics":{},"status":"discard","description":"Tested whether the sampled-branch text-anchor spike extends to a slightly milder nearby setting by using `text_loss_weight=0.08` on top of `text_source=both_weighted_sampled`, normalized/raw weights 3/1, `text_source_weighted_sampled_passes=2`, and the aligned four-head grouped-prefix recipe. This also failed cleanly at asr_wer_prefix=1.0, with throughput collapsing even harder to only ~13.4k samples / 10 min despite EOS on both prompts. So the sampled text-anchor clue is not broad even in the immediate neighborhood below 0.1; the gain still looks like a very sharp `text_loss_weight=0.1` spike.","timestamp":1773772105162,"segment":0}
{"run":395,"commit":"3a7651e","metric":1,"metrics":{},"status":"discard","description":"Tested the upper side of the sampled text-anchor spike by raising the same sampled recipe to `text_loss_weight=0.12` while keeping `text_source=both_weighted_sampled`, normalized/raw weights 3/1, `text_source_weighted_sampled_passes=2`, and the aligned four-head grouped-prefix recipe. This also failed cleanly at asr_wer_prefix=1.0, with throughput collapsing to only ~13.3k samples / 10 min. So the sampled text-anchor clue is not broad above 0.1 either; the current picture is now a very sharp isolated `text_loss_weight=0.1` spike rather than a stable local family.","timestamp":1773772921475,"segment":0}
{"run":396,"commit":"3a7651e","metric":1,"metrics":{},"status":"discard","description":"Tested whether the sampled text-anchor spike can be stabilized by recovering sample coverage with a larger batch: reran the sampled `text_loss_weight=0.1` recipe (`text_source=both_weighted_sampled`, normalized/raw weights 3/1, `text_source_weighted_sampled_passes=2`, aligned four-head grouped-prefix recipe) at `batch_size=12`. This failed cleanly at asr_wer_prefix=1.0 despite higher instantaneous samples/sec, and total 10-minute coverage still fell to only ~18.6k samples because step count collapsed to 1548. So the sampled text-anchor spike does not look like a simple small-batch or step-overhead artifact; larger batch does not rescue it.","timestamp":1773773923523,"segment":0}
{"run":397,"commit":"3a7651e","metric":0.8333333134651184,"metrics":{},"status":"discard","description":"Tested a new low-mass anchored sampled-text formulation on the aligned four-head grouped-prefix recipe: added `text_source=both_plus_normalized_sampled`, which keeps one full normalized pass plus one sampled 1:1 normalized/raw pass for a lower-mass 3:1 overall normalized/raw mixture. This was meant to preserve the sampled branch's per-example randomness while forcing every utterance to keep a normalized anchor. It recovered only weak life at asr_wer_prefix=0.8333 with CER 0.636, EOS on both prompts, and full throughput (~30.0k samples / 10 min), so it is clearly worse than the live 2-pass sampled 3:1 branch and far below the old 0.3333 spike. The sampled clue therefore does not seem to come from simple 'normalized anchor + random second pass' structure either.","timestamp":1773774859975,"segment":0}
{"run":398,"commit":"3a7651e","metric":1,"metrics":{},"status":"discard","description":"Tested whether the live sampled 2-pass 3:1 branch depends on the specific modulo-4 assignment geometry rather than just the normalized/raw ratio by keeping `text_source=both_weighted_sampled`, `text_source_weighted_sampled_passes=2`, and the aligned four-head grouped-prefix recipe but scaling the weights from `3/1` to `6/2`. This preserves the same 3:1 marginal ratio while changing the deterministic bucket structure from 4 slots to 8 slots, so example/pass assignments and cross-pass collisions change without changing total dataset mass. It failed cleanly at asr_wer_prefix=1.0 despite full throughput (~30.5k samples / 10 min), EOS on both prompts, short generations (~38/38 frames), and very strong in-domain WER 0.111. So the sampled branch is not just about the coarse 3:1 ratio and 2-pass mass; it is also sensitive to the exact assignment geometry, and the original `3/1` modulo-4 formulation still looks like another narrow local spike.","timestamp":1773776190059,"segment":0}
{"run":399,"commit":"3a7651e","metric":1,"metrics":{},"status":"discard","description":"Tested a new content-aware low-mass mixed-text branch on the aligned four-head grouped-prefix recipe by adding `text_source=normalized_plus_raw_diff`, which keeps one normalized pass for every utterance and adds a raw-text copy only for the ~11.5% of LJSpeech samples where `text_raw` actually differs from `text_norm`. This was meant to stop wasting mixed-text mass on utterances where raw and normalized text are identical while still concentrating raw exposure on the informative numeric/punctuation subset. It failed cleanly at asr_wer_prefix=1.0 with OOD EOS disappearing again, the utterance stretching back to the 53-frame cap, CER 0.909, and no throughput gain beyond the usual ~30.0k samples / 10 min. So the mixed-text clue is not explained by simply targeting raw text only to the subset where normalization changes the transcript; low-mass content-aware raw exposure alone is not enough.","timestamp":1773777323469,"segment":0}
{"run":400,"commit":"3a7651e","metric":1,"metrics":{},"status":"discard","description":"Retuned the new content-aware mixed-text branch to restore the raw mass of the live 3:1 family by keeping `text_source=normalized_plus_raw_diff` on the aligned four-head grouped-prefix recipe but raising `text_source_weighted_raw_repeats=3`. This keeps one normalized pass for every utterance, then adds three extra raw copies only for the ~11.5% of utterances where raw and normalized text actually differ, giving a low-mass but much more concentrated analogue of the old 3:1 normalized/raw branch. It still failed cleanly at asr_wer_prefix=1.0 with OOD EOS disappearing again, the utterance hitting the 53-frame cap, CER 0.955, and only middling in-domain WER 0.222. So even when the informative raw subset is upweighted back toward the old 3:1 raw mass, content-aware 'raw only where text changes' targeting does not recover the mixed-text gain; the live clue is not just about concentrating raw exposure on normalization-different utterances.","timestamp":1773778212475,"segment":0}
{"run":401,"commit":"3a7651e","metric":1,"metrics":{},"status":"discard","description":"Ran another plain reproducibility check of the live sampled branch on the original `text_source=both_weighted_sampled`, normalized/raw `3/1`, `text_source_weighted_sampled_passes=2`, aligned four-head grouped-prefix recipe after pruning more local neighbors. It collapsed again to asr_wer_prefix=1.0, but this time it still emitted EOS on both prompts, stayed short (~40/44 frames), and kept decent CER 0.545 rather than failing via a long no-EOS cap hit. So the plain sampled branch remains real but increasingly looks bimodal with multiple failure modes; another fresh seed-0 rerun did not restore the old 0.5/0.6667 life.","timestamp":1773779216619,"segment":0}
{"run":402,"commit":"3a7651e","metric":1,"metrics":{},"status":"discard","description":"Tested whether more aggressive short-example focusing helps fast convergence by lowering `length_percentile` from `0.95` to `0.9` on the aligned four-head grouped-prefix backbone (`text_source=normalized`, future steps 4, future weight 0.5, `semantic_self_condition_prob=0.5`, EOS weight 2.0, 12-token grouped prefix). This rebuilt the train set with shorter padding limits (`max_seq_len=150`, `max_audio_frames=117`) and filtered the corpus from 13.1k to 11.7k examples, but it backfired badly: throughput collapsed to only ~17.8k samples / 10 min, the run regressed cleanly to asr_wer_prefix=1.0, and both prompts became under-generated despite EOS still firing (only ~28/38 frames). So simply truncating training to the 90th-length-percentile regime is stale; the benchmark seems to prefer the broader 95th-percentile coverage rather than a smaller faster-focus subset.","timestamp":1773780189094,"segment":0}
{"run":403,"commit":"3a7651e","metric":0,"metrics":{},"status":"crash","description":"Tried probing an untested eval-only acoustic knob on the aligned four-head grouped-prefix backbone by setting `residual_gen_temperature=0.2` and `residual_gen_top_p=0.9` to sample Mimi residual codebooks during heavy eval instead of greedy argmax. The run crashed before training because this config invalidated the dataset hash and `./autoresearch.sh` was launched without pre-generated caches for the new config. This suggests the current dataset cache key is broader than just true dataset-building fields, so even eval-only generation changes may require a `--launcher dataset` prebuild before benchmarking.","timestamp":1773780324532,"segment":0}
{"run":404,"commit":"3a7651e","metric":1,"metrics":{},"status":"discard","description":"After pre-generating caches for the broader config hash, tested an untried eval-only acoustic knob on the aligned four-head grouped-prefix backbone by setting `residual_gen_temperature=0.2` and `residual_gen_top_p=0.9` so Mimi residual codebooks are sampled instead of generated by greedy argmax. This was clearly harmful: asr_wer_prefix stayed at 1.0, CER exploded to 11.45, in-domain WER regressed to 0.889, and sample coverage dropped to only ~22.4k / 10 min even though EOS still fired on both prompts. So residual-codebook sampling during eval is a bad direction in this regime; the benchmark strongly prefers greedy residual generation.","timestamp":1773781103136,"segment":0}
{"run":405,"commit":"3a7651e","metric":1,"metrics":{},"status":"discard","description":"Tested whether the aligned four-head grouped-prefix backbone is acoustically under-capacity by enlarging Stage 2 from 4 to 6 residual-transformer layers while keeping the rest of the robust recipe fixed (`text_source=normalized`, future steps 4, future weight 0.5, `semantic_self_condition_prob=0.5`, EOS weight 2.0, 12-token grouped prefix). This increased the model/optimizer slightly but hurt the 10-minute regime: sample coverage fell to only ~17.1k examples, OOD EOS disappeared again, the utterance hit the 53-frame cap, and asr_wer_prefix stayed at 1.0. So simply making Stage 2 deeper is not a fast-convergence win; the benchmark remains more sample-limited than acoustically under-capacity in this direction.","timestamp":1773781970429,"segment":0}
{"run":406,"commit":"1532a6d","metric":0.8333333134651184,"metrics":{},"status":"keep","description":"Tested whether the fixed-duplicate weighted branch depends on the exact total duplicate mass or mainly on the normalized/raw ratio by keeping the aligned four-head grouped-prefix recipe and preserving the same 3:1 ratio, but doubling the duplicate counts from `text_source=both_weighted` repeats `3/1` to `6/2`. This larger-mass same-ratio branch stayed alive at asr_wer_prefix=0.8333 with strong CER 0.545, EOS on both prompts, short generations (~34/45 frames), and full throughput (~30.2k samples / 10 min). So the fixed-duplicate weighted family is not pinned to exactly four total copies; higher duplicate mass can still produce sub-1.0 life, though it did not recover the older 0.5/0.6667 bests. This suggests the fixed duplicate branch is broader in total-mass space than the much narrower sampled branch, even if the original `3/1` recipe remains the stronger center.","timestamp":1773782911517,"segment":0}
