{"run":221,"commit":"cf0f36a","metric":1,"metrics":{},"status":"discard","description":"Tested whether the noisy larger-LM exact-last grouped clue benefits from the new cheap targeted early-prefix self-conditioning objective by combining `llm_repo=QWEN3_1_7B`, `batch_size=4`, `text_source=both`, the matched two-head 12-token exact-last grouped prefix, and the cheap targeted early-prefix replacement (`semantic_self_condition_prob=0.5`, `semantic_self_condition_use_inference_policy=true`, `semantic_self_condition_match_early_grouped_prefix=true`, `semantic_self_condition_inference_policy_prob=0.0`). This failed cleanly at asr_wer_prefix=1.0 with only middling CER 0.864, so the cheap targeted early-prefix objective does not stabilize the noisy larger-LM grouped branch either.","timestamp":1773587343847,"segment":0}
{"run":222,"commit":"cf0f36a","metric":1,"metrics":{},"status":"discard","description":"Tested whether the weak cheap targeted early-prefix exact-last training clue stacks with the only live grouped-style heavy-eval reranker by combining `semantic_self_condition_prob=0.5`, `semantic_self_condition_use_inference_policy=true`, `semantic_self_condition_match_early_grouped_prefix=true`, `semantic_self_condition_inference_policy_prob=0.0`, and `semantic_eval_compare_exact_last_candidate=true` on the 600M matched two-head exact-last grouped branch (`text_source=both`, future weight 0.5, EOS weight 2.0, 12-token exact-last grouped prefix, 53-frame cap). This failed cleanly at asr_wer_prefix=1.0 with CER 1.0, so the grouped-style self-NLL reranker does not strengthen the new cheap targeted early-prefix exact-last objective either.","timestamp":1773588110589,"segment":0}
{"run":223,"commit":"cf0f36a","metric":0.8333333134651184,"metrics":{},"status":"discard","description":"Added a more exact-last-matched cheap targeted early-prefix self-conditioning mode by replacing only the speculative grouped future-token slots inside the first grouped-prefix window, then tested it on the 600M matched two-head exact-last grouped branch (`text_source=both`, future weight 0.5, `semantic_self_condition_prob=0.5`, `semantic_self_condition_use_inference_policy=true`, `semantic_self_condition_match_early_grouped_prefix=true`, `semantic_self_condition_match_grouped_future_slots_only=true`, `semantic_self_condition_inference_policy_prob=0.0`, EOS weight 2.0, 12-token exact-last grouped prefix, 53-frame cap). This recovered weak life at asr_wer_prefix=0.8333 with improved CER 0.773 and normal throughput (~18.8k samples / 10 min), but it still stayed below the robust 0.6667 baseline.","timestamp":1773588981640,"segment":0}
{"run":224,"commit":"cf0f36a","metric":1,"metrics":{},"status":"discard","description":"Tested whether the new cheap targeted early-prefix self-conditioning can better match the original plain grouped branch by restricting replacement to grouped future-token slots only during the first grouped-prefix window (`semantic_self_condition_match_grouped_future_slots_only=true`) on top of the original matched grouped recipe (`text_source=both`, 2 future-Q0 heads, future weight 0.5, `semantic_self_condition_prob=0.5`, `semantic_self_condition_use_inference_policy=true`, `semantic_self_condition_match_early_grouped_prefix=true`, `semantic_self_condition_inference_policy_prob=0.0`, EOS weight 2.0, plain 12-token grouped prefix, 53-frame cap). This still returned asr_wer_prefix=1.0 with only middling secondaries, so the future-slots-only cheap early-prefix objective does not rescue the plain grouped-prefix mainline either.","timestamp":1773589730678,"segment":0}
{"run":225,"commit":"cf0f36a","metric":1,"metrics":{},"status":"discard","description":"Retuned the more exact-last-matched cheap targeted early-prefix objective upward on the 600M matched two-head exact-last grouped branch by applying the future-slots-only replacement on every self-conditioned example (`semantic_self_condition_prob=1.0`, `semantic_self_condition_use_inference_policy=true`, `semantic_self_condition_match_early_grouped_prefix=true`, `semantic_self_condition_match_grouped_future_slots_only=true`, `semantic_self_condition_inference_policy_prob=0.0`) while keeping `text_source=both`, future weight 0.5, EOS weight 2.0, the 12-token exact-last grouped prefix, and the 53-frame cap. The weak `0.8333` life from the 0.5-probability version did not survive: this fell back to asr_wer_prefix=1.0 with only modest CER 0.818, so saturating the future-slots-only cheap targeted replacement overcooks the exact-last branch too.","timestamp":1773590645032,"segment":0}
{"run":226,"commit":"cf0f36a","metric":1,"metrics":{},"status":"discard","description":"Tested whether the grouped-style heavy-eval reranker stacks with the more exact-last-matched cheap targeted early-prefix training objective by combining `semantic_self_condition_prob=0.5`, `semantic_self_condition_use_inference_policy=true`, `semantic_self_condition_match_early_grouped_prefix=true`, `semantic_self_condition_match_grouped_future_slots_only=true`, `semantic_self_condition_inference_policy_prob=0.0`, and `semantic_eval_compare_exact_last_candidate=true` on the 600M matched two-head exact-last grouped branch (`text_source=both`, future weight 0.5, EOS weight 2.0, 12-token exact-last grouped prefix, 53-frame cap). This fell back to asr_wer_prefix=1.0 with only middling secondaries, so the reranker does not strengthen the future-slots-only cheap targeted exact-last objective either.","timestamp":1773591415168,"segment":0}
{"run":227,"commit":"cf0f36a","metric":1,"metrics":{},"status":"discard","description":"Tested whether the more exact-last-matched cheap targeted early-prefix objective transfers to the only larger-LM grouped clue by combining `llm_repo=QWEN3_1_7B`, `batch_size=4`, `text_source=both`, the matched two-head 12-token exact-last grouped prefix, and future-slots-only cheap early-prefix replacement (`semantic_self_condition_prob=0.5`, `semantic_self_condition_use_inference_policy=true`, `semantic_self_condition_match_early_grouped_prefix=true`, `semantic_self_condition_match_grouped_future_slots_only=true`, `semantic_self_condition_inference_policy_prob=0.0`). This still failed cleanly at asr_wer_prefix=1.0 with only middling CER 0.864, so the future-slots-only cheap targeted objective does not stabilize the noisy larger-LM exact-last grouped branch either.","timestamp":1773592179214,"segment":0}
{"run":228,"commit":"cf0f36a","metric":0.6666666865348816,"metrics":{},"status":"discard","description":"Tested a more truly train/infer-matched exact-last branch by combining the new future-slots-only cheap targeted early-prefix training objective with the unlocked two-head exact/future/future/exact decode path: `text_source=both`, `semantic_future_prediction_steps=2`, `semantic_block_decode_size=4`, `semantic_block_decode_exact_last_token=true`, `semantic_self_condition_prob=0.5`, `semantic_self_condition_use_inference_policy=true`, `semantic_self_condition_match_early_grouped_prefix=true`, `semantic_self_condition_match_grouped_future_slots_only=true`, `semantic_self_condition_inference_policy_prob=0.0`, EOS weight 2.0, grouped only for the first 12 semantic tokens, and the 53-frame cap. This tied the robust best primary metric at asr_wer_prefix=0.6667 with improved CER 0.727 versus prior block_size=4 failures, making it the first sign of life for the broader exact-last family once the training objective is matched to the speculative future-token slots. It is not a strict primary improvement, so discard for now, but this is a more interesting clue than the earlier 1.0 collapses on the broader exact-last path.","timestamp":1773593005387,"segment":0}
{"run":229,"commit":"cf0f36a","metric":0.8333333134651184,"metrics":{},"status":"discard","description":"Exact reran the promising broader exact-last clue that paired future-slots-only cheap targeted early-prefix training with the unlocked two-head exact/future/future/exact decode path (`text_source=both`, `semantic_future_prediction_steps=2`, `semantic_block_decode_size=4`, `semantic_block_decode_exact_last_token=true`, `semantic_self_condition_prob=0.5`, `semantic_self_condition_use_inference_policy=true`, `semantic_self_condition_match_early_grouped_prefix=true`, `semantic_self_condition_match_grouped_future_slots_only=true`, `semantic_self_condition_inference_policy_prob=0.0`, EOS weight 2.0, first 12 semantic tokens grouped, 53-frame cap). The earlier tie-level `0.6667` did not reproduce exactly: this rerun landed at `0.8333`, though CER stayed strong at `0.636` and throughput was excellent (~28.1k samples / 10 min). So this broader exact-last + matched-future-slots objective looks more alive than before, but still noisy rather than robust.","timestamp":1773593771417,"segment":0}
{"run":230,"commit":"cf0f36a","metric":1,"metrics":{},"status":"discard","description":"Retuned the new broader exact-last + future-slots-only clue to a shorter early grouped window by keeping the matched cheap future-slots-only early-prefix training objective but reducing the unlocked exact/future/future/exact decode path from the first 12 grouped semantic tokens down to 8 (`text_source=both`, `semantic_future_prediction_steps=2`, `semantic_block_decode_size=4`, `semantic_block_decode_exact_last_token=true`, `semantic_self_condition_prob=0.5`, `semantic_self_condition_use_inference_policy=true`, `semantic_self_condition_match_early_grouped_prefix=true`, `semantic_self_condition_match_grouped_future_slots_only=true`, `semantic_self_condition_inference_policy_prob=0.0`, EOS weight 2.0, 53-frame cap). This fell back to asr_wer_prefix=1.0 with worse CER 0.955, so the new life in the broader exact-last family does not simply come from shortening the grouped window.","timestamp":1773594584995,"segment":0}
{"run":231,"commit":"cf0f36a","metric":1,"metrics":{},"status":"discard","description":"Retuned the new broader exact-last + future-slots-only clue to a longer, more natural four-step grouped window by keeping the matched cheap future-slots-only early-prefix training objective but extending the unlocked exact/future/future/exact decode path from the first 12 grouped semantic tokens up to 16 (`text_source=both`, `semantic_future_prediction_steps=2`, `semantic_block_decode_size=4`, `semantic_block_decode_exact_last_token=true`, `semantic_self_condition_prob=0.5`, `semantic_self_condition_use_inference_policy=true`, `semantic_self_condition_match_early_grouped_prefix=true`, `semantic_self_condition_match_grouped_future_slots_only=true`, `semantic_self_condition_inference_policy_prob=0.0`, EOS weight 2.0, 53-frame cap). This regressed back to asr_wer_prefix=1.0, so the new life in the broader exact-last family still looks localized around the 12-token / three-step window rather than extending cleanly to the more natural 16-token / four-step schedule.","timestamp":1773595484964,"segment":0}
{"run":232,"commit":"cf0f36a","metric":1,"metrics":{},"status":"discard","description":"Tested whether the more exact-last-matched cheap targeted early-prefix objective extends to a longer speculative block by keeping the future-slots-only training match but using the unlocked two-head `semantic_block_decode_size=5` exact-last path (`text_source=both`, `semantic_future_prediction_steps=2`, `semantic_block_decode_exact_last_token=true`, `semantic_self_condition_prob=0.5`, `semantic_self_condition_use_inference_policy=true`, `semantic_self_condition_match_early_grouped_prefix=true`, `semantic_self_condition_match_grouped_future_slots_only=true`, `semantic_self_condition_inference_policy_prob=0.0`, EOS weight 2.0, first 12 semantic tokens grouped, 53-frame cap). This failed cleanly at asr_wer_prefix=1.0 with worse CER 0.955, so the new matched-training clue does not simply extend to longer speculative blocks beyond the revived `block_decode_size=4` path.","timestamp":1773596263026,"segment":0}
{"run":233,"commit":"cf0f36a","metric":0.8333333134651184,"metrics":{},"status":"discard","description":"Tested whether the future-slots-only cheap targeted early-prefix training objective can revive the true three-head broader exact-last family by combining `semantic_future_prediction_steps=3` with the matched `semantic_block_decode_size=5` exact/future/future/future/exact decoder, `semantic_block_decode_max_grouped_tokens=15`, `semantic_block_decode_exact_last_token=true`, `semantic_self_condition_prob=0.5`, `semantic_self_condition_use_inference_policy=true`, `semantic_self_condition_match_early_grouped_prefix=true`, `semantic_self_condition_match_grouped_future_slots_only=true`, `semantic_self_condition_inference_policy_prob=0.0`, `text_source=both`, EOS weight 2.0, and the 53-frame cap. This recovered weak life at asr_wer_prefix=0.8333 with decent CER 0.682, which is much better than the earlier clean 1.0 collapse of the plain three-head broader exact-last branch, but it still stayed below the robust 0.6667 baseline.","timestamp":1773597068187,"segment":0}
{"run":234,"commit":"cf0f36a","metric":0.8333333134651184,"metrics":{},"status":"discard","description":"Retuned the revived three-head broader exact-last family to a shorter two-block window by keeping the future-slots-only cheap targeted early-prefix training objective but reducing the matched `semantic_block_decode_size=5` exact/future/future/future/exact decoder from the first 15 grouped semantic tokens down to 10 (`text_source=both`, `semantic_future_prediction_steps=3`, `semantic_self_condition_prob=0.5`, `semantic_self_condition_use_inference_policy=true`, `semantic_self_condition_match_early_grouped_prefix=true`, `semantic_self_condition_match_grouped_future_slots_only=true`, `semantic_self_condition_inference_policy_prob=0.0`, EOS weight 2.0, 53-frame cap). This still showed weak life at asr_wer_prefix=0.8333, but CER degraded to 1.0, so the three-head matched branch does not obviously improve just by shortening the grouped window from 15 to 10 tokens.","timestamp":1773597835588,"segment":0}
{"run":235,"commit":"cf0f36a","metric":1,"metrics":{},"status":"discard","description":"Added a tighter train/infer-matched future-head supervision flag (`semantic_future_prediction_match_block_decode=true`) that only trains future-Q0 heads on grouped-step source positions and only for offsets actually consumed by the active fixed block decode policy, then tested it on the live broader exact-last clue: `text_source=both`, `semantic_future_prediction_steps=2`, future weight 0.5, future-slots-only cheap targeted early-prefix matching (`semantic_self_condition_prob=0.5`, `semantic_self_condition_use_inference_policy=true`, `semantic_self_condition_match_early_grouped_prefix=true`, `semantic_self_condition_match_grouped_future_slots_only=true`, `semantic_self_condition_inference_policy_prob=0.0`), `semantic_block_decode_size=4`, `semantic_block_decode_exact_last_token=true`, first 12 semantic tokens grouped, EOS weight 2.0, 53-frame cap. This cleanly regressed to asr_wer_prefix=1.0 despite decent CER 0.773, so restricting the future auxiliary to only grouped-step start positions does not stabilize the revived block_size=4 exact/future/future/exact branch either.","timestamp":1773599058159,"segment":0}
{"run":236,"commit":"cf0f36a","metric":1,"metrics":{},"status":"discard","description":"Retested the new grouped-step-matched future-head supervision flag on the older two-head exact-last 12-token grouped branch where the standard `semantic_block_decode_size=3` exact/future/exact decoder only consumes one speculative future slot per grouped step. The run kept `text_source=both`, future weight 0.5, `semantic_future_prediction_steps=2`, `semantic_future_prediction_match_block_decode=true`, future-slots-only cheap targeted early-prefix matching (`semantic_self_condition_prob=0.5`, `semantic_self_condition_use_inference_policy=true`, `semantic_self_condition_match_early_grouped_prefix=true`, `semantic_self_condition_match_grouped_future_slots_only=true`, `semantic_self_condition_inference_policy_prob=0.0`), `semantic_block_decode_exact_last_token=true`, first 12 semantic tokens grouped, EOS weight 2.0, and the 53-frame cap. This still failed cleanly at asr_wer_prefix=1.0 with worse CER 0.955, so masking the future auxiliary down to only the exact grouped-step uses does not rescue the older exact/future/exact 3-token branch either.","timestamp":1773599816952,"segment":0}
{"run":237,"commit":"cf0f36a","metric":1,"metrics":{},"status":"discard","description":"Tested the still-untried combination of the two noisy larger-scale exact-last clues by transferring the future-slots-only cheap targeted early-prefix objective onto the broader larger-LM exact/future/future/exact branch: `llm_repo=QWEN3_1_7B`, `batch_size=4`, `text_source=both`, `semantic_future_prediction_steps=2`, future weight 0.5, `semantic_self_condition_prob=0.5`, `semantic_self_condition_use_inference_policy=true`, `semantic_self_condition_match_early_grouped_prefix=true`, `semantic_self_condition_match_grouped_future_slots_only=true`, `semantic_self_condition_inference_policy_prob=0.0`, `semantic_block_decode_size=4`, `semantic_block_decode_exact_last_token=true`, first 12 semantic tokens grouped, EOS weight 2.0, and the 53-frame cap. This failed cleanly at asr_wer_prefix=1.0 with only middling CER 0.818 and low throughput (~6.8k samples / 10 min), so the broader block_size=4 matched-training clue does not rescue the noisy larger-LM branch either.","timestamp":1773600672963,"segment":0}
{"run":238,"commit":"cf0f36a","metric":0.8333333134651184,"metrics":{},"status":"discard","description":"Extended the cheap targeted early-prefix self-conditioning path so it can match explicit per-step grouped decode schedules, then tested the strongest late-boundary schedule clue under this new train/infer match: `text_source=both`, `semantic_future_prediction_steps=2`, future weight 0.5, `semantic_self_condition_prob=0.5`, `semantic_self_condition_use_inference_policy=true`, `semantic_self_condition_match_early_grouped_prefix=true`, `semantic_self_condition_match_grouped_future_slots_only=true`, `semantic_self_condition_inference_policy_prob=0.0`, `semantic_block_decode_schedule=3,3,3,1,2`, EOS weight 2.0, 53-frame cap. This recovered weak life at asr_wer_prefix=0.8333 with healthy throughput (~21.0k samples / 10 min) and better in-domain WER 0.667, suggesting the late exact-bridge schedule does benefit somewhat from schedule-aware cheap future-slot matching, but it still stayed below the robust 0.6667 baseline.","timestamp":1773601735744,"segment":0}
{"run":239,"commit":"cf0f36a","metric":1,"metrics":{},"status":"discard","description":"Retested the other late-boundary schedule clue under the new schedule-aware cheap targeted early-prefix future-slot matching: `text_source=both`, `semantic_future_prediction_steps=2`, future weight 0.5, `semantic_self_condition_prob=0.5`, `semantic_self_condition_use_inference_policy=true`, `semantic_self_condition_match_early_grouped_prefix=true`, `semantic_self_condition_match_grouped_future_slots_only=true`, `semantic_self_condition_inference_policy_prob=0.0`, `semantic_block_decode_schedule=3,3,2,1,2`, EOS weight 2.0, 53-frame cap. Unlike the matched `3,3,3,1,2` run, this fell back to asr_wer_prefix=1.0 with worse CER 0.864 and no in-domain recovery, so the schedule-aware cheap future-slot matching seems to help only the later-boundary `3,3,3,1,2` schedule, not the earlier-taper `3,3,2,1,2` variant.","timestamp":1773602477070,"segment":0}
{"run":240,"commit":"cf0f36a","metric":1,"metrics":{},"status":"discard","description":"Tested whether the new schedule-aware cheap targeted early-prefix future-slot matching can stabilize the only late-boundary exact-last schedule clue by combining it with `semantic_block_decode_schedule=3,3,3,1,2` and `semantic_block_decode_exact_last_token=true` on the matched two-head branch (`text_source=both`, future weight 0.5, `semantic_self_condition_prob=0.5`, `semantic_self_condition_use_inference_policy=true`, `semantic_self_condition_match_early_grouped_prefix=true`, `semantic_self_condition_match_grouped_future_slots_only=true`, `semantic_self_condition_inference_policy_prob=0.0`, EOS weight 2.0, 53-frame cap). This fell back to asr_wer_prefix=1.0 with only middling CER 0.773, so the new schedule-aware training match seems to help only the plain late-boundary grouped schedule, not the exact-last version of that schedule.","timestamp":1773603234226,"segment":0}
{"run":241,"commit":"cf0f36a","metric":1,"metrics":{},"status":"discard","description":"Ablated the new schedule-aware late-boundary matched-training clue away from future-slots-only replacement by using whole-window cheap early-prefix replacement instead on the matched plain grouped schedule `3,3,3,1,2` (`text_source=both`, `semantic_future_prediction_steps=2`, future weight 0.5, `semantic_self_condition_prob=0.5`, `semantic_self_condition_use_inference_policy=true`, `semantic_self_condition_match_early_grouped_prefix=true`, `semantic_self_condition_inference_policy_prob=0.0`, EOS weight 2.0, 53-frame cap). This fell back to asr_wer_prefix=1.0 with worse CER 0.864, so the weak life in the new schedule-aware branch appears specific to replacing only the speculative schedule future-token slots, not to replacing the whole late-boundary prefix window.","timestamp":1773603997984,"segment":0}
