{"run":707,"commit":"4df3387","metric":1,"metrics":{},"status":"discard","description":"Pushed the detached **old-train-cache-only + CPU-only** timing test further by building `/tmp/xax-bench-9cea09c-oldtrain-latecpu-nogpu`, still keeping the raw CPU-only surface (GPU monitor disabled, default manager, default spawned CPU worker) but delaying `CPUStatsMonitor.start()` until **~540 seconds** into the 600-second run so the CPU monitor spawns only near the very end. This also failed cleanly at **`asr_wer_prefix=1.0`** with near-old-regime throughput (~30.0k samples / 10 min), EOS on both prompts, and clean gt-ASR. Combined with #700 and #706, this substantially prunes the remaining timing/load story on the detached historical route: the harsher CPU-monitor effect is **not** rescued by polling less often, **not** rescued by delaying the CPU worker until after the initial bootstrap phase, and **not** rescued even when the spawned CPU worker appears only at the very end. So the live explanation now points even more strongly at the **spawned CPU worker's process identity / interaction surface itself**, not at simple early-start timing or sustained monitor load.","timestamp":1774041205088,"segment":0}
{"run":708,"commit":"4df3387","metric":1,"metrics":{},"status":"discard","description":"Tested whether the detached **old-train-cache-only + CPU-only** failure is really the spawned CPU worker's interaction with **`SyncManager` proxies** rather than its broader spawned process identity by building `/tmp/xax-bench-9cea09c-oldtrain-noproxycpu-nogpu`. On this overlay the raw CPU-only route still used the default spawned CPU worker and default `ProcessMixin` manager, but `CPUStatsMonitor` itself stopped using **manager-backed `Event`/`Value` proxies** and instead switched to direct context-owned shared synchronization/state (`ctx.Event()` + `ctx.Value(CPUStats, ...)`). It still failed cleanly at **`asr_wer_prefix=1.0`** with near-old-regime throughput (~29.6k samples / 10 min), EOS on both prompts, and clean gt-ASR. So the harsher detached-route CPU-only damage is **not** well explained by the CPU worker merely talking through manager proxies; removing those proxies from the CPU monitor transport does not reproduce the earlier CPU-worker-off-spawn rescue. That points the live mechanism back toward the broader **spawned CPU-worker process identity / bootstrap surface** rather than simple manager-proxy traffic.","timestamp":1774042225270,"segment":0}
{"run":709,"commit":"4df3387","metric":1,"metrics":{},"status":"discard","description":"Backfilled the already-completed detached **old-train-cache-only + CPU-only** control that moved the CPU-monitor logic fully **inline on the training process** instead of running a separate CPU stats worker, using `/tmp/xax-bench-9cea09c-oldtrain-inlinecpu-nogpu` (GPU monitor disabled, default manager still present). This also failed at **`asr_wer_prefix=1.0`** and slowed throughput to only ~26.6k samples / 10 min, with EOS on both prompts and clean gt-ASR. So simply keeping the CPU-stats logic in-process is **not** a clean rescue for the detached historical CPU-only branch; it prunes the easy story that only the extra child process matters, while also showing that a naive inline replacement adds enough overhead to be unattractive as a comparability anchor.","timestamp":1774043171624,"segment":0}
{"run":710,"commit":"6d95500","metric":0.6666666865348816,"metrics":{},"status":"keep","description":"Tested whether the detached **old-train-cache-only + CPU-only** failure requires the CPU worker's **ongoing psutil/process-scan work**, not just its existence as a spawned child, by building `/tmp/xax-bench-9cea09c-oldtrain-dummycpu-nogpu`. On this overlay the raw CPU-only route still kept the default spawned CPU stats worker and default manager surface, but the CPU worker body was reduced to a **dummy spawned process** that only starts and sleeps — no `psutil.Process(...)`, no child enumeration, no memory sampling, no proxy writes beyond startup. This improved cleanly to **`asr_wer_prefix=0.6667`** with near-old-regime throughput (~29.7k samples / 10 min), EOS on both prompts, and acceptable gt-ASR. That is a strong new split: on the detached historical route, the bad CPU-only class is **not** explained by spawned-child presence alone. A large part of the harsher CPU-side damage requires the worker's **real monitoring logic / process-tree interaction**, not just its bootstrap identity.","timestamp":1774044015797,"segment":0}
{"run":711,"commit":"6d95500","metric":1,"metrics":{},"status":"discard","description":"Followed up the new detached **old-train-cache-only + CPU-only** split by testing whether the harmful CPU-monitor work specifically needs the worker's **recursive child/process-tree scan**, or whether sampling the parent process alone is already enough. I built `/tmp/xax-bench-9cea09c-oldtrain-parentcpu-nogpu`, keeping the raw CPU-only spawned worker and default manager surface but reducing the worker to **parent-only psutil sampling** (`proc.cpu_percent()`, `proc.memory_info()`, `proc.memory_percent()`) with all child metrics forced to zero. This still failed cleanly at **`asr_wer_prefix=1.0`** with near-old-regime throughput (~29.7k samples / 10 min), EOS on both prompts, and clean gt-ASR. So the detached CPU-only damage does **not** require the full recursive child-process scan; some **real psutil monitoring of the parent process itself** is already enough to keep the branch in the bad class.","timestamp":1774044833033,"segment":0}
{"run":712,"commit":"21431c5","metric":0.8333333134651184,"metrics":{},"status":"keep","description":"Followed up the detached **old-train-cache-only + CPU-only** split by testing whether the remaining harm after #710 comes just from the CPU worker's **proxy/event/logging traffic**, even without real monitoring work. I built `/tmp/xax-bench-9cea09c-oldtrain-zerocpu-nogpu`, keeping the default spawned CPU worker and default manager surface but replacing its body with a **zero-emitting monitor** that writes all-zero `CPUStats` payloads and sets the monitor event every interval — so the proxy transport and scalar logging path stay active, but there is **no `psutil` sampling at all**. This improved to **`asr_wer_prefix=0.8333`** with near-old-regime throughput (~29.6k samples / 10 min), EOS on both prompts, and clean gt-ASR. Combined with #710 and #711, this is a strong new detached-route split: **proxy/event/logging traffic alone is somewhat harmful**, but the much worse raw `1.0` class needs **real psutil monitoring of the training process**; the full detached CPU-only damage is not just spawned-child presence and not just transport overhead either.","timestamp":1774045624376,"segment":0}
{"run":713,"commit":"78e6c3e","metric":0.8333333134651184,"metrics":{},"status":"keep","description":"Followed up the detached **old-train-cache-only + CPU-only** `psutil` split by testing whether the remaining parent-side harm is already captured by **`proc.cpu_percent()` alone**. I built `/tmp/xax-bench-9cea09c-oldtrain-cpupctcpu-nogpu`, keeping the default spawned CPU worker and default manager surface but reducing the worker to emit only `cpu_percent=proc.cpu_percent()` while forcing every memory / child field to zero. This improved to **`asr_wer_prefix=0.8333`** with near-old-regime throughput (~29.7k samples / 10 min), EOS on both prompts, and clean gt-ASR. Relative to #711, that strongly suggests the much worse detached CPU-only `1.0` class is **not** driven by `cpu_percent()` alone; the sharper remaining harm is more likely in the worker's **memory/process-inspection path** (`memory_info`, `memory_percent`, or related `psutil` state), with proxy/event/logging overhead still contributing a weaker `0.8333` class.","timestamp":1774046542485,"segment":0}
{"run":714,"commit":"2e750ba","metric":0.6666666865348816,"metrics":{},"status":"keep","description":"Followed up the detached **old-train-cache-only + CPU-only** `psutil` split by testing whether the remaining bad class is already captured by **`proc.memory_info()` alone**. I built `/tmp/xax-bench-9cea09c-oldtrain-meminfocpu-nogpu`, keeping the default spawned CPU worker and default manager surface but reducing the worker to emit only the memory-info-derived fields (`mem_rss`, `mem_vms`, `mem_shared`, totals from the same parent process) while forcing `cpu_percent`, `mem_percent`, and every child field to zero. This improved cleanly to **`asr_wer_prefix=0.6667`** with near-old-regime throughput (~29.6k samples / 10 min), EOS on both prompts, and strong in-domain match (`0.1111`). Relative to #711 and #713, that is a sharp new detached-route split: the raw `1.0` CPU-only class is **not** driven by `cpu_percent()` alone and apparently **does not require `memory_info()` alone** either. The remaining leading suspect is now the CPU worker's **`memory_percent()` / related memory-side `psutil` path**, with transport/logging overhead still looking like a weaker secondary harm.","timestamp":1774047574622,"segment":0}
{"run":715,"commit":"3711103","metric":0.8333333134651184,"metrics":{},"status":"keep","description":"Followed up the detached **old-train-cache-only + CPU-only** memory-side split by testing whether the remaining bad class is already captured by **`proc.memory_percent()` alone**. I built `/tmp/xax-bench-9cea09c-oldtrain-mempctcpu-nogpu`, keeping the default spawned CPU worker and default manager surface but reducing the worker to emit only `mem_percent=proc.memory_percent()` while forcing every CPU, raw-memory, and child field to zero. This improved only to **`asr_wer_prefix=0.8333`** with near-old-regime throughput (~29.5k samples / 10 min), EOS on both prompts, and clean gt-ASR. Relative to #714, that says the much worse detached CPU-only `1.0` class is **not** explained by `memory_info()` alone, but `memory_percent()` remains a stronger suspect than `cpu_percent()`: it still leaves the weaker bad class, and the remaining raw `1.0` route now looks most consistent with a **small memory-side `psutil` combination** rather than any one already-tested scalar call by itself.","timestamp":1774048441193,"segment":0}
{"run":716,"commit":"0c7bfc1","metric":0.8333333134651184,"metrics":{},"status":"keep","description":"Pushed the detached **old-train-cache-only + CPU-only** memory-side split one step further by testing the simple two-percent combination **`proc.cpu_percent() + proc.memory_percent()`** without any raw-memory or child-process fields. I built `/tmp/xax-bench-9cea09c-oldtrain-cpumempctcpu-nogpu`, keeping the default spawned CPU worker and default manager surface but emitting only those two scalar percentages while forcing every raw-memory and child field to zero. This still improved only to **`asr_wer_prefix=0.8333`** with near-old-regime throughput (~29.6k samples / 10 min), EOS on both prompts, and acceptable gt-ASR. Relative to #714 and #715, that usefully narrows the detached CPU-only mechanism again: the remaining raw `1.0` class is **not** explained by `cpu_percent()` alone, **not** by `memory_percent()` alone, and **not** by their simple pair either. The cleanest next suspect is now a narrower **memory-side combination** that still includes `memory_percent()` but also needs richer memory/process inspection, with **`memory_info() + memory_percent()`** the clearest next isolate.","timestamp":1774049302335,"segment":0}
{"run":717,"commit":"62707da","metric":0.6666666865348816,"metrics":{},"status":"keep","description":"Tested the detached **old-train-cache-only + CPU-only** route with the remaining memory-side pair **`proc.memory_info() + proc.memory_percent()`**, while removing `cpu_percent()` and all child-process fields. I built `/tmp/xax-bench-9cea09c-oldtrain-meminfomempctcpu-nogpu`, keeping the default spawned CPU worker and default manager surface but emitting only raw parent memory-info fields (`mem_rss`, `mem_vms`, `mem_shared`, same-process totals) plus `mem_percent`. This recovered the stronger **`asr_wer_prefix=0.6667`** class with clean gt-ASR, EOS on both prompts, very strong CER (`0.4091`), and near-old-regime throughput (~29.9k samples / 10 min). Relative to #711 and #714-#716, that sharply prunes the detached CPU-only hypothesis again: the raw `1.0` class is **not** explained by `memory_percent()` alone, **not** by `cpu_percent()+memory_percent()`, and now **not** by `memory_info()+memory_percent()` either. The cleanest remaining parent-only isolate is now **`cpu_percent() + memory_info()`**, or a call-order / warmup effect that only appears when all three parent-side `psutil` reads are present together.","timestamp":1774050545558,"segment":0}
{"run":718,"commit":"c272704","metric":0.5,"metrics":{},"status":"keep","description":"Tested the last unexplained parent-only `psutil` pair on the detached **old-train-cache-only + CPU-only** route: **`proc.cpu_percent() + proc.memory_info()`**, with `memory_percent()` and all child-process fields removed. I built `/tmp/xax-bench-9cea09c-oldtrain-cpupctmeminfocpu-nogpu`, keeping the default spawned CPU worker and default manager surface but emitting only `cpu_percent` plus raw parent memory-info fields (`mem_rss`, `mem_vms`, `mem_shared`, same-process totals). This improved further to **`asr_wer_prefix=0.5`** with clean gt-ASR, EOS on both prompts, near-old-regime throughput (~29.8k samples / 10 min), and controlled generation length. Relative to #711 and #713-#717, this is the sharpest detached CPU-only split so far: the raw `1.0` class is **not** explained by any single parent-side call, **not** by the pairs involving `memory_percent()`, but the remaining pair **`cpu_percent() + memory_info()`** is the only parent-only combination that materially improves beyond `0.6667`. That strongly concentrates the mechanism around the interaction between those two calls — though this exact branch now needs an immediate rerun before treating `0.5` as anything more than the newest spike.","timestamp":1774051396046,"segment":0}
{"run":719,"commit":"7fc768f","metric":0.6666666865348816,"metrics":{},"status":"keep","description":"Exact rerun of the detached **old-train-cache-only + CPU-only** parent-only **`proc.cpu_percent() + proc.memory_info()`** branch from #718, using the same `/tmp/xax-bench-9cea09c-oldtrain-cpupctmeminfocpu-nogpu` overlay and the same old-HF + old-train-only canonical probe. The branch stayed clearly alive but weakened from **`0.5`** to **`asr_wer_prefix=0.6667`**, with clean gt-ASR, EOS on both prompts, and near-old-regime throughput (~29.8k samples / 10 min). This keeps the mechanism sharp while downgrading the apparent stability: among the parent-only `psutil` splits, **`cpu_percent() + memory_info()`** is still the only pair that has broken into the stronger class at all, but it is not yet a recovered anchor — current picture is **`0.5 -> 0.6667`** rather than a stable new baseline.","timestamp":1774052249209,"segment":0}
{"run":720,"commit":"7fc768f","metric":1,"metrics":{},"status":"discard","description":"Ran the third exact probe of the detached **old-train-cache-only + CPU-only** parent-only **`proc.cpu_percent() + proc.memory_info()`** branch (`/tmp/xax-bench-9cea09c-oldtrain-cpupctmeminfocpu-nogpu`). Unlike #718 and #719, this rerun collapsed back to **`asr_wer_prefix=1.0`** despite still keeping near-old-regime throughput (~29.6k samples / 10 min), EOS on both prompts, and the same narrow parent-only `psutil` surface. So this branch remains mechanistically important — it is still the only parent-only pair that ever reached the `0.5` class — but it is now clearly **not a stable recovered anchor**. Current picture is **`0.5 -> 0.6667 -> 1.0`**, so the best next step is no longer more blind reruns of this exact pair; it is a very small **call-order / warmup** probe around `cpu_percent()` and `memory_info()`, or a return to consumer-level tracing, because the isolated pair itself is now confirmed to be noisy.","timestamp":1774053028270,"segment":0}
{"run":721,"commit":"bea662b","metric":0.8333333134651184,"metrics":{},"status":"keep","description":"Ran the first narrow **call-order / warmup** follow-up on the detached **old-train-cache-only + CPU-only** `proc.cpu_percent()+proc.memory_info()` branch by adding a one-call **`proc.cpu_percent()` warmup** before entering the per-interval loop, while otherwise keeping the same parent-only pair and zeroing `memory_percent` / child fields. I built `/tmp/xax-bench-9cea09c-oldtrain-cpupctwarmmeminfocpu-nogpu`. This weakened to **`asr_wer_prefix=0.8333`** with near-old-regime throughput (~29.5k samples / 10 min), EOS on both prompts, and very strong in-domain prompt match. Relative to #718-#720, that prunes the simplest warmup story: the `cpu_percent()+memory_info()` clue is **not** rescued or stabilized by merely priming `cpu_percent()` once before the loop. The remaining live explanation is now narrower — likely **per-iteration call order / sequencing** between those two reads, not just pair membership or a trivial one-call warmup effect.","timestamp":1774054024887,"segment":0}
{"run":722,"commit":"bea662b","metric":1,"metrics":{},"status":"discard","description":"Tested the **call-order** half of the detached **old-train-cache-only + CPU-only** `proc.cpu_percent()+proc.memory_info()` follow-up by reversing the per-iteration order: the worker now calls `proc.cpu_percent()` first and only then reads `proc.memory_info()`, with `memory_percent` and all child fields still zeroed. I built `/tmp/xax-bench-9cea09c-oldtrain-cpufirstmeminfocpu-nogpu`. This collapsed cleanly back to **`asr_wer_prefix=1.0`** despite near-old-regime throughput (~29.6k samples / 10 min), EOS on both prompts, and clean gt-ASR. Relative to #721, that is a strong new mechanistic split: the surviving `cpu_percent()+memory_info()` clue is **not** just about pair membership. The **per-iteration order** of those two parent-side `psutil` reads materially matters, and putting `cpu_percent()` first appears to return this branch to the bad class.","timestamp":1774054817348,"segment":0}
{"run":723,"commit":"bea662b","metric":1,"metrics":{},"status":"discard","description":"Tested the remaining tiny **call-order + warmup** corner on the detached **old-train-cache-only + CPU-only** `proc.cpu_percent()+proc.memory_info()` branch: the worker now does a one-call `cpu_percent()` warmup at startup **and** still calls `cpu_percent()` before `memory_info()` on each interval. I built `/tmp/xax-bench-9cea09c-oldtrain-cpufirstwarmmeminfocpu-nogpu`. This still failed cleanly at **`asr_wer_prefix=1.0`** with near-old-regime throughput (~29.5k samples / 10 min), lost EOS on the OOD prompt, and returned to the long-frame class (`generated_num_frames=122`). Combined with #721 and #722, this now makes the detached CPU-only clue much sharper: the bad class is **not** about lacking a trivial `cpu_percent()` warmup. It is specifically the **per-iteration ordering** where `cpu_percent()` precedes `memory_info()` that looks toxic on this route.","timestamp":1774055601606,"segment":0}
{"run":724,"commit":"d455668","metric":0.8333333134651184,"metrics":{},"status":"keep","description":"Ran the next tiny sequencing/value-consumption probe on the detached **old-train-cache-only + CPU-only** route: the worker now **touches `proc.cpu_percent()` first**, then reads **`proc.memory_info()`**, and only then logs a **second** `proc.cpu_percent()` value for the interval, with `memory_percent` and all child fields still zeroed. I built `/tmp/xax-bench-9cea09c-oldtrain-cpupretouchmeminfocpu-nogpu`. This weakened only to **`asr_wer_prefix=0.8333`** with near-old-regime throughput (~29.3k samples / 10 min), EOS on both prompts, and acceptable gt-ASR. Relative to #722 and #723, that is a useful new split: merely **touching** `cpu_percent()` before `memory_info()` is **not** sufficient by itself to keep the detached branch in the bad `1.0` class. The harsher failure now looks concentrated more specifically on the case where the **pre-`memory_info()` `cpu_percent()` reading is the one actually consumed** for that interval, rather than on pair membership or a trivial early touch alone.","timestamp":1774056621519,"segment":0}
{"run":725,"commit":"ea6e67b","metric":0.6666666865348816,"metrics":{},"status":"keep","description":"Ran the next tiny sequencing/value-consumption probe on the detached **old-train-cache-only + CPU-only** route: the worker now reads **`proc.memory_info()` first**, then touches **`proc.cpu_percent()`**, and only then logs a **second** `proc.cpu_percent()` value for the interval, with `memory_percent` and all child fields still zeroed. I built `/tmp/xax-bench-9cea09c-oldtrain-meminfotouchcpucpu-nogpu`. This recovered the stronger **`asr_wer_prefix=0.6667`** class with near-old-regime throughput (~29.4k samples / 10 min), EOS on both prompts, and acceptable gt-ASR. Relative to #724, this is a clean new split: merely consuming a *second* post-`memory_info()` `cpu_percent()` reading is **not** enough to poison the branch. What matters much more is whether **`memory_info()` happens before any `cpu_percent()` call in that interval**. That keeps the branch in the stronger class even when an extra `cpu_percent()` touch is present afterward.","timestamp":1774058423014,"segment":0}
