{"run":242,"commit":"cf0f36a","metric":1,"metrics":{},"status":"discard","description":"Exact reran the new schedule-aware late-boundary matched-training clue on the plain grouped schedule `3,3,3,1,2` (`text_source=both`, `semantic_future_prediction_steps=2`, future weight 0.5, `semantic_self_condition_prob=0.5`, `semantic_self_condition_use_inference_policy=true`, `semantic_self_condition_match_early_grouped_prefix=true`, `semantic_self_condition_match_grouped_future_slots_only=true`, `semantic_self_condition_inference_policy_prob=0.0`, EOS weight 2.0, 53-frame cap). The first schedule-aware run had weak life at `0.8333`, but this exact rerun fell back to asr_wer_prefix=1.0 despite very strong throughput (~29.9k samples / 10 min). So the new schedule-aware late-boundary clue looks real enough to affect branch behavior, but it is still noisy rather than robust.","timestamp":1773604752783,"segment":0}
{"run":243,"commit":"cf0f36a","metric":1,"metrics":{},"status":"discard","description":"Tested a broader exact-last late-boundary schedule analogue by pairing the live `block_decode_size=4` future-slots-only cheap targeted early-prefix branch with `semantic_block_decode_schedule=4,4,1,3` and `semantic_block_decode_exact_last_token=true` (`text_source=both`, `semantic_future_prediction_steps=2`, future weight 0.5, `semantic_self_condition_prob=0.5`, `semantic_self_condition_use_inference_policy=true`, `semantic_self_condition_match_early_grouped_prefix=true`, `semantic_self_condition_match_grouped_future_slots_only=true`, `semantic_self_condition_inference_policy_prob=0.0`, EOS weight 2.0, 53-frame cap). This failed cleanly at asr_wer_prefix=1.0 with worse CER 0.909, so the late exact-bridge plus short-final-group schedule that had weak life in the 3-token grouped family does not transfer directly to the broader exact/future/future/exact branch.","timestamp":1773605661715,"segment":0}
{"run":244,"commit":"cf0f36a","metric":1,"metrics":{},"status":"discard","description":"Added an optional cheap early-prefix train/infer-match path that fills grouped speculative slots from the auxiliary future-Q0 heads at the grouped-step source positions (`semantic_self_condition_match_grouped_use_future_heads=true`) instead of using teacher-forced one-step next-token predictions, then tested it on the live broader exact-last clue: `text_source=both`, `semantic_future_prediction_steps=2`, future weight 0.5, `semantic_self_condition_prob=0.5`, `semantic_self_condition_use_inference_policy=true`, `semantic_self_condition_match_early_grouped_prefix=true`, `semantic_self_condition_match_grouped_future_slots_only=true`, `semantic_self_condition_match_grouped_use_future_heads=true`, `semantic_self_condition_inference_policy_prob=0.0`, `semantic_block_decode_size=4`, `semantic_block_decode_exact_last_token=true`, first 12 semantic tokens grouped, EOS weight 2.0, 53-frame cap. This failed cleanly at asr_wer_prefix=1.0 with CER 0.818 and very poor gt-ASR sanity 0.6, so directly injecting future-head slot predictions does not obviously strengthen the revived broader exact/future/future/exact branch in this first form.","timestamp":1773607403744,"segment":0}
{"run":245,"commit":"cf0f36a","metric":1,"metrics":{},"status":"discard","description":"Retested the new cheap future-head speculative-slot replacement path on the only schedule-aware late-boundary clue by combining `semantic_self_condition_match_grouped_use_future_heads=true` with the plain grouped schedule `semantic_block_decode_schedule=3,3,3,1,2` (`text_source=both`, `semantic_future_prediction_steps=2`, future weight 0.5, `semantic_self_condition_prob=0.5`, `semantic_self_condition_use_inference_policy=true`, `semantic_self_condition_match_early_grouped_prefix=true`, `semantic_self_condition_match_grouped_future_slots_only=true`, `semantic_self_condition_inference_policy_prob=0.0`, EOS weight 2.0, 53-frame cap). This also failed cleanly at asr_wer_prefix=1.0 with CER 1.0, so directly filling speculative grouped slots from future-head predictions looks stale both on the broader exact-last branch and on the newer schedule-aware late-boundary branch.","timestamp":1773608153573,"segment":0}
{"run":246,"commit":"cf0f36a","metric":1,"metrics":{},"status":"discard","description":"Tested the broader exact-last no-bridge boundary taper analogue by pairing the live `block_decode_size=4` future-slots-only cheap targeted early-prefix branch with `semantic_block_decode_schedule=4,4,3,1` and `semantic_block_decode_exact_last_token=true` (`text_source=both`, `semantic_future_prediction_steps=2`, future weight 0.5, `semantic_self_condition_prob=0.5`, `semantic_self_condition_use_inference_policy=true`, `semantic_self_condition_match_early_grouped_prefix=true`, `semantic_self_condition_match_grouped_future_slots_only=true`, `semantic_self_condition_inference_policy_prob=0.0`, EOS weight 2.0, 53-frame cap). This also failed cleanly at asr_wer_prefix=1.0 with CER 0.864 and no in-domain recovery, so the broader exact/future/future/exact branch does not seem to benefit from either the `4,4,1,3` late-bridge schedule or the `4,4,3,1` no-bridge taper.","timestamp":1773608347288,"segment":0}
{"run":247,"commit":"cf0f36a","metric":1,"metrics":{},"status":"discard","description":"Added a heavy-eval-only grouped-token refinement candidate (`semantic_eval_compare_refined_candidate=true`) that runs a single teacher-forced pass over the generated semantic candidate and replaces only the speculative grouped-token slots with exact next-token predictions before semantic-NLL reranking, then tested it on the live broader exact-last clue: `text_source=both`, `semantic_future_prediction_steps=2`, future weight 0.5, `semantic_self_condition_prob=0.5`, `semantic_self_condition_use_inference_policy=true`, `semantic_self_condition_match_early_grouped_prefix=true`, `semantic_self_condition_match_grouped_future_slots_only=true`, `semantic_self_condition_inference_policy_prob=0.0`, `semantic_block_decode_size=4`, `semantic_block_decode_exact_last_token=true`, first 12 semantic tokens grouped, EOS weight 2.0, 53-frame cap. This fell back to asr_wer_prefix=1.0 with CER 0.864, so a cheap post-hoc exact-head refinement of the speculative grouped slots does not stabilize the revived broader exact/future/future/exact branch either.","timestamp":1773609366850,"segment":0}
{"run":248,"commit":"cf0f36a","metric":0.8333333134651184,"metrics":{},"status":"discard","description":"Tested the new heavy-eval grouped-token refinement candidate on the only schedule-aware late-boundary clue by combining `semantic_eval_compare_refined_candidate=true` with the plain grouped schedule `semantic_block_decode_schedule=3,3,3,1,2` (`text_source=both`, `semantic_future_prediction_steps=2`, future weight 0.5, `semantic_self_condition_prob=0.5`, `semantic_self_condition_use_inference_policy=true`, `semantic_self_condition_match_early_grouped_prefix=true`, `semantic_self_condition_match_grouped_future_slots_only=true`, `semantic_self_condition_inference_policy_prob=0.0`, EOS weight 2.0, 53-frame cap). This recovered weak life at asr_wer_prefix=0.8333 with improved CER 0.682, suggesting the cheap post-hoc exact-head refinement may help this noisy late-boundary schedule a bit, but it still stayed below the robust 0.6667 baseline.","timestamp":1773610123229,"segment":0}
{"run":249,"commit":"cf0f36a","metric":1,"metrics":{},"status":"discard","description":"Exact reran the new heavy-eval grouped-token refinement candidate on the plain late-boundary grouped schedule `semantic_block_decode_schedule=3,3,3,1,2` (`text_source=both`, `semantic_future_prediction_steps=2`, future weight 0.5, `semantic_self_condition_prob=0.5`, `semantic_self_condition_use_inference_policy=true`, `semantic_self_condition_match_early_grouped_prefix=true`, `semantic_self_condition_match_grouped_future_slots_only=true`, `semantic_self_condition_inference_policy_prob=0.0`, `semantic_eval_compare_refined_candidate=true`, EOS weight 2.0, 53-frame cap). The first refined-candidate run had weak life at `0.8333`, but this exact rerun fell back to asr_wer_prefix=1.0 despite very strong throughput (~29.4k samples / 10 min) and good in-domain WER 0.444. So the cheap post-hoc exact-head refinement looks like another noisy late-boundary schedule-side clue rather than a robust grouped-branch stabilizer.","timestamp":1773610885171,"segment":0}
{"run":250,"commit":"cf0f36a","metric":1,"metrics":{},"status":"discard","description":"Tested the new heavy-eval grouped-token refinement candidate on the original fragile grouped-prefix winner (`text_source=both`, `semantic_future_prediction_steps=2`, future weight 0.5, `semantic_self_condition_prob=0.5`, `semantic_block_decode_size=3`, first 12 semantic tokens grouped, EOS weight 2.0, 53-frame cap, `semantic_eval_compare_refined_candidate=true`). This failed cleanly at asr_wer_prefix=1.0 with worse CER 0.955 and very poor in-domain WER, so the cheap post-hoc refinement heuristic does not rescue the original plain grouped-prefix mainline either.","timestamp":1773611754765,"segment":0}
{"run":251,"commit":"cf0f36a","metric":1,"metrics":{},"status":"discard","description":"Tested the new heavy-eval grouped-token refinement candidate on the 600M exact-last grouped branch with the cheap future-slots-only early-prefix training match (`text_source=both`, `semantic_future_prediction_steps=2`, future weight 0.5, `semantic_self_condition_prob=0.5`, `semantic_self_condition_use_inference_policy=true`, `semantic_self_condition_match_early_grouped_prefix=true`, `semantic_self_condition_match_grouped_future_slots_only=true`, `semantic_self_condition_inference_policy_prob=0.0`, `semantic_block_decode_size=3`, `semantic_block_decode_exact_last_token=true`, first 12 semantic tokens grouped, EOS weight 2.0, 53-frame cap, `semantic_eval_compare_refined_candidate=true`). This failed cleanly at asr_wer_prefix=1.0 with CER 0.955, so the cheap post-hoc refinement heuristic does not rescue the narrower exact-last grouped branch either.","timestamp":1773612562509,"segment":0}
{"run":252,"commit":"cf0f36a","metric":1,"metrics":{},"status":"discard","description":"Transferred the only surviving late-boundary schedule idea onto the revived three-head broader exact-last family by pairing the future-slots-only cheap targeted early-prefix training match with `semantic_future_prediction_steps=3`, `semantic_block_decode_size=5`, `semantic_block_decode_schedule=5,5,1,4`, and `semantic_block_decode_exact_last_token=true` (`text_source=both`, future weight 0.5, `semantic_self_condition_prob=0.5`, `semantic_self_condition_use_inference_policy=true`, `semantic_self_condition_match_early_grouped_prefix=true`, `semantic_self_condition_match_grouped_future_slots_only=true`, `semantic_self_condition_inference_policy_prob=0.0`, EOS weight 2.0, 53-frame cap). This failed cleanly at asr_wer_prefix=1.0 with worse CER 1.136, so the late exact-bridge plus short-final-group schedule clue does not transfer to the broader three-head exact/future/future/future/exact branch either.","timestamp":1773613775444,"segment":0}
{"run":253,"commit":"cf0f36a","metric":1,"metrics":{},"status":"discard","description":"Exact reran the revived three-head broader exact-last matched-training clue (`text_source=both`, `semantic_future_prediction_steps=3`, future weight 0.5, `semantic_self_condition_prob=0.5`, `semantic_self_condition_use_inference_policy=true`, `semantic_self_condition_match_early_grouped_prefix=true`, `semantic_self_condition_match_grouped_future_slots_only=true`, `semantic_self_condition_inference_policy_prob=0.0`, `semantic_block_decode_size=5`, `semantic_block_decode_max_grouped_tokens=15`, `semantic_block_decode_exact_last_token=true`, EOS weight 2.0, 53-frame cap). The earlier two runs on this three-head family had both reached weak life at 0.8333, but this exact rerun fell cleanly back to asr_wer_prefix=1.0 despite strong CER 0.636. So the broader three-head exact/future/future/future/exact branch now also looks like a noisy side clue rather than a robust extension of the live two-head block_size=4 family.","timestamp":1773614539467,"segment":0}
{"run":254,"commit":"cf0f36a","metric":1,"metrics":{},"status":"discard","description":"Exact reran the main live broader exact-last matched-training clue again after pruning the dead heavy-eval refinement path: `text_source=both`, `semantic_future_prediction_steps=2`, future weight 0.5, `semantic_self_condition_prob=0.5`, `semantic_self_condition_use_inference_policy=true`, `semantic_self_condition_match_early_grouped_prefix=true`, `semantic_self_condition_match_grouped_future_slots_only=true`, `semantic_self_condition_inference_policy_prob=0.0`, `semantic_block_decode_size=4`, `semantic_block_decode_exact_last_token=true`, `semantic_block_decode_max_grouped_tokens=12`, EOS weight 2.0, 53-frame cap. After the earlier 0.6667 then 0.8333 results, this fresh exact rerun fell cleanly back to asr_wer_prefix=1.0 with CER 0.864 and even gt-ASR sanity degraded to 0.143, so the broader two-head exact/future/future/exact branch remains very noisy rather than stabilizing into a robust successor.","timestamp":1773615354841,"segment":0}
{"run":255,"commit":"cf0f36a","metric":1,"metrics":{},"status":"discard","description":"Added `acoustic_loss_ramp_steps` to linearly warm up the Stage-2 residual loss so Stage 1 gets more of the early 10-minute budget, then tested it on the strongest reproducible four-head future-Q0 baseline with `acoustic_loss_ramp_steps=1000` (`semantic_future_prediction_steps=4`, future weight 0.5, `semantic_self_condition_prob=0.5`, EOS weight 2.0, 53-frame cap). This failed cleanly at asr_wer_prefix=1.0 with worse CER 1.136 and no in-domain recovery, so a long Stage-2 loss ramp does not help the robust baseline stabilize text-conditioned semantics faster.","timestamp":1773616292411,"segment":0}
{"run":256,"commit":"cf0f36a","metric":1,"metrics":{},"status":"discard","description":"Tested the new Stage-2 acoustic-loss ramp on the original fragile grouped-prefix winner by adding `acoustic_loss_ramp_steps=500` to the `cf0f36a` recipe (`text_source=both`, `semantic_future_prediction_steps=2`, future weight 0.5, `semantic_self_condition_prob=0.5`, `semantic_block_decode_size=3`, first 12 semantic tokens grouped, EOS weight 2.0, 53-frame cap). This still missed on the primary metric at asr_wer_prefix=1.0, but it recovered decent secondary signals (CER 0.682, in-domain WER 0.667) without hurting throughput much. So a short early Stage-2 delay is not an immediate grouped-branch win, though it may be a weak secondary-signal clue rather than a fully dead idea.","timestamp":1773617048208,"segment":0}
{"run":257,"commit":"cf0f36a","metric":1,"metrics":{},"status":"discard","description":"Retuned the new Stage-2 acoustic-loss ramp on the original grouped-prefix winner by shortening it to `acoustic_loss_ramp_steps=250` (`text_source=both`, `semantic_future_prediction_steps=2`, future weight 0.5, `semantic_self_condition_prob=0.5`, `semantic_block_decode_size=3`, first 12 semantic tokens grouped, EOS weight 2.0, 53-frame cap). This still failed badly on the OOD primary metric at asr_wer_prefix=1.0 and exploded CER to 2.73, even though in-domain WER improved to 0.444. So shorter Stage-2 delay looks like another in-domain-only side effect rather than a robust grouped-branch improvement.","timestamp":1773617786342,"segment":0}
{"run":258,"commit":"cf0f36a","metric":1,"metrics":{},"status":"discard","description":"Added `semantic_future_prediction_label_smoothing` to soften only the auxiliary future-Q0 heads, then tested it on the original grouped-prefix winner with `semantic_future_prediction_label_smoothing=0.1` (`text_source=both`, `semantic_future_prediction_steps=2`, future weight 0.5, `semantic_self_condition_prob=0.5`, `semantic_block_decode_size=3`, first 12 semantic tokens grouped, EOS weight 2.0, 53-frame cap). This failed cleanly at asr_wer_prefix=1.0 with middling CER 0.773, so broad label smoothing on the grouped speculative future heads does not obviously stabilize the plain grouped-prefix branch.","timestamp":1773618665471,"segment":0}
{"run":259,"commit":"cf0f36a","metric":1,"metrics":{},"status":"discard","description":"Transferred the new future-head label smoothing idea onto the live broader exact-last matched-training branch by setting `semantic_future_prediction_label_smoothing=0.1` with `text_source=both`, `semantic_future_prediction_steps=2`, future weight 0.5, `semantic_self_condition_prob=0.5`, `semantic_self_condition_use_inference_policy=true`, `semantic_self_condition_match_early_grouped_prefix=true`, `semantic_self_condition_match_grouped_future_slots_only=true`, `semantic_self_condition_inference_policy_prob=0.0`, `semantic_block_decode_size=4`, `semantic_block_decode_exact_last_token=true`, first 12 semantic tokens grouped, EOS weight 2.0, and the 53-frame cap. This also failed cleanly at asr_wer_prefix=1.0 with worse CER 1.136, so softening the auxiliary speculative future-token targets does not rescue the broader exact/future/future/exact branch either.","timestamp":1773619420893,"segment":0}
{"run":260,"commit":"cf0f36a","metric":0.8333333134651184,"metrics":{},"status":"discard","description":"Added `semantic_future_prediction_ramp_steps` to linearly warm up the future-Q0 auxiliary instead of applying its full weight from the first update, then tested it on the original grouped-prefix winner with `semantic_future_prediction_ramp_steps=500` (`text_source=both`, `semantic_future_prediction_steps=2`, future weight 0.5, `semantic_self_condition_prob=0.5`, `semantic_block_decode_size=3`, first 12 semantic tokens grouped, EOS weight 2.0, 53-frame cap). This recovered weak life at asr_wer_prefix=0.8333 with CER 0.773, suggesting a softer early introduction of speculative future-token supervision may help the plain grouped-prefix branch a bit, but it still stayed well below the robust 0.6667 baseline and hurt in-domain behavior.","timestamp":1773620279151,"segment":0}
{"run":261,"commit":"cf0f36a","metric":1,"metrics":{},"status":"discard","description":"Exact reran the new future-Q0 auxiliary ramp idea on the original grouped-prefix winner with `semantic_future_prediction_ramp_steps=500` (`text_source=both`, `semantic_future_prediction_steps=2`, future weight 0.5, `semantic_self_condition_prob=0.5`, `semantic_block_decode_size=3`, first 12 semantic tokens grouped, EOS weight 2.0, 53-frame cap). The first run had weak life at 0.8333, but this exact rerun fell back to asr_wer_prefix=1.0 despite very strong throughput (~31.6k samples / 10 min) and decent CER 0.727. So the softer future-auxiliary warmup currently looks like another noisy grouped-prefix side clue rather than a robust new training schedule.","timestamp":1773621032935,"segment":0}
{"run":262,"commit":"cf0f36a","metric":1,"metrics":{},"status":"discard","description":"Implemented a new generated-context Stage-1.5 Q0 refiner that trains on a second LLM pass over the model's own greedy Q0 sequence while keeping the text prefix fixed, then applies the same one-pass refiner before Stage 2 at inference. Tested it first on the original grouped-prefix winner with `semantic_q0_refiner_loss_weight=0.5` (`text_source=both`, `semantic_future_prediction_steps=2`, future weight 0.5, `semantic_self_condition_prob=0.5`, `semantic_block_decode_size=3`, first 12 semantic tokens grouped, EOS weight 2.0, 53-frame cap). This failed badly at asr_wer_prefix=1.0 with exploded CER 2.73 and much lower throughput (~10.9k samples / 10 min), so the first truly generated-context refiner prototype is not an immediate rescue for the fragile grouped-prefix branch.","timestamp":1773622404026,"segment":0}
{"run":263,"commit":"cf0f36a","metric":1,"metrics":{},"status":"discard","description":"Retuned the new generated-context Stage-1.5 Q0 refiner downward on the original grouped-prefix winner by reducing `semantic_q0_refiner_loss_weight` from 0.5 to 0.25 while keeping the same second-pass greedy-generated Q0 context and inference-time one-pass refinement (`text_source=both`, `semantic_future_prediction_steps=2`, future weight 0.5, `semantic_self_condition_prob=0.5`, `semantic_block_decode_size=3`, first 12 semantic tokens grouped, EOS weight 2.0, 53-frame cap). This remained a clean asr_wer_prefix=1.0 miss with only middling CER 0.818 and still-low throughput (~10.9k samples / 10 min), so the new generated-context refiner family looks too slow and still non-competitive in its first two weights.","timestamp":1773623163437,"segment":0}
{"run":264,"commit":"cf0f36a","metric":1,"metrics":{},"status":"discard","description":"Added a direct Stage-2 text anchor by interpolating text-prefix hidden states into the residual decoder inputs, then tested it on the original grouped-prefix winner with `residual_text_context_weight=0.5` (`text_source=both`, `semantic_future_prediction_steps=2`, future weight 0.5, `semantic_self_condition_prob=0.5`, `semantic_block_decode_size=3`, first 12 semantic tokens grouped, EOS weight 2.0, 53-frame cap). This failed badly at asr_wer_prefix=1.0 with exploded CER 2.73, so giving Stage 2 a cheap direct text-prefix context does not rescue the fragile grouped-prefix branch in this first form.","timestamp":1773624143703,"segment":0}
