{"type":"config","name":"LJSpeech TTS Whisper-match quality after 10 minutes","metricName":"asr_wer_prefix","metricUnit":"","bestDirection":"lower"}
{"run":1,"commit":"34b9c8e","metric":1,"metrics":{},"status":"keep","description":"Baseline: current two-stage Qwen3-600M + Mimi residual TTS on LJSpeech for 10 minutes with Whisper heavy eval; asr_wer_prefix=1.0, no EOS emitted, generations hit frame cap and drift.","timestamp":1773391393473,"segment":0}
{"run":2,"commit":"34b9c8e","metric":0,"metrics":{},"status":"crash","description":"Tried explicit two-GPU baseline via CUDA_VISIBLE_DEVICES=0,1 ./autoresearch.sh --launcher multi; harness was not executable (permission denied).","timestamp":1773392988238,"segment":0}
{"run":3,"commit":"34b9c8e","metric":1,"metrics":{},"status":"discard","description":"Explicit multi-GPU baseline via CUDA_VISIBLE_DEVICES=0,1 ./autoresearch.sh --launcher multi matched the previous WER (asr_wer_prefix=1.0). Ground-truth Whisper sanity check is decent (asr_wer_gt=0.067), so ASR/resample is not totally broken, but generated transcripts remain nonsense, no EOS is emitted, and the training logs still report only JAX device 0 visible despite the multi launcher.","timestamp":1773393711889,"segment":0}
{"run":4,"commit":"34b9c8e","metric":1,"metrics":{},"status":"discard","description":"Fixed the harness to bypass queue GPU masking and avoid ambient RUN_DIR collisions, then reran the 10-minute benchmark on both GPUs (JAX devices [0,1], ~73 samples/s). Despite the throughput gain and perfect Whisper transcription on ground-truth audio (asr_wer_gt=0.0), prompt generations still had no EOS, hit the 121-frame cap, and stayed at asr_wer_prefix=1.0.","timestamp":1773395130412,"segment":0}
{"run":5,"commit":"6a79dd8","metric":1,"metrics":{},"status":"keep","description":"Fix benchmark correctness: force the final heavy eval at the actual 600s training boundary, flush/close JSON logs on shutdown, and hard-pin both GPUs in autoresearch.sh (bypassing queue masking and RUN_DIR collisions). The now-trustworthy final eval still lands at asr_wer_prefix=1.0 with no EOS and a 121-frame cap, so this is the corrected baseline going forward.","timestamp":1773396672314,"segment":0}
{"run":6,"commit":"6a79dd8","metric":1,"metrics":{},"status":"discard","description":"Tried a semantic-prior-focused retune: text_loss_weight=0.05, detach_semantic_hidden_for_stage2=true, semantic_loss_weight=2.0, acoustic_loss_weight=0.5, semantic/residual LRs 6e-4/2e-4, semantic_q0_corruption_prob=0.1, semantic_eos_weight=4.0, and a 4.0 frames-per-text-token length cap. It shortened generations from 121 to 51 frames, but final transcripts stayed wrong (still asr_wer_prefix=1.0), in-domain WER degraded to 1.0, and throughput dropped sharply to ~20k samples / 10 min.","timestamp":1773397559616,"segment":0}
{"run":7,"commit":"6a79dd8","metric":1,"metrics":{},"status":"discard","description":"Switched conditioning to raw LJSpeech text only (text_source=raw) to better match the pretrained tokenizer and the OOD eval prompt. The model still failed to emit EOS, stayed at the 121-frame cap, and remained at asr_wer_prefix=1.0; in-domain WER was still 0.889 and gt Whisper sanity degraded slightly (asr_wer_gt=0.111).","timestamp":1773398352675,"segment":0}
{"run":8,"commit":"6a79dd8","metric":1,"metrics":{},"status":"discard","description":"Tried a stronger prior-preserving setup by freezing Qwen (use_lora=false), switching to raw text, detaching stage-2 gradients from the semantic path, and adding light stage-1 denoising/EOS pressure (semantic_q0_corruption_prob=0.05, semantic_eos_weight=2.0). This trained fast (~45k samples in 10 min) with a much smaller optimizer, but final WER stayed at 1.0, EOS was still never emitted, and in-domain WER regressed to 1.0.","timestamp":1773399188373,"segment":0}
{"run":9,"commit":"6a79dd8","metric":1,"metrics":{},"status":"discard","description":"Added an optional natural-language text_prompt_prefix path and tried raw text with 'Read aloud exactly: ' prepended to every conditioning string, aiming to better match Qwen's instruction-following prior. The new prompting scheme still produced no EOS, generations stayed at the 121-frame cap, and both OOD/in-domain WER remained at 1.0 / 1.0.","timestamp":1773400257934,"segment":0}
{"run":10,"commit":"6a79dd8","metric":0,"metrics":{},"status":"crash","description":"Added stage-1 scheduled-sampling/self-conditioning (semantic_self_condition_prob=0.5, semantic_eos_weight=2.0). Training itself ran, but the extra first-pass decode path caused OOM during the final heavy eval (about +2.3 GiB per GPU), so this exact implementation is not viable as-is.","timestamp":1773401624776,"segment":0}
{"run":11,"commit":"8452044","metric":0.8333333134651184,"metrics":{},"status":"keep","description":"Added lightweight stage-1 scheduled sampling via semantic_self_condition_prob=0.5 (replace a random suffix of teacher-forced Q0 inputs with greedy first-pass predictions during training only) plus semantic_eos_weight=2.0. This is the first real gain: final asr_wer_prefix improved from 1.0 to 0.8333, asr_cer improved to 0.682, and two-GPU throughput remained acceptable (~25k samples in 10 min), though EOS is still never emitted and generations still hit the 121-frame cap.","timestamp":1773402417516,"segment":0}
{"run":12,"commit":"8452044","metric":1,"metrics":{},"status":"discard","description":"Combined the successful scheduled-sampling setup with raw-text conditioning (text_source=raw, semantic_self_condition_prob=0.5, semantic_eos_weight=2.0). This lost the gain: final asr_wer_prefix went back to 1.0, throughput dropped to ~20k samples / 10 min, and EOS/frame-cap behavior remained unchanged.","timestamp":1773403211856,"segment":0}
{"run":13,"commit":"8452044","metric":1,"metrics":{},"status":"discard","description":"Pushed scheduled sampling harder (semantic_self_condition_prob=0.75, semantic_eos_weight=2.0). This overcooked the semantic model: final asr_wer_prefix fell back to 1.0, asr_cer worsened to 0.955, and in-domain free-running became very unstable (asr_wer_in_domain=3.67 from long repetitive output).","timestamp":1773403972584,"segment":0}
{"run":14,"commit":"8452044","metric":0.8333333134651184,"metrics":{},"status":"discard","description":"Combined the successful scheduled-sampling setup with an inference length heuristic near the training-data p95 (semantic_length_heuristic_frames_per_text_token=4.8, factor=1.0), which cut generated length from 121 to 53 frames. Prefix WER stayed flat at 0.8333, CER improved to 0.591, but in-domain WER regressed to 1.0, so this is a useful clue but not a primary-metric win.","timestamp":1773404744878,"segment":0}
{"run":15,"commit":"8452044","metric":1,"metrics":{},"status":"discard","description":"Tried preserving the semantic path further by detaching stage-2 gradients while keeping the winning scheduled-sampling setup (semantic_self_condition_prob=0.5, semantic_eos_weight=2.0, detach_semantic_hidden_for_stage2=true). That removed the gain entirely: final asr_wer_prefix returned to 1.0 and both OOD/in-domain transcripts regressed.","timestamp":1773405499318,"segment":0}
{"run":16,"commit":"8452044","metric":1,"metrics":{},"status":"discard","description":"Ablated the extra EOS emphasis from the winning setup (semantic_self_condition_prob=0.5, semantic_eos_weight back to 1.0). The gain disappeared completely: final asr_wer_prefix reverted to 1.0, CER worsened to 0.955, and in-domain WER also regressed to 1.0.","timestamp":1773406249524,"segment":0}
{"run":17,"commit":"8452044","metric":1,"metrics":{},"status":"discard","description":"Tried making stage-2 more robust to imperfect semantic outputs on top of the winning setup (semantic_self_condition_prob=0.5, semantic_eos_weight=2.0, q0_corruption_prob=0.1, residual_semantic_hidden_dropout_prob=0.1). This did not compound with the gain: final asr_wer_prefix returned to 1.0 while EOS/frame-cap behavior stayed unchanged.","timestamp":1773407006547,"segment":0}
{"run":18,"commit":"8452044","metric":1,"metrics":{},"status":"discard","description":"Added a small text-prefix LM anchor on top of the winning setup (semantic_self_condition_prob=0.5, semantic_eos_weight=2.0, text_loss_weight=0.02) to preserve more of Qwen's language prior. It hurt badly: throughput dropped to ~15k samples / 10 min and final asr_wer_prefix regressed to 1.0.","timestamp":1773407760878,"segment":0}
{"run":19,"commit":"8452044","metric":1,"metrics":{},"status":"discard","description":"Tried a mild stochastic semantic decoder on top of the winning training setup (semantic_gen_temperature=0.3, semantic_gen_top_p=0.9 with semantic_self_condition_prob=0.5 and semantic_eos_weight=2.0). Greedy was better: sampling regressed final asr_wer_prefix to 1.0 and worsened in-domain behavior.","timestamp":1773408530665,"segment":0}
{"run":20,"commit":"8452044","metric":1,"metrics":{},"status":"discard","description":"Made scheduled sampling less aggressive by forcing at least half of the semantic prefix to stay teacher-forced (semantic_self_condition_prob=0.5, semantic_self_condition_min_prefix_fraction=0.5, semantic_eos_weight=2.0). That was worse than the simpler version: final asr_wer_prefix fell back to 1.0 and CER exploded to 5.64.","timestamp":1773409325614,"segment":0}
{"run":21,"commit":"8452044","metric":1,"metrics":{},"status":"discard","description":"Combined the winning scheduled-sampling setup with mild stage-1 token corruption (semantic_self_condition_prob=0.5, semantic_eos_weight=2.0, semantic_q0_corruption_prob=0.05). It did not stack with the win: final asr_wer_prefix went back to 1.0, though CER improved a bit to 0.818 and in-domain WER was 0.889.","timestamp":1773410350394,"segment":0}
{"run":22,"commit":"8452044","metric":1,"metrics":{},"status":"discard","description":"Reduced the winning scheduled-sampling rate slightly (semantic_self_condition_prob=0.4, semantic_eos_weight=2.0) to see if a less aggressive exposure-bias fix would preserve more text conditioning. It did not: final asr_wer_prefix fell back to 1.0, with in-domain WER 0.889 and no change in EOS/frame-cap behavior.","timestamp":1773411091630,"segment":0}
{"run":23,"commit":"8452044","metric":1,"metrics":{},"status":"discard","description":"Added a curriculum to the winning scheduled-sampling path by ramping self-conditioning from 0 to 0.5 over the first 1000 steps (semantic_self_condition_prob=0.5, semantic_self_condition_ramp_steps=1000, semantic_eos_weight=2.0). This lost the gain: final asr_wer_prefix regressed to 1.0 and CER worsened to 0.955.","timestamp":1773411900856,"segment":0}
{"run":24,"commit":"8452044","metric":1,"metrics":{},"status":"discard","description":"Increased EOS weighting on top of the winning scheduled-sampling setup (semantic_self_condition_prob=0.5, semantic_eos_weight=3.0). It improved character-level similarity (asr_cer=0.727) but not the primary metric: final asr_wer_prefix stayed at 1.0, in-domain WER stayed at 1.0, and EOS was still never emitted.","timestamp":1773412645102,"segment":0}
{"run":25,"commit":"8452044","metric":1,"metrics":{},"status":"discard","description":"Switched to mixed normalized+raw text conditioning on top of the winning scheduled-sampling setup (text_source=both, semantic_self_condition_prob=0.5, semantic_eos_weight=2.0). OOD asr_wer_prefix stayed at 1.0, but this was the strongest text-conditioning signal so far after the best run: asr_cer improved to 0.727 and in-domain WER dropped to 0.556.","timestamp":1773413401027,"segment":0}
{"run":26,"commit":"8452044","metric":1,"metrics":{},"status":"discard","description":"Added a lightweight Stage-1 text-summary adapter on top of the winning scheduled-sampling setup (semantic_text_adapter=true, semantic_self_condition_prob=0.5, semantic_eos_weight=2.0). It did not improve the OOD primary metric (asr_wer_prefix stayed 1.0), but it substantially improved in-domain text conditioning to asr_wer_in_domain=0.556.","timestamp":1773414487267,"segment":0}
{"run":27,"commit":"8452044","metric":1,"metrics":{},"status":"discard","description":"Combined the lightweight Stage-1 text-summary adapter with mixed normalized+raw text conditioning (text_source=both, semantic_text_adapter=true, semantic_self_condition_prob=0.5, semantic_eos_weight=2.0). The combination overfit the in-domain wording less cleanly and still failed on the OOD prompt: final asr_wer_prefix stayed 1.0 and in-domain WER regressed to 0.778.","timestamp":1773415229358,"segment":0}
{"run":28,"commit":"8452044","metric":0,"metrics":{},"status":"crash","description":"Reintroduced an optional natural-language conditioning prefix and tried it with the strongest text-conditioning recipe so far (text_source=both, semantic_self_condition_prob=0.5, semantic_eos_weight=2.0, text_prompt_prefix='Read aloud exactly: '). The run crashed before training because the new dataset hash invalidated the cached train/unpadded datasets and the task refused to regenerate them under the training launcher.","timestamp":1773415436695,"segment":0}
{"run":29,"commit":"8452044","metric":1,"metrics":{},"status":"discard","description":"After prebuilding the new dataset variant, retried the natural-language conditioning prefix with text_source=both and the winning scheduled-sampling setup. The CLI parser mangled `text_prompt_prefix='Read aloud exactly: '` into a dict-like string (`{'Read aloud exactly': None}`), so this run was not a clean test; the malformed prompt prefix still yielded asr_wer_prefix=1.0 and regressed other metrics.","timestamp":1773416248572,"segment":0}
{"run":30,"commit":"8452044","metric":1,"metrics":{},"status":"discard","description":"Ran a clean natural-language conditioning-prefix test after prebuilding the datasets (text_source=both, semantic_self_condition_prob=0.5, semantic_eos_weight=2.0, text_prompt_prefix='Read aloud exactly '). This still failed: final asr_wer_prefix stayed 1.0, gt-ASR sanity degraded to 0.25, and both OOD/in-domain transcripts regressed badly.","timestamp":1773417042597,"segment":0}
{"run":31,"commit":"8452044","metric":1,"metrics":{},"status":"discard","description":"Added an explicit Stage-1 text-token interpolation adapter on top of the winning scheduled-sampling setup (semantic_text_interp_adapter=true, semantic_self_condition_prob=0.5, semantic_eos_weight=2.0). This more structured text-conditioning path still failed to help the OOD prompt: final asr_wer_prefix stayed 1.0, with only modest in-domain improvement to 0.778.","timestamp":1773418113380,"segment":0}
{"run":32,"commit":"8452044","metric":1,"metrics":{},"status":"discard","description":"Combined the explicit Stage-1 text-token interpolation adapter with mixed normalized+raw text conditioning (text_source=both, semantic_text_interp_adapter=true, semantic_self_condition_prob=0.5, semantic_eos_weight=2.0). The extra text signal still did not transfer to the OOD eval prompt: final asr_wer_prefix stayed 1.0, and in-domain WER also fell back to 1.0.","timestamp":1773418869071,"segment":0}
{"run":33,"commit":"8452044","metric":1,"metrics":{},"status":"discard","description":"Combined the strongest text-conditioning clue with the inference length cap (text_source=both, semantic_self_condition_prob=0.5, semantic_eos_weight=2.0, semantic_length_heuristic_frames_per_text_token=4.8, factor=1.0). It shortened generations to 53 frames but still did not improve the OOD primary metric: final asr_wer_prefix stayed 1.0.","timestamp":1773419659221,"segment":0}
{"run":34,"commit":"8452044","metric":1,"metrics":{},"status":"discard","description":"Replicated the nominally winning setup exactly (semantic_self_condition_prob=0.5, semantic_eos_weight=2.0) to check variance. The gain did not reproduce in this rerun: final asr_wer_prefix came back as 1.0, although CER was still relatively good at 0.773. This suggests the 0.8333 result is noisy/fragile rather than a robust new baseline.","timestamp":1773420407684,"segment":0}
{"run":35,"commit":"8452044","metric":1,"metrics":{},"status":"discard","description":"Stabilized the scheduled-sampling severity by always replacing a fixed trailing quarter of Q0 inputs when self-conditioning fires (semantic_self_condition_prob=0.5, semantic_self_condition_suffix_fraction=0.25, semantic_eos_weight=2.0). That still did not beat the baseline: final asr_wer_prefix stayed 1.0, though CER remained relatively good at 0.773.","timestamp":1773421207307,"segment":0}
{"run":36,"commit":"8452044","metric":1,"metrics":{},"status":"discard","description":"Tried a gentler deterministic generated suffix for self-conditioning (semantic_self_condition_prob=0.5, semantic_self_condition_suffix_fraction=0.1, semantic_eos_weight=2.0). That did not stabilize the earlier gain: final asr_wer_prefix remained 1.0 and CER regressed back to 0.955.","timestamp":1773421953849,"segment":0}
{"run":37,"commit":"8452044","metric":1,"metrics":{},"status":"discard","description":"Tested whether scheduled sampling works better when Qwen stays frozen (use_lora=false, semantic_self_condition_prob=0.5, semantic_eos_weight=2.0). It trained fast with a much smaller optimizer, but the OOD gain still disappeared completely: final asr_wer_prefix stayed 1.0 and EOS/frame-cap behavior was unchanged.","timestamp":1773422683099,"segment":0}
{"run":38,"commit":"8452044","metric":1,"metrics":{},"status":"discard","description":"Combined the frozen-Qwen prior-preserving path with the strongest text-conditioning data mix and scheduled sampling (use_lora=false, text_source=both, semantic_self_condition_prob=0.5, semantic_eos_weight=2.0). It trained very fast (~40k samples / 10 min) but still failed completely on the eval prompt: final asr_wer_prefix stayed 1.0.","timestamp":1773423393102,"segment":0}
{"run":39,"commit":"8452044","metric":1,"metrics":{},"status":"discard","description":"Retargeted training toward shorter utterances by lowering the retained length percentile to 0.8 on top of the winning scheduled-sampling setup. This filtered the train set down to ~10k examples and shortened the generation cap to 108 frames, but final asr_wer_prefix still stayed at 1.0 and throughput actually worsened badly during the 10-minute budget.","timestamp":1773424215729,"segment":0}
{"run":40,"commit":"8452044","metric":1,"metrics":{},"status":"discard","description":"Added an explicit Stage-1 text hidden-state context built from the LLM's own text-prefix activations and interpolated across audio positions (semantic_text_hidden_context=true with semantic_self_condition_prob=0.5, semantic_eos_weight=2.0). This richer text-conditioning path still failed on the OOD eval prompt: final asr_wer_prefix remained 1.0 and in-domain WER stayed at 1.0.","timestamp":1773425166468,"segment":0}
{"run":41,"commit":"8452044","metric":1,"metrics":{},"status":"discard","description":"Combined the Stage-1 text hidden-state context with the stronger mixed-text data recipe (text_source=both, semantic_text_hidden_context=true, semantic_self_condition_prob=0.5, semantic_eos_weight=2.0). It still did not transfer to the OOD eval prompt: final asr_wer_prefix stayed 1.0 and in-domain WER also remained 1.0.","timestamp":1773425926636,"segment":0}
{"run":42,"commit":"8452044","metric":1,"metrics":{},"status":"discard","description":"Reweighted the loss toward Stage 1 on top of the winning scheduled-sampling setup (semantic_loss_weight=2.0, acoustic_loss_weight=0.5, semantic_self_condition_prob=0.5, semantic_eos_weight=2.0). It improved some secondary text similarity signals (CER 0.818, in-domain WER 0.778) but still failed on the primary metric: final asr_wer_prefix stayed 1.0.","timestamp":1773426723620,"segment":0}
{"run":43,"commit":"8452044","metric":1,"metrics":{},"status":"discard","description":"Added a genuine shared Stage-1 text cross-attention path: wrapped the semantic Q0 decoder with CrossAttentionLLM, encoded the text prefix into 32 fixed encoder slots, trained the new cross-attention weights alongside the usual winning scheduled-sampling setup (semantic_cross_attention=true, semantic_cross_attention_slots=32, semantic_self_condition_prob=0.5, semantic_eos_weight=2.0). This was too slow (~8.8k samples / 10 min) and did not help the OOD prompt: final asr_wer_prefix stayed 1.0 with no EOS.","timestamp":1773428153269,"segment":0}
{"run":44,"commit":"8452044","metric":1,"metrics":{},"status":"discard","description":"Ablated scheduled sampling to see if the new shared Stage-1 text cross-attention could help on its own (semantic_cross_attention=true, semantic_cross_attention_slots=32, semantic_eos_weight=2.0). Throughput recovered somewhat versus the self-conditioned version, but the model still failed completely on the OOD prompt: final asr_wer_prefix stayed 1.0, in-domain free-running became highly repetitive (WER 2.44), and EOS was still never emitted.","timestamp":1773428920414,"segment":0}
{"run":45,"commit":"8452044","metric":1,"metrics":{},"status":"discard","description":"Added a lightweight learned Stage-1 duration head and used it to cap inference length on top of the winning scheduled-sampling setup (semantic_duration_loss_weight=0.1, semantic_use_duration_predictor=true, factor=1.0 with semantic_self_condition_prob=0.5 and semantic_eos_weight=2.0). This successfully replaced the hard 121-frame cap with much shorter learned caps (38 OOD / 43 in-domain), but it over-shortened and final asr_wer_prefix still stayed 1.0.","timestamp":1773429983944,"segment":0}
{"run":46,"commit":"8452044","metric":1,"metrics":{},"status":"discard","description":"Raised the learned duration-cap factor to 1.4 on top of the new Stage-1 duration head plus the winning scheduled-sampling setup. The model still stayed at asr_wer_prefix=1.0; final learned caps were unstable and still too short on the OOD prompt (32 frames OOD, 42 in-domain), though in-domain WER improved to 0.667.","timestamp":1773430773267,"segment":0}
