{"run":820,"commit":"dc63664","metric":0.8333333134651184,"metrics":{},"status":"discard","description":"Tested whether the harsh final-field asymmetry is specifically about moving the final `mem_vms_total` value computation out of the lock, or about breaking the direct expression-to-store surface even when the computation stays inside the original inline lock hold. I built `/tmp/xax-bench-9cea09c-oldtrain-meminfocputouchcpuusefirst-clearonlynoproxy-workercputotalswrite-minimal3-vmslocalinside-nogpu`, kept the exact same inline `with stats.get_lock():` and the same `cpu_percent` + inline `stats.mem_rss_total = int(mem_info.rss)` stores, but split only the final line into two **inside-lock** statements: `mem_vms_total = int(mem_info.vms)` followed by `stats.mem_vms_total = mem_vms_total`. This weakened to **`asr_wer_prefix=0.8333`** with old-regime throughput (~30.0k samples / 10 min). That sharpens the new lock-held source-expression story: for the final `mem_vms_total` field, it is not just crossing the lock boundary that hurts (`#814`, `#816`, `#819`) — even keeping the computation inside the same lock and code object, but separating it from the final wrapper-property `STORE_ATTR`, still loses the stronger classes.","timestamp":1774143654623,"segment":0}
{"run":821,"commit":"dc63664","metric":0.8333333134651184,"metrics":{},"status":"discard","description":"Ran the middle-field counterpart to #820 on the detached **fully direct Event+Value + clear-only** old-train CPU-only minimal-triple branch. I built `/tmp/xax-bench-9cea09c-oldtrain-meminfocputouchcpuusefirst-clearonlynoproxy-workercputotalswrite-minimal3-rsslocalinside-nogpu`, kept the same inline `with stats.get_lock():`, but split only the middle line into two **inside-lock** statements: `mem_rss_total = int(mem_info.rss)` followed by `stats.mem_rss_total = mem_rss_total`, while leaving the final `stats.mem_vms_total = int(mem_info.vms)` fully inline. This also weakened to **`asr_wer_prefix=0.8333`** with old-regime throughput (~29.9k samples / 10 min). Together with #820, that sharpens the source-expression picture further: even when the value computation stays inside the same lock and code object, breaking either live memory-field store into a local-then-`STORE_ATTR` two-statement path weakens the branch to the same `0.8333` class. So the stronger partial classes now look even more concentrated around the exact one-line wrapper-property store surface, not just inside-vs-outside-lock placement.","timestamp":1774144436995,"segment":0}
{"run":822,"commit":"dc63664","metric":0.8333333134651184,"metrics":{},"status":"discard","description":"Tested whether the new inside-lock local-temp weakness from #820-#821 is specific to the two memory-field stores, or whether **any** extra local-then-`STORE_ATTR` split inside the original lock is enough to weaken the branch. I built `/tmp/xax-bench-9cea09c-oldtrain-meminfocputouchcpuusefirst-clearonlynoproxy-workercputotalswrite-minimal3-cpulocalinside-nogpu`, kept the same inline `with stats.get_lock():` and the same one-line memory-field stores, but split only the leading CPU line into `cpu_percent_local = cpu_percent` followed by `stats.cpu_percent = cpu_percent_local`. This also weakened to **`asr_wer_prefix=0.8333`** with old-regime throughput (~29.7k samples / 10 min). So the source-surface story is sharper again: the stronger partial classes are not just about the two memory-field lines. Even the already-precomputed leading `cpu_percent` assignment appears to want the exact one-line wrapper-property store surface inside the original lock, suggesting the live clue is now about the **whole minimal triple as three single-statement wrapper stores**, not only the memory-field computations.","timestamp":1774145432853,"segment":0}
{"run":823,"commit":"dc63664","metric":0.8333333134651184,"metrics":{},"status":"discard","description":"Tested whether the new inside-lock weakness from #820-#822 is about splitting a live store specifically, or about adding **any extra statement at all** inside the original lock-held region. I built `/tmp/xax-bench-9cea09c-oldtrain-meminfocputouchcpuusefirst-clearonlynoproxy-workercputotalswrite-minimal3-dummyinside-nogpu`, kept the exact original three one-line wrapper-property stores, but inserted only a harmless local statement `dummy = 0` at the top of the original `with stats.get_lock():` block. This still weakened to **`asr_wer_prefix=0.8333`** with old-regime throughput (~29.8k samples / 10 min). That sharpens the mechanism materially: the stronger partial classes are now no longer just about keeping each store as a one-line surface. The whole live branch appears to want the lock-held region itself to remain the exact minimal three-statement wrapper-store body, with even a dead local assignment inside the lock already enough to lose it.","timestamp":1774146221828,"segment":0}
