{"run":455,"commit":"c1a29b2","metric":1,"metrics":{},"status":"discard","description":"Mapped the longer grouped-window neighbor of the new reproducible 2-head sampled grouped backbone by extending `semantic_block_decode_max_grouped_tokens` from 12 to 15 while keeping `text_source=both_weighted_sampled`, normalized/raw weights 3/1, `text_source_weighted_sampled_passes=2`, `semantic_future_prediction_steps=2`, future weight 0.5, scheduled sampling 0.5, EOS weight 2.0, the p95-style cap, and plain `semantic_block_decode_size=3` grouped decoding. It failed cleanly at asr_wer_prefix=1.0 with CER 0.909 despite EOS on both prompts and healthy throughput (~23.8k samples / 10 min). So on the cleaner sampled grouped 2-head branch, the grouped-window family still looks asymmetric and narrow: 12 is reproducibly live, 9 and 15 both fail, and the only shorter hint at 6 already collapsed on exact rerun.","timestamp":1773824243156,"segment":0}
{"run":456,"commit":"c1a29b2","metric":0.8333333134651184,"metrics":{},"status":"discard","description":"Tested whether the old late-boundary schedule clue revives on the new reproducible 2-head sampled grouped backbone by replacing the plain 12-token grouped cutoff with `semantic_block_decode_schedule=3,3,3,1,2` while keeping `text_source=both_weighted_sampled`, normalized/raw weights 3/1, `text_source_weighted_sampled_passes=2`, `semantic_future_prediction_steps=2`, future weight 0.5, scheduled sampling 0.5, EOS weight 2.0, and the p95-style cap. It recovered only weak life at asr_wer_prefix=0.8333 with CER 0.682, strong in-domain WER 0.111, and full throughput (~31.2k samples / 10 min), but it still regressed relative to the reproducible 0.6667 plain 12-token grouped branch. So the older late-boundary schedule family remains a side clue rather than a stabilizer even on the cleaner 2-head sampled grouped backbone.","timestamp":1773825011924,"segment":0}
{"run":457,"commit":"c1a29b2","metric":0.8333333134651184,"metrics":{},"status":"discard","description":"Tested whether the new reproducible 2-head sampled grouped backbone broadens across normalized/raw ratios by lowering the sampled weighting from 3:1 down to `2:1` while keeping `text_source=both_weighted_sampled`, `text_source_weighted_sampled_passes=2`, `semantic_future_prediction_steps=2`, future weight 0.5, scheduled sampling 0.5, EOS weight 2.0, the p95-style cap, and the plain 12-token grouped prefix. This recovered only weak life at asr_wer_prefix=0.8333 with exploded full-WER/CER despite perfect gt-ASR sanity, strong in-domain WER 0.111, EOS on both prompts, and full throughput (~31.4k samples / 10 min). So the cleaner sampled grouped 2-head branch does not obviously broaden toward the older 2:1 normalized/raw neighborhood either; the live sampled grouped family still seems centered on the original 3:1 ratio.","timestamp":1773825841277,"segment":0}
{"run":458,"commit":"c1a29b2","metric":1,"metrics":{},"status":"discard","description":"Tested the opposite normalized-heavier neighbor on the new reproducible 2-head sampled grouped backbone by raising the sampled weighting from 3:1 up to `4:1` while keeping `text_source=both_weighted_sampled`, `text_source_weighted_sampled_passes=2`, `semantic_future_prediction_steps=2`, future weight 0.5, scheduled sampling 0.5, EOS weight 2.0, the p95-style cap, and the plain 12-token grouped prefix. It failed cleanly at asr_wer_prefix=1.0 with CER 0.727 despite perfect gt-ASR sanity, EOS on both prompts, and full throughput (~31.3k samples / 10 min). So the cleaner sampled grouped 2-head branch does not broaden toward the more normalized-heavy 4:1 neighbor either; on this branch the original sampled 3:1 ratio still looks like the real center.","timestamp":1773826598783,"segment":0}
{"run":459,"commit":"c1a29b2","metric":0.8333333134651184,"metrics":{},"status":"discard","description":"Tested whether the old sampled text-anchor spike transfers to the new reproducible 2-head sampled grouped backbone by adding `text_loss_weight=0.1` on top of `text_source=both_weighted_sampled`, normalized/raw weights 3/1, `text_source_weighted_sampled_passes=2`, `semantic_future_prediction_steps=2`, future weight 0.5, scheduled sampling 0.5, EOS weight 2.0, the p95-style cap, and the plain 12-token grouped prefix. It recovered only weak life at asr_wer_prefix=0.8333 while throughput collapsed to just ~14.0k samples / 10 min, OOD EOS disappeared, and in-domain WER regressed to 1.0. So the old sampled text-anchor spike does not rescue the cleaner sampled grouped 2-head backbone either; on this branch it behaves like another stale slowdown rather than a stabilizer.","timestamp":1773827456996,"segment":0}
{"run":460,"commit":"c1a29b2","metric":0.8333333134651184,"metrics":{},"status":"discard","description":"Tested whether the reproducible fuller-LoRA fallback transfers to the new 2-head sampled grouped backbone by adding `lora_targets=[q_proj,k_proj,v_proj,o_proj,gate,up,down]` on top of `text_source=both_weighted_sampled`, normalized/raw weights 3/1, `text_source_weighted_sampled_passes=2`, `semantic_future_prediction_steps=2`, future weight 0.5, scheduled sampling 0.5, EOS weight 2.0, the p95-style cap, and the plain 12-token grouped prefix. It recovered only weak life at asr_wer_prefix=0.8333 despite perfect gt-ASR and in-domain WER, while shortening the OOD utterance further and staying below the reproducible 0.6667 default-target branch. So fuller LoRA is not the right stabilizer for the cleaner sampled grouped 2-head backbone either; like the older sampled branches, this one still seems to prefer the default LoRA target set.","timestamp":1773828220857,"segment":0}
{"run":461,"commit":"c1a29b2","metric":0.8333333134651184,"metrics":{},"status":"discard","description":"Tested whether the new 2-head grouped transfer improves the older fixed-duplicate weighted family by combining the aligned 3:1 fixed-duplicate text mix (`text_source=both_weighted`, normalized/raw repeats 3/1) with `semantic_future_prediction_steps=2`, future weight 0.5, scheduled sampling 0.5, EOS weight 2.0, the p95-style cap, and the plain 12-token grouped prefix. It recovered only weak life at asr_wer_prefix=0.8333 with CER 0.636, EOS on both prompts, perfect gt-ASR sanity, and full throughput (~31.1k samples / 10 min). So the cleaner 2-head grouped transfer does not rescue the older fixed-duplicate 3:1 family the way it does the sampled branch; this still looks like evidence that the stronger live clue is specifically the sampled assignment geometry rather than future-depth matching alone.","timestamp":1773829034931,"segment":0}
{"run":462,"commit":"c1a29b2","metric":0.8333333134651184,"metrics":{},"status":"discard","description":"Tested whether the new reproducible 2-head sampled grouped backbone broadens toward higher sampled mass by raising `text_source_weighted_sampled_passes` from 2 to 3 while keeping the original sampled 3:1 ratio, `semantic_future_prediction_steps=2`, future weight 0.5, scheduled sampling 0.5, EOS weight 2.0, the p95-style cap, and the plain 12-token grouped prefix. It recovered only weak life at asr_wer_prefix=0.8333 with CER 0.636 despite perfect gt-ASR sanity, EOS on both prompts, and full throughput (~31.2k samples / 10 min). So even on the cleaner 2-head sampled grouped backbone, the sampled-mass axis still does not broaden cleanly above the original 2-pass center.","timestamp":1773829797396,"segment":0}
{"run":463,"commit":"c1a29b2","metric":0.8333333134651184,"metrics":{},"status":"discard","description":"Tested whether the new reproducible 2-head sampled grouped backbone broadens toward lower sampled mass by reducing `text_source_weighted_sampled_passes` from 2 down to 1 while keeping the original sampled 3:1 ratio, `semantic_future_prediction_steps=2`, future weight 0.5, scheduled sampling 0.5, EOS weight 2.0, the p95-style cap, and the plain 12-token grouped prefix. It recovered only weak life at asr_wer_prefix=0.8333 with strong CER 0.545, EOS on both prompts, perfect gt-ASR sanity, and full throughput (~31.3k samples / 10 min), but still regressed relative to the reproducible 2-pass center. So even on the cleaner 2-head sampled grouped backbone, the sampled-mass axis still looks centered on exactly 2 passes rather than broadening toward either 1 or 3 passes.","timestamp":1773830563768,"segment":0}
{"run":464,"commit":"c1a29b2","metric":1,"metrics":{},"status":"discard","description":"Tested whether the sampled branch's remaining signal can be stabilized at eval by letting heavy eval choose between the plain grouped and exact-last transitions on the reproducible 2-head sampled grouped backbone (`text_source=both_weighted_sampled`, normalized/raw weights 3/1, `text_source_weighted_sampled_passes=2`, `semantic_future_prediction_steps=2`, future weight 0.5, scheduled sampling 0.5, EOS weight 2.0, p95-style cap, plain 12-token grouped prefix, plus `semantic_eval_compare_exact_last_candidate=true`). This failed cleanly at asr_wer_prefix=1.0, lost OOD EOS, stretched back to the 53-frame cap, and cut effective coverage to only ~20.2k samples / 10 min. So on the cleaner sampled grouped 2-head backbone, heavy-eval reranking between plain grouped and exact-last behaves like another stale slowdown rather than a usable bridge between the reproducible grouped backbone and the fragile sampled exact-last spike.","timestamp":1773831797998,"segment":0}
{"run":465,"commit":"c1a29b2","metric":0.8333333134651184,"metrics":{},"status":"discard","description":"Tested whether the plain sampled grouped 2-head backbone benefits from a cheap early-prefix train/infer match by enabling the future-slots-only inference-policy replacement path (`semantic_self_condition_use_inference_policy=true`, `semantic_self_condition_match_early_grouped_prefix=true`, `semantic_self_condition_match_grouped_future_slots_only=true`, `semantic_self_condition_inference_policy_prob=0.0`) on top of `text_source=both_weighted_sampled`, normalized/raw weights 3/1, `text_source_weighted_sampled_passes=2`, `semantic_future_prediction_steps=2`, future weight 0.5, scheduled sampling 0.5, EOS weight 2.0, the p95-style cap, and the plain 12-token grouped prefix. It recovered only weak life at asr_wer_prefix=0.8333 with CER 0.591, EOS on both prompts, and reduced effective coverage to ~20.7k samples / 10 min, while in-domain WER stayed weak and gt-ASR sanity softened. So even on the cleaner sampled grouped 2-head backbone, the cheap future-slots-only early-prefix train/infer-match path is still another stale slowdown rather than the missing stabilizer.","timestamp":1773832588357,"segment":0}
{"run":466,"commit":"c1a29b2","metric":1,"metrics":{},"status":"discard","description":"Tested the broader cheap early-prefix train/infer-match variant on the reproducible 2-head sampled grouped backbone by enabling early-prefix inference-policy replacement without restricting it to only speculative future slots (`semantic_self_condition_use_inference_policy=true`, `semantic_self_condition_match_early_grouped_prefix=true`, `semantic_self_condition_inference_policy_prob=0.0`) on top of `text_source=both_weighted_sampled`, normalized/raw weights 3/1, `text_source_weighted_sampled_passes=2`, `semantic_future_prediction_steps=2`, future weight 0.5, scheduled sampling 0.5, EOS weight 2.0, the p95-style cap, and the plain 12-token grouped prefix. This failed cleanly at asr_wer_prefix=1.0 with only middling CER 0.682, weak in-domain WER 0.667, and coverage down to only ~18.3k samples / 10 min. So on the cleaner sampled grouped 2-head backbone, the cheap early-prefix train/infer-match family now looks stale in both forms: the whole-window version fails outright, while the future-slots-only version only recovers weak 0.8333 life.","timestamp":1773833331381,"segment":0}
{"run":467,"commit":"f927e34","metric":0.5,"metrics":{},"status":"keep","description":"Added a new sampled text-source variant `text_source=both_weighted_sampled_diff` that keeps the same deterministic sampled-pass geometry as `both_weighted_sampled` but only actually uses raw text on utterances where `text_raw != text_norm`, falling back to normalized text when the two transcript forms are identical. On the reproducible sampled grouped 2-head backbone (`text_source_weighted_normalized_repeats=3`, `text_source_weighted_raw_repeats=1`, `text_source_weighted_sampled_passes=2`, `semantic_future_prediction_steps=2`, future weight 0.5, scheduled sampling 0.5, EOS weight 2.0, p95-style cap, plain 12-token grouped prefix), this improved to asr_wer_prefix=0.5 with CER 0.500, strong in-domain WER 0.222, perfect gt-ASR sanity, EOS on both prompts, and full throughput (~31.4k samples / 10 min). So the sampled branch's gain is not coming from broad raw duplication on unchanged utterances; concentrating the raw exposure onto the true normalized-vs-raw difference subset while preserving the sampled 2-pass geometry is a real new structural clue and currently the cleanest sampled-side improvement over the reproducible 0.6667 backbone.","timestamp":1773834575682,"segment":0}
{"run":468,"commit":"f927e34","metric":0.8333333134651184,"metrics":{},"status":"discard","description":"Exact reran the new `text_source=both_weighted_sampled_diff` branch after its first 0.5 keep, keeping the same sampled grouped 2-head recipe: normalized/raw weights 3/1, `text_source_weighted_sampled_passes=2`, `semantic_future_prediction_steps=2`, future weight 0.5, scheduled sampling 0.5, EOS weight 2.0, the p95-style cap, and the plain 12-token grouped prefix. The first-run gain did not hold: this rerun softened back to asr_wer_prefix=0.8333 with CER 0.682, weaker in-domain WER 0.444, and slightly degraded gt-ASR sanity 0.158, though EOS and full throughput (~31.3k samples / 10 min) remained intact. So concentrating raw exposure only on true normalized-vs-raw difference utterances is a real new sampled-side clue, but in its current plain 2-pass 3:1 grouped form it still looks noisy rather than yet reproducible.","timestamp":1773835345223,"segment":0}
{"run":469,"commit":"f927e34","metric":1,"metrics":{},"status":"discard","description":"Tested whether the new diff-targeted sampled text mix transfers to the fragile sampled exact-last family by swapping `text_source=both_weighted_sampled_diff` into the old best-side recipe while keeping normalized/raw weights 3/1, `text_source_weighted_sampled_passes=2`, four future-Q0 heads, future weight 0.5, scheduled sampling 0.5, EOS weight 2.0, the p95-style cap, the 12-token grouped prefix, and `semantic_block_decode_exact_last_token=true`. This failed cleanly at asr_wer_prefix=1.0 despite EOS on both prompts, perfect gt-ASR sanity, decent in-domain WER 0.333, and still-healthy throughput (~30.1k samples / 10 min). So the new raw-difference-targeted sampled geometry is not a generic upgrade across the sampled family: it helps the plain grouped 2-head backbone, but it does not rescue the fragile four-head sampled exact-last spike.","timestamp":1773836136660,"segment":0}
{"run":470,"commit":"f927e34","metric":1,"metrics":{},"status":"discard","description":"Tested whether the new diff-targeted sampled text mix helps the width-matched sampled exact-last side clue by combining `text_source=both_weighted_sampled_diff` with normalized/raw weights 3/1, `text_source_weighted_sampled_passes=2`, `semantic_future_prediction_steps=2`, future weight 0.5, scheduled sampling 0.5, EOS weight 2.0, the p95-style cap, the 12-token grouped prefix, and `semantic_block_decode_exact_last_token=true`. This also failed cleanly at asr_wer_prefix=1.0 despite EOS on both prompts, perfect gt-ASR sanity, strong in-domain WER 0.222, and healthy throughput (~30.9k samples / 10 min). So the new raw-difference-targeted sampled geometry appears specific to the plain grouped 2-head path; it does not transfer to either the four-head or the width-matched two-head sampled exact-last branches.","timestamp":1773836907855,"segment":0}
{"run":471,"commit":"f927e34","metric":0,"metrics":{},"status":"crash","description":"Tried to map the nominal normalized/raw ratio on the new `text_source=both_weighted_sampled_diff` family by lowering it from 3:1 to 2:1 on the plain sampled grouped 2-head backbone, but `./autoresearch.sh` crashed before training because the changed `text_source` hash / sampled-weight config required fresh `train` and `unpadded` dataset caches. Need to prebuild the 2:1 diff-targeted sampled datasets with `uv run examples/ljspeech.py --launcher dataset ...` before this ratio probe can be judged.","timestamp":1773837064762,"segment":0}
{"run":472,"commit":"f927e34","metric":1,"metrics":{},"status":"discard","description":"Retried the new diff-targeted sampled family with a nominally raw-heavier ratio by lowering `text_source_weighted_normalized_repeats:text_source_weighted_raw_repeats` from 3:1 to 2:1 on the plain sampled grouped 2-head backbone, keeping `text_source=both_weighted_sampled_diff`, `text_source_weighted_sampled_passes=2`, `semantic_future_prediction_steps=2`, future weight 0.5, scheduled sampling 0.5, EOS weight 2.0, the p95-style cap, and the plain 12-token grouped prefix. After prebuilding the new caches, this failed cleanly at asr_wer_prefix=1.0 despite EOS on both prompts, perfect gt-ASR sanity, full throughput (~31.4k samples / 10 min), and only middling CER 0.636. So even inside the new raw-difference-targeted sampled geometry, the nominal normalized/raw ratio still looks narrow: simply shifting it toward more raw exposure on the differing subset does not preserve the first 0.5 gain.","timestamp":1773837874023,"segment":0}
{"run":473,"commit":"f927e34","metric":0.6666666865348816,"metrics":{},"status":"discard","description":"Tested the more normalized-heavy neighbor of the new diff-targeted sampled family by raising the nominal weighting from 3:1 up to 4:1 on `text_source=both_weighted_sampled_diff`, while keeping `text_source_weighted_sampled_passes=2`, `semantic_future_prediction_steps=2`, future weight 0.5, scheduled sampling 0.5, EOS weight 2.0, the p95-style cap, and the plain 12-token grouped prefix. After prebuilding the new caches, it recovered only tie-level life at asr_wer_prefix=0.6667 with CER 0.591, EOS on both prompts, perfect gt-ASR sanity, and full throughput (~31.4k samples / 10 min), but it still stayed below the first-run 0.5 result of the original 3:1 diff-targeted recipe. So the new raw-difference-targeted sampled branch is real, but its nominal ratio axis already looks narrow and asymmetric: shifting raw heavier to 2:1 fails outright, while pushing farther normalized to 4:1 only softens back to the old reproducible 0.6667 level rather than improving on the 3:1 first-run gain.","timestamp":1773838671363,"segment":0}
{"run":474,"commit":"f927e34","metric":0.8333333134651184,"metrics":{},"status":"discard","description":"Tested whether the new `both_weighted_sampled_diff` clue is mainly about concentrating raw exposure onto the true normalized-vs-raw difference subset, or whether it still depends on the sampled-pass assignment geometry, by adding a temporary fixed-duplicate `text_source=both_weighted_diff` variant and running it on the plain sampled grouped 2-head backbone with nominal normalized/raw repeats 3:1, `semantic_future_prediction_steps=2`, future weight 0.5, scheduled sampling 0.5, EOS weight 2.0, the p95-style cap, and the plain 12-token grouped prefix. After prebuilding the new caches, this recovered only weak life at asr_wer_prefix=0.8333 with CER 0.636, perfect in-domain WER and gt-ASR sanity, EOS on both prompts, and full throughput (~31.4k samples / 10 min). So merely restricting raw text to the differing subset is not enough by itself: the stronger 0.5 signal from `both_weighted_sampled_diff` still appears to depend on the sampled low-mass / assignment geometry rather than on a fixed-duplicate diff-only dataset alone.","timestamp":1773840047077,"segment":0}
{"run":475,"commit":"f927e34","metric":1,"metrics":{},"status":"discard","description":"Tested whether the noisy `both_weighted_sampled_diff` clue wants *more* sampled mass once raw exposure is restricted only to utterances where `text_raw != text_norm`, by raising `text_source_weighted_sampled_passes` from 2 to 4 while keeping the original 3:1 nominal weighting, `semantic_future_prediction_steps=2`, future weight 0.5, scheduled sampling 0.5, EOS weight 2.0, the p95-style cap, and the plain 12-token grouped prefix. After prebuilding the new caches, this failed cleanly at asr_wer_prefix=1.0 with CER 0.773 despite EOS on both prompts, perfect gt-ASR sanity, decent in-domain WER 0.222, and essentially full throughput (~31.4k samples / 10 min). So the diff-targeted sampled clue does not broaden back toward the old higher-mass sampled regime: even after removing raw exposure on unchanged utterances, pushing the sampled-pass count above the live 2-pass center looks stale.","timestamp":1773840911280,"segment":0}
