{"run":125,"commit":"cf0f36a","metric":1,"metrics":{},"status":"discard","description":"Tested the new exact-last-token grouped transition with a longer grouped prefix, extending the hybrid schedule from 12 grouped semantic tokens up to 15 while keeping text_source=both, two future-Q0 heads, scheduled sampling, EOS weighting, and the 53-frame cap. This regressed back to asr_wer_prefix=1.0, so the exact-last-token variant also appears tightly localized around the 12-token prefix rather than supporting a broader grouped window.","timestamp":1773495939872,"segment":0}
{"run":126,"commit":"cf0f36a","metric":1,"metrics":{},"status":"discard","description":"Combined the two main surviving grouped-prefix clues — the exact-last-token grouped transition and the soft early-position future-loss weighting — by setting semantic_future_prediction_position_decay=0.97 on the text_source=both matched two-head / 12-token exact-last-token grouped-prefix recipe. This failed badly at asr_wer_prefix=1.0 with CER 2.59, so the weak soft position-weighting signal does not stack with the new exact-last-token transition and should remain low priority.","timestamp":1773496904136,"segment":0}
{"run":127,"commit":"cf0f36a","metric":1,"metrics":{},"status":"discard","description":"Ran an exact rerun of the new 12-token exact-last-token grouped transition (text_source=both, two future-Q0 heads, scheduled sampling, EOS weighting, 53-frame cap). Unlike the first promising 0.6667 run, this rerun collapsed to asr_wer_prefix=1.0, though in-domain WER improved to 0.333. So the exact-last-token transition now also looks high-variance rather than a robust new baseline.","timestamp":1773497660076,"segment":0}
{"run":128,"commit":"cf0f36a","metric":1,"metrics":{},"status":"discard","description":"Tested a transition-only exact-last-token schedule by applying the exact-last-token grouped step only on the final grouped step before fallback to token-by-token decoding (semantic_block_decode_exact_last_group_steps=1) while keeping the earlier grouped steps plain. On the text_source=both matched two-head / 12-token grouped-prefix recipe this still missed the primary metric at asr_wer_prefix=1.0, though in-domain prefix WER improved to 0.333. The idea may help secondaries, but in its current form it is too slow (~12 samples/s) and does not stabilize the main objective.","timestamp":1773498650147,"segment":0}
{"run":129,"commit":"cf0f36a","metric":1,"metrics":{},"status":"discard","description":"Tested a broader position-dependent transition policy by applying the exact-last-token grouped step on the final two grouped steps before fallback (semantic_block_decode_exact_last_group_steps=2) while keeping the earlier grouped steps plain. On the text_source=both matched two-head / 12-token grouped-prefix recipe this still returned asr_wer_prefix=1.0, so simply extending the transition-only exact-last schedule from one grouped step to two does not stabilize the branch either.","timestamp":1773499451103,"segment":0}
{"run":130,"commit":"cf0f36a","metric":1,"metrics":{},"status":"discard","description":"Tested a richer grouped-prefix transition that inserts a periodic exact bridge token after each 3-token grouped step (semantic_block_decode_exact_bridge_token=true): decode one exact token, predict two future Q0 tokens with the matched two-head branch, feed them through the cache, then decode one extra token exactly before the next grouped step. On the text_source=both / 12-token grouped-prefix recipe this still returned asr_wer_prefix=1.0, so a simple exact-bridge resynchronization every grouped step does not rescue the fragile branch at the original 12-token cutoff.","timestamp":1773500703911,"segment":0}
{"run":131,"commit":"cf0f36a","metric":1,"metrics":{},"status":"discard","description":"Retested the new periodic exact-bridge grouped-prefix transition with a longer grouped window (semantic_block_decode_exact_bridge_token=true, semantic_block_decode_max_grouped_tokens=16) so the bridge design got four grouped steps instead of only three at the old 12-token cutoff. This still failed at asr_wer_prefix=1.0 and even hurt secondaries, so the simple exact-bridge transition now looks stale both at the original cutoff and at the more natural four-step 16-token schedule.","timestamp":1773501499054,"segment":0}
{"run":132,"commit":"cf0f36a","metric":1,"metrics":{},"status":"discard","description":"Tested a more explicitly matched 3->2 grouped-prefix taper: during inference the second future-Q0 head was only active for the first 6 grouped tokens before dropping to one-head / 2-token grouped steps until the 12-token cutoff (semantic_block_decode_second_head_max_grouped_tokens=6), and during training the later future head was masked to the first 6 Q0 target positions (semantic_future_prediction_late_head_max_q0_positions=6). This still returned asr_wer_prefix=1.0, so a simple head-position-matched 3->2 taper does not rescue the stale late-taper family either.","timestamp":1773502456830,"segment":0}
{"run":133,"commit":"cf0f36a","metric":1,"metrics":{},"status":"discard","description":"Tested a more tightly train/infer-matched exact-last-token variant by reducing the grouped branch to a single future-Q0 head in training (semantic_future_prediction_steps=1) while still decoding 3-token grouped steps as exact / future / exact during the first 12 semantic tokens (semantic_block_decode_exact_last_token=true). This also collapsed to asr_wer_prefix=1.0, so simply matching the exact-last transition to one future head does not rescue that fragile family either.","timestamp":1773503509453,"segment":0}
{"run":134,"commit":"cf0f36a","metric":1,"metrics":{},"status":"discard","description":"Tested a shorter exact-last-token grouped prefix on the original two-head grouped branch: keep the exact / future / exact 3-token grouped step, but only for the first 6 generated semantic tokens before falling back to exact token-by-token decoding. This also returned asr_wer_prefix=1.0, so the exact-last-token clue does not generalize to a shorter 6-token grouped-prefix cutoff either.","timestamp":1773504427830,"segment":0}
{"run":135,"commit":"cf0f36a","metric":1,"metrics":{},"status":"discard","description":"Tested an early-only exact-last transition schedule: use the exact / future / exact 3-token grouped step only for the first 9 generated semantic tokens, then switch back to the plain two-head grouped path for the final grouped step before the usual fallback to token-by-token decoding (semantic_block_decode_exact_last_max_grouped_tokens=9, semantic_block_decode_max_grouped_tokens=12). This still returned asr_wer_prefix=1.0, so simply confining the exact-last clue to the early grouped prefix does not rescue the branch either.","timestamp":1773505438890,"segment":0}
{"run":136,"commit":"cf0f36a","metric":0,"metrics":{},"status":"crash","description":"Tried a new train/infer-match auxiliary for the exact-last-token branch: with the 12-token exact-last grouped decode, add a weighted second stage-1 pass that locally corrupts early Q0 inputs with first future-head predictions from two positions earlier (semantic_future_input_loss_weight=0.25, prob=0.5, max early Q0 positions=12). Training itself progressed and the auxiliary produced nontrivial metrics, but the extra stage-1 pass OOMed during the final heavy eval. This needs an eval-side guard (disable the auxiliary when heavy=True) before the idea can be judged on the primary metric.","timestamp":1773506421241,"segment":0}
{"run":137,"commit":"cf0f36a","metric":0.8333333134651184,"metrics":{},"status":"discard","description":"Retried the new future-input corruption auxiliary after disabling it during heavy eval to avoid the OOM: on the 12-token exact-last-token grouped recipe, add an auxiliary second stage-1 pass that replaces some early Q0 inputs with first future-head predictions from two positions earlier (semantic_future_input_loss_weight=0.25, prob=0.5, max_q0_positions=12). This finished and reached asr_wer_prefix=0.8333, so the idea has some life versus the recent 1.0 collapses, but it is still worse than the strong baselines and it roughly halved throughput (~12.9k samples in 10 min).","timestamp":1773507222228,"segment":0}
{"run":138,"commit":"cf0f36a","metric":1,"metrics":{},"status":"discard","description":"Retuned the new future-input corruption auxiliary lighter by dropping semantic_future_input_loss_prob from 0.5 to 0.25 while keeping weight=0.25, max_q0_positions=12, and the 12-token exact-last-token grouped decode. This regressed badly to asr_wer_prefix=1.0 with catastrophic CER 8.14 and even lower throughput (~9.3k samples in 10 min), so a simple probability retune of this auxiliary is not enough and the current implementation is too expensive.","timestamp":1773507978653,"segment":0}
{"run":139,"commit":"cf0f36a","metric":1,"metrics":{},"status":"discard","description":"Tested a cheaper train/infer-match objective by piggybacking on scheduled sampling: when semantic_self_condition_prob=0.5 activates, also corrupt some early Q0 inputs with first future-head predictions from two positions earlier (semantic_future_input_corruption_prob=0.5, max_q0_positions=12) on the 12-token exact-last-token grouped recipe. This kept throughput reasonable (~20.0k samples in 10 min) and produced very strong in-domain metrics (asr_wer_in_domain=0.111, prefix_in_domain=0.111), but the primary OOD metric still stayed at asr_wer_prefix=1.0, so it is not a keep.","timestamp":1773509034563,"segment":0}
{"run":140,"commit":"cf0f36a","metric":1,"metrics":{},"status":"discard","description":"Moved the cheaper future-input corruption objective onto the original cf0f36a grouped-prefix mainline (plain 3-token grouped steps for the first 12 semantic tokens, no exact-last transition). Corrupting some early Q0 inputs with first future-head predictions from two positions earlier kept throughput high (~25.3k samples in 10 min) and improved CER to 0.682, but the primary OOD metric still stayed at asr_wer_prefix=1.0 and ground-truth ASR degraded slightly, so this is not yet a real win.","timestamp":1773509798615,"segment":0}
{"run":141,"commit":"cf0f36a","metric":1,"metrics":{},"status":"discard","description":"Retuned the cheaper piggyback future-input corruption objective on the original grouped-prefix mainline by shrinking the early corruption window from 12 Q0 positions down to 6 (semantic_future_input_corruption_max_q0_positions=6, prob=0.5). This still stayed at asr_wer_prefix=1.0 and regressed secondaries versus the 12-position version, so a simple shorter-window retune of the cheap local-corruption objective also looks stale.","timestamp":1773510550287,"segment":0}
{"run":142,"commit":"cf0f36a","metric":1,"metrics":{},"status":"discard","description":"Tested a more structurally matched cheap future-input corruption objective on the original cf0f36a grouped-prefix mainline: when scheduled sampling activates, corrupt early Q0 inputs in the same 3-token grouped pattern used at inference by applying future head 0 on Q0 ranks 2/5/8/... and future head 1 on ranks 3/6/9/... (semantic_future_input_corruption_match_grouped_block=true, prob=0.5, max_q0_positions=12). This still stayed at asr_wer_prefix=1.0 and degraded gt ASR to 0.25, so even the richer two-head grouped-pattern corruption is not enough in its current form.","timestamp":1773512341077,"segment":0}
{"run":143,"commit":"cf0f36a","metric":1,"metrics":{},"status":"discard","description":"Tested a more targeted cheap future-input corruption objective on the exact-last-token grouped branch by only corrupting the speculative middle-token positions of each early 3-token grouped block (semantic_future_input_corruption_stride=3, phase=2, prob=0.5, max_q0_positions=12) while keeping the 12-token exact-last grouped decode. This still returned asr_wer_prefix=1.0, so simply targeting the middle-token speculative slots is not enough to turn the cheap local-corruption objective into an OOD win.","timestamp":1773512358031,"segment":0}
{"run":144,"commit":"cf0f36a","metric":1,"metrics":{},"status":"discard","description":"Tested detach_semantic_hidden_for_stage2=true on the strongest reproducible four-head future-Q0 baseline (semantic_future_prediction_steps=4, weight=0.5, semantic_self_condition_prob=0.5, semantic_eos_weight=2.0, 53-frame cap). The idea was to stop stage-2 residual gradients from distorting the semantic decoder during the 10-minute budget, but it regressed to asr_wer_prefix=1.0 and even degraded gt ASR to 0.25, so simple stage2-gradient detachment is not a win on the reproducible baseline.","timestamp":1773513215117,"segment":0}
{"run":145,"commit":"cf0f36a","metric":0.8333333134651184,"metrics":{},"status":"discard","description":"Tested an auxiliary text-prefix LM loss on the strongest reproducible four-head future-Q0 baseline (text_loss_weight=0.1 with semantic_future_prediction_steps=4, weight=0.5, semantic_self_condition_prob=0.5, semantic_eos_weight=2.0, 53-frame cap). This avoided the common 1.0 collapse and kept gt ASR good, but it only reached asr_wer_prefix=0.8333 and cut 10-minute throughput to ~13.9k samples, so the first text-loss attempt is not yet competitive with the 0.6667 baseline.","timestamp":1773514009094,"segment":0}
{"run":146,"commit":"cf0f36a","metric":1,"metrics":{},"status":"discard","description":"Retuned the new auxiliary text-prefix LM loss on the strongest reproducible four-head future-Q0 baseline down from text_loss_weight=0.1 to 0.02. This collapsed back to asr_wer_prefix=1.0 with worse CER 0.909, so the first text-loss clue does not improve under a simple smaller-weight retune.","timestamp":1773514761208,"segment":0}
{"run":147,"commit":"cf0f36a","metric":1,"metrics":{},"status":"discard","description":"Tested whether the exact-last-token grouped transition transfers to the strongest reproducible four-head future-Q0 baseline: keep semantic_future_prediction_steps=4, weight=0.5, scheduled sampling, EOS weighting, and the 53-frame cap, but decode the first 12 semantic tokens in exact/future/exact 3-token grouped steps before falling back to tokenwise decoding. This still returned asr_wer_prefix=1.0, so the exact-last transition does not rescue the plain four-head recipe either and still appears specific to the matched two-head grouped branch.","timestamp":1773524571728,"segment":0}
{"run":148,"commit":"cf0f36a","metric":1,"metrics":{},"status":"discard","description":"Tested a smaller Stage-2 residual decoder on the strongest reproducible four-head future-Q0 baseline by shrinking the residual transformer to 2 layers / 2 heads / MLP 256, while keeping semantic_future_prediction_steps=4, weight=0.5, semantic_self_condition_prob=0.5, semantic_eos_weight=2.0, and the 53-frame cap. This did not help: final asr_wer_prefix stayed at 1.0, in-domain WER stayed at 1.0, and throughput actually fell to about 20.5k samples / 10 min, so simply shrinking Stage 2 is not a good fast-convergence pivot.","timestamp":1773525870125,"segment":0}
{"run":149,"commit":"cf0f36a","metric":1,"metrics":{},"status":"discard","description":"Tested a smaller global batch on the strongest reproducible four-head future-Q0 baseline by overriding batch_size from 8 to 4 while keeping semantic_future_prediction_steps=4, weight=0.5, semantic_self_condition_prob=0.5, semantic_eos_weight=2.0, and the 53-frame cap. This traded samples for more updates (3384 steps but only 13.5k samples in 10 min) and still failed on the primary metric: asr_wer_prefix stayed at 1.0, CER worsened to 0.864, and in-domain WER only recovered to 0.889.","timestamp":1773526684574,"segment":0}
{"run":150,"commit":"cf0f36a","metric":1,"metrics":{},"status":"discard","description":"Added a richer position-dependent grouped decode schedule for Stage 1 and tested it on the matched two-head grouped-prefix branch with text_source=both: use the explicit early schedule 3,3,1,2,2,1 (two 3-token grouped steps, one exact bridge token, then a gentler 2-token taper) instead of the old fixed 12-token grouped prefix, while keeping semantic_future_prediction_steps=2, weight=0.5, semantic_self_condition_prob=0.5, semantic_eos_weight=2.0, and the 53-frame cap. This explicit transition policy failed cleanly at asr_wer_prefix=1.0 and worsened secondaries, so this first mid-bridge+taper schedule is not the right stabilization for the grouped-prefix branch.","timestamp":1773527723526,"segment":0}
{"run":151,"commit":"cf0f36a","metric":0.8333333134651184,"metrics":{},"status":"discard","description":"Retested the new per-step grouped decode schedule support with a later, more targeted transition policy on the matched two-head text_source=both branch: schedule 3,3,3,1,2, i.e. keep the first 9 semantic tokens in the original 3-token grouped steps, insert one exact bridge token near the grouped->exact boundary, then do one final 2-token grouped step before falling back to exact decoding. This was the first scheduled-transition variant with some life, reaching asr_wer_prefix=0.8333 and in-domain WER 0.556, but it still stayed well below the strong 0.6667 baselines.","timestamp":1773528503644,"segment":0}
{"run":152,"commit":"cf0f36a","metric":1,"metrics":{},"status":"discard","description":"Ablated the final 2-token grouped step from the first promising scheduled-transition variant on the matched two-head text_source=both branch, testing schedule 3,3,3,1,1,1 instead of 3,3,3,1,2. That collapsed back to asr_wer_prefix=1.0 with much worse CER 1.36, so the small amount of life in the previous late-bridge schedule does not come from the bridge token alone; the final short grouped step seems materially important.","timestamp":1773529253779,"segment":0}
{"run":153,"commit":"cf0f36a","metric":1,"metrics":{},"status":"discard","description":"Tested another late-boundary explicit grouped schedule on the matched two-head text_source=both branch: schedule 3,3,3,2,1, i.e. keep the first 9 semantic tokens in 3-token grouped steps, then use one 2-token grouped step before falling back to exact decoding, with no explicit bridge token. This regressed to asr_wer_prefix=1.0, though in-domain WER stayed decent at 0.556, so the weak life in 3,3,3,1,2 does not come from merely shortening the last grouped step; the explicit late exact bridge still looks important.","timestamp":1773530160322,"segment":0}
{"run":154,"commit":"cf0f36a","metric":1,"metrics":{},"status":"discard","description":"Tested a second late-boundary explicit grouped schedule on the matched two-head text_source=both branch: schedule 3,3,2,1,2, i.e. bring the taper one token earlier than 3,3,3,1,2 while still keeping a late exact bridge plus a final 2-token grouped step. This still missed the primary metric at asr_wer_prefix=1.0, but it produced the strongest in-domain result seen in this mini-schedule sweep (asr_wer_in_domain=0.111), suggesting the late-bridge family may help alignment in-domain without yet transferring to the OOD prompt.","timestamp":1773530897867,"segment":0}
{"run":155,"commit":"cf0f36a","metric":1,"metrics":{},"status":"discard","description":"Exact reran the previously most promising explicit late-boundary schedule on the matched two-head text_source=both branch (`semantic_block_decode_schedule=3,3,3,1,2`). The earlier `asr_wer_prefix=0.8333` did not reproduce: this rerun fell back to `1.0`, though CER stayed decent at `0.682` and throughput was strong (~31.4k samples in 10 min). So the new schedule-support clue is real enough to affect secondaries, but the nominal best explicit late-bridge schedule still looks noisy rather than robust.","timestamp":1773531648681,"segment":0}
{"run":156,"commit":"cf0f36a","metric":1,"metrics":{},"status":"discard","description":"Tested whether an explicit text-prefix LM anchor could rescue the strongest in-domain late-bridge schedule by adding text_loss_weight=0.1 on top of the matched two-head text_source=both branch with semantic_block_decode_schedule=3,3,2,1,2. This hurt badly: throughput fell to ~14.6k samples in 10 min, in-domain WER regressed from the earlier 0.111 to 1.0, and the primary metric stayed at asr_wer_prefix=1.0. So a simple text-prefix LM loss does not combine well with the current late-boundary grouped schedules.","timestamp":1773532395296,"segment":0}
{"run":157,"commit":"cf0f36a","metric":1,"metrics":{},"status":"discard","description":"Tested a smaller LoRA adaptation on the strongest reproducible four-head future-Q0 baseline by reducing LoRA rank/alpha from 16/16 to 8/8 while keeping semantic_future_prediction_steps=4, weight=0.5, semantic_self_condition_prob=0.5, semantic_eos_weight=2.0, and the 53-frame cap. This did not help fast convergence: final asr_wer_prefix stayed at 1.0, throughput fell to ~19.0k samples in 10 min, and in-domain WER regressed to 1.0.","timestamp":1773533188376,"segment":0}
{"run":158,"commit":"cf0f36a","metric":0.8333333134651184,"metrics":{},"status":"discard","description":"Reintroduced the exact-last-token grouped decoder on top of the current schedule-capable generation path and retested the original matched two-head text_source=both / 12-token grouped-prefix recipe (three-token grouped steps for the first 12 semantic tokens, then exact decoding). This recovered some life at asr_wer_prefix=0.8333 with decent in-domain WER 0.556, confirming the reimplementation is directionally similar to the old clue, but it still fell well short of the prior 0.6667/0.5 best results.","timestamp":1773534270063,"segment":0}
