{"run":726,"commit":"19b0f5c","metric":0.8333333134651184,"metrics":{},"status":"keep","description":"Ran the complementary detached **old-train-cache-only + CPU-only** sequencing probe to ask whether simply **touching `proc.cpu_percent()` before `proc.memory_info()`** is already enough to weaken the branch, even if the emitted stats stay **memory-info-only**. I built `/tmp/xax-bench-9cea09c-oldtrain-cpupretouchmeminfoonly-nogpu`, where each interval does `proc.cpu_percent()`, then `proc.memory_info()`, then logs only the memory-info-derived fields with `cpu_percent=0`. This weakened to **`asr_wer_prefix=0.8333`** with near-old-regime throughput (~29.4k samples / 10 min), EOS on both prompts, and clean gt-ASR. Relative to #714 and #724-#725, that is a strong new split: **touching `cpu_percent()` before `memory_info()` is already enough to knock the branch out of the stronger `0.6667` class**, but not enough by itself to force the full bad `1.0` class. The harsher failure still appears to need that same pre-`memory_info()` `cpu_percent()` reading to be the one actually consumed for the interval.","timestamp":1774058433391,"segment":0}
{"run":727,"commit":"19b0f5c","metric":1,"metrics":{},"status":"discard","description":"Ran the next tiny detached **old-train-cache-only + CPU-only** sequencing/value-consumption probe to separate **call order** from **which `cpu_percent()` value is consumed**. I built `/tmp/xax-bench-9cea09c-oldtrain-cpufirstmeminfotouchcpuusefirst-nogpu`, where each interval does `cpu1=proc.cpu_percent()`, then `proc.memory_info()`, then a **second** `proc.cpu_percent()` touch, but still logs/emits the **first** pre-`memory_info()` `cpu1` value together with the memory-info fields. This failed cleanly at **`asr_wer_prefix=1.0`** with near-old-regime throughput (~29.9k samples / 10 min), EOS on both prompts, and clean gt-ASR. Relative to #724-#726, this is a sharp new split: a later post-`memory_info()` `cpu_percent()` touch is **not** enough to rescue the branch if the emitted value is still the **pre-`memory_info()`** reading. That materially strengthens the current mechanism read: the harsher bad class is concentrated on intervals that both **touch `cpu_percent()` before `memory_info()`** and **consume that pre-`memory_info()` `cpu_percent()` reading** for the logged stats.","timestamp":1774059788507,"segment":0}
{"run":728,"commit":"19b0f5c","metric":1,"metrics":{},"status":"discard","description":"Ran the symmetric detached **old-train-cache-only + CPU-only** follow-up to #727 on the **`memory_info()`-first** side. I built `/tmp/xax-bench-9cea09c-oldtrain-meminfocputouchcpuusefirst-nogpu`, where each interval does `mem=proc.memory_info()`, then `cpu1=proc.cpu_percent()`, then a **second** `proc.cpu_percent()` touch, but still logs/emits the **first** post-`memory_info()` `cpu1` value together with the memory-info fields. This also failed cleanly at **`asr_wer_prefix=1.0`** with near-old-regime throughput (~29.8k samples / 10 min), EOS on both prompts, and clean gt-ASR. Relative to #725 and #727, this sharpens the mechanism again: it is **not** enough for `memory_info()` to happen first if the emitted value is still the **first** `cpu_percent()` reading for that interval. The stronger `0.6667` class on #725 appears to depend specifically on consuming a **second** post-`memory_info()` `cpu_percent()` reading rather than the first one.","timestamp":1774060585781,"segment":0}
{"run":729,"commit":"a66cdea","metric":0.6666666865348816,"metrics":{},"status":"keep","description":"Ran the key bridge probe on the detached **old-train-cache-only + CPU-only** route to reconcile the noisy original **single-read** `memory_info() -> cpu_percent()` branch with the newer two-read picture. I built `/tmp/xax-bench-9cea09c-oldtrain-meminfotouchcpuonlymem-nogpu`, where each interval does `mem=proc.memory_info()`, then **touches** `proc.cpu_percent()` once, but still emits **memory-info-only** stats with `cpu_percent=0`. This recovered the stronger **`asr_wer_prefix=0.6667`** class with near-old-regime throughput (~29.8k samples / 10 min), EOS on both prompts, and zero invalid q0s, though gt-ASR and in-domain quality were weaker than the cleanest branches. Relative to #725 and #727-#728, this is the missing bridge: a **single post-`memory_info()` `cpu_percent()` touch is not enough to poison the branch by itself if that CPU value is not emitted**. That strengthens the current mechanism read substantially: the weaker `0.8333` harm comes from touching `cpu_percent()` before `memory_info()`, but the harsher `1.0` class now points much more specifically at a downstream consumer reacting to the **first emitted `cpu_percent()` value** for the interval.","timestamp":1774061747633,"segment":0}
{"run":730,"commit":"a66cdea","metric":1,"metrics":{},"status":"discard","description":"Ran the first direct **consumer-level tracing** follow-up on the detached **old-train-cache-only + CPU-only** route. Starting from the bad `#728` surface (`memory_info() -> cpu_percent() -> cpu_percent()` while emitting the **first** post-`memory_info()` CPU reading), I built `/tmp/xax-bench-9cea09c-oldtrain-meminfocputouchcpuusefirst-nologcpu-nogpu` and removed only the **training-side logger consumer** of `stats.cpu_percent` in `CPUStatsMixin.on_step_start()`, while leaving the worker, shared stats payload, manager surface, and all memory logging intact. This still failed cleanly at **`asr_wer_prefix=1.0`** with near-old-regime throughput (~29.7k samples / 10 min), EOS on both prompts, and acceptable gt-ASR. So the newly narrowed bad-class mechanism is **not** explained just by the downstream `logger.log_scalar(\"percent\", stats.cpu_percent, namespace=\"🔧 cpu\")` call. The harmful consumer lies deeper than that single visible logging site — likely in the broader shared-stats / logger-backend surface, or in some other consequence of carrying that first emitted CPU value through the monitor path at all.","timestamp":1774062556561,"segment":0}
{"run":731,"commit":"6e8b3b0","metric":0.8333333134651184,"metrics":{},"status":"keep","description":"Ran the next direct **consumer-path** split on the detached **old-train-cache-only + CPU-only** route. Starting from the bad `#728` surface (`memory_info() -> cpu_percent() -> cpu_percent()` while emitting the **first** post-`memory_info()` CPU reading), I built `/tmp/xax-bench-9cea09c-oldtrain-meminfocputouchcpuusefirst-noread-nogpu` and changed `CPUStatsMixin.on_step_start()` to **stop reading and logging the monitor payload entirely**, while keeping the spawned CPU worker, manager proxies, shared-state writes, and worker-side `psutil` behavior unchanged. This improved from the raw `1.0` class down to **`asr_wer_prefix=0.8333`** with near-old-regime throughput (~29.5k samples / 10 min), EOS on both prompts, and acceptable gt-ASR. Relative to #730, this is a strong new consumer-level split: the bad class is **not** explained by the one visible `logger.log_scalar(\"percent\", stats.cpu_percent, ...)` call alone, but it **does** depend materially on the broader **training-side monitor read/log path**. The remaining live suspect is now narrower: some combination of `monitor.get()` / event-clear / proxy-read / cached-state update and the remaining memory/child logging, rather than the worker-side `psutil` calls alone or that single visible CPU-percent scalar log.","timestamp":1774063500944,"segment":0}
{"run":732,"commit":"6e8b3b0","metric":1,"metrics":{},"status":"discard","description":"Ran the next consumer-path split on the detached **old-train-cache-only + CPU-only** route. Starting from the bad `#728` surface, I built `/tmp/xax-bench-9cea09c-oldtrain-meminfocputouchcpuusefirst-getnolog-nogpu` and kept the full training-side **read path** (`monitor.get_if_set()` / `monitor.get()`, event clear, proxy read, cached-state update) but removed **all** logging of the returned monitor payload. This still failed cleanly at **`asr_wer_prefix=1.0`** with near-old-regime throughput (~29.6k samples / 10 min), EOS on both prompts, and clean gt-ASR. Relative to #731, this is a sharp new consumer-level split: the remaining bad-class consumer does **not** need any of the visible memory/child/cpu logging calls at all. The harmful step is now concentrated more narrowly inside the **read path itself** — some combination of event/proxy interaction, shared-value fetch, and cached-state update — rather than in the downstream scalar logging surface.","timestamp":1774064324096,"segment":0}
{"run":733,"commit":"2d1324e","metric":0.6666666865348816,"metrics":{},"status":"keep","description":"Ran the next consumer-path split on the detached **old-train-cache-only + CPU-only** route. Starting from the bad `#728` surface, I built `/tmp/xax-bench-9cea09c-oldtrain-meminfocputouchcpuusefirst-clearonly-nogpu` and reduced the training-side consumer to only the **event-proxy read/clear path**: `on_step_start()` now checks `monitor._monitor_event.is_set()` and clears it, but performs **no shared-value fetch**, **no stats decode/cached-state update**, and **no logging**. This recovered the stronger **`asr_wer_prefix=0.6667`** class with near-old-regime throughput (~29.7k samples / 10 min), EOS on both prompts, and zero invalid q0s. Relative to #731-#732, this is a sharp new split: the bad class does **not** require the visible logging calls, and it does **not** require the event-clear step alone. The remaining harmful consumer is now concentrated much more narrowly in the **shared-value fetch / stats-decode / cached-state** side of the training-loop monitor path, not in the worker-side `psutil` calls alone and not in any visible scalar logging site.","timestamp":1774065243600,"segment":0}
{"run":734,"commit":"2d1324e","metric":1,"metrics":{},"status":"discard","description":"Ran the next shared-value-read split on the detached **old-train-cache-only + CPU-only** route. Starting from the bad `#728` surface, I built `/tmp/xax-bench-9cea09c-oldtrain-meminfocputouchcpuusefirst-getraw-nogpu` and kept the **event `is_set()/clear()` path** from `#733`, but added back only the raw **`ValueProxy.get()`** on `monitor._cpu_stats_smem` — still with **no stats decode**, **no cached-state update**, and **no logging**. This still failed cleanly at **`asr_wer_prefix=1.0`** with near-old-regime throughput (~29.5k samples / 10 min), EOS on both prompts, and clean gt-ASR. Relative to #733, this is the sharpest consumer-level split yet: the event-proxy clear step alone is compatible with the stronger class, but adding back the raw **shared-value fetch** is already enough to restore the bad class. That concentrates the remaining mechanism very tightly around the **`ValueProxy.get()` / manager-shared-value fetch** itself, not around stats decode, cached-state update, or any visible logging site.","timestamp":1774066045218,"segment":0}
{"run":735,"commit":"770a36a","metric":0.8333333134651184,"metrics":{},"status":"keep","description":"Ran the next consumer-order split on the detached **old-train-cache-only + CPU-only** route. Starting from the bad `#728` surface, I built `/tmp/xax-bench-9cea09c-oldtrain-meminfocputouchcpuusefirst-getrawnoclear-nogpu` and kept only a **raw shared-value fetch** on `monitor._cpu_stats_smem`, but crucially did **not** clear the event first and still performed **no stats decode, no cached-state update, and no logging**. This weakened only to **`asr_wer_prefix=0.8333`** with near-old-regime throughput (~29.5k samples / 10 min), EOS on both prompts, and clean gt-ASR. Relative to #734, this is a sharp new split: the raw `ValueProxy.get()` is still harmful, but the full bad `1.0` class is harsher specifically when the consumer does **clear-then-get** rather than **get-without-clear**. That concentrates the remaining mechanism even more tightly around the **ordering-sensitive manager read path** itself, not just the existence of a shared-value fetch or any visible logging/decoding step.","timestamp":1774067001575,"segment":0}
{"run":736,"commit":"252a25c","metric":0.8333333134651184,"metrics":{},"status":"keep","description":"Ran the final consumer-order corner on the detached **old-train-cache-only + CPU-only** route. Starting from the bad `#728` surface, I built `/tmp/xax-bench-9cea09c-oldtrain-meminfocputouchcpuusefirst-getthenclear-nogpu` and kept only a raw **shared-value fetch** on `monitor._cpu_stats_smem`, followed immediately by an **event clear** — still with **no stats decode, no cached-state update, and no logging**. This weakened only to **`asr_wer_prefix=0.8333`** with near-old-regime throughput (~29.6k samples / 10 min), EOS on both prompts, and clean gt-ASR. Relative to #734 and #735, this cleanly completes the manager-read ordering split: the full bad `1.0` class is specific to **clear-then-fetch**, while both **fetch-without-clear** and **fetch-then-clear** soften only to the weaker `0.8333` class. That concentrates the remaining mechanism very tightly around the **clear-before-fetch ordering** inside the manager-backed shared-value read path, not around the visible logging sites, stats decoding, or cached-state update.","timestamp":1774067948124,"segment":0}
{"run":737,"commit":"252a25c","metric":1,"metrics":{},"status":"discard","description":"Tested whether the detached old-train CPU-only **clear-then-fetch** bad class depends specifically on `SyncManager` proxy transport. I built `/tmp/xax-bench-9cea09c-oldtrain-meminfocputouchcpuusefirst-getrawnoproxy-nogpu`, which keeps the bad `#734` structure — worker emits the first post-`memory_info()` `cpu_percent()` value and the training loop does only **clear then raw fetch** with no decode/cached-state/logging — but swaps the CPU monitor itself from manager proxies to direct `context.Event()` + shared `context.Value(...)` transport. This failed cleanly at **`asr_wer_prefix=1.0`** with near-old-regime throughput (~29.7k samples / 10 min), EOS on both prompts, and worse gt-ASR. So the harsh clear-then-fetch class is **not** specific to `SyncManager.ValueProxy.get()`; it survives under non-manager shared memory too, which pushes the live mechanism away from proxy RPC semantics and more toward the **ordering of event clear vs shared-state fetch / synchronization** itself.","timestamp":1774069078853,"segment":0}
{"run":738,"commit":"252a25c","metric":1,"metrics":{},"status":"discard","description":"Ran the follow-up non-manager transport ordering control on the detached old-train CPU-only route. I built `/tmp/xax-bench-9cea09c-oldtrain-meminfocputouchcpuusefirst-getthenclearnoproxy-nogpu`, keeping the same direct `context.Event()` + shared `context.Value(...)` transport from #737 but changing the consumer from **clear-then-fetch** to **fetch-then-clear**, again with no decode/cached-state/logging and the worker still emitting the first post-`memory_info()` `cpu_percent()` value. This also failed cleanly at **`asr_wer_prefix=1.0`** with near-old-regime throughput (~29.8k samples / 10 min), EOS on both prompts, and clean gt-ASR. So the manager-free transport does **not** reproduce the manager-proxy ordering asymmetry from #735-#736: once the CPU monitor uses direct shared memory, both clear/fetch orderings stay in the bad class. That means #737 did more than just prune `ValueProxy.get()` RPC semantics — it suggests the softer manager-side `0.8333` branches may depend on the proxy/object-copy path itself, while the direct shared-memory path is harsh regardless of clear/fetch order.","timestamp":1774069887448,"segment":0}
{"run":739,"commit":"f4098e7","metric":0.6666666865348816,"metrics":{},"status":"keep","description":"Ran the direct-shared-memory clear-only control on the detached old-train CPU-only route. Starting from the new direct `context.Event()` + shared `context.Value(...)` transport path from #737-#738, I built `/tmp/xax-bench-9cea09c-oldtrain-meminfocputouchcpuusefirst-clearonlynoproxy-nogpu` and reduced the training-side consumer to **event clear only**, with **no payload read**, no decode/cached-state update, and no logging, while the worker still emitted the first post-`memory_info()` `cpu_percent()` value. This recovered the stronger **`asr_wer_prefix=0.6667`** class with near-old-regime throughput (~29.8k samples / 10 min), EOS on both prompts, clean gt-ASR, and shorter generations. Relative to #737-#738 plus the older #733-#736 manager-proxy map, this sharpens the mechanism materially: under direct shared memory, the route stays in the bad `1.0` class for **any actual payload read**, but still recovers `0.6667` for **clear-only**. So the live mystery is now narrower than `SyncManager` itself — it is centered on the **shared-state read/synchronization semantics** of that first-emitted CPU payload, with manager proxies softening some read-order cases to `0.8333` while direct shared memory remains harsh whenever the payload is actually read.","timestamp":1774070795368,"segment":0}
{"run":740,"commit":"f4098e7","metric":1,"metrics":{},"status":"discard","description":"Ran the next direct-shared-memory synchronization split on the detached old-train CPU-only route. Starting from the clear-only direct transport branch from #739, I built `/tmp/xax-bench-9cea09c-oldtrain-meminfocputouchcpuusefirst-lockonlynoproxy-nogpu` and changed the training-side consumer to **clear the event and acquire the shared-value lock, but read no payload fields at all**. The worker still emitted the first post-`memory_info()` `cpu_percent()` value. This still failed cleanly at **`asr_wer_prefix=1.0`** with near-old-regime throughput (~29.6k samples / 10 min), EOS on both prompts, and acceptable gt-ASR. That sharpens #737-#739 materially: under direct shared memory, the harsh class does **not** require copying any payload fields — the **lock/synchronization step itself** is already enough to keep the route in the bad class once the event is consumed. So the remaining direct-transport mystery is now even narrower: it is centered on **shared-memory synchronization/locking**, not on payload decode or field reads.","timestamp":1774071621006,"segment":0}
{"run":741,"commit":"527fe37","metric":0.8333333134651184,"metrics":{},"status":"keep","description":"Ran the complementary direct-shared-memory synchronization split on the detached old-train CPU-only route. Starting from the clear-only direct transport branch from #739, I built `/tmp/xax-bench-9cea09c-oldtrain-meminfocputouchcpuusefirst-locknoclearnoproxy-nogpu` and changed the training-side consumer to **acquire the shared-value lock without clearing the event and without reading any payload fields**. The worker still emitted the first post-`memory_info()` `cpu_percent()` value. This weakened only to **`asr_wer_prefix=0.8333`** with near-old-regime throughput (~29.5k samples / 10 min), EOS on both prompts, and clean gt-ASR. Relative to #739-#740, this is a sharp new split: under direct shared memory, **lock acquisition alone is already harmful**, but the full bad `1.0` class is harsher specifically when that lock acquisition happens **after consuming/clearing the event**. That concentrates the remaining mechanism even more tightly around the interaction between **event consumption** and **shared-memory synchronization**, not payload decoding or visible logging.","timestamp":1774072405101,"segment":0}
{"run":742,"commit":"de9387a","metric":0.8333333134651184,"metrics":{},"status":"keep","description":"Ran the last direct-shared-memory lock-order corner on the detached old-train CPU-only route. Starting from the same direct shared-memory transport as #739-#741, I built `/tmp/xax-bench-9cea09c-oldtrain-meminfocputouchcpuusefirst-lockthenclearnoproxy-nogpu` and changed the training-side consumer to **acquire the shared-value lock first without reading any fields, then clear the event**. The worker still emitted the first post-`memory_info()` `cpu_percent()` value. This weakened only to **`asr_wer_prefix=0.8333`** with near-old-regime throughput (~29.7k samples / 10 min), EOS on both prompts, and strong in-domain match. Relative to #740-#741, this completes the direct lock-order split: the full bad `1.0` class is specific to **clear-then-lock**, while both **lock-only without clear** and **lock-then-clear** soften only to the weaker `0.8333` class. That narrows the remaining mechanism further: on the direct shared-memory path, the sharpest degradant is not payload reading but specifically **consuming/clearing the event before touching the shared-value lock**.","timestamp":1774073316254,"segment":0}
{"run":743,"commit":"de9387a","metric":1,"metrics":{},"status":"discard","description":"Tested whether the new direct-shared-memory **clear-before-lock** bad class from #740 depends on actually acquiring the lock. I built `/tmp/xax-bench-9cea09c-oldtrain-meminfocputouchcpuusefirst-getlockonlynoproxy-nogpu`, where the training loop does **clear the event**, then merely calls `monitor._cpu_stats_smem.get_lock()` but does **not** enter/acquire it and still reads no payload fields. The worker still emitted the first post-`memory_info()` `cpu_percent()` value. This still failed cleanly at **`asr_wer_prefix=1.0`** with near-old-regime throughput (~29.5k samples / 10 min), EOS on both prompts, and clean gt-ASR. That suggests the harsh direct shared-memory path is even touchier than expected: once the event is consumed, even **touching the shared-value lock object** appears sufficient to keep the route in the bad class. So the remaining direct-transport mystery is now centered very specifically on the combination of **event clear + subsequent shared-value/lock touch**, not on payload decode, and not even clearly on lock acquisition alone.","timestamp":1774074215605,"segment":0}
