{"run":476,"commit":"f927e34","metric":0.6666666865348816,"metrics":{},"status":"discard","description":"Tested whether the noisy `both_weighted_sampled_diff` clue wants *less* sampled mass than the live 2-pass center by lowering `text_source_weighted_sampled_passes` from 2 to 1 while keeping the original 3:1 nominal weighting, `semantic_future_prediction_steps=2`, future weight 0.5, scheduled sampling 0.5, EOS weight 2.0, the p95-style cap, and the plain 12-token grouped prefix. After prebuilding the new caches, this recovered only tie-level life at asr_wer_prefix=0.6667 with CER 0.682, but it lost OOD EOS, stretched back to the 53-frame cap, and gt-ASR sanity softened to 0.143 despite in-domain EOS and healthy throughput (~31.4k samples / 10 min). So the diff-targeted sampled clue does not broaden cleanly toward lower sampled mass either: just one deterministic pass softens back to baseline-like life while reintroducing the old long-form OOD failure mode, which makes the original 2-pass setting look even more like the narrow center of this family.","timestamp":1773841706606,"segment":0}
{"run":477,"commit":"f927e34","metric":0.6666666865348816,"metrics":{},"status":"discard","description":"Tested whether the new diff-targeted sampled text mix transfers beyond the plain sampled grouped 2-head path by swapping `text_source=both_weighted_sampled_diff` into the older aligned four-head grouped-prefix recipe while keeping nominal normalized/raw weights 3:1, `text_source_weighted_sampled_passes=2`, future weight 0.5, scheduled sampling 0.5, EOS weight 2.0, the p95-style cap, and the plain 12-token grouped prefix. It recovered only tie-level life at asr_wer_prefix=0.6667 with CER 0.682, EOS on both prompts, perfect gt-ASR sanity, and healthy throughput (~30.5k samples / 10 min), but it did not improve on either the reproducible aligned grouped backbone or the first-run 0.5 result from the cleaner 2-head diff-targeted branch. So the diff-targeted sampled clue is not a broad grouped-family upgrade either; it still looks most specific to the plain sampled grouped 2-head backbone.","timestamp":1773842562427,"segment":0}
{"run":478,"commit":"f927e34","metric":1,"metrics":{},"status":"discard","description":"Tested whether the old sampled-branch text anchor can stabilize the new diff-targeted sampled clue by adding `text_loss_weight=0.1` on top of `text_source=both_weighted_sampled_diff`, nominal normalized/raw weights 3:1, `text_source_weighted_sampled_passes=2`, `semantic_future_prediction_steps=2`, future weight 0.5, scheduled sampling 0.5, EOS weight 2.0, the p95-style cap, and the plain 12-token grouped prefix. This failed cleanly at asr_wer_prefix=1.0 with CER 0.818 and wildly wrong in-domain transcription despite EOS on both prompts, while collapsing sample coverage to only ~23.6k / 10 min. So the old fragile `text_loss_weight=0.1` spike does not rescue the new diff-targeted grouped clue either; on this branch it behaves like another stale throughput-costly regression rather than a stabilizer.","timestamp":1773843348539,"segment":0}
{"run":479,"commit":"f927e34","metric":0.8333333134651184,"metrics":{},"status":"discard","description":"Tested whether the new diff-targeted sampled clue wants an interior future-depth between the live 2-head grouped backbone and the old 4-head grouped branch by raising `semantic_future_prediction_steps` from 2 to 3 while keeping `text_source=both_weighted_sampled_diff`, nominal normalized/raw weights 3:1, `text_source_weighted_sampled_passes=2`, future weight 0.5, scheduled sampling 0.5, EOS weight 2.0, the p95-style cap, and the plain 12-token grouped prefix. This recovered only weak life at asr_wer_prefix=0.8333 with CER 0.955, EOS on both prompts, and reduced coverage (~23.5k samples / 10 min), while both OOD and in-domain transcripts were clearly worse than the live 2-head branch. So the diff-targeted sampled clue does not appear to broaden across intermediate future depth either; it still looks centered on the plain 2-head grouped decoder rather than on a smoother 3-head compromise.","timestamp":1773844137720,"segment":0}
{"run":480,"commit":"f927e34","metric":1,"metrics":{},"status":"discard","description":"Tested whether the new diff-targeted sampled clue inherits the old shorter-window side path by reducing `semantic_block_decode_max_grouped_tokens` from 12 down to 6 while keeping `text_source=both_weighted_sampled_diff`, nominal normalized/raw weights 3:1, `text_source_weighted_sampled_passes=2`, `semantic_future_prediction_steps=2`, future weight 0.5, scheduled sampling 0.5, EOS weight 2.0, and the same plain grouped transition. This failed cleanly at asr_wer_prefix=1.0 with CER 0.773 despite EOS on both prompts, decent in-domain WER 0.222, and healthy throughput (~31.2k samples / 10 min). So the diff-targeted sampled clue does not seem to broaden toward the older noisy 6-token side path either; it still looks pinned to the original 12-token grouped window.","timestamp":1773844909729,"segment":0}
{"run":481,"commit":"f927e34","metric":1,"metrics":{},"status":"discard","description":"Tested a new anchored diff-targeted dataset geometry by adding a temporary `text_source=both_weighted_sampled_diff_anchor` variant: one full normalized anchor pass plus one diff-targeted weighted sampled pass. I ran it on the plain sampled grouped 2-head backbone with `text_source_weighted_normalized_repeats=1`, `text_source_weighted_raw_repeats=1`, and `text_source_weighted_sampled_passes=2`, which makes the second pass a 1:1 diff-only sampled perturbation while keeping one guaranteed normalized pass; across the two passes this was meant to approximate an effective 3:1 normalized/raw exposure on the differing subset with less assignment fragility than the current `both_weighted_sampled_diff` winner. After prebuilding the new caches, it failed cleanly at asr_wer_prefix=1.0 with CER 0.818 despite EOS on both prompts, decent in-domain WER 0.222, and full throughput (~31.2k samples / 10 min). So a normalized anchor plus one diff-only sampled perturbation is not the missing stabilizer either: the stronger 0.5 signal from `both_weighted_sampled_diff` does not seem to come from simply anchoring one full normalized pass while preserving an effective 3:1 diff-only exposure on the second pass.","timestamp":1773845959076,"segment":0}
{"run":482,"commit":"f927e34","metric":0.8333333134651184,"metrics":{},"status":"discard","description":"Tested whether the new `both_weighted_sampled_diff` clue is mainly a lucky deterministic sampled assignment by adding a temporary `text_source_weighted_sampled_seed` control and rerunning the plain sampled grouped 2-head diff-targeted recipe at alternate assignment seed `1` while keeping the original 3:1 nominal weighting, `text_source_weighted_sampled_passes=2`, `semantic_future_prediction_steps=2`, future weight 0.5, scheduled sampling 0.5, EOS weight 2.0, the p95-style cap, and the plain 12-token grouped prefix. After prebuilding the new caches, this softened to only weak life at asr_wer_prefix=0.8333 with CER 0.727, EOS on both prompts, perfect gt-ASR sanity, and full throughput (~31.2k samples / 10 min). So the current 0.5 diff-targeted result does not appear robust across nearby sampled-assignment salts; at least one simple alternate seed already looks materially worse.","timestamp":1773847016108,"segment":0}
{"run":483,"commit":"f927e34","metric":1,"metrics":{},"status":"discard","description":"Continued the new sampled-assignment sensitivity check for `both_weighted_sampled_diff` by rerunning the same plain sampled grouped 2-head recipe at alternate assignment seed `2` via a temporary `text_source_weighted_sampled_seed` control, while keeping the original 3:1 nominal weighting, `text_source_weighted_sampled_passes=2`, `semantic_future_prediction_steps=2`, future weight 0.5, scheduled sampling 0.5, EOS weight 2.0, the p95-style cap, and the plain 12-token grouped prefix. After prebuilding the new caches, this failed cleanly at asr_wer_prefix=1.0 with CER 0.636 despite EOS on both prompts, perfect gt-ASR sanity, decent in-domain WER 0.333, and full throughput (~31.1k samples / 10 min). So the diff-targeted 0.5 clue now looks strongly assignment-sensitive rather than broadly reproducible: one nearby sampled salt softened to 0.8333, and another already collapses all the way back to 1.0.","timestamp":1773847816491,"segment":0}
{"run":484,"commit":"f927e34","metric":0.8333333134651184,"metrics":{},"status":"discard","description":"Tested a new temporary `text_source=both_weighted_sampled_diff_digit_heavy` variant to see whether the noisy diff-targeted sampled clue improves if the same 2-pass grouped 2-head backbone spends its raw-text budget only on *larger* numeric/date/ID normalization cases rather than on every differing row. The variant kept the same deterministic sampled-pass geometry as `both_weighted_sampled_diff` but only allowed raw text on differing utterances whose raw transcript contains at least four digit characters; with that narrower subset (`838` rows, ~6.4% of the corpus) I used a 1:1 normalized/raw weighting and 2 sampled passes so the overall expected raw exposure stayed close to the live 3:1 diff-targeted recipe. On the plain sampled grouped 2-head backbone (`semantic_future_prediction_steps=2`, future weight 0.5, scheduled sampling 0.5, EOS weight 2.0, p95-style cap, plain 12-token grouped prefix), this recovered only weak life at asr_wer_prefix=0.8333 with CER 0.591, EOS on both prompts, but degraded gt-ASR sanity to 0.227 and missed both OOD and in-domain transcripts. So the diff-targeted clue is not just coming from concentrating raw exposure on the heaviest numeric verbalization rows; pruning toward only the largest digit-heavy subset looks stale.","timestamp":1773849464250,"segment":0}
{"run":485,"commit":"f927e34","metric":1,"metrics":{},"status":"discard","description":"Tested a new temporary `text_source=both_weighted_sampled_diff_spread` variant to see whether the noisy `both_weighted_sampled_diff` clue can be stabilized by changing the *assignment geometry* rather than the mass, ratio, or grouped decoder. This variant kept the same diff-targeted 3:1 raw budget, 2 sampled passes, and plain sampled grouped 2-head backbone, but instead of independently hashing each differing utterance/pass pair it precomputed an exact raw quota and spread raw exposure across as many differing utterances as possible before repeating rows across passes. In other words, it enforced low-overlap, max-coverage raw assignment on the differing subset while leaving unchanged rows normalized. On the live grouped 2-head recipe (`semantic_future_prediction_steps=2`, future weight 0.5, scheduled sampling 0.5, EOS weight 2.0, p95-style cap, plain 12-token grouped prefix), this failed cleanly at asr_wer_prefix=1.0 with CER 0.727 despite EOS on both prompts, perfect gt-ASR sanity, strong in-domain WER 0.222, and full throughput (~31.4k samples / 10 min). So the diff-targeted 0.5 clue is not rescued by a simple exact-quota / broader-coverage raw assignment either; preserving the same raw budget while explicitly spreading raw exposure across more unique differing rows looks stale.","timestamp":1773850460718,"segment":0}
{"run":486,"commit":"f927e34","metric":1,"metrics":{},"status":"discard","description":"Tested whether the reproducible fuller-LoRA fallback can stabilize the noisy diff-targeted sampled clue by rerunning the plain grouped 2-head `both_weighted_sampled_diff` recipe with `lora_targets=[q_proj,k_proj,v_proj,o_proj,gate,up,down]` while keeping the original 3:1 nominal weighting, `text_source_weighted_sampled_passes=2`, `semantic_future_prediction_steps=2`, future weight 0.5, scheduled sampling 0.5, EOS weight 2.0, the p95-style cap, and the plain 12-token grouped prefix. This failed cleanly at asr_wer_prefix=1.0 with CER 0.773 despite EOS on both prompts, perfect gt-ASR sanity, very strong in-domain WER 0.111, and still healthy coverage (~29.8k samples / 10 min). So fuller LoRA does not rescue the diff-targeted sampled family either; on this branch it behaves like another stale stack rather than a stabilizer.","timestamp":1773851402602,"segment":0}
{"run":487,"commit":"f927e34","metric":0.8333333134651184,"metrics":{},"status":"discard","description":"Tested a new grouped-transition variant on the noisy diff-targeted sampled clue by shrinking the plain grouped decoder from 3-token steps down to `semantic_block_decode_size=2` while keeping the same `both_weighted_sampled_diff` 3:1 / 2-pass dataset, `semantic_future_prediction_steps=2`, future weight 0.5, scheduled sampling 0.5, EOS weight 2.0, the p95-style cap, and a 12-token grouped prefix. This uses the same trained 2-head model but only consumes the first speculative future slot per grouped step, i.e. a gentler exact/future transition rather than the live exact/future/future step. It recovered only weak life at asr_wer_prefix=0.8333 with very strong CER 0.455, EOS on both prompts, perfect gt-ASR sanity, but much lower effective coverage (~23.7k samples / 10 min) and poor in-domain WER 0.778. So the diff-targeted clue does not broaden toward a simpler 2-token grouped transition either; narrowing the inference step size without changing the trained 2-head backbone looks like another stale slowdown rather than a stabilizer.","timestamp":1773852412759,"segment":0}
{"run":488,"commit":"f927e34","metric":0,"metrics":{},"status":"crash","description":"Tried to probe whether the simpler 2-token grouped transition (`semantic_block_decode_size=2`) broadens beyond the diff-targeted branch by applying it to the reproducible plain sampled grouped 2-head backbone (`text_source=both_weighted_sampled`, 3:1, 2 passes, `semantic_future_prediction_steps=2`, future weight 0.5, scheduled sampling 0.5, EOS weight 2.0, 12-token grouped prefix). `./autoresearch.sh` crashed before training because this config needed fresh cached `train` / `unpadded` datasets. Need to prebuild the datasets with `uv run examples/ljspeech.py --launcher dataset ...` before the transition probe itself can be judged.","timestamp":1773852531938,"segment":0}
{"run":489,"commit":"f927e34","metric":0.8333333134651184,"metrics":{},"status":"discard","description":"After prebuilding the required datasets, tested whether the simpler 2-token grouped transition (`semantic_block_decode_size=2`) broadens beyond the diff-targeted branch by applying it to the reproducible plain sampled grouped 2-head backbone (`text_source=both_weighted_sampled`, normalized/raw 3:1, 2 sampled passes, `semantic_future_prediction_steps=2`, future weight 0.5, scheduled sampling 0.5, EOS weight 2.0, p95-style cap, 12-token grouped prefix). This uses the same trained 2-head model but only consumes one speculative future slot per grouped step instead of the live 3-token exact/future/future transition. It recovered only weak life at asr_wer_prefix=0.8333 with CER 0.818, EOS on both prompts, perfect gt-ASR sanity, and full throughput (~31.2k samples / 10 min), but it still regressed clearly relative to the reproducible 0.6667 `semantic_block_decode_size=3` backbone. So the simpler 2-token exact/future transition looks stale on the plain sampled grouped family too, not just on the diff-targeted branch.","timestamp":1773853323811,"segment":0}
{"run":490,"commit":"f927e34","metric":0,"metrics":{},"status":"crash","description":"Tried to revisit the old soft early-position future-loss clue on the live diff-targeted sampled grouped 2-head branch by setting `semantic_future_prediction_position_decay=0.97`, but the run crashed immediately during config parsing: that knob no longer exists in the current `examples/ljspeech.py` config surface. So this older position-decay branch is not currently actionable without reintroducing deleted code, and should not remain in the live near-term idea set.","timestamp":1773853378555,"segment":0}
{"run":491,"commit":"f927e34","metric":1,"metrics":{},"status":"discard","description":"Tested a new broader exact-last transfer for the noisy diff-targeted sampled family by combining `text_source=both_weighted_sampled_diff` with the width-matched two-head `semantic_block_decode_size=4` exact/future/future/exact decoder (`semantic_block_decode_exact_last_token=true`) while keeping the original 3:1 nominal weighting, 2 sampled passes, future weight 0.5, scheduled sampling 0.5, EOS weight 2.0, the p95-style cap, and a 12-token grouped prefix. This failed cleanly at asr_wer_prefix=1.0, lost OOD EOS, stretched back to the 53-frame cap, and slowed coverage to only ~30.5k samples / 10 min despite perfect in-domain WER 0.0 and perfect gt-ASR sanity. So the diff-targeted clue does not transfer to the broader two-head exact/future/future/exact sampled family either; that remaining exact-last neighborhood looks stale here too.","timestamp":1773854291980,"segment":0}
{"run":492,"commit":"f927e34","metric":0,"metrics":{},"status":"crash","description":"Tried to probe whether the width-matching clue transfers back to the aligned normalized grouped backbone by running `text_source=normalized` with `semantic_future_prediction_steps=2`, future weight 0.5, scheduled sampling 0.5, EOS weight 2.0, and the plain 12-token / 3-token grouped prefix. `./autoresearch.sh` crashed before training because this config needed fresh cached `train` / `unpadded` datasets. Need to prebuild the normalized 2-head grouped datasets with `uv run examples/ljspeech.py --launcher dataset ...` before the transfer itself can be judged.","timestamp":1773854391372,"segment":0}
{"run":493,"commit":"f927e34","metric":0.6666666865348816,"metrics":{},"status":"discard","description":"After prebuilding the required datasets, tested whether the width-matching clue from the sampled family transfers back to the aligned normalized grouped backbone by running `text_source=normalized` with `semantic_future_prediction_steps=2`, future weight 0.5, scheduled sampling 0.5, EOS weight 2.0, the p95-style cap, and the plain 12-token / 3-token grouped prefix. This tied the robust best at asr_wer_prefix=0.6667 with CER 0.591, EOS on both prompts, perfect gt-ASR sanity, and full throughput (~31.0k samples / 10 min), but it did not improve on the stronger reproducible aligned 4-head grouped backbone. So width matching is not unique to the sampled family after all: the aligned normalized grouped backbone also has a viable 2-head transfer, but for now it only reaches tie-level life rather than a new win.","timestamp":1773855187612,"segment":0}
{"run":494,"commit":"f927e34","metric":0.5,"metrics":{},"status":"discard","description":"Tested whether the width-matched 2-head grouped clue becomes stronger on the aligned normalized backbone when paired with the narrower exact-last grouped transition by running `text_source=normalized`, `semantic_future_prediction_steps=2`, `semantic_block_decode_size=3`, `semantic_block_decode_exact_last_token=true`, future weight 0.5, scheduled sampling 0.5, EOS weight 2.0, the p95-style cap, and a 12-token grouped prefix. This reached tie-level life at asr_wer_prefix=0.5 with strong CER 0.455, EOS on both prompts, perfect gt-ASR sanity, and healthy coverage (~30.7k samples / 10 min), though in-domain WER stayed weak at 0.778. So the aligned normalized backbone does have a real width-matched exact-last 2-head branch, but this first run only ties the current 0.5 class rather than improving on it.","timestamp":1773855959576,"segment":0}
{"run":495,"commit":"f927e34","metric":0.6666666865348816,"metrics":{},"status":"discard","description":"Exact reran the new aligned normalized width-matched exact-last branch (`text_source=normalized`, `semantic_future_prediction_steps=2`, `semantic_block_decode_size=3`, `semantic_block_decode_exact_last_token=true`, future weight 0.5, scheduled sampling 0.5, EOS weight 2.0, p95-style cap, 12-token grouped prefix) after its first tie-level 0.5 result. The rerun softened back to asr_wer_prefix=0.6667 with CER 0.591, EOS on both prompts, in-domain WER 0.222, and slightly degraded gt-ASR sanity 0.167. So this new aligned normalized 2-head exact-last branch looks real enough to reach the 0.5 class once, but it is still noisy rather than an immediately reproducible successor.","timestamp":1773856764086,"segment":0}
{"run":496,"commit":"f927e34","metric":0,"metrics":{},"status":"crash","description":"Tried to combine the new aligned normalized 2-head exact-last clue with the older fixed-duplicate weighted 3:1 text mix by running `text_source=both_weighted`, normalized/raw repeats 3/1, `semantic_future_prediction_steps=2`, `semantic_block_decode_size=3`, `semantic_block_decode_exact_last_token=true`, future weight 0.5, scheduled sampling 0.5, EOS weight 2.0, and a 12-token grouped prefix. `./autoresearch.sh` crashed before training because this config needed fresh cached `train` / `unpadded` datasets. Need to prebuild the weighted 3:1 + 2-head exact-last datasets with `uv run examples/ljspeech.py --launcher dataset ...` before this structural combo can be judged.","timestamp":1773856912413,"segment":0}
