{"run":192,"commit":"cf0f36a","metric":1,"metrics":{},"status":"discard","description":"Tested whether the only live larger-LM grouped clue prefers a smoother late-boundary transition by combining `llm_repo=QWEN3_1_7B`, `batch_size=4`, `text_source=both`, the matched two-head grouped branch, `semantic_block_decode_exact_last_token=true`, and the most promising late schedule `semantic_block_decode_schedule=3,3,3,1,2`. This failed cleanly at asr_wer_prefix=1.0 with CER 0.864 and weak gt-ASR sanity, so the larger-LM grouped branch does not get stabilized by the same late-boundary schedule clue either.","timestamp":1773562645058,"segment":0}
{"run":193,"commit":"cf0f36a","metric":1,"metrics":{},"status":"discard","description":"Closed the last obvious larger-LM grouped clue stack by combining `llm_repo=QWEN3_1_7B`, `batch_size=4`, `text_source=both`, the matched two-head 12-token exact-last grouped prefix, and fuller LoRA targets `lora_targets=[q_proj,k_proj,v_proj,o_proj,gate,up,down]`. This failed cleanly at asr_wer_prefix=1.0 with worse CER 0.955 and no in-domain recovery, so fuller LoRA does not stabilize the noisy larger-LM exact-last grouped branch either.","timestamp":1773563522492,"segment":0}
{"run":194,"commit":"cf0f36a","metric":1,"metrics":{},"status":"discard","description":"Tested whether the two-head exact-last grouped branch is more step-limited than sample-limited by lowering `batch_size` from 8 to 4 on the plain 600M exact-last 12-token grouped recipe (`text_source=both`, 2 future-Q0 heads, scheduled sampling 0.5, EOS weight 2.0, 53-frame cap). This raised the update count substantially to 3260 steps in 10 minutes, but it still fell back to asr_wer_prefix=1.0 with only middling secondaries. So simply buying more optimizer steps does not stabilize the exact-last grouped branch either.","timestamp":1773564361021,"segment":0}
{"run":195,"commit":"cf0f36a","metric":1,"metrics":{},"status":"discard","description":"Enabled a new exact-last decode regime in code where exact-last grouped steps can emit one more token than the number of future heads, then tested the first truly train/infer-matched two-head exact-last branch: `text_source=both`, `semantic_future_prediction_steps=2`, `semantic_block_decode_size=4`, `semantic_block_decode_exact_last_token=true`, grouped only for the first 12 semantic tokens, with scheduled sampling 0.5, EOS weight 2.0, and the 53-frame cap. This gives exact / future / future / exact grouped steps so both future heads are actually used during inference. It still failed on the primary metric at asr_wer_prefix=1.0, though in-domain WER recovered to 0.667. So simply unlocking a fuller two-head exact-last grouped step is not an immediate win, but the new code path works and is now testable.","timestamp":1773565381340,"segment":0}
{"run":196,"commit":"cf0f36a","metric":1,"metrics":{},"status":"discard","description":"Retested the new fuller exact-last decode regime on the only larger-LM grouped branch that had shown life by combining `llm_repo=QWEN3_1_7B`, `batch_size=4`, `text_source=both`, two future-Q0 heads, and a newly unlocked 4-token exact-last grouped step for the first 12 semantic tokens (`semantic_block_decode_size=4`, `semantic_block_decode_exact_last_token=true`). This makes the larger LM use both future heads during inference via exact / future / future / exact steps, but it still failed on the primary metric at asr_wer_prefix=1.0. CER was only 0.773, so the branch is not totally dead, yet the new fuller exact-last transition did not stabilize the noisy larger-LM clue either.","timestamp":1773566147830,"segment":0}
{"run":197,"commit":"cf0f36a","metric":1,"metrics":{},"status":"discard","description":"Implemented a new targeted train/infer-match path that only self-conditions the first grouped-prefix window after AUDIO_START: when scheduled sampling fires, replace just the first 12 Q0 inputs with a short free-running grouped decode from the pure text prompt (`semantic_self_condition_use_inference_policy=true`, `semantic_self_condition_match_early_grouped_prefix=true`) on the original matched grouped recipe (`text_source=both`, 2 future-Q0 heads, plain 3-token grouped prefix, EOS weight 2.0, 53-frame cap). This was intended to be much cheaper than suffix-based free-running self-conditioning, but it was still catastrophically slow in practice: only 113 steps / 904 samples in 10 minutes, with asr_wer_prefix stuck at 1.0. So even a targeted early-prefix free-running match is too expensive in its current per-example form.","timestamp":1773567024960,"segment":0}
{"run":198,"commit":"cf0f36a","metric":1,"metrics":{},"status":"discard","description":"Retuned the newly unlocked fuller exact-last grouped family to a shorter early window: `text_source=both`, two future-Q0 heads, `semantic_block_decode_size=4`, `semantic_block_decode_exact_last_token=true`, but only the first 8 semantic tokens grouped before falling back to exact decoding. This restored healthy throughput (~22.2k samples / 10 min), but the primary metric still stayed at asr_wer_prefix=1.0 with middling secondaries. So the new fuller exact-last family does not appear to come alive just by shortening the grouped window from 12 to 8 tokens.","timestamp":1773567794321,"segment":0}
{"run":199,"commit":"cf0f36a","metric":1,"metrics":{},"status":"discard","description":"Extended the newly unlocked fuller exact-last family to a true three-head match: `text_source=both`, `semantic_future_prediction_steps=3`, `semantic_block_decode_size=5`, `semantic_block_decode_exact_last_token=true`, grouped only for the first 10 semantic tokens, with scheduled sampling 0.5, EOS weight 2.0, and the 53-frame cap. This creates exact / future / future / future / exact grouped steps so all three future heads are used during inference, but it still returned asr_wer_prefix=1.0 with only middling CER/in-domain metrics. So the broader exact-last family beyond the old 3-token branch still looks stale.","timestamp":1773568568261,"segment":0}
{"run":200,"commit":"cf0f36a","metric":0,"metrics":{},"status":"crash","description":"Added a heavy-eval-only candidate reranker that compares the current blockwise semantic decode against the same decode with `semantic_block_decode_exact_last_token` toggled, scores both under teacher-forced stage-1 semantic NLL, and chooses the lower-loss candidate. The first test on the original `text_source=both` / two-head / 12-token grouped-prefix recipe crashed with a JAX ConcretizationTypeError during heavy eval because the reranker tried to convert traced candidate lengths to Python ints inside the generation path. This needs a JAX-safe selection path before the heuristic can be judged.","timestamp":1773569013089,"segment":0}
{"run":201,"commit":"cf0f36a","metric":1,"metrics":{},"status":"discard","description":"Fixed the new heavy-eval candidate reranker to stay JAX-safe, then tested it on the original grouped-prefix winner: `text_source=both`, two future-Q0 heads, scheduled sampling 0.5, EOS weight 2.0, 12-token grouped prefix, 53-frame cap, plus `semantic_eval_compare_exact_last_candidate=true` to compare the plain grouped decode against the same decode with `semantic_block_decode_exact_last_token` toggled and pick the lower semantic NLL candidate. It finished cleanly but still returned asr_wer_prefix=1.0 with no in-domain recovery, so simple self-NLL reranking between the two main grouped transition styles does not rescue the noisy grouped branch.","timestamp":1773569830109,"segment":0}
{"run":202,"commit":"cf0f36a","metric":0.6666666865348816,"metrics":{},"status":"discard","description":"Tested the new self-NLL heavy-eval reranker on the 600M exact-last grouped clue: `text_source=both`, two future-Q0 heads, scheduled sampling 0.5, EOS weight 2.0, 12-token exact-last grouped prefix, 53-frame cap, plus `semantic_eval_compare_exact_last_candidate=true` to compare exact-last vs plain grouped decoding and choose the lower semantic NLL candidate. This tied the robust best primary metric at asr_wer_prefix=0.6667 while improving CER sharply to 0.545, which is the strongest character-level result seen in this family so far. It is not a strict primary improvement, but it is the first sign that simple heavy-eval reranking between grouped transition styles may actually stabilize a live branch rather than just regress.","timestamp":1773570603841,"segment":0}
{"run":203,"commit":"cf0f36a","metric":1,"metrics":{},"status":"discard","description":"Exact reran the promising self-NLL heavy-eval reranker on the 600M exact-last grouped branch (`text_source=both`, 2 future-Q0 heads, 12-token exact-last grouped prefix, scheduled sampling 0.5, EOS weight 2.0, 53-frame cap, `semantic_eval_compare_exact_last_candidate=true`). The earlier tie-level result at asr_wer_prefix=0.6667 with CER 0.545 did not reproduce: this rerun fell back to 1.0, though in-domain prefix WER improved sharply to 0.222. So the reranker currently looks like another noisy grouped-side clue rather than a robust stabilizer.","timestamp":1773571371476,"segment":0}
{"run":204,"commit":"cf0f36a","metric":1,"metrics":{},"status":"discard","description":"Tested whether the new self-NLL heavy-eval reranker can stabilize the only live larger-LM grouped clue by combining `llm_repo=QWEN3_1_7B`, `batch_size=4`, `text_source=both`, two future-Q0 heads, the 12-token exact-last grouped prefix, and `semantic_eval_compare_exact_last_candidate=true` to compare exact-last vs plain grouped decoding at eval. This still failed cleanly at asr_wer_prefix=1.0 with only modest CER 0.773, so the reranker does not obviously rescue the noisy larger-LM grouped branch either.","timestamp":1773572145445,"segment":0}
{"run":205,"commit":"cf0f36a","metric":1,"metrics":{},"status":"discard","description":"Extended the heavy-eval self-NLL reranker to compare a third grouped candidate with the late-boundary schedule `3,3,3,1,2`, then tested it on the 600M exact-last grouped clue (`text_source=both`, 2 future-Q0 heads, scheduled sampling 0.5, EOS weight 2.0, 12-token exact-last grouped prefix, 53-frame cap, `semantic_eval_compare_exact_last_candidate=true`, `semantic_eval_compare_schedule_candidate=3,3,3,1,2`). This three-way reranking between plain grouped, exact-last grouped, and the main late-boundary schedule still returned asr_wer_prefix=1.0 with no useful secondary recovery. So broadening the reranker candidate set to include the late-boundary schedule does not stabilize the grouped branch either.","timestamp":1773573908747,"segment":0}
{"run":206,"commit":"cf0f36a","metric":1,"metrics":{},"status":"discard","description":"Retested the broadened heavy-eval self-NLL reranker with the other late-boundary schedule clue by comparing plain grouped, exact-last grouped, and the schedule `3,3,2,1,2` on the 600M exact-last grouped branch (`text_source=both`, 2 future-Q0 heads, scheduled sampling 0.5, EOS weight 2.0, 53-frame cap, `semantic_eval_compare_exact_last_candidate=true`, `semantic_eval_compare_schedule_candidate=3,3,2,1,2`). This failed even harder than the `3,3,3,1,2` variant: asr_wer_prefix stayed at 1.0 and transcript WER/CER exploded. So schedule-augmented self-NLL reranking now looks clearly stale as a family.","timestamp":1773574752441,"segment":0}
{"run":207,"commit":"cf0f36a","metric":1,"metrics":{},"status":"discard","description":"Reweighted the grouped exact-last branch toward Stage 1 by setting `semantic_loss_weight=2.0` and `acoustic_loss_weight=0.5` on top of the 600M matched two-head exact-last grouped recipe (`text_source=both`, future weight 0.5, scheduled sampling 0.5, EOS weight 2.0, 12-token exact-last grouped prefix, 53-frame cap). This did not help the fast-convergence regime: asr_wer_prefix stayed at 1.0 with only middling secondary metrics, so simply emphasizing stage-1 loss is not a win for the exact-last grouped branch either.","timestamp":1773575628863,"segment":0}
{"run":208,"commit":"cf0f36a","metric":1,"metrics":{},"status":"discard","description":"Reweighted the original grouped-prefix winner toward Stage 1 by setting `semantic_loss_weight=2.0` and `acoustic_loss_weight=0.5` on top of the plain 600M matched grouped recipe (`text_source=both`, 2 future-Q0 heads, future weight 0.5, scheduled sampling 0.5, EOS weight 2.0, 12-token grouped prefix, 53-frame cap). This still missed the primary metric at asr_wer_prefix=1.0, though CER recovered to 0.682 and in-domain WER to 0.556. So simple stage-1 loss upweighting does not stabilize the fragile original grouped branch either.","timestamp":1773576392849,"segment":0}
{"run":209,"commit":"cf0f36a","metric":1,"metrics":{},"status":"discard","description":"Tested whether protecting the fragile grouped semantic branch from stage-2 feedback helps by setting `detach_semantic_hidden_for_stage2=true` on the original matched grouped recipe (`text_source=both`, 2 future-Q0 heads, future weight 0.5, scheduled sampling 0.5, EOS weight 2.0, 12-token grouped prefix, 53-frame cap). This still failed cleanly at asr_wer_prefix=1.0 with only middling CER/in-domain metrics, so stage2-gradient detachment does not rescue the grouped-prefix branch either.","timestamp":1773577153553,"segment":0}
{"run":210,"commit":"cf0f36a","metric":1,"metrics":{},"status":"discard","description":"Tested a smaller Stage-2 residual decoder on the fragile original grouped-prefix winner by shrinking the residual transformer to 2 layers / 2 heads / MLP 256 while keeping `text_source=both`, 2 future-Q0 heads, future weight 0.5, scheduled sampling 0.5, EOS weight 2.0, the 12-token grouped prefix, and the 53-frame cap. This still failed at asr_wer_prefix=1.0 with only middling CER/in-domain metrics, so simply shrinking Stage 2 does not rescue the grouped-prefix branch either.","timestamp":1773577905053,"segment":0}
{"run":211,"commit":"cf0f36a","metric":1,"metrics":{},"status":"discard","description":"Extended the heavy-eval self-NLL reranker to compare a third candidate that effectively does fully exact token-by-token decoding by setting `semantic_eval_compare_schedule_candidate=1` on the 600M matched two-head exact-last grouped branch (`text_source=both`, scheduled sampling 0.5, EOS weight 2.0, 12-token exact-last grouped prefix, 53-frame cap, plus `semantic_eval_compare_exact_last_candidate=true`). This let heavy eval choose among exact-last grouped, plain grouped, and a tokenwise exact candidate, but it still returned asr_wer_prefix=1.0 with weak CER/in-domain metrics. So self-NLL reranking against a tokenwise exact fallback also looks stale in this family.","timestamp":1773578999234,"segment":0}
{"run":212,"commit":"cf0f36a","metric":0.8333333134651184,"metrics":{},"status":"discard","description":"Tested a text-prefix LM anchor on the 600M matched two-head exact-last grouped branch by adding `text_loss_weight=0.1` on top of `text_source=both`, future weight 0.5, scheduled sampling 0.5, EOS weight 2.0, the 12-token exact-last grouped prefix, and the 53-frame cap. This recovered some life at asr_wer_prefix=0.8333 with decent CER 0.636, but it still stayed below both the robust 0.6667 baseline and the original grouped-prefix outlier, while throughput dropped sharply to only ~13.4k samples in 10 minutes.","timestamp":1773579783000,"segment":0}
{"run":213,"commit":"cf0f36a","metric":1,"metrics":{},"status":"discard","description":"Retuned the text-prefix LM anchor downward on the 600M matched two-head exact-last grouped branch by setting `text_loss_weight=0.05` instead of `0.1` while keeping `text_source=both`, future weight 0.5, scheduled sampling 0.5, EOS weight 2.0, the 12-token exact-last grouped prefix, and the 53-frame cap. The weak life from `0.1` did not survive: this dropped back to asr_wer_prefix=1.0 with worse CER 0.909 and no in-domain recovery, so a smaller simple text anchor does not stabilize the exact-last grouped branch either.","timestamp":1773580559225,"segment":0}
{"run":214,"commit":"cf0f36a","metric":1,"metrics":{},"status":"discard","description":"Tested whether the weak text-prefix LM anchor stacks with the only live heavy-eval reranker by adding `text_loss_weight=0.1` on top of the 600M matched two-head exact-last grouped branch and `semantic_eval_compare_exact_last_candidate=true` (so heavy eval chooses between exact-last and plain grouped decoding). This combination failed cleanly at asr_wer_prefix=1.0 with uniformly weak secondary metrics, so the simple text anchor does not make the grouped-style self-NLL reranker any more robust.","timestamp":1773581312515,"segment":0}
{"run":215,"commit":"cf0f36a","metric":1,"metrics":{},"status":"discard","description":"Tested whether the noisy fuller LoRA-target clue stacks with the only live grouped-style heavy-eval reranker by adding `lora_targets=[q_proj,k_proj,v_proj,o_proj,gate,up,down]` on top of the 600M matched two-head exact-last grouped branch and `semantic_eval_compare_exact_last_candidate=true` (so heavy eval chooses between exact-last and plain grouped decoding). This failed badly at asr_wer_prefix=1.0 with exploding WER/CER, so fuller LoRA does not make the grouped-style reranker any more robust on the exact-last branch either.","timestamp":1773582159040,"segment":0}
{"run":216,"commit":"cf0f36a","metric":1,"metrics":{},"status":"discard","description":"Extended the targeted early-grouped-prefix self-conditioning path so it can fall back to the usual cheap one-step scheduled-sampling replacement on most examples, then tested a sparse mixed variant on the original matched grouped recipe (`text_source=both`, 2 future-Q0 heads, plain 12-token grouped prefix, `semantic_self_condition_prob=0.5`, `semantic_self_condition_use_inference_policy=true`, `semantic_self_condition_match_early_grouped_prefix=true`, `semantic_self_condition_inference_policy_prob=0.1`, EOS weight 2.0, 53-frame cap). This still failed badly: asr_wer_prefix stayed at 1.0 and throughput remained catastrophic at only 106 steps / 848 samples in 10 minutes. So even the new sparse targeted early-prefix mix does not make per-example free-running grouped self-conditioning viable in this training path.","timestamp":1773583276913,"segment":0}
{"run":217,"commit":"cf0f36a","metric":1,"metrics":{},"status":"discard","description":"Added a cheap targeted early-prefix self-conditioning fallback: when `semantic_self_condition_match_early_grouped_prefix=true` but the expensive inference-matched path is disabled, replace only the first grouped-prefix window after `AUDIO_START` with teacher-forced first-pass Q0 predictions instead of a random suffix. Tested this on the original matched grouped recipe with `semantic_self_condition_prob=0.5`, `semantic_self_condition_use_inference_policy=true`, `semantic_self_condition_match_early_grouped_prefix=true`, `semantic_self_condition_inference_policy_prob=0.0`, plain 12-token grouped decoding, EOS weight 2.0, and the 53-frame cap. Throughput recovered to a normal ~18.5k samples / 10 min, but the primary metric still stayed at asr_wer_prefix=1.0 with weak secondaries, so a cheap targeted early-prefix replacement alone does not rescue the grouped-prefix branch either.","timestamp":1773584075101,"segment":0}
{"run":218,"commit":"cf0f36a","metric":0.8333333134651184,"metrics":{},"status":"discard","description":"Tested the new cheap targeted early-prefix self-conditioning fallback on the 600M matched two-head exact-last grouped branch: when `semantic_self_condition_match_early_grouped_prefix=true` and `semantic_self_condition_inference_policy_prob=0.0`, replace only the first grouped-prefix window after `AUDIO_START` with teacher-forced first-pass Q0 predictions instead of a random suffix. On top of `text_source=both`, future weight 0.5, `semantic_self_condition_prob=0.5`, EOS weight 2.0, the 12-token exact-last grouped prefix, and the 53-frame cap, this recovered some life at asr_wer_prefix=0.8333 with normal throughput (~16.3k samples / 10 min), but it still stayed below the robust 0.6667 baseline and had weak secondary metrics.","timestamp":1773584848507,"segment":0}
{"run":219,"commit":"cf0f36a","metric":1,"metrics":{},"status":"discard","description":"Retuned the new cheap targeted early-prefix self-conditioning objective upward on the 600M matched two-head exact-last grouped branch by applying it on every self-conditioned example (`semantic_self_condition_prob=1.0`, `semantic_self_condition_use_inference_policy=true`, `semantic_self_condition_match_early_grouped_prefix=true`, `semantic_self_condition_inference_policy_prob=0.0`) while keeping `text_source=both`, future weight 0.5, EOS weight 2.0, the 12-token exact-last grouped prefix, and the 53-frame cap. The weak `0.8333` life from the 0.5-probability version did not survive: this fell back to asr_wer_prefix=1.0 with only middling in-domain recovery, so fully saturating the cheap targeted early-prefix replacement overcooks the exact-last branch.","timestamp":1773585654630,"segment":0}
{"run":220,"commit":"cf0f36a","metric":1,"metrics":{},"status":"discard","description":"Tested whether the weak text-prefix LM anchor stacks with the new cheap targeted early-prefix exact-last training objective by combining `text_loss_weight=0.1` with `semantic_self_condition_prob=0.5`, `semantic_self_condition_use_inference_policy=true`, `semantic_self_condition_match_early_grouped_prefix=true`, and `semantic_self_condition_inference_policy_prob=0.0` on the 600M matched two-head exact-last grouped branch (`text_source=both`, future weight 0.5, EOS weight 2.0, 12-token exact-last grouped prefix, 53-frame cap). This failed cleanly at asr_wer_prefix=1.0 with only modest CER 0.818 while throughput fell to ~12.3k samples / 10 min, so the text anchor does not strengthen the new cheap targeted early-prefix exact-last objective either.","timestamp":1773586499058,"segment":0}
