{"run":569,"commit":"9cea09c","metric":1,"metrics":{},"status":"discard","description":"Tested whether the lone `0.6667` recovery on the combined old-environment path depends on immediately fresh old-format caches by rebuilding the entire detached `9cea09c` + `datasets==3.6.0` + `transformers==4.52.4` / `tokenizers 0.21.4` / `huggingface_hub 0.36.2` data surface again from scratch into a brand-new isolated temp data dir and rerunning the canonical aligned normalized 4-head grouped backbone. This also failed cleanly at asr_wer_prefix=1.0 with CER 0.818, in-domain WER 0.778, EOS on both prompts, and the same low-coverage regime (~17.6k samples / 10 min, 2195 steps). So the first `0.6667` recovered run now looks much more like a one-off spike than like a stable consequence of the combined reconstructed environment or of a fresh old-format cache rebuild.","timestamp":1773921945601,"segment":0}
{"run":570,"commit":"9cea09c","metric":0,"metrics":{},"status":"crash","description":"Probed the lower-level stack by overlaying `jax==0.9.2`, `jaxlib==0.9.2`, `jax-cuda12-pjrt==0.9.2`, `jax-cuda12-plugin==0.9.2`, `orbax-checkpoint==0.11.33`, and `optax==0.2.7` on top of the previously best combined reconstruction (`datasets==3.6.0`, `transformers==4.52.4`, `tokenizers 0.21.4`, `huggingface_hub 0.36.2`, detached `9cea09c` worktree, old-format caches). GPU devices came up correctly, but training crashed during the first train step with a new JAX sharding/vmap incompatibility: `ValueError: Mapped away dimension of inputs passed to vmap should be sharded the same. Got inconsistent axis specs: batch vs None`. So a broader newer JAX/CUDA stack is definitely touching benchmark semantics/runtime, but this exact 0.9.2 lower-level stack is not source-compatible with the historical benchmark code path.","timestamp":1773922568603,"segment":0}
{"run":571,"commit":"9cea09c","metric":1,"metrics":{},"status":"discard","description":"Tested a more faithful detached-worktree reconstruction by forcing the historical repo root itself onto `PYTHONPATH` (`/tmp/xax-bench-9cea09c`) while running the combined old-environment path (`datasets==3.6.0`, `transformers==4.52.4`, `tokenizers 0.21.4`, `huggingface_hub 0.36.2`, old-format caches). This avoids the hybrid surface where `examples/ljspeech.py` came from the detached worktree but some `xax/...` imports could still resolve elsewhere. The result stayed at asr_wer_prefix=1.0, so this still does not recover the historical diagnostic quality, but it restored old-regime throughput (~30.1k samples / 10 min, 3758 steps) and short EOS-rich generations (31/40 frames, CER 0.409, in-domain WER 0.556). So the fully local detached worktree path is materially different from the slower hybrid reruns, but still not enough by itself to recover `0.6667`.","timestamp":1773923382160,"segment":0}
{"run":572,"commit":"6cfa0dd","metric":0.6666666865348816,"metrics":{},"status":"keep","description":"Exact reran the newly corrected **fully local** historical benchmark surface: detached `9cea09c` worktree root forced onto `PYTHONPATH` (so `xax/...` imports come from the worktree too, not a hybrid package surface), plus `datasets==3.6.0`, `transformers==4.52.4`, `tokenizers 0.21.4`, `huggingface_hub 0.36.2`, and the old-format caches in `/tmp/xax-data-ds36hf452`. After the first fully local probe (#571) restored old-regime throughput but still landed at `1.0`, this exact rerun recovered **`asr_wer_prefix=0.6667`** again, with ~30.0k samples / 10 min, EOS on both prompts, and the detached-worktree import-surface issue now looking like a real piece of the benchmark-drift story. This makes the fully local detached-worktree + old HF/datasets + old-format cache path the strongest current recovery route; next priority is a third probe and then factor isolation inside that faithful local-old-worktree surface.","timestamp":1773924245754,"segment":0}
{"run":573,"commit":"9cea09c","metric":1,"metrics":{},"status":"discard","description":"Ran the third probe of the now-corrected **fully local** detached-worktree surface (worktree root on `PYTHONPATH` + `datasets==3.6.0` + `transformers==4.52.4` / `tokenizers 0.21.4` / `huggingface_hub 0.36.2` + old-format caches). It held the old-regime throughput regime again (~29.9k samples / 10 min, 3742 steps) and EOS on both prompts, but the primary metric collapsed back to asr_wer_prefix=1.0. So forcing the worktree root onto `PYTHONPATH` clearly fixes a real import-surface / throughput difference, but the recovered `0.6667` quality still looks noisy rather than stabilized after three fully local probes (`1.0 -> 0.6667 -> 1.0`).","timestamp":1773925024603,"segment":0}
{"run":574,"commit":"9cea09c","metric":0.6666666865348816,"metrics":{},"status":"discard","description":"Factor-isolated the fully local detached-worktree recovery by dropping the old `datasets==3.6.0` overlay while **keeping** the historical worktree root on `PYTHONPATH`, the old HF stack (`transformers==4.52.4`, `tokenizers 0.21.4`, `huggingface_hub 0.36.2`), and the old-format caches from `/tmp/xax-data-ds36hf452`. Current `datasets 4.4.2` could read those old caches cleanly, and the canonical probe tied the recovered quality at **`asr_wer_prefix=0.6667`** with old-regime throughput (~30.0k samples / 10 min), strong CER 0.409, and very good in-domain WER 0.222. This is not a primary-metric improvement over the newly recovered local-old-worktree best, so discard, but it is a strong factor-isolation clue: the old-`datasets` overlay itself may not be required once the run is truly local to the detached worktree and uses the old-format caches.","timestamp":1773925808602,"segment":0}
{"run":575,"commit":"9cea09c","metric":0.6666666865348816,"metrics":{},"status":"discard","description":"Exact reran the factor-isolated fully local path with the detached `9cea09c` worktree root on `PYTHONPATH`, the old HF stack (`transformers==4.52.4`, `tokenizers 0.21.4`, `huggingface_hub 0.36.2`), **current** `datasets 4.4.2`, and the old-format caches from `/tmp/xax-data-ds36hf452`. It again hit **`asr_wer_prefix=0.6667`** with old-regime throughput (~30.0k samples / 10 min) and strong CER 0.409, confirming that the old-`datasets` overlay itself is probably not the key requirement once the run is truly local to the detached worktree and still points at the old-format cache surface. Primary metric is unchanged from the new best, so discard, but the live dependency picture has narrowed: import-surface fidelity + old HF stack + old cache provenance now look more important than the old-`datasets` runtime package.","timestamp":1773926566471,"segment":0}
{"run":576,"commit":"9cea09c","metric":1,"metrics":{},"status":"discard","description":"Factor-isolated the fully local detached-worktree path one step further by dropping **all** old package overlays except the worktree root itself on `PYTHONPATH` — i.e. current repaired `transformers/tokenizers/huggingface_hub/datasets` stack, but still the detached `9cea09c` code surface and the old-format caches in `/tmp/xax-data-ds36hf452`. This preserved the old-regime throughput (~29.9k samples / 10 min), so the import-surface/worktree-root fix still matters, but quality fell back to asr_wer_prefix=1.0 with CER 0.682 and in-domain WER 1.0. That narrows the live dependency picture further: the old-`datasets` runtime package is probably not essential, but the older HF tokenizer/model-loading stack still looks much more likely to be part of the recovered `0.6667` surface.","timestamp":1773927310582,"segment":0}
{"run":577,"commit":"9cea09c","metric":1,"metrics":{},"status":"discard","description":"Tested whether the **old-format cache provenance itself** is required by keeping the fully local detached `9cea09c` worktree on `PYTHONPATH` and the old HF stack (`transformers==4.52.4`, `tokenizers 0.21.4`, `huggingface_hub 0.36.2`), but pointing the run at the main current data dir (`/home/ben/Experiments/Data`) so it loaded the **current-format** `tokenized/v4`, `unpadded/d7b4569f5462acf7_e4146c08`, and `train/a009c9c8eee13c4a_e4146c08` caches instead of the rebuilt old-format versions in `/tmp/xax-data-ds36hf452`. This preserved old-regime throughput (~30.3k samples / 10 min, 3784 steps) but quality fell cleanly back to asr_wer_prefix=1.0 with in-domain WER 1.0 and no in-domain EOS. So old-format cache provenance now looks genuinely live, not just incidental bookkeeping around the older HF/import surface.","timestamp":1773928292714,"segment":0}
{"run":578,"commit":"9cea09c","metric":1,"metrics":{},"status":"discard","description":"Isolated the tokenized-stage provenance by keeping the fully local detached `9cea09c` worktree on `PYTHONPATH` plus the old HF stack (`transformers==4.52.4`, `tokenizers 0.21.4`, `huggingface_hub 0.36.2`), then seeding a brand-new temp data dir with only the **current-format** `tokenized/v4` copied from `/home/ben/Experiments/Data` and regenerating `unpadded`/`train` there under current `datasets 4.4.2`. The rebuilt dataset surface matched the current-style stats (`max_seq_len/max_audio_frames=155/121`, filtered train size `12315`) and the canonical probe stayed at asr_wer_prefix=1.0 with old-regime throughput (~30.2k samples / 10 min). So the tokenized-stage cache provenance is already enough to destroy the recovered `0.6667`: old-format tokenization/layout looks like a real live dependency, not just downstream train/unpadded serialization.","timestamp":1773929126905,"segment":0}
{"run":579,"commit":"9cea09c","metric":1,"metrics":{},"status":"discard","description":"Isolated the next cache stage by keeping the fully local detached `9cea09c` worktree on `PYTHONPATH` plus the old HF stack, then seeding a fresh temp data dir with only the **old-format tokenized/v4** from `/tmp/xax-data-ds36hf452` and regenerating `unpadded`/`train` there under current `datasets 4.4.2`. The rebuilt dataset surface kept the old-style shape stats (`max_seq_len/max_audio_frames=156/122`, filtered train size `12365`), but the benchmark still collapsed to asr_wer_prefix=1.0 with no OOD EOS and a 122-frame cap. So old tokenization/layout alone is **not sufficient**: the surviving `0.6667` path appears to depend on the downstream old-format `train`/`unpadded` cache content too, not just on reproducing the old tokenized-stage statistics.","timestamp":1773929932350,"segment":0}
{"run":580,"commit":"9cea09c","metric":0.8333333134651184,"metrics":{},"status":"discard","description":"Tested whether the surviving old-cache signal might collapse all the way down to the **old train cache content alone** by keeping the fully local detached `9cea09c` worktree on `PYTHONPATH` plus the old HF stack, but providing only `/tmp/xax-data-ds36hf452/.../train/a009c9c8eee13c4a_e4146c08` in a fresh temp data dir (no tokenized or unpadded caches present). This first probe improved over the `1.0` cache-rebuild failures and preserved old-regime throughput (~29.9k samples / 10 min), landing at asr_wer_prefix=0.8333 with CER 0.591, but it did not yet tie the recovered `0.6667`. So the old train cache alone looks meaningfully alive, but after a single probe it was still only a partial recovery clue.","timestamp":1773931536060,"segment":0}
{"run":581,"commit":"4d1b28d","metric":0.3333333432674408,"metrics":{},"status":"keep","description":"Exact reran the newly isolated **old-train-cache-only** surface: fully local detached `9cea09c` worktree root on `PYTHONPATH`, older HF stack (`transformers==4.52.4`, `tokenizers 0.21.4`, `huggingface_hub 0.36.2`), and a fresh temp data dir containing only the old `train/a009c9c8eee13c4a_e4146c08` cache copied from `/tmp/xax-data-ds36hf452` — with no tokenized or unpadded caches present at all. After the first probe on this surface improved only to `0.8333`, this exact rerun jumped to **`asr_wer_prefix=0.3333`** with CER 0.318, old-regime throughput (~29.9k samples / 10 min), EOS on both prompts, and only mild gt-ASR drift (`asr_wer_gt=0.0476`). This is the strongest post-drift recovery so far on a much simpler reconstructed surface, and it sharply narrows the live comparability hypothesis: the old train-cache payload itself may be the main missing non-repo artifact, while upstream tokenized/unpadded cache presence is not obviously required at runtime.","timestamp":1773931629856,"segment":0}
{"run":582,"commit":"9cea09c","metric":1,"metrics":{},"status":"discard","description":"Ran the third probe of the simplified **old-train-cache-only** surface (fully local detached `9cea09c` worktree on `PYTHONPATH`, old HF stack, only the old `train/a009c9c8eee13c4a_e4146c08` cache present). It collapsed back to asr_wer_prefix=1.0 with old-regime throughput (~29.8k samples / 10 min), so this route is still noisy after three probes (`0.8333 -> 0.3333 -> 1.0`). Even so, it remains the strongest simplification clue so far, because the single best post-drift recovery now came from this train-only cache surface rather than from the broader old tokenized/unpadded environment.","timestamp":1773932376674,"segment":0}
{"run":583,"commit":"9cea09c","metric":1,"metrics":{},"status":"discard","description":"Factor-isolated the simplified old-train-cache route by dropping the older HF overlay while keeping the detached `9cea09c` worktree root on `PYTHONPATH` and reusing the same temp data dir that contains only the old `train/a009c9c8eee13c4a_e4146c08` cache. This fell cleanly back to asr_wer_prefix=1.0 with old-regime throughput (~29.8k samples / 10 min) and badly degraded gt-ASR sanity (`asr_wer_gt=0.364`). So even on the train-cache-only surface, the older HF tokenizer/model-loading stack still looks like a real part of the recovered regime rather than a removable detail.","timestamp":1773933131507,"segment":0}
{"run":584,"commit":"9cea09c","metric":0.8333333134651184,"metrics":{},"status":"discard","description":"Tested whether the corrected **local worktree import surface** is still needed once only the old train cache is present by rerunning the old-train-cache-only setup with the old HF overlay but **without** forcing `/tmp/xax-bench-9cea09c` onto `PYTHONPATH` (hybrid import surface again). This landed at asr_wer_prefix=0.8333, but throughput collapsed back to the old hybrid low-coverage regime (~18.0k samples / 10 min, 2245 steps). So the local-worktree import fix still matters materially even on the train-cache-only surface: it seems tied not just to throughput, but likely to quality too, and the fully local + old HF + old train cache path remains the better-controlled route.","timestamp":1773933953431,"segment":0}
{"run":585,"commit":"9cea09c","metric":1,"metrics":{},"status":"discard","description":"Ran a fourth probe of the best-controlled **old-train-cache-only** surface (fully local detached `9cea09c` worktree on `PYTHONPATH` + old HF stack + only the old `train/a009c9c8eee13c4a_e4146c08` cache present). It again collapsed to asr_wer_prefix=1.0 with old-regime throughput (~29.8k samples / 10 min). So the simplified train-only surface is now clearly highly bimodal across four probes (`0.8333 -> 0.3333 -> 1.0 -> 1.0`): still the strongest current recovery clue, but not yet a stabilized benchmark surface.","timestamp":1773934804132,"segment":0}
{"run":586,"commit":"4d1b28d","metric":0,"metrics":{},"status":"crash","description":"Tried to transfer the simplified old-train-cache clue back onto the **current repo code surface** by running from `/home/ben/Github/xax` with the old HF stack and the temp data dir that contains only the old `train/a009c9c8eee13c4a_e4146c08` cache. This crashed before training because current HEAD hashes the train/unpadded datasets differently (`train/84e979518684a895_e4146c08`, `unpadded/13775093ac577a11_e4146c08`) and therefore refused to reuse the old-train-only cache, immediately requiring a `--launcher dataset` rebuild. So the train-cache-only simplification currently transfers only to the detached `9cea09c` code surface; current HEAD’s dataset-function hash drift blocks a clean apples-to-apples direct test without fabricating additional cache aliases or rebuilding under the newer code.","timestamp":1773935287452,"segment":0}
{"run":587,"commit":"4d1b28d","metric":1,"metrics":{},"status":"discard","description":"Forced a direct transfer test of the simplified train-cache clue onto the **current repo code surface** by aliasing the old train payload into the current HEAD’s expected cache path (`train/84e979518684a895_e4146c08`) and rerunning from `/home/ben/Github/xax` with the old HF stack. This avoided the earlier hash-miss crash, but the result still fell cleanly to asr_wer_prefix=1.0 with the slow current-code throughput regime (~17.6k samples / 10 min, 2205 steps). So the old train payload alone is **not** enough to rescue the benchmark under current repo code: the detached `9cea09c` code/import surface still looks like a required part of the strongest recovered path.","timestamp":1773936093791,"segment":0}
{"run":588,"commit":"4d1b28d","metric":1,"metrics":{},"status":"discard","description":"Strengthened the current-code transfer test by aliasing the **full old cache surface** into the current HEAD’s expected cache names (`tokenized/v4`, `unpadded/13775093ac577a11_e4146c08`, `train/84e979518684a895_e4146c08`) and rerunning from `/home/ben/Github/xax` with the old HF stack. This still failed cleanly at asr_wer_prefix=1.0 with the slow current-code regime (~17.7k samples / 10 min, 2210 steps). So even when current HEAD is force-fed the old tokenized/unpadded/train payloads under the names it expects, the detached `9cea09c` code/import surface still appears necessary for the strongest recovered behavior.","timestamp":1773936909633,"segment":0}
{"run":589,"commit":"4d1b28d","metric":0.6666666865348816,"metrics":{},"status":"discard","description":"Separated the current top-level benchmark script from the deeper package surface by running the **current** `/home/ben/Github/xax/examples/ljspeech.py` while forcing `xax/...` imports to come from the detached `9cea09c` worktree (`PYTHONPATH=/tmp/xax-bench-9cea09c:/home/ben/Github/xax:/tmp/xax-overlay-hf452`) and aliasing the full old cache surface into the current HEAD cache names. This recovered **`asr_wer_prefix=0.6667`** with old-regime throughput (~29.7k samples / 10 min), showing that the current top-level example script is *not* the main drift culprit. The stronger drift signal seems to live in the deeper `xax/...` package surface imported by the newer repo state. Primary metric is still worse than the new 0.3333 best, so discard, but this is a major factor-isolation clue.","timestamp":1773937691045,"segment":0}
{"run":590,"commit":"4d1b28d","metric":0.8333333134651184,"metrics":{},"status":"discard","description":"Probed the complementary mixed surface: **current** top-level `examples/ljspeech.py`, but `xax/...` imports forced to come from the detached `9cea09c` worktree, with the old HF stack and only the old train cache aliased into the current HEAD cache name. This restored the fast ~29.8k-samples/10min regime and improved to asr_wer_prefix=0.8333, but did not match the stronger `0.3333` spike seen when both the script and package surface came from the detached worktree. So the deeper `xax/...` package surface looks like the main drift culprit, but the old top-level example script may still contribute on the narrow train-cache-only path.","timestamp":1773938448900,"segment":0}
{"run":591,"commit":"4d1b28d","metric":1,"metrics":{},"status":"discard","description":"Tested whether a broad but still benchmark-focused subset of old `xax/...` files is enough to explain the recovered behavior by running the current top-level script with a temp current-package copy patched back to the old worktree versions of `xax/task/logger.py`, `xax/task/mixins/{compile,supervised,data_loader}.py`, `xax/arch/{attention,llm}.py`, `xax/nn/lora.py`, and `xax/arch/speech/{asr,codec}.py`, while force-feeding the aliased full old cache surface and the old HF stack. This restored old-regime throughput (~29.6k samples / 10 min) but still failed cleanly at asr_wer_prefix=1.0. So the remaining quality-critical drift is not confined to that obvious benchmark-file cluster; the full old package recovery is still depending on additional `xax/...` state beyond these swapped modules.","timestamp":1773940856448,"segment":0}
{"run":592,"commit":"4d1b28d","metric":0.5,"metrics":{},"status":"discard","description":"Exact-reran the previously single-hit mixed surface from #589: **current** `/home/ben/Github/xax/examples/ljspeech.py`, but `xax/...` imports forced to come from the detached `9cea09c` worktree via `PYTHONPATH=/tmp/xax-bench-9cea09c:/home/ben/Github/xax:/tmp/xax-overlay-hf452`, with the old HF stack and the full old cache surface aliased into current HEAD’s expected cache names. Instead of collapsing, this second probe improved to **asr_wer_prefix=0.5** with old-regime throughput (~29.9k samples / 10 min), EOS on both prompts, and perfect gt-ASR sanity. So the current-script + old-package + old-full-cache path is definitely still alive and now looks less like a pure 0.6667 fluke, but it remains noisy and still does not beat the current 0.3333 best.","timestamp":1773942024554,"segment":0}
