{"run":433,"commit":"0963536","metric":1,"metrics":{},"status":"discard","description":"Ran a third benchmark of the new sampled exact-last branch after its surprising jump to the new best 0.1667 result (`text_source=both_weighted_sampled`, normalized/raw weights 3/1, `text_source_weighted_sampled_passes=2`, four future-Q0 heads, scheduled sampling 0.5, EOS weight 2.0, 12-token grouped prefix, `semantic_block_decode_exact_last_token=true`). It collapsed straight back to asr_wer_prefix=1.0 while keeping EOS on both prompts, short generations (~29/37 frames), and full throughput (~30.0k samples / 10 min). So the new best sampled exact-last result is real history but still highly unstable; this branch has joined the same sharp-spike category as the earlier mixed-text and sampled text-anchor wins rather than becoming a stable new mainline.","timestamp":1773806313012,"segment":0}
{"run":434,"commit":"0963536","metric":0.8333333134651184,"metrics":{},"status":"discard","description":"Tested whether the old sampled text-anchor spike stacks with the newly revived sampled exact-last transition by adding `text_loss_weight=0.1` on top of the aligned 2-pass sampled 3:1 exact-last recipe (`text_source=both_weighted_sampled`, normalized/raw weights 3/1, `text_source_weighted_sampled_passes=2`, four future-Q0 heads, scheduled sampling 0.5, EOS weight 2.0, 12-token grouped prefix, `semantic_block_decode_exact_last_token=true`). It recovered only weak life at asr_wer_prefix=0.8333 while throughput collapsed to just ~16.4k samples / 10 min and the in-domain prompt remained poor. So the two sampled-side spikes do not stack cleanly; exact-last plus `text_loss_weight=0.1` is worse than the plain exact-last sampled branch and does not stabilize the new 0.1667 outlier.","timestamp":1773807175195,"segment":0}
{"run":435,"commit":"0963536","metric":0.6666666865348816,"metrics":{},"status":"discard","description":"Tested whether the reproducible fuller-LoRA fallback can stabilize the new sampled exact-last branch by adding `lora_targets=[q_proj,k_proj,v_proj,o_proj,gate,up,down]` on top of the aligned 2-pass sampled 3:1 exact-last recipe (`text_source=both_weighted_sampled`, normalized/raw weights 3/1, `text_source_weighted_sampled_passes=2`, four future-Q0 heads, scheduled sampling 0.5, EOS weight 2.0, 12-token grouped prefix, `semantic_block_decode_exact_last_token=true`). It recovered only the old 0.6667 level with CER 0.500 while throughput fell to ~20.3k samples / 10 min. So fuller LoRA does not stabilize or preserve the new 0.1667 sampled exact-last spike; like the text anchor, it only drags the branch back toward slower tie-level behavior.","timestamp":1773808025059,"segment":0}
{"run":436,"commit":"a22d113","metric":0.3333333432674408,"metrics":{},"status":"keep","description":"Tested whether the new sampled exact-last spike is tightly pinned to the old 12-token grouped window by shortening the grouped prefix to `semantic_block_decode_max_grouped_tokens=9` on the aligned 2-pass sampled 3:1 exact-last recipe (`text_source=both_weighted_sampled`, normalized/raw weights 3/1, `text_source_weighted_sampled_passes=2`, four future-Q0 heads, scheduled sampling 0.5, EOS weight 2.0, `semantic_block_decode_exact_last_token=true`). This stayed strongly alive at asr_wer_prefix=0.3333 with CER 0.318, EOS on both prompts, and short generations (~28/37 frames), though throughput dropped to ~21.5k samples / 10 min and in-domain WER collapsed to 1.0. So unlike the older fixed-duplicate exact-last clue, the sampled exact-last branch may have some real grouped-window breadth rather than being pinned to exactly 12 tokens, even if it remains very noisy.","timestamp":1773808805393,"segment":0}
{"run":437,"commit":"a22d113","metric":1,"metrics":{},"status":"discard","description":"Exact reran the shortened-window sampled exact-last branch after its first 0.3333 keep (`text_source=both_weighted_sampled`, normalized/raw weights 3/1, `text_source_weighted_sampled_passes=2`, four future-Q0 heads, scheduled sampling 0.5, EOS weight 2.0, `semantic_block_decode_exact_last_token=true`, `semantic_block_decode_max_grouped_tokens=9`). It collapsed straight back to asr_wer_prefix=1.0 while keeping EOS on both prompts, near-full throughput (~29.7k samples / 10 min), and even very strong in-domain WER 0.111. So the sampled exact-last 9-token branch is another noisy side spike rather than a stable shorter-window successor to the 12-token recipe.","timestamp":1773809568121,"segment":0}
{"run":438,"commit":"2d37414","metric":0.5,"metrics":{},"status":"keep","description":"Tested whether the sampled exact-last spike is partly a train/infer future-width mismatch by shrinking the aligned 2-pass sampled 3:1 exact-last recipe from four future-Q0 heads down to `semantic_future_prediction_steps=2` while keeping `text_source=both_weighted_sampled`, normalized/raw weights 3/1, `text_source_weighted_sampled_passes=2`, future weight 0.5, scheduled sampling 0.5, EOS weight 2.0, the p95-style cap, and the 12-token grouped prefix with `semantic_block_decode_exact_last_token=true`. This recovered solid life at asr_wer_prefix=0.5 with full throughput (~31.0k samples / 10 min), EOS on both prompts, short generations (~36/33 frames), perfect gt-ASR sanity, and much stronger in-domain WER 0.333. So the sampled exact-last branch is not obviously tied to the old four-head backbone: reducing future depth toward the actual exact-last speculative width may be a real stabilizer clue rather than just a weaker regression.","timestamp":1773810732541,"segment":0}
{"run":439,"commit":"2d37414","metric":1,"metrics":{},"status":"discard","description":"Exact reran the new 2-head sampled exact-last transfer after its first 0.5 keep (`text_source=both_weighted_sampled`, normalized/raw weights 3/1, `text_source_weighted_sampled_passes=2`, `semantic_future_prediction_steps=2`, future weight 0.5, scheduled sampling 0.5, EOS weight 2.0, p95-style cap, 12-token grouped prefix, `semantic_block_decode_exact_last_token=true`). It collapsed straight back to asr_wer_prefix=1.0, lost OOD EOS entirely, stretched the OOD utterance back to the 53-frame cap, and degraded to CER 0.955 despite keeping near-full throughput (~30.9k samples / 10 min). So reducing future depth toward the exact-last speculative width is a real first-run clue, but it is not yet a reproducible stabilizer for the sampled exact-last branch.","timestamp":1773811481544,"segment":0}
{"run":440,"commit":"2d37414","metric":0.8333333134651184,"metrics":{},"status":"discard","description":"Tested a more directly train/infer-matched sampled exact-last transfer by keeping the live 2-pass sampled 3:1 text recipe but using `semantic_future_prediction_steps=2` together with the broader `semantic_block_decode_size=4` exact/future/future/exact decoder (`semantic_block_decode_exact_last_token=true`, 12-token grouped prefix, future weight 0.5, scheduled sampling 0.5, EOS weight 2.0, p95-style cap). This recovered only weak life at asr_wer_prefix=0.8333 with CER 0.636, perfect gt-ASR sanity, EOS on both prompts, and very strong in-domain WER 0.111, but throughput dropped to only ~21.7k samples / 10 min. So the sampled branch does not obviously want the broader exact/future/future/exact transition either; if reduced future depth matters here, it looks more like a narrow 3-token exact-last clue than a broad block_size=4 revival.","timestamp":1773812254083,"segment":0}
{"run":441,"commit":"2d37414","metric":0.6666666865348816,"metrics":{},"status":"discard","description":"Tested whether the new 2-head sampled exact-last clue prefers the shorter grouped window that once reached 0.3333 on the four-head branch by combining `semantic_future_prediction_steps=2` with `semantic_block_decode_max_grouped_tokens=9` on the aligned 2-pass sampled 3:1 exact-last recipe (`text_source=both_weighted_sampled`, normalized/raw weights 3/1, `text_source_weighted_sampled_passes=2`, future weight 0.5, scheduled sampling 0.5, EOS weight 2.0, p95-style cap, `semantic_block_decode_exact_last_token=true`). This landed only at asr_wer_prefix=0.6667 with CER 0.636, EOS on both prompts, short generations (~28/37 frames), and only ~22.5k samples / 10 min. So the weaker 2-head transfer does not inherit the old 9-token sampled exact-last spike; if reduced future depth is useful at all, it currently seems more compatible with the original 12-token window than with the shorter-window branch.","timestamp":1773813015214,"segment":0}
{"run":442,"commit":"2d37414","metric":1,"metrics":{},"status":"discard","description":"Tested the maximally train/infer-matched sampled exact-last variant by shrinking the aligned 2-pass sampled 3:1 branch all the way to `semantic_future_prediction_steps=1` while keeping `text_source=both_weighted_sampled`, normalized/raw weights 3/1, `text_source_weighted_sampled_passes=2`, future weight 0.5, scheduled sampling 0.5, EOS weight 2.0, the p95-style cap, and the 12-token grouped prefix with `semantic_block_decode_exact_last_token=true`. It failed cleanly at asr_wer_prefix=1.0 despite EOS on both prompts and short generations (~35/42 frames), while throughput collapsed to only ~17.7k samples / 10 min and gt-ASR sanity weakened to 0.158. So fully collapsing future depth to the single speculative exact-last slot is too aggressive; the sampled branch does not want a one-head exact-last training target.","timestamp":1773813827829,"segment":0}
{"run":443,"commit":"2d37414","metric":1,"metrics":{},"status":"discard","description":"Mapped the only remaining untested interior future-depth point on the sampled exact-last branch by setting `semantic_future_prediction_steps=3` on the aligned 2-pass sampled 3:1 exact-last recipe (`text_source=both_weighted_sampled`, normalized/raw weights 3/1, `text_source_weighted_sampled_passes=2`, future weight 0.5, scheduled sampling 0.5, EOS weight 2.0, p95-style cap, 12-token grouped prefix, `semantic_block_decode_exact_last_token=true`). This failed cleanly at asr_wer_prefix=1.0 despite EOS on both prompts, but throughput collapsed to only ~17.1k samples / 10 min and the OOD utterance lengthened back out to 49 frames. So the sampled exact-last family does not seem to hide a smoother optimum at three future heads either; after probing 1, 2, 3, and 4 heads, the future-depth axis now looks mostly like a noisy side path rather than a clean stabilizer family.","timestamp":1773814687924,"segment":0}
{"run":444,"commit":"2d37414","metric":0.8333333134651184,"metrics":{},"status":"discard","description":"Mapped a shorter grouped-window neighbor on the main sampled exact-last branch by reducing the aligned 2-pass sampled 3:1 exact-last recipe from a 12-token grouped prefix down to `semantic_block_decode_max_grouped_tokens=6` while keeping four future-Q0 heads, future weight 0.5, scheduled sampling 0.5, EOS weight 2.0, the p95-style cap, and `semantic_block_decode_exact_last_token=true`. This recovered only weak life at asr_wer_prefix=0.8333 with CER 0.591, EOS on both prompts, and only ~21.7k samples / 10 min. So the sampled exact-last family does not obviously broaden toward a much shorter 6-token grouped prefix either; the better life still appears centered around the 9–12 token region, even though that region remains highly unstable.","timestamp":1773815470244,"segment":0}
{"run":445,"commit":"2d37414","metric":1,"metrics":{},"status":"discard","description":"Mapped a longer grouped-window neighbor on the main sampled exact-last branch by extending the aligned 2-pass sampled 3:1 exact-last recipe from a 12-token grouped prefix to `semantic_block_decode_max_grouped_tokens=15` while keeping four future-Q0 heads, future weight 0.5, scheduled sampling 0.5, EOS weight 2.0, the p95-style cap, and `semantic_block_decode_exact_last_token=true`. It failed cleanly at asr_wer_prefix=1.0 with CER 0.727 despite EOS on both prompts, near-full throughput (~21.8k samples / 10 min), and short generations (~40/37 frames). So the sampled exact-last branch does not broaden cleanly to a longer grouped prefix either; taken together with the weaker 6-token result, the remaining life really does look concentrated in the narrow 9–12 token region.","timestamp":1773816258740,"segment":0}
{"run":446,"commit":"2d37414","metric":1,"metrics":{},"status":"discard","description":"Tested whether the sampled exact-last branch wants a softer exit from grouped decoding via an exact-last partial-final-block schedule by replacing the plain 12-token cutoff with `semantic_block_decode_schedule=3,3,3,2` on the aligned 2-pass sampled 3:1 recipe (`text_source=both_weighted_sampled`, normalized/raw weights 3/1, `text_source_weighted_sampled_passes=2`, four future-Q0 heads, future weight 0.5, scheduled sampling 0.5, EOS weight 2.0, p95-style cap, `semantic_block_decode_exact_last_token=true`). It failed cleanly at asr_wer_prefix=1.0 despite EOS on both prompts, short generations (~30/38 frames), and only ~21.7k samples / 10 min. So the sampled exact-last family does not seem to want the old 11-token partial-final-block smoothing clue either; its remaining life still looks tied more to the hard 9–12 token cutoffs than to a softer exact-last taper.","timestamp":1773817119919,"segment":0}
{"run":447,"commit":"2d37414","metric":1,"metrics":{},"status":"discard","description":"Tested whether the sampled exact-last branch wants the older late-boundary bridge+taper clue when combined with exact-last grouped steps by running the aligned 2-pass sampled 3:1 recipe with `semantic_block_decode_schedule=3,3,3,1,2` plus `semantic_block_decode_exact_last_token=true` (`text_source=both_weighted_sampled`, normalized/raw weights 3/1, `text_source_weighted_sampled_passes=2`, four future-Q0 heads, future weight 0.5, scheduled sampling 0.5, EOS weight 2.0, p95-style cap). It failed cleanly at asr_wer_prefix=1.0 despite EOS on both prompts, short generations (~33/40 frames), and only ~21.8k samples / 10 min. So the older late-boundary schedule clue does not rescue the sampled exact-last family either; sampled schedule smoothing now looks stale both with and without exact-last.","timestamp":1773817886259,"segment":0}
{"run":448,"commit":"2d37414","metric":1,"metrics":{},"status":"discard","description":"Tested whether a cheap train/infer match can stabilize the sampled exact-last branch by enabling the future-slots-only early-prefix inference-policy replacement path on the aligned 2-pass sampled 3:1 exact-last recipe (`text_source=both_weighted_sampled`, normalized/raw weights 3/1, `text_source_weighted_sampled_passes=2`, four future-Q0 heads, future weight 0.5, scheduled sampling 0.5, `semantic_self_condition_use_inference_policy=true`, `semantic_self_condition_match_early_grouped_prefix=true`, `semantic_self_condition_match_grouped_future_slots_only=true`, `semantic_self_condition_inference_policy_prob=0.0`, EOS weight 2.0, p95-style cap, 12-token grouped prefix, `semantic_block_decode_exact_last_token=true`). It failed cleanly at asr_wer_prefix=1.0, lost OOD EOS, stretched back to the 53-frame cap, and cut coverage to only ~17.6k samples / 10 min. So this cheap early-prefix train/infer-match path does not rescue the sampled exact-last family either; on this branch it behaves like another stale slowdown rather than a stabilizer.","timestamp":1773818676890,"segment":0}
{"run":449,"commit":"2d37414","metric":1,"metrics":{},"status":"discard","description":"Tested whether the only mildly promising 2-head sampled exact-last side clue becomes more stable when paired with the cheap future-slots-only train/infer-match path (`semantic_self_condition_use_inference_policy=true`, `semantic_self_condition_match_early_grouped_prefix=true`, `semantic_self_condition_match_grouped_future_slots_only=true`, `semantic_self_condition_inference_policy_prob=0.0`) on the aligned 2-pass sampled 3:1 exact-last recipe with `semantic_future_prediction_steps=2`, future weight 0.5, scheduled sampling 0.5, EOS weight 2.0, the p95-style cap, and a 12-token grouped prefix. It failed cleanly at asr_wer_prefix=1.0 with worse gt-ASR sanity 0.333, only ~18.3k samples / 10 min, and an OOD utterance stretched back out to 49 frames despite EOS. So even the more width-matched 2-head sampled exact-last branch does not benefit from this cheap early-prefix train/infer-match path; that family now looks stale on sampled exact-last regardless of future depth.","timestamp":1773819490934,"segment":0}
{"run":450,"commit":"7ec79ef","metric":0.6666666865348816,"metrics":{},"status":"keep","description":"Tested whether the live 2-pass sampled 3:1 branch wants future-depth matched to the plain grouped transition even without exact-last by shrinking from four future-Q0 heads down to `semantic_future_prediction_steps=2` on the aligned sampled grouped-prefix recipe (`text_source=both_weighted_sampled`, normalized/raw weights 3/1, `text_source_weighted_sampled_passes=2`, future weight 0.5, scheduled sampling 0.5, EOS weight 2.0, p95-style cap, `semantic_block_decode_size=3`, 12-token grouped prefix, no exact-last). This recovered solid life at asr_wer_prefix=0.6667 with strong CER 0.545, perfect gt-ASR sanity, EOS on both prompts, very strong in-domain WER 0.111, and full throughput (~31.4k samples / 10 min). So the sampled branch is not tied to the old four-head grouped backbone either: a cleaner two-head grouped transfer is now a real live alternative, and it looks less pathological on secondary metrics than the noisier sampled exact-last spike.","timestamp":1773820300697,"segment":0}
{"run":451,"commit":"7ec79ef","metric":0.6666666865348816,"metrics":{},"status":"discard","description":"Exact reran the new 2-head sampled grouped-transfer branch after its first 0.6667 keep (`text_source=both_weighted_sampled`, normalized/raw weights 3/1, `text_source_weighted_sampled_passes=2`, `semantic_future_prediction_steps=2`, future weight 0.5, scheduled sampling 0.5, EOS weight 2.0, p95-style cap, `semantic_block_decode_size=3`, 12-token grouped prefix, no exact-last). It held the same asr_wer_prefix=0.6667 with EOS on both prompts, perfect gt-ASR sanity, full throughput (~31.4k samples / 10 min), and even stronger in-domain WER 0.0, though CER softened to 0.727. So unlike the noisier sampled exact-last family, the plain sampled grouped branch with future depth matched to the actual 3-token grouped transition now looks like a genuinely reproducible 0.6667-side backbone rather than a one-off spike.","timestamp":1773821074461,"segment":0}
{"run":452,"commit":"7ec79ef","metric":1,"metrics":{},"status":"discard","description":"Mapped the grouped-window breadth of the new reproducible 2-head sampled grouped backbone by shortening its grouped prefix from 12 tokens to `semantic_block_decode_max_grouped_tokens=9` while keeping `text_source=both_weighted_sampled`, normalized/raw weights 3/1, `text_source_weighted_sampled_passes=2`, `semantic_future_prediction_steps=2`, future weight 0.5, scheduled sampling 0.5, EOS weight 2.0, the p95-style cap, and plain `semantic_block_decode_size=3` grouped decoding. This collapsed cleanly to asr_wer_prefix=1.0 with exploded WER/CER despite EOS on both prompts, so the cleaner 2-head sampled grouped branch does not inherit the old 9-token sampled exact-last spike either; like the weighted grouped family, it currently still looks tightly centered on the original 12-token grouped prefix.","timestamp":1773821857373,"segment":0}
{"run":453,"commit":"c1a29b2","metric":0.6666666865348816,"metrics":{},"status":"keep","description":"Tested whether the new reproducible 2-head sampled grouped backbone broadens toward a shorter grouped prefix by reducing `semantic_block_decode_max_grouped_tokens` from 12 down to 6 while keeping `text_source=both_weighted_sampled`, normalized/raw weights 3/1, `text_source_weighted_sampled_passes=2`, `semantic_future_prediction_steps=2`, future weight 0.5, scheduled sampling 0.5, EOS weight 2.0, the p95-style cap, and plain `semantic_block_decode_size=3` grouped decoding. Unlike the 9-token collapse, this stayed strongly alive at asr_wer_prefix=0.6667 with better CER 0.500, perfect gt-ASR sanity, EOS on both prompts, and solid throughput (~23.8k samples / 10 min), though in-domain WER softened to 0.444. So the cleaner 2-head sampled grouped branch is not pinned strictly to 12 grouped tokens after all: it now looks like a broader 6–12 token family, with 9 unexpectedly acting like a bad local geometry rather than a simple monotonic width trend.","timestamp":1773822732741,"segment":0}
{"run":454,"commit":"c1a29b2","metric":1,"metrics":{},"status":"discard","description":"Exact reran the new 6-token variant of the 2-head sampled grouped backbone after its first 0.6667 keep (`text_source=both_weighted_sampled`, normalized/raw weights 3/1, `text_source_weighted_sampled_passes=2`, `semantic_future_prediction_steps=2`, future weight 0.5, scheduled sampling 0.5, EOS weight 2.0, the p95-style cap, `semantic_block_decode_size=3`, `semantic_block_decode_max_grouped_tokens=6`, no exact-last). It collapsed straight back to asr_wer_prefix=1.0 despite EOS on both prompts, full throughput (~31.4k samples / 10 min), and short generations (~31/36 frames). So the apparent 6-token broadening was another first-run spike; for now the genuinely reproducible sampled grouped 2-head branch still looks centered on the original 12-token grouped prefix rather than on shorter windows.","timestamp":1773823492048,"segment":0}
