{"run":265,"commit":"cf0f36a","metric":1,"metrics":{},"status":"discard","description":"Transferred the new direct Stage-2 text-prefix context path onto the strongest reproducible four-head future-Q0 baseline by setting `residual_text_context_weight=0.5` while keeping `semantic_future_prediction_steps=4`, future weight 0.5, `semantic_self_condition_prob=0.5`, EOS weight 2.0, and the 53-frame cap. This also failed cleanly at asr_wer_prefix=1.0 with worse CER 0.909, so giving the residual decoder a cheap interpolated text-prefix hidden-state anchor does not look like a useful fast-convergence pivot on either the grouped-prefix branch or the robust four-head baseline.","timestamp":1773624892276,"segment":0}
{"run":266,"commit":"cf0f36a","metric":0,"metrics":{},"status":"crash","description":"Added a new Stage-1 audio progress/remaining-length context path that injects a learned utterance-progress embedding into audio-token positions during training and inference, then tried it first on the reproducible four-head future-Q0 baseline with `semantic_audio_position_context_weight=0.25`. The first run crashed early in heavy eval: the new context path was being added in float32 while cached LLM states were bfloat16, so incremental generation hit a `lax.dynamic_update_slice` dtype mismatch inside attention cache writes. Needs a dtype-safe retry before judging the idea.","timestamp":1773626032262,"segment":0}
{"run":267,"commit":"cf0f36a","metric":1,"metrics":{},"status":"discard","description":"Retried the new Stage-1 audio progress/remaining-length context path after fixing the bfloat16 cache mismatch, testing it first on the reproducible four-head future-Q0 baseline with `semantic_audio_position_context_weight=0.25` plus the usual future weight 0.5, `semantic_self_condition_prob=0.5`, EOS weight 2.0, and the 53-frame cap. This ran cleanly but still finished at asr_wer_prefix=1.0 with only middling CER 0.773 and slightly reduced throughput (~21.7k samples / 10 min), so explicit utterance-progress conditioning is not an immediate robust-baseline win in this first form.","timestamp":1773626793616,"segment":0}
{"run":268,"commit":"cf0f36a","metric":1,"metrics":{},"status":"discard","description":"Transferred the new Stage-1 audio progress/remaining-length context path onto the original grouped-prefix winner by adding `semantic_audio_position_context_weight=0.25` while keeping `text_source=both`, two future-Q0 heads at weight 0.5, `semantic_self_condition_prob=0.5`, grouped decoding for the first 12 semantic tokens, EOS weight 2.0, and the 53-frame cap. This also failed cleanly at asr_wer_prefix=1.0; it only recovered a secondary in-domain WER clue (0.444) with mediocre CER 0.818, so explicit utterance-progress conditioning now looks like another non-robust side signal rather than a live new mainline on either the robust four-head baseline or the grouped-prefix branch.","timestamp":1773627558386,"segment":0}
{"run":269,"commit":"cf0f36a","metric":1,"metrics":{},"status":"discard","description":"Tested whether mixed normalized+raw text conditioning helps the reproducible four-head future-Q0 baseline by itself: `text_source=both`, `semantic_future_prediction_steps=4`, future weight 0.5, `semantic_self_condition_prob=0.5`, EOS weight 2.0, and the 53-frame cap. It failed cleanly at asr_wer_prefix=1.0 with CER 0.773 and worse in-domain WER 0.889, so the mixed-text clue still looks specific to the fragile grouped-prefix regime rather than a generic upgrade to the robust four-head baseline.","timestamp":1773628834795,"segment":0}
{"run":270,"commit":"cf0f36a","metric":1,"metrics":{},"status":"discard","description":"Added a cheap Stage-2 train/infer-match path that conditions the residual decoder on the Q0 stream actually fed into Stage 1 during training (after any scheduled-sampling replacements) instead of always using ground-truth Q0 codes, then tested it first on the reproducible four-head future-Q0 baseline with `stage2_match_stage1_input_q0=true` plus future weight 0.5, `semantic_self_condition_prob=0.5`, EOS weight 2.0, and the 53-frame cap. This ran at normal speed but still failed cleanly at asr_wer_prefix=1.0 with worse CER 0.818 and in-domain WER 1.0, so simply matching Stage 2 to the Stage-1 input Q0 stream is not an immediate robust-baseline win.","timestamp":1773629973336,"segment":0}
{"run":271,"commit":"cf0f36a","metric":0.8333333134651184,"metrics":{},"status":"discard","description":"Transferred the new cheap Stage-2 train/infer-match path onto the original grouped-prefix winner by conditioning the residual decoder on the Q0 stream actually fed into Stage 1 during training (`stage2_match_stage1_input_q0=true`) instead of always using ground-truth Q0 codes, while keeping `text_source=both`, two future-Q0 heads at weight 0.5, `semantic_self_condition_prob=0.5`, grouped decoding for the first 12 semantic tokens, EOS weight 2.0, and the 53-frame cap. This recovered only weak life at asr_wer_prefix=0.8333 with CER 0.773 and strong in-domain WER 0.222, still well below the robust 0.6667 baseline and far below the fragile 0.5 outlier, so stage2 Q0 train/infer matching is at most another grouped-prefix side clue rather than a new keeper.","timestamp":1773630728101,"segment":0}
{"run":272,"commit":"cf0f36a","metric":1,"metrics":{},"status":"discard","description":"Transferred the new Stage-2 Q0 train/infer-match path onto the reintroduced exact-last grouped transition by adding `stage2_match_stage1_input_q0=true` on top of `text_source=both`, two future-Q0 heads at weight 0.5, `semantic_self_condition_prob=0.5`, `semantic_block_decode_exact_last_token=true`, grouped decoding for the first 12 semantic tokens, EOS weight 2.0, and the 53-frame cap. This failed badly at asr_wer_prefix=1.0 with exploded CER 2.73, so matching Stage 2 to the Stage-1 input Q0 stream does not stabilize the exact-last grouped branch either.","timestamp":1773631500794,"segment":0}
{"run":273,"commit":"cf0f36a","metric":0.6666666865348816,"metrics":{},"status":"discard","description":"Added a new cheap hierarchical Stage-1 auxiliary: keep the main semantic decoder autoregressive, but also train the lightweight non-AR text-to-frame Q0 branch as a parallel auxiliary (`semantic_non_ar_aux_loss_weight=0.25`) using the already-computed causal prefix hidden states, then tested it first on the reproducible four-head future-Q0 baseline with future weight 0.5, `semantic_self_condition_prob=0.5`, EOS weight 2.0, and the 53-frame cap. This tied the robust best at asr_wer_prefix=0.6667 on its first run, but with worse CER 0.864 and worse in-domain WER 1.11, so it is only a weak new structural clue rather than a keeper yet.","timestamp":1773632767672,"segment":0}
{"run":274,"commit":"cf0f36a","metric":0.8333333134651184,"metrics":{},"status":"discard","description":"Transferred the new parallel non-AR Stage-1 auxiliary onto the original grouped-prefix winner by adding `semantic_non_ar_aux_loss_weight=0.25` while keeping `text_source=both`, two future-Q0 heads at weight 0.5, `semantic_self_condition_prob=0.5`, grouped decoding for the first 12 semantic tokens, EOS weight 2.0, and the 53-frame cap. This recovered only weak life at asr_wer_prefix=0.8333 with CER 0.818 and middling in-domain WER 0.667, so the auxiliary text-to-frame branch is not an immediate grouped-prefix rescue at this first weight.","timestamp":1773633521566,"segment":0}
{"run":275,"commit":"cf0f36a","metric":1,"metrics":{},"status":"discard","description":"Retuned the new parallel non-AR Stage-1 auxiliary downward on the reproducible four-head future-Q0 baseline by lowering `semantic_non_ar_aux_loss_weight` from 0.25 to 0.1 while keeping future weight 0.5, `semantic_self_condition_prob=0.5`, EOS weight 2.0, and the 53-frame cap. This collapsed badly to asr_wer_prefix=1.0 with exploded CER 2.73, so the first tie-level result at weight 0.25 already looks noisy rather than like a robust new auxiliary direction.","timestamp":1773634279241,"segment":0}
{"run":276,"commit":"cf0f36a","metric":1,"metrics":{},"status":"discard","description":"Exact reran the most promising new parallel non-AR Stage-1 auxiliary setup on the reproducible four-head future-Q0 baseline (`semantic_non_ar_aux_loss_weight=0.25` with future weight 0.5, `semantic_self_condition_prob=0.5`, EOS weight 2.0, and the 53-frame cap). The first run had tied the robust best at 0.6667, but this exact rerun collapsed all the way to asr_wer_prefix=1.0 with exploded CER 2.73 despite very strong throughput (~29.7k samples / 10 min), so the auxiliary non-AR branch now looks like another noisy side clue rather than a robust new structural win.","timestamp":1773635038409,"segment":0}
{"run":277,"commit":"cf0f36a","metric":1,"metrics":{},"status":"discard","description":"Added a new grouped-generation length-aware EOS heuristic by ramping a positive EOS logit bias over the final quarter of the allowed semantic-length budget (`semantic_eos_length_bias=2.0`), then tested it on the original grouped-prefix winner with `text_source=both`, two future-Q0 heads at weight 0.5, `semantic_self_condition_prob=0.5`, grouped decoding for the first 12 semantic tokens, EOS weight 2.0, and the 53-frame cap. This still failed at asr_wer_prefix=1.0 with no EOS emitted, so a simple length-aware EOS bias does not rescue the grouped-prefix branch in this first form.","timestamp":1773636069737,"segment":0}
{"run":278,"commit":"cf0f36a","metric":0,"metrics":{},"status":"crash","description":"Tried a new structural future-head redesign: replaced the plain linear future-Q0 heads with offset-conditioned adapter heads that reused the shared audio token output head, aiming to make multi-token prediction converge faster from the main Stage-1 logits. The first run on the reproducible four-head baseline crashed in the future-head auxiliary path with `ValueError: attempt to get argmax of an empty sequence`, caused by the shared-head Q0 logit slice resolving incorrectly under this first implementation. Needs a safer future-head parameterization before the idea can be judged.","timestamp":1773636644985,"segment":0}
{"run":279,"commit":"cf0f36a","metric":1,"metrics":{},"status":"discard","description":"Fixed the new future-head redesign into a safer low-rank nonlinear MLP head (embed -> bottleneck 128 -> CODEBOOK_SIZE) and tested it on the reproducible four-head future-Q0 baseline in place of the original plain linear future heads, while keeping future weight 0.5, `semantic_self_condition_prob=0.5`, EOS weight 2.0, and the 53-frame cap. This ran cleanly but failed at asr_wer_prefix=1.0 with CER 0.864, so the cheaper nonlinear future-head parameterization does not improve the robust baseline in its first form.","timestamp":1773637454107,"segment":0}
{"run":280,"commit":"cf0f36a","metric":0.6666666865348816,"metrics":{},"status":"discard","description":"Transferred the new low-rank nonlinear future-Q0 head redesign (embed -> bottleneck 128 -> CODEBOOK_SIZE per future step) onto the original grouped-prefix winner while keeping `text_source=both`, two future-Q0 heads at weight 0.5, `semantic_self_condition_prob=0.5`, grouped decoding for the first 12 semantic tokens, EOS weight 2.0, and the 53-frame cap. This recovered real life at asr_wer_prefix=0.6667 with better-than-usual grouped-branch CER 0.727, but it only ties the robust baseline rather than beating it, so it is a promising new grouped-prefix-side structural clue rather than a keeper yet.","timestamp":1773638206728,"segment":0}
{"run":281,"commit":"cf0f36a","metric":1,"metrics":{},"status":"discard","description":"Exact reran the new low-rank nonlinear future-Q0 head redesign on the original grouped-prefix winner (`text_source=both`, two future-Q0 heads at weight 0.5, `semantic_self_condition_prob=0.5`, grouped decoding for the first 12 semantic tokens, EOS weight 2.0, and the 53-frame cap). The first run had shown tie-level life at 0.6667, but this exact rerun collapsed to asr_wer_prefix=1.0 with exploded CER 4.32 and degraded gt-ASR sanity, so the cheap nonlinear future-head family already looks like another noisy grouped-side clue rather than a robust improvement.","timestamp":1773638958260,"segment":0}
{"run":282,"commit":"cf0f36a","metric":0,"metrics":{},"status":"crash","description":"Added a new text-prefix semantic-length-delta predictor auxiliary (`semantic_length_delta_predictor_loss_weight=0.1`) that learns how many frames to add or subtract from the current heuristic cap, then tried it first on the reproducible four-head future-Q0 baseline. The first implementation crashed in heavy eval with a JAX `ConcretizationTypeError` because inference tried to turn the predicted length delta into a Python int while traced. Needs a JAX-safe runtime cap before the idea can be judged.","timestamp":1773639489186,"segment":0}
{"run":283,"commit":"cf0f36a","metric":1,"metrics":{},"status":"discard","description":"Retried the new text-prefix semantic-length-delta predictor auxiliary after fixing the JAX tracing issue, testing it first on the reproducible four-head future-Q0 baseline with `semantic_length_delta_predictor_loss_weight=0.1` plus future weight 0.5, `semantic_self_condition_prob=0.5`, EOS weight 2.0, and the p95-style 53-frame heuristic cap. The learned cap did change behavior (heavy eval shortened to ~40/38 frames), but the primary metric still stayed at asr_wer_prefix=1.0 with worse CER 0.955, so the first learned length-adjustment path is not an immediate robust-baseline win.","timestamp":1773640318755,"segment":0}
{"run":284,"commit":"cf0f36a","metric":0.8333333134651184,"metrics":{},"status":"discard","description":"Transferred the new text-prefix semantic-length-delta predictor auxiliary onto the original grouped-prefix winner with `semantic_length_delta_predictor_loss_weight=0.1` while keeping `text_source=both`, two future-Q0 heads at weight 0.5, `semantic_self_condition_prob=0.5`, grouped decoding for the first 12 semantic tokens, EOS weight 2.0, and the baseline 53-frame heuristic. The learned cap again shortened generation (to ~41/38 frames) and recovered only weak life at asr_wer_prefix=0.8333 while badly damaging in-domain behavior (`asr_wer_in_domain=3.56`), so the first learned length-adjustment path is only another noisy grouped-prefix side clue rather than a strong new cap policy.","timestamp":1773641086293,"segment":0}
{"run":285,"commit":"cf0f36a","metric":1,"metrics":{},"status":"discard","description":"Added a new local grouped-step lookahead for the reintroduced exact-last transition: on each 3-token grouped step (`semantic_block_decode_exact_last_token=true`), compare the speculative middle future-token against the exact next-token candidate using a short 2-token exact-model lookahead, then keep whichever local path scores better (`semantic_block_decode_compare_exact_middle_candidate=true`). Tested it on the original grouped-prefix winner (`text_source=both`, two future-Q0 heads at weight 0.5, `semantic_self_condition_prob=0.5`, first 12 semantic tokens grouped, EOS weight 2.0, 53-frame cap). It ran cleanly but collapsed to asr_wer_prefix=1.0 with CER 0.864 and both prompts hitting the full 53-frame cap, so this richer local overlap/beam-style transition is not the corrective grouped-prefix fix in its first form.","timestamp":1773642710415,"segment":0}
{"run":286,"commit":"cf0f36a","metric":0.8333333134651184,"metrics":{},"status":"discard","description":"Added a new text-anchored future-head redesign: each Stage-1 future-Q0 head now also receives a learned text-prefix logit bias derived from the prompt hidden states, scaled by `semantic_future_prediction_text_context_weight=0.5`, so speculative grouped tokens can stay more tied to the requested text. Tested it first on the original grouped-prefix winner (`text_source=both`, two future-Q0 heads at weight 0.5, `semantic_self_condition_prob=0.5`, first 12 semantic tokens grouped, EOS weight 2.0, 53-frame cap). It recovered only weak life at asr_wer_prefix=0.8333, though CER improved sharply to 0.545, so the first text-anchored future-head variant is only a noisy grouped-prefix clue rather than a new keeper.","timestamp":1773643895260,"segment":0}
{"run":287,"commit":"cf0f36a","metric":1,"metrics":{},"status":"discard","description":"Retuned the new text-anchored future-head redesign down to `semantic_future_prediction_text_context_weight=0.25` on the original grouped-prefix winner (`text_source=both`, two future-Q0 heads at weight 0.5, `semantic_self_condition_prob=0.5`, first 12 semantic tokens grouped, EOS weight 2.0, 53-frame cap). The first run at 0.5 had shown only weak life with strong CER, but this lighter version collapsed back to asr_wer_prefix=1.0 with worse CER 0.909, so the direct text-prefix bias on speculative future heads already looks like another noisy grouped-side clue rather than a stable grouped-token anchor.","timestamp":1773644661894,"segment":0}
{"run":288,"commit":"cf0f36a","metric":1,"metrics":{},"status":"discard","description":"Added a new inference-only recent-token repetition penalty for custom blockwise semantic generation (`semantic_recent_repeat_penalty=2.0`, window 8) to discourage grouped-prefix branches from repeating the same Q0 codes until the 53-frame cap. Tested it on the original grouped-prefix winner (`text_source=both`, two future-Q0 heads at weight 0.5, `semantic_self_condition_prob=0.5`, first 12 semantic tokens grouped, EOS weight 2.0, 53-frame cap). It ran cleanly and even improved 10-minute throughput to ~24.3k samples, but the primary metric still stayed at asr_wer_prefix=1.0 with both prompts hitting the full frame cap, so a simple recent-token anti-loop penalty does not rescue the grouped-prefix branch in this first form.","timestamp":1773645746715,"segment":0}
{"run":289,"commit":"cf0f36a","metric":0,"metrics":{},"status":"crash","description":"Added a new future-head distillation objective (`semantic_future_prediction_distill_weight=0.25`) that tries to teach each future-Q0 head to match the exact next-token Q0 distribution at the corresponding future position under the current Stage-1 hidden states, then tested it on the original grouped-prefix winner. The first implementation crashed at train time because the teacher-logit slice into the audio extra-head was wrong for Qwen's padded vocab/tokenizer alignment, producing an empty `(…, 0)` Q0-logit slice. This exposed a likely tokenizer-vs-model-vocab alignment bug around the added audio tokens, which is now the more promising structural issue to investigate directly.","timestamp":1773646546141,"segment":0}
{"run":290,"commit":"cf0f36a","metric":0,"metrics":{},"status":"crash","description":"Pivoted to a likely tokenizer/model-vocab alignment bug: Qwen's config vocab is padded above the live tokenizer length, so newly added audio tokens were landing partly inside the frozen base-vocab range instead of entirely in the dedicated extra-token path. After padding the tokenizer up to the model vocab before adding audio tokens and invalidating the dataset hash, the first baseline run crashed only because the new `train`/`unpadded` caches had not been regenerated yet. Regenerated the normalized-text dataset cache next; the alignment fix itself still needs a clean benchmark run.","timestamp":1773646901406,"segment":0}
{"run":291,"commit":"1d3afab","metric":0.8333333134651184,"metrics":{},"status":"keep","description":"Fixed a likely tokenizer/model-vocab alignment bug: Qwen's config vocab is padded above the live tokenizer length, so newly added audio tokens were previously landing partly inside the frozen base-vocab range instead of entirely in the dedicated extra-token path. The fix pads the tokenizer up to the model vocab before adding text/audio/Q0 tokens and invalidates cached train/unpadded datasets with the new ids. On the reproducible four-head future-Q0 baseline (future steps 4, weight 0.5, `semantic_self_condition_prob=0.5`, EOS weight 2.0, 53-frame cap), this improved the primary metric from the current 1.0 baseline to asr_wer_prefix=0.8333 and, more interestingly, finally produced EOS on both prompts with much shorter generations (~41/39 frames). It is still below the historical 0.6667 keeper, but this looks like a meaningful structural fix worth keeping and exploring.","timestamp":1773647677094,"segment":0}
{"run":292,"commit":"1d3afab","metric":0.8333333134651184,"metrics":{},"status":"discard","description":"Transferred the tokenizer/model-vocab alignment fix onto the original grouped-prefix winner (`text_source=both`, two future-Q0 heads at weight 0.5, `semantic_self_condition_prob=0.5`, grouped decoding for the first 12 semantic tokens, EOS weight 2.0, p95-style cap). The fix again induced EOS on both prompts and shortened generation sharply to ~36/41 frames while improving in-domain WER to 0.556, but the primary metric only tied at asr_wer_prefix=0.8333 and gt-ASR sanity weakened to 0.118, so this first grouped transfer is a promising alignment-side clue rather than a new keeper.","timestamp":1773648478501,"segment":0}
{"run":293,"commit":"1d3afab","metric":1,"metrics":{},"status":"discard","description":"Followed up the tokenizer/model-vocab alignment fix on the four-head future-Q0 baseline by forcing later EOS eligibility with `semantic_gen_min_new_tokens=48`, aiming to keep the new EOS-emitting regime from terminating too early (~41/39 frames). This removed the apparent benefit entirely: EOS disappeared again on both prompts, generation went back to the full 53-frame cap, and the primary metric regressed to asr_wer_prefix=1.0. So the alignment-fix gain does not survive a blunt minimum-length floor at 48 frames.","timestamp":1773649245509,"segment":0}
