{"run":497,"commit":"f927e34","metric":1,"metrics":{},"status":"discard","description":"After prebuilding the required datasets, tested whether the new aligned normalized 2-head exact-last side clue improves when combined with the older fixed-duplicate weighted 3:1 text mix by running `text_source=both_weighted`, normalized/raw repeats 3/1, `semantic_future_prediction_steps=2`, `semantic_block_decode_size=3`, `semantic_block_decode_exact_last_token=true`, future weight 0.5, scheduled sampling 0.5, EOS weight 2.0, the p95-style cap, and a 12-token grouped prefix. This failed cleanly at asr_wer_prefix=1.0 with CER 0.818 despite EOS on both prompts, perfect gt-ASR sanity, and healthy coverage (~30.6k samples / 10 min). So the new aligned normalized 2-head exact-last clue does not broaden across the older fixed-duplicate weighted 3:1 text family either; this stack looks stale.","timestamp":1773857756764,"segment":0}
{"run":498,"commit":"9cea09c","metric":0.5,"metrics":{},"status":"keep","description":"Found a new live aligned mixed-text width-matched grouped branch by running `text_source=both` on the tokenizer-aligned backbone with `semantic_future_prediction_steps=2`, plain `semantic_block_decode_size=3`, future weight 0.5, scheduled sampling 0.5, EOS weight 2.0, the p95-style cap, and a 12-token grouped prefix. This reached asr_wer_prefix=0.5 with CER 0.545, in-domain WER 0.333, perfect gt-ASR sanity, EOS on both prompts, short generations (~29/36 frames), and full throughput (~31.4k samples / 10 min). So the old mixed-text grouped clue is not confined to the aligned 4-head backbone after all: on the current code surface, plain grouped width matching to 2 future heads is a real new side branch for `text_source=both`, and it is at least as strong as the new normalized 2-head exact-last clue while keeping the simpler plain grouped transition.","timestamp":1773858945228,"segment":0}
{"run":499,"commit":"9cea09c","metric":0.8333333134651184,"metrics":{},"status":"discard","description":"Exact reran the new aligned mixed-text width-matched grouped branch (`text_source=both`, `semantic_future_prediction_steps=2`, plain `semantic_block_decode_size=3`, future weight 0.5, scheduled sampling 0.5, EOS weight 2.0, p95-style cap, 12-token grouped prefix) after its first 0.5 keep. The rerun softened back to asr_wer_prefix=0.8333 with CER 0.727, in-domain WER 0.444, EOS on both prompts, perfect gt-ASR sanity, and full throughput (~31.3k samples / 10 min). So this new aligned mixed-text 2-head grouped branch is real enough to reach the 0.5 class once, but it is still noisy rather than an immediately reproducible successor.","timestamp":1773859697957,"segment":0}
{"run":500,"commit":"9cea09c","metric":0.8333333134651184,"metrics":{},"status":"discard","description":"Tested whether the new aligned mixed-text width-matched grouped clue gets stronger when paired with the narrower exact-last transition by running `text_source=both`, `semantic_future_prediction_steps=2`, `semantic_block_decode_size=3`, `semantic_block_decode_exact_last_token=true`, future weight 0.5, scheduled sampling 0.5, EOS weight 2.0, the p95-style cap, and a 12-token grouped prefix. This recovered only weak life at asr_wer_prefix=0.8333 with CER 0.545, in-domain WER 0.222, EOS on both prompts, and slightly degraded gt-ASR sanity 0.182 at healthy coverage (~31.1k samples / 10 min). So on the new aligned mixed-text 2-head family, exact-last looks stale rather than a stabilizer; the first 0.5 signal belongs to the plain grouped transition, not to the narrower exact/future/exact step.","timestamp":1773860464183,"segment":0}
{"run":501,"commit":"9cea09c","metric":1,"metrics":{},"status":"discard","description":"Mapped the grouped-window breadth of the new aligned mixed-text width-matched 2-head grouped branch by shortening its grouped prefix from 12 tokens to `semantic_block_decode_max_grouped_tokens=6` while keeping `text_source=both`, `semantic_future_prediction_steps=2`, plain `semantic_block_decode_size=3`, future weight 0.5, scheduled sampling 0.5, EOS weight 2.0, and the p95-style cap. This failed cleanly at asr_wer_prefix=1.0 with CER 0.500 despite EOS on both prompts, decent in-domain WER 0.444, and full throughput (~31.3k samples / 10 min). So the new aligned mixed-text 2-head grouped clue does not broaden toward the shorter 6-token side path either; for now it looks pinned to the original 12-token grouped prefix.","timestamp":1773861292692,"segment":0}
{"run":502,"commit":"9cea09c","metric":0.6666666865348816,"metrics":{},"status":"discard","description":"Mapped another grouped-window neighbor of the new aligned mixed-text width-matched 2-head grouped branch by shortening its grouped prefix from 12 tokens to `semantic_block_decode_max_grouped_tokens=9` while keeping `text_source=both`, `semantic_future_prediction_steps=2`, plain `semantic_block_decode_size=3`, future weight 0.5, scheduled sampling 0.5, EOS weight 2.0, and the p95-style cap. This recovered tie-level life at asr_wer_prefix=0.6667 with CER 0.636, EOS on both prompts, perfect gt-ASR sanity, and full throughput (~31.2k samples / 10 min), but in-domain WER softened badly to 0.778 and it still regressed clearly relative to the 12-token branch's first 0.5 result. So the new aligned mixed-text 2-head grouped family may have some 9-token side life, but it does not yet look like a better or cleaner center than the original 12-token cutoff.","timestamp":1773862122713,"segment":0}
{"run":503,"commit":"9cea09c","metric":1,"metrics":{},"status":"discard","description":"Exact reran the 9-token neighbor of the new aligned mixed-text width-matched 2-head grouped branch (`text_source=both`, `semantic_future_prediction_steps=2`, plain `semantic_block_decode_size=3`, `semantic_block_decode_max_grouped_tokens=9`, future weight 0.5, scheduled sampling 0.5, EOS weight 2.0, p95-style cap) after its first tie-level 0.6667 result. It collapsed straight back to asr_wer_prefix=1.0 with CER 0.818 and the same weak in-domain WER 0.778, despite EOS on both prompts, perfect gt-ASR sanity, and full throughput (~31.4k samples / 10 min). So the 9-token side life was another one-off spike; the new aligned mixed-text 2-head grouped family still looks centered much more narrowly on the original 12-token grouped prefix.","timestamp":1773862873281,"segment":0}
{"run":504,"commit":"9cea09c","metric":0.6666666865348816,"metrics":{},"status":"discard","description":"Mapped the longer grouped-window neighbor of the new aligned mixed-text width-matched 2-head grouped branch by extending its grouped prefix from 12 tokens to `semantic_block_decode_max_grouped_tokens=15` while keeping `text_source=both`, `semantic_future_prediction_steps=2`, plain `semantic_block_decode_size=3`, future weight 0.5, scheduled sampling 0.5, EOS weight 2.0, and the p95-style cap. This recovered tie-level life at asr_wer_prefix=0.6667 with CER 0.727, in-domain WER 0.333, EOS on both prompts, perfect gt-ASR sanity, and full throughput (~31.4k samples / 10 min), but it still regressed relative to the original 12-token branch's first 0.5 result. So the new aligned mixed-text 2-head grouped family has some longer-window side life too, but 15 tokens does not yet look like a better center than the original 12-token cutoff.","timestamp":1773863633321,"segment":0}
{"run":505,"commit":"9cea09c","metric":1,"metrics":{},"status":"discard","description":"Exact reran the 15-token neighbor of the new aligned mixed-text width-matched 2-head grouped branch (`text_source=both`, `semantic_future_prediction_steps=2`, plain `semantic_block_decode_size=3`, `semantic_block_decode_max_grouped_tokens=15`, future weight 0.5, scheduled sampling 0.5, EOS weight 2.0, p95-style cap) after its first tie-level 0.6667 result. It collapsed straight back to asr_wer_prefix=1.0 with CER 0.818, in-domain WER 0.667, and gt-ASR sanity 0.25, despite EOS on both prompts and full throughput (~31.3k samples / 10 min). So the 15-token side life was another one-off spike; the new aligned mixed-text 2-head grouped family still looks centered narrowly on the original 12-token grouped prefix.","timestamp":1773864382575,"segment":0}
{"run":506,"commit":"9cea09c","metric":1,"metrics":{},"status":"discard","description":"Tested whether the new aligned mixed-text width-matched 2-head grouped branch benefits from a cheap early-prefix train/infer match by enabling the future-slots-only inference-policy replacement path (`semantic_self_condition_use_inference_policy=true`, `semantic_self_condition_match_early_grouped_prefix=true`, `semantic_self_condition_match_grouped_future_slots_only=true`, `semantic_self_condition_inference_policy_prob=0.0`) on top of `text_source=both`, `semantic_future_prediction_steps=2`, plain `semantic_block_decode_size=3`, future weight 0.5, scheduled sampling 0.5, EOS weight 2.0, the p95-style cap, and a 12-token grouped prefix. This failed cleanly at asr_wer_prefix=1.0 with CER 0.682 despite perfect in-domain WER 0.0, perfect gt-ASR sanity, EOS on both prompts, and still decent coverage (~29.6k samples / 10 min). So even on the new width-matched mixed-text 2-head branch, cheap future-slots-only early-prefix matching still looks like an in-domain-only side effect rather than a real OOD stabilizer.","timestamp":1773865285235,"segment":0}
{"run":507,"commit":"9cea09c","metric":0.8333333134651184,"metrics":{},"status":"discard","description":"Tested whether the old late-boundary schedule clue revives on the new aligned mixed-text width-matched 2-head grouped branch by replacing the plain 12-token grouped cutoff with `semantic_block_decode_schedule=3,3,3,1,2` while keeping `text_source=both`, `semantic_future_prediction_steps=2`, future weight 0.5, scheduled sampling 0.5, EOS weight 2.0, and the p95-style cap. This recovered only weak life at asr_wer_prefix=0.8333 with CER 0.636, EOS on both prompts, but gt-ASR sanity softened to 0.25 and in-domain WER stayed weak at 0.667 despite full throughput (~31.3k samples / 10 min). So the old late-boundary schedule family does not look like a stabilizer on the new aligned mixed-text 2-head grouped branch either; the first 0.5 signal still belongs to the plain 12-token cutoff.","timestamp":1773866092238,"segment":0}
{"run":508,"commit":"9cea09c","metric":1,"metrics":{},"status":"discard","description":"Tested whether the older broader exact/future/future/exact clue revives on the new aligned mixed-text width-matched 2-head family by combining `text_source=both` with the matched future-slots-only early-prefix replacement objective (`semantic_self_condition_use_inference_policy=true`, `semantic_self_condition_match_early_grouped_prefix=true`, `semantic_self_condition_match_grouped_future_slots_only=true`, `semantic_self_condition_inference_policy_prob=0.0`) and the broader `semantic_block_decode_size=4` exact/future/future/exact decoder (`semantic_block_decode_exact_last_token=true`), while keeping `semantic_future_prediction_steps=2`, future weight 0.5, scheduled sampling 0.5, EOS weight 2.0, the p95-style cap, and a 12-token grouped prefix. This failed cleanly at asr_wer_prefix=1.0 with CER 0.727 despite perfect in-domain WER 0.0, perfect gt-ASR sanity, EOS on both prompts, and still decent coverage (~27.8k samples / 10 min). So the broader matched-training exact-last family does not revive on the new aligned mixed-text 2-head branch either; this remains another in-domain-only side effect rather than a real OOD stabilizer.","timestamp":1773866852416,"segment":0}
{"run":509,"commit":"9cea09c","metric":1,"metrics":{},"status":"discard","description":"Tested whether the new aligned mixed-text width-matched 2-head clue survives without any grouped-prefix decoding by running `text_source=both`, `semantic_future_prediction_steps=2`, future weight 0.5, scheduled sampling 0.5, EOS weight 2.0, and the p95-style cap under plain exact token-by-token decoding. This failed cleanly at asr_wer_prefix=1.0 with CER 0.773, in-domain WER 1.0, gt-ASR sanity 0.267, EOS on both prompts, and much lower coverage (~23.8k samples / 10 min). So on the current aligned code surface, the new mixed-text 2-head signal is still genuinely grouped-prefix-specific; width matching plus mixed text alone does not rescue the exact-decoding path.","timestamp":1773867623434,"segment":0}
{"run":510,"commit":"9cea09c","metric":1,"metrics":{},"status":"discard","description":"Tested whether the old fragile text-prefix anchor helps the new aligned mixed-text width-matched 2-head grouped branch by adding `text_loss_weight=0.1` on top of `text_source=both`, `semantic_future_prediction_steps=2`, plain `semantic_block_decode_size=3`, future weight 0.5, scheduled sampling 0.5, EOS weight 2.0, the p95-style cap, and a 12-token grouped prefix. This failed cleanly at asr_wer_prefix=1.0 with CER 1.091 despite very strong in-domain WER 0.111, perfect gt-ASR sanity, and EOS on both prompts, while coverage collapsed to only ~23.6k samples / 10 min and the OOD utterance stretched longer to 48 frames. So the old text-loss spike does not rescue the new aligned mixed-text 2-head grouped branch either; here too it behaves like an in-domain-only side effect plus throughput cost, not a real OOD stabilizer.","timestamp":1773868383692,"segment":0}
{"run":511,"commit":"9cea09c","metric":1,"metrics":{},"status":"discard","description":"Tested whether the new aligned mixed-text grouped clue prefers an interior future-depth between the new width-matched 2-head branch and the older aligned 4-head mixed-text grouped winner by raising `semantic_future_prediction_steps` from 2 to 3 while keeping `text_source=both`, plain `semantic_block_decode_size=3`, future weight 0.5, scheduled sampling 0.5, EOS weight 2.0, the p95-style cap, and a 12-token grouped prefix. This failed cleanly at asr_wer_prefix=1.0 with CER 0.682, in-domain WER 0.667, EOS on both prompts, gt-ASR sanity 0.04, and full throughput (~30.4k samples / 10 min). So on the aligned mixed-text grouped family, the newer 2-head side clue does not broaden toward an interior 3-head compromise; the future-depth axis here still looks narrow rather than like a smooth bridge between the 2-head and old 4-head branches.","timestamp":1773869313321,"segment":0}
{"run":512,"commit":"9cea09c","metric":0.8333333134651184,"metrics":{},"status":"discard","description":"Tested whether the older fixed-duplicate weighted 3:1 grouped family prefers an interior future-depth between its noisier 4-head life and the weak 2-head transfer by running `text_source=both_weighted` with normalized/raw repeats 3/1, `semantic_future_prediction_steps=3`, plain `semantic_block_decode_size=3`, future weight 0.5, scheduled sampling 0.5, EOS weight 2.0, the p95-style cap, and a 12-token grouped prefix. This recovered only weak life at asr_wer_prefix=0.8333 with CER 0.773, EOS on both prompts, gt-ASR sanity 0.043, and full throughput (~30.7k samples / 10 min). So the fixed-duplicate weighted 3:1 branch does not seem to want a smoother 3-head compromise either; beyond the original four-head grouped path, extra future-depth remaps still look weak rather than like a clean bridge.","timestamp":1773870071520,"segment":0}
{"run":513,"commit":"9cea09c","metric":0.6666666865348816,"metrics":{},"status":"discard","description":"Tested whether the aligned normalized grouped backbone prefers an interior future-depth between the reproducible 2-head transfer and the original aligned 4-head mainline by running `text_source=normalized`, `semantic_future_prediction_steps=3`, plain `semantic_block_decode_size=3`, future weight 0.5, scheduled sampling 0.5, EOS weight 2.0, the p95-style cap, and a 12-token grouped prefix. This recovered tie-level life at asr_wer_prefix=0.6667 with CER 0.636, in-domain WER 0.333, EOS on both prompts, and full throughput (~30.6k samples / 10 min), but gt-ASR sanity softened to 0.308 and it did not improve on the stronger reproducible normalized grouped backbones. So the normalized grouped family does have some interior 3-head life, but for now it looks like another tie-level side path rather than a clearer successor.","timestamp":1773870875251,"segment":0}
{"run":514,"commit":"9cea09c","metric":1,"metrics":{},"status":"discard","description":"Exact reran the new interior 3-head normalized grouped probe (`text_source=normalized`, `semantic_future_prediction_steps=3`, plain `semantic_block_decode_size=3`, future weight 0.5, scheduled sampling 0.5, EOS weight 2.0, p95-style cap, 12-token grouped prefix) after its first tie-level 0.6667 result. It collapsed straight back to asr_wer_prefix=1.0 with CER 0.773 and in-domain WER 0.444, despite EOS on both prompts, perfect gt-ASR sanity, and still full throughput (~30.6k samples / 10 min). So the aligned normalized grouped family does not hide a stable interior 3-head compromise either; that tie-level first run was another one-off side path rather than a reproducible successor.","timestamp":1773871633253,"segment":0}
{"run":515,"commit":"9cea09c","metric":1,"metrics":{},"status":"discard","description":"Tested whether the newer width-matched 2-head grouped decoder rescues the older normalized-heavier fixed-duplicate weighted family by running `text_source=both_weighted` with normalized/raw repeats 2/1, `semantic_future_prediction_steps=2`, plain `semantic_block_decode_size=3`, future weight 0.5, scheduled sampling 0.5, EOS weight 2.0, the p95-style cap, and a 12-token grouped prefix. After prebuilding the required caches, this failed cleanly at asr_wer_prefix=1.0 with CER 0.773 despite EOS on both prompts, very strong in-domain WER 0.111, and gt-ASR sanity 0.111 at full throughput (~31.1k samples / 10 min). So the cleaner 2-head grouped transfer does not rescue the older fixed-duplicate 2:1 weighted family either; on this branch too, width matching plus a fixed-duplicate normalized-heavy mix behaves like another in-domain-only side path rather than a real OOD stabilizer.","timestamp":1773872651233,"segment":0}
{"run":516,"commit":"9cea09c","metric":0.8333333134651184,"metrics":{},"status":"discard","description":"Tested whether the newer width-matched 2-head grouped decoder rescues a more normalized-heavy fixed-duplicate weighted family by running `text_source=both_weighted` with normalized/raw repeats 4/1, `semantic_future_prediction_steps=2`, plain `semantic_block_decode_size=3`, future weight 0.5, scheduled sampling 0.5, EOS weight 2.0, the p95-style cap, and a 12-token grouped prefix. After prebuilding the required caches, this recovered only weak life at asr_wer_prefix=0.8333 with CER 0.682, in-domain WER 0.333, EOS on both prompts, perfect gt-ASR sanity, and full throughput (~31.1k samples / 10 min). So even pushing farther toward normalized text does not make the width-matched 2-head transfer a strong fixed-duplicate weighted stabilizer; on this family too, the 2-head grouped path stays clearly weaker than the best mixed-text and sampled-side clues.","timestamp":1773873499231,"segment":0}
{"run":517,"commit":"9cea09c","metric":1,"metrics":{},"status":"discard","description":"Tested whether the reproducible sampled grouped 2-head backbone actually needs grouped-prefix inference by ablating grouped decoding entirely and running the same width-matched sampled recipe with exact token-by-token generation: `text_source=both_weighted_sampled`, normalized/raw weights 3/1, `text_source_weighted_sampled_passes=2`, `semantic_future_prediction_steps=2`, future weight 0.5, scheduled sampling 0.5, EOS weight 2.0, and the p95-style cap, but no grouped block decode. This failed cleanly at asr_wer_prefix=1.0 with CER 0.955, OOD EOS disappearing again, the OOD utterance stretching back to the 53-frame cap, weaker in-domain WER 0.556, and only middling gt-ASR sanity 0.069 despite full throughput (~31.5k samples / 10 min). So on the newer sampled 2-head family, width matching plus sampled text geometry alone is not enough: the grouped-prefix decoder itself is essential, and the reproducible `0.6667` backbone does not transfer back to plain exact decoding.","timestamp":1773874846916,"segment":0}
{"run":518,"commit":"9cea09c","metric":1,"metrics":{},"status":"discard","description":"Tested whether the newer diff-targeted sampled clue actually needs grouped-prefix inference by ablating grouped decoding entirely and running the same width-matched sampled recipe with exact token-by-token generation: `text_source=both_weighted_sampled_diff`, normalized/raw weights 3/1, `text_source_weighted_sampled_passes=2`, `semantic_future_prediction_steps=2`, future weight 0.5, scheduled sampling 0.5, EOS weight 2.0, and the p95-style cap, but no grouped block decode. This also failed cleanly at asr_wer_prefix=1.0, even though CER improved to 0.636, in-domain WER was perfect at 0.0, EOS fired on both prompts, generations stayed short (~32/37 frames), and gt-ASR sanity stayed strong at 0.056 with full throughput (~31.5k samples / 10 min). So the diff-targeted sampled gain is not a broad exact-decoding data-geometry upgrade either: like the plain sampled 2-head branch, it remains grouped-prefix-specific, and without grouped inference it collapses into another in-domain-only side path.","timestamp":1773875591431,"segment":0}
