{"run":619,"commit":"4d1b28d","metric":0.6666666865348816,"metrics":{},"status":"discard","description":"Isolated the **manager-only start-method** question on the bad symlink-to-copy surface by using the old overlay with **both CPU and GPU stats monitors disabled** (so only the broader `ProcessMixin` manager/process machinery remains) and switching to `multiprocessing_context=fork`. Unlike the spawn manager-only probe `#614` that stayed at `1.0`, this forked manager-only surface recovered **asr_wer_prefix=0.6667** with old-regime throughput (~30.0k samples / 10 min). So the culprit is now even narrower: it is not manager existence alone, but specifically the **spawned `SyncManager` process** on the symlinked surface. A forked manager can sit in the good regime.","timestamp":1773964552710,"segment":0}
{"run":620,"commit":"4d1b28d","metric":0.8333333134651184,"metrics":{},"status":"discard","description":"Exact reran the new **manager-only under `fork`** surface from #619: bad symlink-to-copy entrypoint, split old overlays, no repo root, old HF stack, aliased full old caches, both stats monitors disabled, and only the broader `ProcessMixin` manager/process machinery left active under `multiprocessing_context=fork`. This weakened from `0.6667` to **`0.8333`** while preserving old-regime throughput (~30.0k samples / 10 min). So the key new distinction still holds qualitatively — **spawn manager-only** is much worse than **fork manager-only** on this symlinked surface — but the fork-manager rescue is also noisy rather than perfectly stable.","timestamp":1773965306988,"segment":0}
{"run":621,"commit":"4d1b28d","metric":1,"metrics":{},"status":"discard","description":"Tested whether the new symlinked-surface failure is *only* about the manager start method by patching the old overlay so `ProcessMixin` still uses the default **spawn** context for worker processes but always creates the **manager with `fork`**. On the bad symlink-to-copy surface (split old overlays, no repo root, old HF stack, aliased full old caches), this still failed cleanly at **asr_wer_prefix=1.0** with old-regime throughput (~29.9k samples / 10 min) and no EOS on the main prompt. So a forked manager alone is **not sufficient** once the spawned stats workers are re-enabled: the bad surface is not just 'spawn manager bad, fork manager good', but more broadly involves the spawned monitor-worker bootstrap too.","timestamp":1773966344699,"segment":0}
{"run":622,"commit":"4d1b28d","metric":1,"metrics":{},"status":"discard","description":"Narrowed the spawned-worker story further on the bad symlink-to-copy surface by using the **fork-manager** overlay but disabling only the **GPU stats** monitor, leaving just the **CPU stats worker** active under the default spawn context. This still failed cleanly at **asr_wer_prefix=1.0** with old-regime throughput (~29.9k samples / 10 min). So even once the manager itself is moved off spawn, the **spawned CPU monitor worker alone** is sufficient to keep the bad symlinked surface in the failing class.","timestamp":1773967104783,"segment":0}
{"run":623,"commit":"4d1b28d","metric":0.8333333134651184,"metrics":{},"status":"discard","description":"Completed the fork-manager worker isolation on the bad symlink-to-copy surface by disabling only the **CPU stats** monitor, leaving just the **GPU stats worker** active under the default spawn context while the manager itself is created with `fork`. This weakened to **asr_wer_prefix=0.8333** with old-regime throughput (~29.9k samples / 10 min), clearly better than the fork-manager + CPU-only case `#622` at `1.0` but still worse than the manager-only fork surface. So after moving the manager off spawn, the remaining spawned-worker damage is now asymmetric: the **CPU monitor worker** looks like the harsher bad actor, while the **GPU monitor worker** alone only weakly degrades the surface.","timestamp":1773967866640,"segment":0}
{"run":624,"commit":"4d1b28d","metric":0.8333333134651184,"metrics":{},"status":"discard","description":"Directly tested whether the harsh failure of the **CPU-only spawned worker** in `#622` is really about its **spawn** bootstrap by patching the bad symlinked surface so the manager is created with `fork`, the GPU monitor is disabled, and the remaining **CPU stats worker** is also forced to start with `fork`. This improved the surface from the CPU-only spawned `1.0` class to **asr_wer_prefix=0.8333** with old-regime throughput (~29.8k samples / 10 min). So the CPU monitor's damage is indeed substantially tied to its **spawned** bootstrap; moving that worker to `fork` partially rescues the surface.","timestamp":1773968789185,"segment":0}
{"run":625,"commit":"4d1b28d","metric":0.6666666865348816,"metrics":{},"status":"discard","description":"Tested the fully **all-forked child** repair on the bad symlink-to-copy surface by using a temp old overlay where `ProcessMixin` creates the manager with `fork` and both the **CPU** and **GPU** monitor workers are also forced to start with `fork`, while keeping the rest of the mixed surface unchanged (split old overlays, no repo root, old HF stack, aliased full old caches). This recovered **asr_wer_prefix=0.6667** with old-regime throughput (~29.7k samples / 10 min), EOS on both prompts, and clean gt-ASR. Combined with #621-#624, this is the clearest mechanistic result yet: the bad symlinked surface is largely a **spawned-child bootstrap** problem. Moving the manager, CPU monitor, and GPU monitor off `spawn` is enough to return the surface to the old `0.6667` class.","timestamp":1773969599818,"segment":0}
{"run":626,"commit":"4d1b28d","metric":1,"metrics":{},"status":"discard","description":"Exact reran the fully **all-forked child** repair from #625: temp old overlay where the manager, CPU monitor, and GPU monitor all start with `fork` on the bad symlink-to-copy mixed surface. This collapsed back to **asr_wer_prefix=1.0** despite old-regime throughput (~29.6k samples / 10 min). So the all-forked rescue is real but **not yet stable**; current picture is `0.6667 -> 1.0`. The mechanistic direction still looks strong, but it remains noisy enough that direct child-bootstrap introspection is now more valuable than additional blind reruns.","timestamp":1773970363920,"segment":0}
{"run":627,"commit":"4d1b28d","metric":0.6666666865348816,"metrics":{},"status":"discard","description":"Added lightweight bootstrap instrumentation to the **CPU stats worker** on the bad symlinked surface with **forked manager + GPU disabled**, so the remaining CPU monitor still uses the default spawn path but dumps its startup view of `__main__`/`sys.path`. The run itself landed at **asr_wer_prefix=0.6667** (showing this surface is noisier than `#622` suggested), but the important mechanistic payload is clear: the spawned CPU child starts with `main_file=/tmp/current-copy-link.py`, `argv0=/tmp/current-copy-link.py`, and `sys.path` beginning with `/tmp`, then the old overlay roots. So the spawned CPU worker is literally bootstrapping through the **symlinked entry script** as `__main__`, which strongly supports the current hypothesis that these failures are driven by **spawn bootstrap against the symlinked main-module surface**, not just by generic monitoring logic.","timestamp":1773971178750,"segment":0}
{"run":628,"commit":"4d1b28d","metric":1,"metrics":{},"status":"discard","description":"Compared the new **spawned manager-child bootstrap** directly across entrypoint forms by running the same manager-instrumented / no-stats mixed surface on the **hard-copied current script** instead of the symlinked one. The run itself stayed at **asr_wer_prefix=1.0** with old-regime throughput (~29.8k samples / 10 min), but the debug payload is high-value: the spawned manager child now starts with `main_file=/tmp/current_ljspeech_copy.py`, `argv0=/tmp/current_ljspeech_copy.py`, while `sys.path` still begins with `/tmp` and the old overlay roots. Combined with the companion symlinked-surface manager bootstrap probe, this confirms the bootstrap difference is exactly what we suspected: spawned children re-enter through whatever entry script is `__main__`, and on the bad surface that means the **symlinked** `/tmp/current-copy-link.py` rather than the hard copy.","timestamp":1773972908619,"segment":0}
{"run":629,"commit":"4d1b28d","metric":1,"metrics":{},"status":"discard","description":"Instrumented the **spawned manager child** directly on the bad symlink-to-copy mixed surface by patching the no-stats old overlay so `ProcessMixin` creates a manual `SyncManager` with a startup initializer that writes its bootstrap view of `__main__` and `sys.path`. The run itself stayed in the expected bad class at **asr_wer_prefix=1.0** with old-regime throughput (~29.6k samples / 10 min), and the key payload was decisive: the spawned manager child starts with `main_file=/tmp/current-copy-link.py`, `argv0=/tmp/current-copy-link.py`, and `sys.path` beginning with `/tmp`, then the old overlay roots. So the manager child, like the spawned CPU worker in #627, is literally re-entering through the **symlinked entry script** as `__main__`.","timestamp":1773972925055,"segment":0}
{"run":630,"commit":"4d1b28d","metric":1,"metrics":{},"status":"discard","description":"Completed the direct **CPU-worker bootstrap comparison** against the hard-copied entrypoint surface. Using the same forked-manager + GPU-disabled setup as #627, but launching the **hard-copied** current script, the run stayed at **asr_wer_prefix=1.0** with old-regime throughput (~29.5k samples / 10 min). The debug payload mirrors the manager result from #628: the spawned CPU child now starts with `main_file=/tmp/current_ljspeech_copy.py`, `argv0=/tmp/current_ljspeech_copy.py`, and `sys.path` still beginning with `/tmp`. So both spawned-child types we care about now show the same exact copied-vs-symlinked bootstrap split: on the bad surface they re-enter through the **symlinked** main script, while on the copied surface they re-enter through the hard copy instead.","timestamp":1773973806502,"segment":0}
{"run":631,"commit":"4d1b28d","metric":1,"metrics":{},"status":"discard","description":"Tested the converse sufficiency question: starting from the normally stronger **hard-copied current-script** surface, I patched a temp copy so it force-overrides `__main__.__file__` and `sys.argv[0]` to the **symlink path** `/tmp/current-copy-link.py` before imports, while otherwise keeping the same split-old-overlays / no-repo-root / old-HF / aliased-old-cache setup. This collapsed the copied surface cleanly to **asr_wer_prefix=1.0** with old-regime throughput (~29.5k samples / 10 min). Combined with the spawned-child debug probes and the failed symlink-canonicalization run, this is the strongest causal evidence yet that the benchmark drift is driven by the **spawn bootstrap main-path identity** itself: forcing a copied surface to present the symlinked `__main__` path is enough to re-enter the bad class.","timestamp":1773975630940,"segment":0}
{"run":632,"commit":"4d1b28d","metric":1,"metrics":{},"status":"discard","description":"Tested whether the bad symlinked surface can be rescued just by **canonicalizing the main-path identity**. I created a temp current-script copy that, at startup, rewrites `__main__.__file__` and `sys.argv[0]` to its resolved realpath, then launched it through a symlink on the usual split-old-overlays / no-repo-root / old-HF / aliased-old-cache surface. The run still failed cleanly at **asr_wer_prefix=1.0** with old-regime throughput (~29.6k samples / 10 min). So rewriting `__main__.__file__`/`argv0` alone from inside the symlinked process is **not sufficient** to rescue the benchmark surface, even though the converse forced-symlink-main probe can poison a copied surface.","timestamp":1773975671702,"segment":0}
{"run":633,"commit":"4d1b28d","metric":0.8333333134651184,"metrics":{},"status":"discard","description":"Separated the new forced-symlink-main poison from the `ProcessMixin` child surface. Starting from the copied current-script mixed surface, I kept the temp prelude that forces `__main__.__file__` / `argv0` to the symlink path `/tmp/current-copy-link.py` (the same poison from #631) **but also set `disable_multiprocessing=true`** to remove the `SyncManager` + stats-monitor subprocess layer. This no-manager/no-monitor version improved sharply from #631’s clean `1.0` failure to **`asr_wer_prefix=0.8333`** with old-regime throughput (~30.2k samples / 10 min), EOS on both prompts, short generations (32/36 frames), and clean gt-ASR (`asr_wer_gt=0.0`). So presenting the symlinked main-path identity is still harmful even without the `ProcessMixin` multiprocessing surface, but a large part of the full poison clearly routes through those spawned child paths rather than through parent-only state.","timestamp":1773977168292,"segment":0}
{"run":634,"commit":"4d1b28d","metric":1,"metrics":{},"status":"discard","description":"Tested whether the forced-symlink-main poison from #631 can be neutralized simply by moving `ProcessMixin` off spawn. Using the same temp copied script that force-presents `/tmp/current-copy-link.py` as `__main__`, I kept the old mixed-surface overlays/HF/caches but changed only `multiprocessing_context=fork` (manager + monitors still enabled). Unlike the `disable_multiprocessing=true` variant in #633, this **did not rescue** the surface: it stayed at **`asr_wer_prefix=1.0`** with old-regime throughput (~29.8k samples / 10 min), EOS on both prompts, short generations (30/41 frames), and clean gt-ASR (`asr_wer_gt=0.0`). So for the forced-symlink-main copied surface, merely switching the `ProcessMixin` start method to `fork` is not enough; the full poison is not reducible to spawn bootstrap alone once the manager/monitor machinery remains in play.","timestamp":1773977947866,"segment":0}
{"run":635,"commit":"4d1b28d","metric":1,"metrics":{},"status":"discard","description":"Tested a stronger early-bootstrap repair than #632 by launching a **symlinked wrapper** that never executes the benchmark code under the symlink path at all: before any benchmark imports, the wrapper rebound `__main__` to `/tmp/current_ljspeech_copy.py`, installed a real `SourceFileLoader`, set `sys.argv[0]` to the copy path, and `exec`-compiled the copied script with `co_filename=/tmp/current_ljspeech_copy.py`. A cheap probe had already shown this makes both parent and spawned-child code/object provenance look like a real copy launch, and the benchmark logs confirmed the runtime now reports `/tmp/current_ljspeech_copy.py` as the task path/command line. Even so, the mixed old-overlay / old-HF / aliased-old-cache surface still failed cleanly at **`asr_wer_prefix=1.0`** with old-regime throughput (~29.8k samples / 10 min). So simply canonicalizing benchmark-code `__main__`/loader/code provenance inside a wrapper is **not sufficient** to recover the copied-script behavior; some outer bootstrap/wrapper surface or additional noise still remains.","timestamp":1773979171913,"segment":0}
{"run":636,"commit":"0ec2af2","metric":0.8333333134651184,"metrics":{},"status":"keep","description":"Ran the immediate clean **hard-copied current-script control** against the failed exec-real wrapper probe, keeping the same split old overlays (`/tmp/xaxpkg-oldexact:/tmp/oldexamplesonly`), old HF overlay, aliased old full caches, no repo root on `PYTHONPATH`, and the same canonical aligned normalized 4-head grouped config. Unlike the exec-real wrapper in #635, the plain copied-script surface still hit **`asr_wer_prefix=0.8333`** with old-regime throughput (~29.7k samples / 10 min), EOS on both prompts, short generations (30/41 frames), and clean gt-ASR (`asr_wer_gt=0.0`). This makes #635 much more informative: even when the benchmark code itself is canonicalized to `/tmp/current_ljspeech_copy.py` before imports, the **outer wrapper/bootstrap identity** still leaves a materially worse surface than a true copied-script launch.","timestamp":1773980051943,"segment":0}
{"run":637,"commit":"0ec2af2","metric":1,"metrics":{},"status":"discard","description":"Tested whether the failed exec-real wrapper from #635 was bad specifically because it was **symlink-launched**. I reran the same wrapper **directly** (no symlink), still with split old overlays, old HF, aliased old full caches, and the wrapper rebinding `__main__` / loader / `co_filename` to `/tmp/current_ljspeech_copy.py` before any benchmark imports. It still failed cleanly at **`asr_wer_prefix=1.0`** with old-regime throughput (~29.6k samples / 10 min), EOS on both prompts, and the logs again reporting `/tmp/current_ljspeech_copy.py` as the task path. So the remaining harm is **not** about the wrapper being symlinked; the act of launching through this outer exec-wrapper surface is itself materially worse than a true copied-script launch.","timestamp":1773980842364,"segment":0}
{"run":638,"commit":"9c584f9","metric":0.5,"metrics":{},"status":"keep","description":"Tested whether the new **exec-real wrapper** harm from #635/#637 still routes mainly through the `ProcessMixin` child layer. I kept the same direct wrapper launch (not symlinked), still rebinding `__main__`, loader, `sys.argv[0]`, and `co_filename` to `/tmp/current_ljspeech_copy.py` before any benchmark imports, but added **`disable_multiprocessing=true`** on the same split-old-overlays / old-HF / aliased-old-cache surface. That rescued the wrapper surface sharply from `1.0` to **`asr_wer_prefix=0.5`** with old-regime throughput (~29.9k samples / 10 min), EOS on both prompts, short generations (33/37 frames), and clean gt-ASR (`asr_wer_gt=0.0`). So even after canonicalizing the benchmark code itself to the copied-script path, the remaining wrapper/bootstrap harm still routes heavily through the `SyncManager` / monitor-process layer rather than living purely in parent-only state.","timestamp":1773981700594,"segment":0}
{"run":639,"commit":"9c584f9","metric":1,"metrics":{},"status":"discard","description":"Tested whether the new exec-real-wrapper rescue from #638 depends specifically on the `SyncManager`, or on the broader monitor-process layer. I kept the same direct exec-real wrapper surface that canonicalizes `__main__`, loader, `sys.argv[0]`, and `co_filename` to `/tmp/current_ljspeech_copy.py`, but swapped in the old-overlay **no-`SyncManager`** `ProcessMixin` patch instead of using `disable_multiprocessing=true`. This did **not** rescue the wrapper surface: it failed cleanly at **`asr_wer_prefix=1.0`** with old-regime throughput (~29.7k samples / 10 min), EOS on both prompts, and clean gt-ASR. So for the exec-real-wrapper surface, the strong `disable_multiprocessing=true` rescue from #638 is **not** reproduced by removing the manager alone; the remaining harm appears to require the broader monitoring/process layer, not just `SyncManager` creation in isolation.","timestamp":1773982472174,"segment":0}
{"run":640,"commit":"6c343f1","metric":0.6666666865348816,"metrics":{},"status":"keep","description":"Tested whether the direct **exec-real wrapper** harm from #637/#639 is specifically coming from the monitor subprocesses rather than the outer wrapper surface or manager alone. I kept the same direct wrapper launch that canonicalizes `__main__`, loader, `sys.argv[0]`, and `co_filename` to `/tmp/current_ljspeech_copy.py`, but swapped in the old-overlay **no-stats** patch so both CPU and GPU monitor subprocesses are disabled while the broader process/manager surface remains. This rescued the wrapper surface from `1.0` to **`asr_wer_prefix=0.6667`** with old-regime throughput (~29.7k samples / 10 min), perfect in-domain prompt match (`asr_wer_prefix_in_domain=0.0`), EOS on both prompts, short generations (27/41 frames), and clean gt-ASR (`asr_wer_gt=0.0`). Combined with #638 and #639, this sharply narrows the wrapper-side culprit: on the exec-real wrapper surface, the main remaining harm is coming from the **stats-monitor subprocess layer**, not from `SyncManager` creation alone.","timestamp":1773983384643,"segment":0}
{"run":641,"commit":"6c343f1","metric":1,"metrics":{},"status":"discard","description":"Tested the **direct exec-real wrapper** surface with the **CPU stats monitor disabled but GPU monitor still active** (old-overlay `/tmp/xaxpkg-oldexact-nocpu`), keeping the same split-old-overlays / old-HF / aliased-old-cache setup and the same canonical wrapper rebinding to `/tmp/current_ljspeech_copy.py`. This did **not** rescue the wrapper: it failed cleanly at **`asr_wer_prefix=1.0`** with old-regime throughput (~29.6k samples / 10 min), EOS on both prompts, and slightly worse gt-ASR (`asr_wer_gt=0.167`). So on the wrapper surface, a remaining **GPU monitor alone is sufficient** to keep the run in the bad class; the no-stats rescue from #640 is not explained solely by removing the CPU monitor.","timestamp":1773984142183,"segment":0}
{"run":642,"commit":"6c343f1","metric":0.8333333134651184,"metrics":{},"status":"discard","description":"Completed the wrapper monitor-asymmetry split by testing the **direct exec-real wrapper** surface with the **GPU stats monitor disabled but CPU monitor still active** (old-overlay `/tmp/xaxpkg-oldexact-nogpu`). This improved over the raw wrapper `1.0` class to **`asr_wer_prefix=0.8333`** with old-regime throughput (~29.5k samples / 10 min), perfect in-domain prompt match, EOS on both prompts, and clean gt-ASR — but it was still clearly worse than the no-stats rescue in #640 and the full `disable_multiprocessing=true` rescue in #638. Together with #641, this sharpens the wrapper-specific culprit: on the exec-real wrapper surface, the **GPU monitor alone is sufficient to keep the run in the bad `1.0` class**, while the **CPU monitor alone is only weakly harmful** (`0.8333`), and removing both monitors recovers the stronger `0.6667` class.","timestamp":1773984913294,"segment":0}
