{"run":593,"commit":"4d1b28d","metric":1,"metrics":{},"status":"discard","description":"Tested whether the live mixed-surface recovery really depends only on the old `xax/...` package tree by copying the detached worktree’s `xax/` directory into `/tmp/xaxpkg-oldexact` and running the **current** top-level script with `PYTHONPATH=/tmp/xaxpkg-oldexact:/home/ben/Github/xax:/tmp/xax-overlay-hf452`, plus the aliased full old cache surface. Unlike the corresponding runs that put the **entire detached worktree root** on `PYTHONPATH`, this exact-old-`xax`-package-copy path collapsed cleanly to asr_wer_prefix=1.0 despite old-regime throughput (~30.0k / 10 min). So the live recovery is not explained by the `xax/` package directory alone: some additional import / namespace / top-level repo-root context from `/tmp/xax-bench-9cea09c` is materially affecting the benchmark surface.","timestamp":1773942834676,"segment":0}
{"run":594,"commit":"4d1b28d","metric":0,"metrics":{},"status":"crash","description":"Attempted the first truly corrected mixed-surface run by launching the **current** script from outside the repo root (`cd /tmp`) so `PYTHONPATH=/tmp/xax-bench-9cea09c:/tmp/xax-overlay-hf452` would force `xax` imports to come from the detached worktree. This failed immediately because `uv run` outside the project ignored the benchmark environment (`--no-sync` had no effect) and the script crashed on `ModuleNotFoundError: No module named 'equinox'` before any training or JSON logging. So the corrected current-script + old-`xax` test must still be launched through the project environment, but with a script path whose directory is outside the repo root.","timestamp":1773942989281,"segment":0}
{"run":595,"commit":"4d1b28d","metric":1,"metrics":{},"status":"discard","description":"Ran the first **actually corrected** current-script + old-`xax` benchmark by launching a `/tmp/current-ljspeech-link.py` symlink to the current `examples/ljspeech.py` through the repo’s project environment (`uv run python /tmp/current-ljspeech-link.py ...`) while setting `PYTHONPATH=/tmp/xax-bench-9cea09c:/tmp/xax-overlay-hf452`. This setup really does import `xax/...` from the detached worktree while keeping the current top-level script, and it used the aliased full old cache surface plus the old HF stack. It failed cleanly at asr_wer_prefix=1.0 with old-regime throughput (~29.8k samples / 10 min). So the earlier #589/#592 gains were **not** evidence that the current script works fine with the old `xax` package; those earlier runs were still actually using current `xax` because the repo root stayed on `sys.path`. The old-`xax` package alone does not rescue the benchmark under the current top-level script.","timestamp":1773943748327,"segment":0}
{"run":596,"commit":"4d1b28d","metric":1,"metrics":{},"status":"discard","description":"Isolated whether the old-root effect could be coming mainly from **old `examples.ljspeech` module resolution in worker/spawn paths** by creating `/tmp/oldexamplesonly/examples/ljspeech.py` from the detached worktree and running the current benchmark script with `PYTHONPATH=/tmp/oldexamplesonly:/home/ben/Github/xax:/tmp/xax-overlay-hf452`. This setup leaves `xax/...` on the current repo surface but makes `examples.ljspeech` resolve to the old script inside namespace-package imports. It still failed cleanly at asr_wer_prefix=1.0 and stayed in the slow ~18.1k-samples/10min regime. So old `examples.ljspeech` resolution by itself is not enough; the earlier live hybrid path appears to require the **combination** of current main-script path plus old-root-provided `xax/...` and `examples/...` context, not just old examples-module resolution alone.","timestamp":1773944641477,"segment":0}
{"run":597,"commit":"4d1b28d","metric":0.6666666865348816,"metrics":{},"status":"discard","description":"Reconstructed the previously mysterious old-root effect explicitly, without using the full detached repo root, by combining **old `xax/...`** (`PYTHONPATH=/tmp/xaxpkg-oldexact`) with **old `examples.ljspeech` namespace resolution** (`/tmp/oldexamplesonly/examples/ljspeech.py`) while still executing the **current** main script from `/home/ben/Github/xax/examples/ljspeech.py`, and keeping the old HF stack plus the aliased full old caches. This synthetic hybrid recovered **asr_wer_prefix=0.6667** with old-regime throughput (~29.8k / 10 min). So the earlier live mixed-surface behavior is now explained: it does not require the whole detached worktree root, but it *does* require the combination of old `xax` package resolution and old `examples.ljspeech` module resolution under the current main-script path. Neither half alone was sufficient (#593, #596).","timestamp":1773945397999,"segment":0}
{"run":598,"commit":"4d1b28d","metric":0.8333333134651184,"metrics":{},"status":"discard","description":"Exact-reran the synthetic hybrid from #597: current main-script path, synthetic old `xax` resolution (`/tmp/xaxpkg-oldexact`), synthetic old `examples.ljspeech` resolution (`/tmp/oldexamplesonly`), old HF stack, and aliased full old caches. The first probe on this reconstructed import surface recovered `0.6667`, but the exact rerun weakened to `0.8333` while keeping old-regime throughput (~29.8k samples / 10 min) and perfect gt-ASR sanity. So the synthetic hybrid explanation still looks real, but the resulting benchmark surface is noisy rather than stabilized.","timestamp":1773946268380,"segment":0}
{"run":599,"commit":"4d1b28d","metric":0.5,"metrics":{},"status":"discard","description":"Tested whether the **current main-script path itself** is required by rerunning the synthetic hybrid surface through `/tmp/current-ljspeech-link.py` (a symlink to the current benchmark script) while keeping the same old-`xax` overlay (`/tmp/xaxpkg-oldexact`), old `examples.ljspeech` namespace overlay (`/tmp/oldexamplesonly`), repo root on `PYTHONPATH`, old HF stack, and aliased full old caches. This improved to **asr_wer_prefix=0.5** with old-regime throughput (~29.9k samples / 10 min), so the exact `/home/ben/Github/xax/examples/ljspeech.py` main-script path is **not** required. The real live ingredient is broader module-identity / namespace resolution, not that specific path.","timestamp":1773947271081,"segment":0}
{"run":600,"commit":"4d1b28d","metric":0.8333333134651184,"metrics":{},"status":"discard","description":"Tested whether the synthetic import-surface gain depends on the current script resolving back to its original file by running a **hard copy** of the current benchmark script (`/tmp/current_ljspeech_copy.py`) instead of the symlink, while keeping the same old-`xax` overlay, old `examples.ljspeech` namespace overlay, repo root on `PYTHONPATH`, old HF stack, and aliased full old caches. This still landed in the live regime at asr_wer_prefix=0.8333 with old-regime throughput (~29.8k samples / 10 min). So the gain does not require the main script path to resolve back to `/home/ben/Github/xax/examples/ljspeech.py`; a copied current script still works. That points away from file-path identity and more toward the namespace-package composition itself.","timestamp":1773948047208,"segment":0}
{"run":601,"commit":"4d1b28d","metric":0.8333333134651184,"metrics":{},"status":"discard","description":"Tested whether the synthetic live surface really needs the **current repo root on `PYTHONPATH`** by running the copied current script (`/tmp/current_ljspeech_copy.py`) with only the split old overlays on `PYTHONPATH` (`/tmp/xaxpkg-oldexact:/tmp/oldexamplesonly:/tmp/xax-overlay-hf452`) plus the old HF stack and aliased full old caches. This still landed at asr_wer_prefix=0.8333 with old-regime throughput (~29.8k samples / 10 min). So the repo root namespace contribution is **not** required after all; the more important distinction now seems to be the **split old overlays** versus the single unified detached-worktree root.","timestamp":1773948806773,"segment":0}
{"run":602,"commit":"4d1b28d","metric":1,"metrics":{},"status":"discard","description":"Compared the split-old-overlays surface against #595 under the **same symlink main-script path** by running `/tmp/current-ljspeech-link.py` with only `/tmp/xaxpkg-oldexact:/tmp/oldexamplesonly:/tmp/xax-overlay-hf452` on `PYTHONPATH` (no repo root), plus old HF and aliased full old caches. Unlike the copied-script variant on the same split overlays (#601), this symlinked run collapsed back to asr_wer_prefix=1.0. The key new clue is that the symlink resolves back to `/home/ben/Github/xax/examples/ljspeech.py`, so `task_module` still falls back to `examples.ljspeech`, while the hard copy resolves to `/tmp/current_ljspeech_copy.py` and gets a different fallback module name. So the import-surface story is now narrowing toward **task/module identity** (`examples.ljspeech` vs a standalone copied module name) rather than just old-vs-current file contents.","timestamp":1773949584439,"segment":0}
{"run":603,"commit":"4d1b28d","metric":0.8333333134651184,"metrics":{},"status":"discard","description":"Compared the unified detached-worktree root against the split-overlay surface under the **same hard-copied current script** by running `/tmp/current_ljspeech_copy.py` with `PYTHONPATH=/tmp/xax-bench-9cea09c:/tmp/xax-overlay-hf452` (no repo root) plus old HF and aliased full old caches. This still landed at asr_wer_prefix=0.8333 with old-regime throughput (~29.8k samples / 10 min). So the earlier corrected-symlink failure (#595) was **not** about needing split overlays instead of the unified old root; the more central difference is still the copied-module vs symlinked-`examples.ljspeech` identity. That further strengthens the view that task/module identity is the key live mechanism.","timestamp":1773950452391,"segment":0}
{"run":604,"commit":"4d1b28d","metric":0.8333333134651184,"metrics":{},"status":"discard","description":"Tested whether the apparent `examples.ljspeech`-identity penalty could be reproduced without any symlink by running a **hard copy** named `/tmp/examples.ljspeech.py` on the split-old-overlays / no-repo-root surface. Under `_path_to_module_name(...)`, this flat file still falls back to `task_module=examples.ljspeech`, but it landed at asr_wer_prefix=0.8333 with old-regime throughput (~29.9k samples / 10 min). So `task_module=examples.ljspeech` by itself is **not** sufficient to explain the symlinked failure from #602. The live distinction is now narrower: something about the symlink-resolved path back into the repo, or just plain noise, still remains confounded with task/module identity.","timestamp":1773951409812,"segment":0}
{"run":605,"commit":"4d1b28d","metric":0,"metrics":{},"status":"crash","description":"Attempted an exact rerun of the **symlinked current-script + split-old-overlays + no-repo-root** surface from #602, but I botched the shell wrapper by using a temporary `BENCH_RUN_DIR=...` assignment only for the `uv run` process while still expanding `$BENCH_RUN_DIR` in the surrounding shell. The underlying training job still ran to completion and again landed at **asr_wer_prefix=1.0** with old-regime throughput (~29.8k samples / 10 min), but the wrapper failed afterwards because `tee` wrote to `/stdout.log` and the metric-extraction step pointed at the wrong JSON path. So this was an operator-error crash, but it also weakly confirms that the symlinked no-repo-root surface remains in the `1.0` regime.","timestamp":1773952209695,"segment":0}
{"run":606,"commit":"4d1b28d","metric":1,"metrics":{},"status":"discard","description":"Tested whether the copied-script advantage survives a **symlink that resolves to the copied script itself** by running `/tmp/current-copy-link.py -> /tmp/current_ljspeech_copy.py` on the same split-old-overlays / no-repo-root surface with old HF and aliased full old caches. This still collapsed to asr_wer_prefix=1.0 with old-regime throughput (~29.7k samples / 10 min). So the copied-script gain is **not** just about the resolved target path or fallback `task_module=current_ljspeech_copy`; the symlink itself appears to matter materially. That shifts the main live hypothesis toward Python main-module / multiprocessing-spawn behavior for symlinked entrypoints, rather than simple task-module identity alone.","timestamp":1773952994489,"segment":0}
{"run":607,"commit":"4d1b28d","metric":0.6666666865348816,"metrics":{},"status":"discard","description":"Tested the new **multiprocessing-spawn hypothesis** directly on the failing symlink-to-copy surface by rerunning `/tmp/current-copy-link.py -> /tmp/current_ljspeech_copy.py` on the split-old-overlays / no-repo-root setup, but with `disable_multiprocessing=true` to turn off the spawned CPU/GPU monitor processes from `ProcessMixin`. This rescued the surface from `1.0` back to **asr_wer_prefix=0.6667** with old-regime throughput (~29.8k samples / 10 min), EOS on both prompts, and perfect gt-ASR sanity. That is the strongest evidence yet that the remaining drift is not just generic import-path weirdness: the interaction appears to run specifically through **spawned multiprocessing behavior for symlinked entrypoints**.","timestamp":1773953747943,"segment":0}
{"run":608,"commit":"4d1b28d","metric":0.5,"metrics":{},"status":"discard","description":"Checked whether the new multiprocessing clue is specific to symlinked entrypoints by rerunning the **hard-copied current script** on the same split-old-overlays / no-repo-root surface, but with `disable_multiprocessing=true`. This improved from the prior copied-script `0.8333` surface to **asr_wer_prefix=0.5** with old-regime throughput (~29.8k samples / 10 min), EOS on both prompts, and perfect gt-ASR sanity. So spawned multiprocessing is not just a symlink-only nuisance: it materially affects the copied-script surface too. The symlink case is worse, but `disable_multiprocessing` is now a genuinely live benchmark-surface lever across both entrypoint styles.","timestamp":1773954508411,"segment":0}
{"run":609,"commit":"4d1b28d","metric":1,"metrics":{},"status":"discard","description":"Exact-reran the new symlink-to-copy + `disable_multiprocessing=true` rescue from #607 on the same split-old-overlays / no-repo-root surface. The first probe improved to `0.6667`, but this exact rerun collapsed back to asr_wer_prefix=1.0 while keeping old-regime throughput (~29.8k samples / 10 min). So the multiprocessing clue is real but still noisy on the symlinked surface: disabling spawned monitor processes can rescue it, but not yet reproducibly.","timestamp":1773955256548,"segment":0}
{"run":610,"commit":"4d1b28d","metric":0.8333333134651184,"metrics":{},"status":"discard","description":"Tested whether the live subprocess issue is specifically about the default **`spawn`** context by rerunning the failing symlink-to-copy surface (`/tmp/current-copy-link.py -> /tmp/current_ljspeech_copy.py`) with `multiprocessing_context=fork` instead of the default spawn, while keeping the same split-old-overlays / no-repo-root setup, old HF stack, and aliased full old caches. This improved the surface from the prior `1.0` failures to **asr_wer_prefix=0.8333** with old-regime throughput (~29.6k samples / 10 min). So the new clue sharpens further: the problem is not just “any multiprocessing”, but specifically the **spawn-style subprocess surface**; switching to `fork` is materially better than default spawn, though still weaker than the one-shot `disable_multiprocessing=true` rescue.","timestamp":1773956177213,"segment":0}
{"run":611,"commit":"4d1b28d","metric":0.8333333134651184,"metrics":{},"status":"discard","description":"Ran the matching copied-current-script probe with `multiprocessing_context=fork` on the same split-old-overlays / no-repo-root surface, old HF stack, and aliased full old caches. Unlike `disable_multiprocessing=true`, this did **not** improve the copied-script surface beyond its usual `0.8333` class. Combined with #610, that suggests `fork` mainly helps the **bad symlinked spawn surface**, while the copied-script surface still benefits more from eliminating the monitor subprocesses entirely than from merely changing the subprocess start method.","timestamp":1773956934004,"segment":0}
{"run":612,"commit":"4d1b28d","metric":1,"metrics":{},"status":"discard","description":"Isolated the spawned-monitor clue further on the bad symlink-to-copy surface by patching the old `xax` overlay to disable only the **CPU stats** monitor process while keeping the GPU stats monitor active, then rerunning `/tmp/current-copy-link.py -> /tmp/current_ljspeech_copy.py` on the split-old-overlays / no-repo-root surface with old HF and aliased full old caches. This still failed at asr_wer_prefix=1.0 with old-regime throughput (~29.7k samples / 10 min). So the one-off rescue from `disable_multiprocessing=true` is **not** explained by removing the CPU stats subprocess alone.","timestamp":1773958522277,"segment":0}
{"run":613,"commit":"4d1b28d","metric":1,"metrics":{},"status":"discard","description":"Ran the complementary monitor-isolation probe on the bad symlink-to-copy surface by patching the old `xax` overlay to disable only the **GPU stats** monitor process while keeping the CPU stats monitor active, then rerunning `/tmp/current-copy-link.py -> /tmp/current_ljspeech_copy.py` on the split-old-overlays / no-repo-root surface with old HF and aliased full old caches. This also failed at asr_wer_prefix=1.0 with old-regime throughput (~29.6k samples / 10 min). So neither the CPU-stats subprocess alone nor the GPU-stats subprocess alone explains the `disable_multiprocessing=true` rescue; the live effect likely depends on the broader `ProcessMixin` spawn/manager surface or on both monitors together.","timestamp":1773959275918,"segment":0}
{"run":614,"commit":"4d1b28d","metric":1,"metrics":{},"status":"discard","description":"Narrowed the multiprocessing clue further by patching the old `xax` overlay to disable **both** CPU and GPU monitor subprocesses while still leaving the broader `ProcessMixin` multiprocessing context / SyncManager surface intact, then rerunning the bad symlink-to-copy setup on the split-old-overlays / no-repo-root surface with old HF and aliased full old caches. This still failed at asr_wer_prefix=1.0 with old-regime throughput (~29.8k samples / 10 min). That is a strong new factor-isolation result: the earlier `disable_multiprocessing=true` rescue is **not** caused by the monitor subprocesses themselves, either individually or together. The remaining live suspect is now the broader **ProcessMixin spawn/SyncManager machinery** rather than CPU/GPU stats collection per se.","timestamp":1773960151098,"segment":0}
{"run":615,"commit":"4d1b28d","metric":0.6666666865348816,"metrics":{},"status":"discard","description":"Directly isolated the broader `ProcessMixin` machinery by patching the old `xax` overlay so `ProcessMixin` still creates a multiprocessing **context** but does **not** create the `SyncManager`, while leaving `disable_multiprocessing=false` and otherwise keeping the bad symlink-to-copy setup unchanged (split old overlays, no repo root, old HF, aliased full old caches). This rescued the surface from `1.0` back to **asr_wer_prefix=0.6667** with old-regime throughput (~29.7k samples / 10 min), EOS on both prompts, and perfect gt-ASR sanity. Combined with #612-#614, this is the strongest factor isolation yet: the live culprit is now much more specifically the **`SyncManager` creation / spawn-manager surface**, not the CPU/GPU monitor subprocesses themselves.","timestamp":1773960930814,"segment":0}
{"run":616,"commit":"4d1b28d","metric":0.6666666865348816,"metrics":{},"status":"discard","description":"Exact-reran the new **no-SyncManager** surface from #615: patched old `xax` overlay where `ProcessMixin` still creates a multiprocessing context but does **not** create the manager, with the same bad symlink-to-copy entrypoint on the split-old-overlays / no-repo-root surface, old HF stack, and aliased full old caches. This second probe again held **asr_wer_prefix=0.6667** with old-regime throughput (~29.7k samples / 10 min). So unlike the noisy `disable_multiprocessing=true` rescue, the no-manager factor isolation now looks reproducible: the strongest live repo-surface culprit is specifically the **`SyncManager` creation** inside `ProcessMixin`.","timestamp":1773961683661,"segment":0}
{"run":617,"commit":"4d1b28d","metric":1,"metrics":{},"status":"discard","description":"Checked whether the new no-`SyncManager` rescue is specific to the bad symlinked entrypoint by running the **hard-copied current script** on the same split-old-overlays / no-repo-root surface, but with the patched old `xax` overlay where `ProcessMixin` creates a multiprocessing context and skips manager creation. This did **not** help the copied-script surface; it fell cleanly to asr_wer_prefix=1.0. So the `SyncManager` creation bug now looks especially tied to the **symlinked entrypoint** path rather than being a universal penalty across all current-script-copy surfaces.","timestamp":1773962531942,"segment":0}
{"run":618,"commit":"4d1b28d","metric":0.8333333134651184,"metrics":{},"status":"discard","description":"Third exact rerun of the **no-`SyncManager` symlinked surface**: patched old `xax` overlay where `ProcessMixin` still creates a multiprocessing context but skips manager creation, with `/tmp/current-copy-link.py` on the split-old-overlays / no-repo-root surface, old HF stack, and aliased full old caches. This weakened from `0.6667 -> 0.6667` to **`0.8333`** while preserving old-regime throughput (~30.1k samples / 10 min). So the no-manager rescue remains clearly better than the raw bad-symlink `1.0` class, but it is **not perfectly stable**; current picture is `0.6667 -> 0.6667 -> 0.8333`.","timestamp":1773963776607,"segment":0}
