{"run":540,"commit":"9cea09c","metric":1,"metrics":{},"status":"discard","description":"Ran a third probe of the original aligned mixed-text width-matched grouped 2-head branch (`text_source=both`, `semantic_future_prediction_steps=2`, plain `semantic_block_decode_size=3`, `semantic_block_decode_max_grouped_tokens=12`, future weight 0.5, scheduled sampling 0.5, EOS weight 2.0, p95-style cap) after its earlier 0.5 first run and 0.8333 exact rerun. This time it collapsed cleanly to asr_wer_prefix=1.0 with CER 0.773, both EOS flags preserved, perfect gt-ASR sanity, very strong in-domain WER 0.111, short generations (~28/39 frames), and full throughput (~30.9k samples / 10 min). So the mixed-text plain grouped 2-head branch now looks more like another bimodal in-domain-only side effect than a live contender; after three runs (`0.5 -> 0.8333 -> 1.0`) it no longer deserves to be treated as a serious broader successor.","timestamp":1773894402714,"segment":0}
{"run":541,"commit":"9cea09c","metric":1,"metrics":{},"status":"discard","description":"Ran a third probe of the original diff-targeted sampled grouped 2-head clue (`text_source=both_weighted_sampled_diff`, normalized/raw weights 3/1, `text_source_weighted_sampled_passes=2`, `semantic_future_prediction_steps=2`, plain `semantic_block_decode_size=3`, `semantic_block_decode_max_grouped_tokens=12`, future weight 0.5, scheduled sampling 0.5, EOS weight 2.0, p95-style cap) after its earlier `0.5 -> 0.8333` sequence. This time it collapsed cleanly to asr_wer_prefix=1.0 with CER 0.682, both EOS flags preserved, near-perfect gt-ASR sanity 0.045, decent in-domain WER 0.333, healthy coverage (~31.0k samples / 10 min), and no primary upside. So the original diff-targeted sampled grouped clue now also looks more like a bimodal in-domain-heavy side effect than a live broader branch; after three probes it no longer deserves to be treated as the cleanest sampled-side improvement over the reproducible 0.6667 backbone.","timestamp":1773895157292,"segment":0}
{"run":542,"commit":"9cea09c","metric":1,"metrics":{},"status":"discard","description":"Ran a third probe of the noisy aligned normalized exact-last 12-token center (`text_source=normalized`, `semantic_future_prediction_steps=2`, `semantic_block_decode_size=3`, `semantic_block_decode_exact_last_token=true`, `semantic_block_decode_max_grouped_tokens=12`, future weight 0.5, scheduled sampling 0.5, EOS weight 2.0, p95-style cap) after its earlier `0.5 -> 0.6667` sequence. This time it collapsed cleanly to asr_wer_prefix=1.0 with CER 0.773, both EOS flags preserved, perfect gt-ASR sanity, short generations (~30/32 frames), but weak in-domain WER 0.889 and no primary upside. So the aligned normalized exact-last family now also looks sharply bimodal at its original 12-token center; the only remaining reproducible signal in that family is the narrower 9-token tie-level side path, not the original 12-token branch.","timestamp":1773895969839,"segment":0}
{"run":543,"commit":"9cea09c","metric":1,"metrics":{},"status":"discard","description":"Ran a third probe of the previously reproducible sampled grouped 2-head backbone (`text_source=both_weighted_sampled`, normalized/raw weights 3/1, `text_source_weighted_sampled_passes=2`, `semantic_future_prediction_steps=2`, plain `semantic_block_decode_size=3`, `semantic_block_decode_max_grouped_tokens=12`, future weight 0.5, scheduled sampling 0.5, EOS weight 2.0, p95-style cap) after its earlier `0.6667 -> 0.6667` sequence. This time it collapsed cleanly to asr_wer_prefix=1.0 with CER 0.682, both EOS flags preserved, perfect gt-ASR sanity, healthy coverage (~30.8k samples / 10 min), but only middling in-domain WER 0.556 and no primary upside. So the sampled grouped 2-head branch is less reproducible than it looked after two runs; it now also reads as a broader noisy/bimodal family rather than as a truly stable 0.6667 backbone.","timestamp":1773896858257,"segment":0}
{"run":544,"commit":"9cea09c","metric":0.6666666865348816,"metrics":{},"status":"discard","description":"Ran a third probe of the aligned four-head grouped-prefix mainline (`text_source=normalized`, `semantic_future_prediction_steps=4`, plain `semantic_block_decode_size=3`, `semantic_block_decode_max_grouped_tokens=12`, future weight 0.5, scheduled sampling 0.5, EOS weight 2.0, tokenizer/model-vocab alignment fix, p95-style cap) after its earlier `0.6667 -> 0.6667` sequence. It held the same asr_wer_prefix=0.6667 again with CER 0.682, both EOS flags preserved, perfect gt-ASR sanity, very strong in-domain WER 0.111, short generations (~30/40 frames), and healthy coverage (~29.8k samples / 10 min). So unlike several recently pruned 2-head side branches, the aligned 4-head grouped mainline still looks like a genuinely reproducible 0.6667 backbone on third probe, even though it does not improve on the primary metric.","timestamp":1773897632567,"segment":0}
{"run":545,"commit":"9cea09c","metric":1,"metrics":{},"status":"discard","description":"Ran a third probe of the aligned normalized exact-last 9-token side path (`text_source=normalized`, `semantic_future_prediction_steps=2`, `semantic_block_decode_size=3`, `semantic_block_decode_exact_last_token=true`, `semantic_block_decode_max_grouped_tokens=9`, future weight 0.5, scheduled sampling 0.5, EOS weight 2.0, p95-style cap) after its earlier `0.6667 -> 0.6667` sequence. This time it collapsed cleanly to asr_wer_prefix=1.0 with CER 0.818, both EOS flags preserved, perfect gt-ASR sanity, but weak in-domain WER 0.889, longer OOD generation (~40 frames), and no primary upside. So the normalized exact-last 9-token path is less reproducible than it looked after two runs; it now also reads as another bimodal side branch rather than a truly stable 0.6667 family.","timestamp":1773898389907,"segment":0}
{"run":546,"commit":"9cea09c","metric":1,"metrics":{},"status":"discard","description":"Ran a third probe of the mixed-text aligned four-head grouped fuller-LoRA fallback (`text_source=both`, `semantic_future_prediction_steps=4`, plain `semantic_block_decode_size=3`, `semantic_block_decode_max_grouped_tokens=12`, future weight 0.5, scheduled sampling 0.5, EOS weight 2.0, tokenizer/model-vocab alignment fix, `lora_targets=[q_proj,k_proj,v_proj,o_proj,gate,up,down]`, p95-style cap) after its earlier `0.6667 -> 0.6667` sequence. This time it collapsed cleanly to asr_wer_prefix=1.0 with CER 0.773, both EOS flags preserved, weak in-domain WER 0.556, degraded gt-ASR sanity 0.100, longer generations (~41/43 frames), and reduced coverage (~21.2k samples / 10 min). So this fuller-LoRA mixed-text fallback is less reproducible than it looked after two runs; it now also reads as another noisy side branch rather than as a truly stable 0.6667 backup to the plain aligned four-head grouped mainline.","timestamp":1773899179790,"segment":0}
{"run":554,"commit":"a4e2f21","metric":1,"metrics":{},"status":"discard","description":"Restored `examples/ljspeech.py` from the last known benchmark-bearing code surface (`9cea09c`), revalidated syntax with `py_compile`, and then reran the aligned normalized four-head grouped-prefix backbone on the current HEAD/toolchain state (`UV_NO_SYNC=1`, `text_source=normalized`, `semantic_future_prediction_steps=4`, future weight 0.5, scheduled sampling 0.5, EOS weight 2.0, tokenizer/model-vocab alignment fix, plain `semantic_block_decode_size=3`, `semantic_block_decode_max_grouped_tokens=12`). This did not recover the old behavior: it regressed all the way to asr_wer_prefix=1.0 with CER 0.909, though both EOS flags stayed on and in-domain WER was only 0.444. Coverage remained very low (~17.6k samples / 10 min). So simply restoring `examples/ljspeech.py` is not enough to recover the old benchmark regime on top of the newer HEAD; the drift is deeper than that, likely in surrounding repo/toolchain state rather than only the top-level benchmark script.","timestamp":1773904301035,"segment":0}
{"run":555,"commit":"a4e2f21","metric":1,"metrics":{},"status":"discard","description":"Restored both `examples/ljspeech.py` and the older Linux-enabled JAX cache behavior in `xax/task/mixins/compile.py` from the last benchmark-bearing code surface (`9cea09c`), then reran the aligned normalized four-head grouped-prefix backbone (`UV_NO_SYNC=1`, `text_source=normalized`, `semantic_future_prediction_steps=4`, future weight 0.5, scheduled sampling 0.5, EOS weight 2.0, plain `semantic_block_decode_size=3`, `semantic_block_decode_max_grouped_tokens=12`). This recovered the old throughput regime (~30.1k samples / 10 min, 3759 steps) but **not** the old quality: asr_wer_prefix still stayed at 1.0 with CER 0.818, in-domain WER 0.667, and both EOS flags preserved. So the benchmark drift on the newer repo/toolchain state is not just a compile-cache throughput issue; restoring the older script plus Linux JAX cache behavior recovers speed but not the historical aligned grouped quality.","timestamp":1773905208766,"segment":0}
{"run":556,"commit":"a4e2f21","metric":1,"metrics":{},"status":"discard","description":"Exact reran the same partially restored benchmark surface — `examples/ljspeech.py` plus the older Linux-enabled `xax/task/mixins/compile.py` behavior from `9cea09c` — on the aligned normalized four-head grouped-prefix backbone (`UV_NO_SYNC=1`, `text_source=normalized`, `semantic_future_prediction_steps=4`, future weight 0.5, scheduled sampling 0.5, EOS weight 2.0, plain `semantic_block_decode_size=3`, `semantic_block_decode_max_grouped_tokens=12`). It again stayed at asr_wer_prefix=1.0, this time with CER 0.773, in-domain WER 0.667, both EOS flags preserved, and the same restored high coverage (~30.0k samples / 10 min). So the new benchmark drift is now clearly reproducible: recovering the old throughput regime on top of the newer repo/toolchain state still does not recover the historical 0.6667 aligned grouped quality.","timestamp":1773905964175,"segment":0}
{"run":557,"commit":"40c8504","metric":1,"metrics":{},"status":"discard","description":"Broadened the benchmark-surface restoration beyond `examples/ljspeech.py` and Linux JAX cache behavior by also restoring the only other runtime-relevant files changed since the old benchmark-bearing surface (`9cea09c`): `xax/task/logger.py`, `xax/task/mixins/supervised.py`, and `xax/arch/speech/asr.py`. Then reran the aligned normalized four-head grouped-prefix backbone (`UV_NO_SYNC=1`, `text_source=normalized`, `semantic_future_prediction_steps=4`, future weight 0.5, scheduled sampling 0.5, EOS weight 2.0, plain `semantic_block_decode_size=3`, `semantic_block_decode_max_grouped_tokens=12`). This still failed at asr_wer_prefix=1.0 with restored high coverage (~29.9k samples / 10 min), CER 0.818, in-domain WER 0.667, and both EOS flags preserved. So restoring the remaining small runtime diffs beyond `examples/ljspeech.py` and `compile.py` is not enough to recover the historical `0.6667` benchmark surface on current HEAD.","timestamp":1773906993398,"segment":0}
{"run":558,"commit":"40c8504","metric":0.8333333134651184,"metrics":{},"status":"discard","description":"Exact reran the broader benchmark-surface restoration (restored `examples/ljspeech.py`, `xax/task/mixins/compile.py`, `xax/task/logger.py`, `xax/task/mixins/supervised.py`, and `xax/arch/speech/asr.py` from `9cea09c`) on the aligned normalized four-head grouped-prefix backbone (`UV_NO_SYNC=1`, `text_source=normalized`, `semantic_future_prediction_steps=4`, future weight 0.5, scheduled sampling 0.5, EOS weight 2.0, plain `semantic_block_decode_size=3`, `semantic_block_decode_max_grouped_tokens=12`). The rerun improved only partway to asr_wer_prefix=0.8333 with CER 0.591, but in-domain WER still stayed at 1.0 despite both EOS flags and full restored coverage (~29.9k samples / 10 min). So even the broader restored benchmark surface remains noisy and clearly worse than the historical reproducible `0.6667`; repo-surface restoration alone is still not sufficient to recover the old regime.","timestamp":1773907000552,"segment":0}
{"run":559,"commit":"40c8504","metric":0.8333333134651184,"metrics":{},"status":"discard","description":"Ran a third probe of the fully restored benchmark-bearing runtime surface — current working tree now matches `9cea09c` for all runtime-relevant files (`examples/ljspeech.py`, `xax/task/mixins/compile.py`, `xax/task/logger.py`, `xax/task/mixins/supervised.py`, and `xax/arch/speech/asr.py`) — on the aligned normalized four-head grouped-prefix backbone (`UV_NO_SYNC=1`, `text_source=normalized`, `semantic_future_prediction_steps=4`, future weight 0.5, scheduled sampling 0.5, EOS weight 2.0, plain `semantic_block_decode_size=3`, `semantic_block_decode_max_grouped_tokens=12`). This third probe again stayed degraded at asr_wer_prefix=0.8333 with CER 0.682, in-domain WER 1.0, and full restored coverage (~29.9k samples / 10 min). So the drift is now clear: even when the local runtime code surface is effectively back to `9cea09c`, the historical reproducible `0.6667` backbone no longer returns, which strongly points to non-repo state drift (external model/tokenizer artifacts, caches, or other environment state) rather than an un-restored source diff.","timestamp":1773907820636,"segment":0}
{"run":560,"commit":"40c8504","metric":1,"metrics":{},"status":"discard","description":"Added optional `llm_revision` support in `examples/ljspeech.py` / `xax/arch/llm.py`, rebuilt the aligned normalized 4-head grouped backbone with the older Qwen upload snapshot `167b8104f88905a951069f5f95f9776908da5f68`, and reran the 10-minute benchmark (`UV_NO_SYNC=1`, normalized text, future depth 4, grouped prefix 12). This regressed cleanly to asr_wer_prefix=1.0 with CER 0.864, in-domain WER 0.778, EOS on both prompts, short generations (~29/41 frames), and full old-regime coverage (~30.2k samples / 10 min). A supporting diagnostic also found the rebuilt pinned-revision train/unpadded Arrow payloads and Qwen `model.safetensors` hashes are byte-identical to the current main snapshot, so pinning Qwen back to the old upload revision is not the missing explanation for the post-`9cea09c` benchmark drift.","timestamp":1773909773789,"segment":0}
{"run":561,"commit":"9cea09c","metric":1,"metrics":{},"status":"discard","description":"Created a dedicated detached worktree at the full historical benchmark-bearing commit `9cea09c`, symlinked it to the current repaired `.venv`, prebuilt the canonical aligned normalized 4-head grouped caches there, and reran the 10-minute diagnostic backbone directly from that old worktree (`UV_NO_SYNC=1`, normalized text, future depth 4, grouped prefix 12). This still failed cleanly at asr_wer_prefix=1.0 with CER 0.773, in-domain WER 0.556, EOS on both prompts, and restored old-regime coverage (~30.1k samples / 10 min, 3763 steps). So even a full real checkout of `9cea09c` does not recover the historical `0.6667` under the current repaired environment, which strongly downgrades the remaining 'dedicated old benchmark branch' hypothesis and points even more directly to non-repo environment/toolchain state.","timestamp":1773910936931,"segment":0}
{"run":562,"commit":"9cea09c","metric":0,"metrics":{},"status":"crash","description":"Tested a partial older-library reconstruction by overlaying `datasets==3.6.0` on top of the current repaired environment while benchmarking the full `9cea09c` worktree and the canonical aligned normalized 4-head grouped backbone. This crashed before training could proceed because older `datasets` could not load the current preserved cached Arrow datasets: `ValueError: Feature type 'List' not found` when reading `/home/ben/Experiments/Data/processed/lj_speech_tts/train/a009c9c8eee13c4a_e4146c08`. That is a useful new clue: dataset-library provenance is now clearly part of the benchmark surface, and the current preserved caches are written in a newer format that older `datasets` cannot even read.","timestamp":1773911222331,"segment":0}
{"run":563,"commit":"9cea09c","metric":1,"metrics":{},"status":"discard","description":"Pushed the older-`datasets` reconstruction farther by running the full `9cea09c` worktree under a `datasets==3.6.0` + `librosa/soundfile` overlay, patching the raw LJSpeech load to `trust_remote_code=True`, rebuilding tokenized/unpadded/train caches from scratch into an isolated temp data dir, and then rerunning the canonical aligned normalized 4-head grouped backbone. The rebuilt old-`datasets` cache surface was materially different (padding lengths shifted to 156/122, filtered train size to 12365 vs the current 12315), but the benchmark still failed cleanly at asr_wer_prefix=1.0 with CER 0.591, in-domain WER 0.778, EOS on both prompts, and much lower coverage (~17.4k samples / 10 min). So dataset-library provenance is definitely part of the benchmark surface, but simply reconstructing an older `datasets` stack and older-format caches does not recover the historical `0.6667` backbone either.","timestamp":1773913982209,"segment":0}
{"run":564,"commit":"9cea09c","metric":1,"metrics":{},"status":"discard","description":"Tested a broader older Hugging Face stack by running the full `9cea09c` worktree under a `transformers==4.52.4` overlay (with `tokenizers 0.21.4`, `huggingface_hub 0.36.2`, `safetensors 0.7.0`) while reusing the canonical tokenized cache through an isolated temp data dir, rebuilding unpadded/train there, and rerunning the aligned normalized 4-head grouped backbone. This still failed cleanly at asr_wer_prefix=1.0 with gt-ASR sanity 0.0, very strong in-domain WER 0.111, EOS on both prompts, restored old-regime coverage (~30.1k samples / 10 min), and a longer OOD generation (~55 frames). So a modestly older HF tokenizer/model-loading stack is not enough by itself to recover the historical `0.6667` backbone either, though the changed in-domain behavior suggests HF package provenance is still touching generation semantics.","timestamp":1773915052795,"segment":0}
{"run":565,"commit":"9cea09c","metric":0,"metrics":{},"status":"crash","description":"Tried a cleaner multi-package reconstruction by combining the older `datasets==3.6.0` overlay with the older HF stack (`transformers==4.52.4`, `tokenizers 0.21.4`) while reusing the current canonical `tokenized/v4` cache through an isolated temp data dir. This crashed immediately because older `datasets` could not even read the current tokenized cache format: `ValueError: Feature type 'List' not found` when loading `/tmp/xax-data-ds360hf452/processed/lj_speech_tts/tokenized/v4`. So the cache-format drift extends all the way back to the tokenized stage, not just train/unpadded, and any serious older-`datasets` reconstruction needs an older-format tokenized cache too.","timestamp":1773915176065,"segment":0}
{"run":566,"commit":"cd0c095","metric":0.6666666865348816,"metrics":{},"status":"keep","description":"Recovered the historical aligned normalized 4-head grouped benchmark surface by running the full detached `9cea09c` worktree under a combined older environment: `datasets==3.6.0`, `transformers==4.52.4`, `tokenizers 0.21.4`, `huggingface_hub 0.36.2`, plus a fresh old-format tokenized/unpadded/train rebuild in an isolated temp data dir. On that reconstructed surface, the canonical diagnostic backbone (`text_source=normalized`, future depth 4, grouped prefix 12, future weight 0.5, scheduled sampling 0.5, EOS weight 2.0) finally recovered asr_wer_prefix=0.6667 again with CER 0.5, EOS on both prompts, and near-old-regime coverage (~29.5k samples / 10 min). This is the first real post-drift comparability recovery, so the next priority is exact rerun / minimal-factor isolation inside this combined environment path.","timestamp":1773917728356,"segment":0}
{"run":567,"commit":"9cea09c","metric":1,"metrics":{},"status":"discard","description":"Exact reran the newly recovered combined environment path — detached `9cea09c` worktree + `datasets==3.6.0` + `transformers==4.52.4` / `tokenizers 0.21.4` / `huggingface_hub 0.36.2`, reusing the freshly rebuilt old-format tokenized/unpadded/train caches in `/tmp/xax-data-ds36hf452` — on the canonical aligned normalized 4-head grouped backbone. It collapsed straight back to asr_wer_prefix=1.0 with CER 0.727, in-domain WER 0.556, EOS on both prompts, and badly reduced coverage (~17.7k samples / 10 min, 2213 steps). So the first `0.6667` recovery is real but not yet reproducible; this combined old-environment path is now a live but still noisy benchmark-surface clue rather than a fully stabilized recovered regime.","timestamp":1773918539771,"segment":0}
{"run":568,"commit":"9cea09c","metric":1,"metrics":{},"status":"discard","description":"Ran a third probe of the combined recovered environment path — detached `9cea09c` worktree + `datasets==3.6.0` + `transformers==4.52.4` / `tokenizers 0.21.4` / `huggingface_hub 0.36.2`, again reusing the already rebuilt old-format caches in `/tmp/xax-data-ds36hf452` — on the canonical aligned normalized 4-head grouped backbone. It collapsed to asr_wer_prefix=1.0 again with CER 0.636, in-domain WER 1.0, EOS on both prompts, and the same badly reduced coverage (~17.6k samples / 10 min, 2203 steps). So the first `0.6667` recovery now looks like a one-off within this combined environment unless the **fresh-cache rebuild itself** is part of the live mechanism.","timestamp":1773919381813,"segment":0}
