{"run":343,"commit":"14352ef","metric":0.8333333134651184,"metrics":{},"status":"discard","description":"Probed the new generic weighted-text branch closer to the original 1:1 mixed-text ratio by testing a 3:2 normalized/raw mix (`text_source=both_weighted`, normalized repeats 3, raw repeats 2) on the aligned four-head grouped-prefix recipe. This stayed fast at 3819 steps / 30.6k samples and preserved EOS on both prompts, but the primary metric only reached asr_wer_prefix=0.8333. So the weighted-mix sweet spot does not seem to live near this milder 3:2 ratio; the better signals still appear more concentrated in the 2:1–3:1 normalized-heavy range.","timestamp":1773727603967,"segment":0}
{"run":344,"commit":"14352ef","metric":1,"metrics":{},"status":"discard","description":"Pushed the generic weighted-text branch to an intermediate 5:2 normalized/raw mix (`text_source=both_weighted`, normalized repeats 5, raw repeats 2) on the aligned four-head grouped-prefix recipe. Despite preserving EOS on both prompts and even hitting perfect in-domain WER 0.0, the OOD primary metric regressed cleanly to asr_wer_prefix=1.0 with CER 0.818 and slightly weaker gt-ASR sanity. So the weighted-mix sweet spot is not simply any ratio between 2:1 and 3:1; this 5:2 point already looks like another in-domain-only side effect rather than a robust improvement.","timestamp":1773728607051,"segment":0}
{"run":345,"commit":"14352ef","metric":1,"metrics":{},"status":"discard","description":"Added a new `text_source=both_weighted_balanced` path to test whether the live normalized-heavy weighted mix stabilizes better when each utterance keeps only one transcript variant instead of literal dataset duplication. The first probe used a 3:1 normalized/raw assignment by utterance index on the aligned four-head grouped-prefix recipe, preserving the same weighted ratio as the earlier duplicated 3:1 branch while restoring the dataset to one text variant per audio. This failed cleanly at asr_wer_prefix=1.0 with CER 0.955, so the weighted-mix clue does not seem to come from duplication-free one-variant balancing; the first balanced weighted formulation should be reverted and pruned.","timestamp":1773729510102,"segment":0}
{"run":346,"commit":"4894aa5","metric":0.6666666865348816,"metrics":{},"status":"keep","description":"Ran a third independent benchmark of the live 3:1 normalized/raw weighted-text branch (`text_source=both_weighted`, normalized repeats 3, raw repeats 1) on the aligned four-head grouped-prefix recipe to measure whether its earlier 0.5->0.8333 behavior was just pure collapse or a broader distribution. This third run landed in the middle at asr_wer_prefix=0.6667 with CER 0.682, EOS on both prompts, and the usual high throughput (~30.4k samples / 10 min). So the 3:1 weighted mix is still clearly fragile, but it now looks less catastrophically unstable than the first 2:1 weighted branch: across three runs it has produced 0.5, 0.8333, and 0.6667 rather than collapsing twice to 1.0.","timestamp":1773730350228,"segment":0}
{"run":347,"commit":"4894aa5","metric":1,"metrics":{},"status":"discard","description":"Exact reran the 4:1 normalized/raw weighted-text branch (`text_source=both_weighted`, normalized repeats 4, raw repeats 1) on the aligned four-head grouped-prefix recipe. Its first run had landed at the old reproducible 0.6667 level, but the rerun collapsed all the way back to asr_wer_prefix=1.0 with CER 0.864. So 4:1 normalized-heavy weighting is not a reproducible stable alternative; it now looks like another fragile weighted side branch rather than a reliable fallback.","timestamp":1773731118936,"segment":0}
{"run":348,"commit":"4894aa5","metric":1,"metrics":{},"status":"discard","description":"Tested the only still-somewhat-live late-boundary schedule clue on top of the weighted 3:1 normalized/raw branch by replacing the plain 12-token grouped prefix with `semantic_block_decode_schedule=3,3,3,1,2` while keeping the aligned four-head future-Q0 recipe and `text_source=both_weighted` (normalized repeats 3, raw repeats 1). This failed cleanly at asr_wer_prefix=1.0 despite decent CER 0.636 and healthy throughput, so the late-boundary schedule clue does not rescue or stabilize the weighted-text branch either.","timestamp":1773731934978,"segment":0}
{"run":349,"commit":"1f20fc3","metric":0.8333333134651184,"metrics":{},"status":"keep","description":"Tested the generic weighted-text infrastructure at the old 2:1 normalized/raw ratio (`text_source=both_weighted`, normalized repeats 2, raw repeats 1) on the aligned four-head grouped-prefix recipe. This first reusable 2:1 run landed at asr_wer_prefix=0.8333 with CER 0.773, EOS on both prompts, and the usual high throughput (~30.5k samples / 10 min). So the old 2:1 clue was not unique to the hardcoded path, but it still looks weaker and more collapse-prone than the newer 3:1 branch: across the 2:1 family we now have 0.5, 1.0, and 0.8333 rather than a clear reproducible improvement.","timestamp":1773733133760,"segment":0}
{"run":350,"commit":"b05cd86","metric":0.6666666865348816,"metrics":{},"status":"keep","description":"Tested whether the live 3:1 normalized/raw weighted-text clue is actually specific to grouped-prefix decoding by ablating the grouped prefix entirely: kept the aligned four-head future-Q0 recipe with exact token-by-token semantic decoding, but switched text conditioning to `text_source=both_weighted` with normalized repeats 3 and raw repeats 1. Surprisingly this tied the old robust best at asr_wer_prefix=0.6667 with CER 0.682, EOS on both prompts, and even slightly higher throughput (~30.6k samples / 10 min). So normalized-heavy weighted text is not purely a grouped-prefix-only effect; it can also materially rescue the aligned exact-decoding backbone.","timestamp":1773733880245,"segment":0}
{"run":351,"commit":"b05cd86","metric":1,"metrics":{},"status":"discard","description":"Exact reran the new weighted-text transfer onto the aligned four-head exact-decoding backbone (`text_source=both_weighted`, normalized repeats 3, raw repeats 1, no grouped prefix). The first run had surprisingly tied the robust 0.6667 baseline, but the rerun collapsed back to asr_wer_prefix=1.0 with worse CER 0.818 despite very strong in-domain WER 0.222 and EOS on both prompts. So normalized-heavy weighted text is not purely grouped-specific, but its transfer to the exact-decoding backbone is also fragile rather than a new reproducible mainline.","timestamp":1773734627481,"segment":0}
{"run":352,"commit":"b05cd86","metric":1,"metrics":{},"status":"discard","description":"Mapped the exact-decoding transfer further by testing the generic 2:1 normalized/raw weighted mix (`text_source=both_weighted`, normalized repeats 2, raw repeats 1) on the aligned four-head future-Q0 backbone with no grouped prefix. Unlike the one noisy 3:1 exact-decoding success, this 2:1 transfer failed cleanly at asr_wer_prefix=1.0 with CER 0.773, despite very strong in-domain WER 0.222 and EOS on both prompts. So the exact-decoding weighted-text clue, if real at all, is at least narrower than just 'any normalized-heavy mix' and currently looks centered closer to 3:1 than 2:1.","timestamp":1773735381234,"segment":0}
{"run":353,"commit":"b05cd86","metric":1,"metrics":{},"status":"discard","description":"Extended the exact-decoding weighted-text map farther toward normalized text by testing `text_source=both_weighted` with repeats 4/1 on the aligned four-head future-Q0 backbone and no grouped prefix. This failed cleanly at asr_wer_prefix=1.0 with CER 0.727, so the one 3:1 exact-decoding hit does not extend monotonically toward more normalized-heavy weighting. The exact-decoding weighted clue now looks very narrow and noisy rather than like a general benefit from simply increasing normalized-text mass.","timestamp":1773736226068,"segment":0}
{"run":354,"commit":"20f1369","metric":0.8333333134651184,"metrics":{},"status":"keep","description":"Ran a fourth independent benchmark of the live grouped 3:1 normalized/raw weighted-text branch (`text_source=both_weighted`, normalized repeats 3, raw repeats 1) on the aligned four-head grouped-prefix recipe. This time it landed at asr_wer_prefix=0.8333 with CER 0.909, EOS on both prompts, and very strong in-domain WER 0.222. That is not a new primary win, but it matters for the stability map: across four grouped 3:1 runs this branch has now produced 0.5, 0.8333, 0.6667, and 0.8333 — still fragile, but notably it has stayed sub-1.0 on every independent run so far, which makes it look more reproducible than the neighboring 2:1 family.","timestamp":1773737023000,"segment":0}
{"run":355,"commit":"20f1369","metric":1,"metrics":{},"status":"discard","description":"Ran a third independent benchmark of the weighted 3:1 normalized/raw transfer onto the aligned four-head exact-decoding backbone (`text_source=both_weighted`, normalized repeats 3, raw repeats 1, no grouped prefix). After one initial 0.6667 hit and one collapse to 1.0, this third run also fell back to asr_wer_prefix=1.0 with CER 0.909 and longer OOD output (45 frames). So the exact-decoding weighted-text clue now looks mostly stale/noisy: it has produced one tie-level hit followed by two clean collapses, unlike the grouped 3:1 branch which has stayed sub-1.0 on every rerun so far.","timestamp":1773737934319,"segment":0}
{"run":356,"commit":"c5b5892","metric":0.8333333134651184,"metrics":{},"status":"keep","description":"Tested whether the live grouped 3:1 weighted branch prefers a much shorter speculative window by reducing `semantic_block_decode_max_grouped_tokens` from 12 to 6 while keeping `text_source=both_weighted` (normalized repeats 3, raw repeats 1) and the aligned four-head grouped-prefix recipe. This stayed sub-1.0 at asr_wer_prefix=0.8333 with EOS on both prompts, but it did not improve on the 12-token branch and it cut 10-minute throughput noticeably to 2915 steps / 23.3k samples. So the weighted 3:1 clue does not obviously want a much shorter grouped prefix; the original 12-token window still looks at least as good and more sample-efficient.","timestamp":1773738680926,"segment":0}
{"run":357,"commit":"c5b5892","metric":1,"metrics":{},"status":"discard","description":"Tested a short late-bridge schedule on the live weighted 3:1 grouped branch by replacing the plain grouped prefix with `semantic_block_decode_schedule=3,1,2` while keeping `text_source=both_weighted` (normalized repeats 3, raw repeats 1) and the aligned four-head future-Q0 recipe. This regressed cleanly to asr_wer_prefix=1.0 with CER 0.864 and low throughput (~23.3k samples / 10 min). So the late-boundary bridge+taper family still does not rescue the weighted 3:1 branch even when shortened to a 6-token schedule.","timestamp":1773739465487,"segment":0}
{"run":358,"commit":"c5b5892","metric":1,"metrics":{},"status":"discard","description":"Mapped the minimum useful grouped-prefix length on the live weighted 3:1 branch by shrinking `semantic_block_decode_max_grouped_tokens` all the way to 3, i.e. only one grouped 3-token speculative step before exact decoding. This failed cleanly at asr_wer_prefix=1.0 with CER 0.818 despite very strong in-domain WER 0.111 and EOS on both prompts. So the weighted 3:1 clue does not survive with only a single grouped step; it appears to need a longer grouped prefix than 3 tokens, and probably longer than the slower 6-token retune as well.","timestamp":1773740215333,"segment":0}
{"run":359,"commit":"a3347d6","metric":0.8333333134651184,"metrics":{},"status":"keep","description":"Ran a fifth independent benchmark of the live grouped 3:1 normalized/raw weighted-text branch (`text_source=both_weighted`, normalized repeats 3, raw repeats 1) on the aligned four-head grouped-prefix recipe. This again stayed sub-1.0 at asr_wer_prefix=0.8333 with CER 0.682, EOS on both prompts, and full throughput (~30.5k samples / 10 min). That matters more than the raw score: across five independent grouped runs, the 3:1 weighted branch has now produced 0.5, 0.8333, 0.6667, 0.8333, and 0.8333 — still not a new best, but much more reproducible than the neighboring weighted variants and much less collapse-prone than the exact-decoding transfer.","timestamp":1773741004666,"segment":0}
{"run":360,"commit":"a3347d6","metric":1,"metrics":{},"status":"discard","description":"Tested whether the historical exact-last grouped transition can stabilize the live weighted 3:1 grouped branch by setting `semantic_block_decode_exact_last_token=true` on top of `text_source=both_weighted` (normalized repeats 3, raw repeats 1) and the aligned four-head grouped-prefix recipe with a 12-token grouped window. This regressed cleanly to asr_wer_prefix=1.0 with CER 0.864, slower throughput (~30.0k vs ~30.5k samples / 10 min), and no secondary upside. So exact-last does not rescue the weighted 3:1 branch either; this transition family should now be treated as stale for the weighted path too.","timestamp":1773741850468,"segment":0}
{"run":361,"commit":"a3347d6","metric":1,"metrics":{},"status":"discard","description":"Mapped the grouped-prefix length on the live weighted 3:1 branch at an intermediate cutoff by testing `semantic_block_decode_max_grouped_tokens=9` with `text_source=both_weighted` (normalized repeats 3, raw repeats 1) on the aligned four-head grouped-prefix recipe. This failed cleanly at asr_wer_prefix=1.0 with CER 0.818 despite healthy throughput (~30.5k samples / 10 min) and EOS on both prompts. So the weighted 3:1 branch now looks sharply localized around the original 12-token grouped prefix: 3 and 9 both collapse to 1.0, while 6 only reaches 0.8333 more slowly.","timestamp":1773742596057,"segment":0}
{"run":362,"commit":"a3347d6","metric":1,"metrics":{},"status":"discard","description":"Extended the grouped-prefix length map on the live weighted 3:1 branch by testing a longer `semantic_block_decode_max_grouped_tokens=15` while keeping `text_source=both_weighted` (normalized repeats 3, raw repeats 1) and the aligned four-head grouped-prefix recipe. This also regressed cleanly to asr_wer_prefix=1.0 with CER 0.864, so the weighted 3:1 branch now looks sharply localized around the original 12-token grouped window: 3, 9, and 15 all collapse to 1.0, while 6 only reaches 0.8333 more slowly.","timestamp":1773743382296,"segment":0}
{"run":363,"commit":"a3347d6","metric":1,"metrics":{},"status":"discard","description":"Tested whether emphasizing Stage 1 can stabilize the live grouped 3:1 weighted branch by setting `semantic_loss_weight=2.0` and `acoustic_loss_weight=0.5` on top of `text_source=both_weighted` (normalized repeats 3, raw repeats 1) and the aligned four-head grouped-prefix recipe. This failed cleanly at asr_wer_prefix=1.0 while cutting 10-minute sample coverage sharply to 18.1k examples, so simple Stage-1 upweighting / Stage-2 downweighting is stale for the weighted branch too.","timestamp":1773744258751,"segment":0}
{"run":364,"commit":"3da6e66","metric":0.8333333134651184,"metrics":{},"status":"keep","description":"Tested whether a text-prefix LM anchor can stabilize the live grouped 3:1 weighted branch by adding `text_loss_weight=0.1` on top of `text_source=both_weighted` (normalized repeats 3, raw repeats 1) and the aligned four-head grouped-prefix recipe. This stayed sub-1.0 at asr_wer_prefix=0.8333 with improved CER 0.636, but it cut 10-minute sample coverage to only 23.0k examples and in-domain WER regressed to 1.0. So a simple text-loss anchor is at best a weak weighted-branch side clue, not a clear stabilizer or new mainline.","timestamp":1773745012709,"segment":0}
{"run":365,"commit":"1de8b6a","metric":0.8333333134651184,"metrics":{},"status":"keep","description":"Ran a sixth independent benchmark of the live grouped 3:1 normalized/raw weighted-text branch (`text_source=both_weighted`, normalized repeats 3, raw repeats 1) on the aligned four-head grouped-prefix recipe after mapping several failed nearby retunes. This again stayed sub-1.0 at asr_wer_prefix=0.8333, and this time CER improved sharply to 0.545 with in-domain WER 0.333 and full throughput (~30.3k samples / 10 min). Across six independent grouped runs, the 3:1 weighted branch has now produced 0.5, 0.8333, 0.6667, 0.8333, 0.8333, and 0.8333 — still not a new best, but clearly the most reproducible weighted branch we have.","timestamp":1773745826812,"segment":0}
{"run":366,"commit":"1de8b6a","metric":1,"metrics":{},"status":"discard","description":"Exact reran the weighted-branch text-anchor side clue by adding `text_loss_weight=0.1` on top of the live grouped 3:1 normalized/raw branch (`text_source=both_weighted`, normalized repeats 3, raw repeats 1, aligned four-head grouped-prefix recipe). The first run had stayed at 0.8333 with better CER, but this rerun collapsed back to asr_wer_prefix=1.0 despite the same large throughput penalty (~22.9k samples / 10 min). So the weighted-branch text-loss anchor now looks noisy rather than stabilizing; it is not a reproducible improvement path in its current form.","timestamp":1773746713267,"segment":0}
{"run":367,"commit":"1de8b6a","metric":1,"metrics":{},"status":"discard","description":"Tested whether a milder text-prefix LM anchor could preserve the one-off CER gain on the live grouped 3:1 weighted branch by lowering the anchor to `text_loss_weight=0.05`. This failed badly: asr_wer_prefix regressed to 1.0, CER worsened to 0.955, and throughput collapsed further to only 13.7k samples / 10 min. So the weighted-branch text-loss anchor looks stale/noisy in this neighborhood rather than like a usable stabilizer.","timestamp":1773747464322,"segment":0}
{"run":368,"commit":"1de8b6a","metric":1,"metrics":{},"status":"discard","description":"Ran a seventh independent benchmark of the plain live grouped 3:1 normalized/raw weighted branch (`text_source=both_weighted`, normalized repeats 3, raw repeats 1, aligned four-head grouped-prefix recipe, 12-token grouped window) after the latest side-branch failures. This time it finally collapsed to asr_wer_prefix=1.0 with CER 0.682, even though EOS still fired on both prompts and throughput stayed normal (~30.3k samples / 10 min). So the branch is still the strongest weighted family overall, but it is no longer true that it has stayed sub-1.0 on every grouped rerun; the stability story needs to be downgraded from 'never collapsed' to 'more reproducible than neighbors, but still capable of full collapse.'","timestamp":1773748250959,"segment":0}
{"run":369,"commit":"68fa085","metric":0.5,"metrics":{},"status":"keep","description":"Ran an eighth independent benchmark of the plain live grouped 3:1 normalized/raw weighted branch (`text_source=both_weighted`, normalized repeats 3, raw repeats 1, aligned four-head grouped-prefix recipe, 12-token grouped window) immediately after its first full collapse. The branch bounced back strongly: asr_wer_prefix returned to 0.5 with excellent CER 0.455, EOS on both prompts, and normal throughput (~30.3k samples / 10 min). So the stability picture is now clearer: the grouped 3:1 weighted branch is definitely still noisy, but it remains the strongest weighted family overall, with a distribution that now includes two 0.5 hits, one 0.6667, four 0.8333s, and one 1.0 collapse rather than a simple monotonic decay.","timestamp":1773749212986,"segment":0}
{"run":370,"commit":"68fa085","metric":1,"metrics":{},"status":"discard","description":"Exact reran the revived grouped 3:1 normalized/raw weighted branch immediately after its new 0.5 rebound (`text_source=both_weighted`, normalized repeats 3, raw repeats 1, aligned four-head grouped-prefix recipe, 12-token grouped window). The branch collapsed again to asr_wer_prefix=1.0, OOD EOS disappeared, and the OOD utterance stretched back to the 53-frame cap. So the weighted 3:1 branch remains the strongest weighted family overall, but its distribution is now clearly bimodal/noisy rather than merely softening around 0.8333.","timestamp":1773749982860,"segment":0}
{"run":374,"commit":"ac1d47e","metric":0.8333333134651184,"metrics":{},"status":"keep","description":"Ran a tenth independent benchmark of the plain grouped 3:1 normalized/raw weighted branch (`text_source=both_weighted`, normalized repeats 3, raw repeats 1, aligned four-head grouped-prefix recipe, 12-token grouped window) after discarding the new sampled-pass reformulation. The plain branch recovered again to asr_wer_prefix=0.8333 with CER 0.636, EOS on both prompts, short generations (~32/37 frames), and full throughput (~30.6k samples / 10 min). This matters more than the raw score: after the fresh 1.0 failure and the sampled-pass dead end, the original fixed-duplicate 3:1 weighted recipe is still clearly the strongest weighted family overall. Its grouped-run distribution is now two 0.5 hits, one 0.6667, five 0.8333s, and three 1.0 collapses, and the newest failures show at least two distinct failure modes rather than a single EOS-length problem.","timestamp":1773753139391,"segment":0}
{"run":375,"commit":"89e2c35","metric":0.5,"metrics":{},"status":"keep","description":"Tested a new weighted-text stochastic-mass variant on the aligned four-head grouped-prefix recipe: added `text_source=both_weighted_sampled` with a new `text_source_weighted_sampled_passes=2`, so the model keeps the same 3:1 normalized/raw weighting but only builds two deterministic sampled passes instead of the full four-pass duplicate mass. This is the first version that truly decouples weighted sampling probability from total dataset mass within the 10-minute budget. It paid off immediately: asr_wer_prefix improved to 0.5 with excellent CER 0.455, EOS on both prompts, short generations (~30/40 frames), and full throughput (~30.5k samples / 10 min). So the weighted clue is not limited to the original fixed-duplicate formulation after all; a lower-mass two-pass sampled 3:1 variant is now a live structural branch worth rerunning.","timestamp":1773754310520,"segment":0}
