{"run":782,"commit":"a754af1","metric":0.8333333134651184,"metrics":{},"status":"discard","description":"Ran the contemporaneous wrapper-property control for the new late-total-fields clue by exact-rerunning `/tmp/xax-bench-9cea09c-oldtrain-meminfocputouchcpuusefirst-clearonlynoproxy-workercputotalswrite-nogpu`, the **fully direct Event+Value clear-only** branch that writes real **`cpu_percent + mem_rss_total + mem_vms_total`** through the synchronized wrapper properties. This weakened from the original `0.5` (#777) to **`asr_wer_prefix=0.8333`** with near-old-regime throughput (~29.9k samples / 10 min). Together with #781, that means the raw-vs-wrapper split is still somewhat noisy, but it is now much cleaner than the old full-payload comparison: the same sharpened late-total-fields subset currently lands at **`0.8333`** through wrapper-property stores versus **`1.0`** through `get_obj()` raw writes. So the setter-path semantics remain a live explanation clue for this branch, even though the branch itself is not perfectly stable.","timestamp":1774109597503,"segment":0}
{"run":783,"commit":"a754af1","metric":0.6666666865348816,"metrics":{},"status":"discard","description":"Tested whether the new late-total-fields clue depends on the **write order** of the paired late stores on the **fully direct Event+Value clear-only** branch. I built `/tmp/xax-bench-9cea09c-oldtrain-meminfocputouchcpuusefirst-clearonlynoproxy-workercputotalswrite-swapped-nogpu`, keeping the same successful real-field subset as #777 but swapping the wrapper-property store order to write **`mem_vms_total` before `mem_rss_total`**. This weakened to **`asr_wer_prefix=0.6667`** with near-old-regime throughput (~29.7k samples / 10 min). Together with #782, that says the branch is not just about the presence of the late pair: **store order matters some**. The original `cpu_percent -> mem_rss_total -> mem_vms_total` ordering was stronger (`0.8333` contemporaneously, `0.5` historically) than the swapped late-pair ordering. So the live clue now points not just to a two-field late-offset pattern, but to a likely **ordered synchronized-wrapper store path**.","timestamp":1774110372732,"segment":0}
{"run":784,"commit":"a754af1","metric":0.6666666865348816,"metrics":{},"status":"discard","description":"Tested whether the new late-total-fields clue depends on the **position of the `cpu_percent` store** inside the successful wrapper-property sequence on the **fully direct Event+Value clear-only** branch. I built `/tmp/xax-bench-9cea09c-oldtrain-meminfocputouchcpuusefirst-clearonlynoproxy-workercputotalswrite-cpulast-nogpu`, keeping the same real subset as #777 but moving the `cpu_percent` property write **after** `mem_rss_total` and `mem_vms_total`. This weakened to **`asr_wer_prefix=0.6667`** with near-old-regime throughput (~29.7k samples / 10 min). Together with #783, that sharpens the current mechanism clue again: the helpful branch is not just about which three fields get written, but about their **ordered synchronized-wrapper property-store path**. Moving either the late-pair order or the `cpu_percent` position away from the original sequence weakens the branch.","timestamp":1774111253649,"segment":0}
{"run":785,"commit":"a754af1","metric":0.8333333134651184,"metrics":{},"status":"discard","description":"Tested whether the ordered **wrapper-property** clue on the detached **fully direct Event+Value clear-only** branch depends on holding the sharedctypes **outer batch lock** across the whole store sequence. I built `/tmp/xax-bench-9cea09c-oldtrain-meminfocputouchcpuusefirst-clearonlynoproxy-workercputotalswrite-nobatchlock-nogpu`, kept the exact #777 field/value/order path (`cpu_percent`, zeroed early fields, then `mem_rss_total`, `mem_vms_total`, then child zeros), but removed the outer `with stats.get_lock():` so each property setter used its own synchronized acquire/release path. This weakened to **`asr_wer_prefix=0.8333`** with old-regime throughput (~30.0k samples / 10 min). Together with #781/#783/#784, that says the helpful write-side clue is narrower than “same final values through wrapper properties”: it appears to want the original **ordered wrapper-property path plus the outer batch-held lock**, not merely per-field synchronized property writes in isolation.","timestamp":1774112520246,"segment":0}
{"run":786,"commit":"3b4cc3c","metric":0.1666666716337204,"metrics":{},"status":"keep","description":"Found the strongest new detached write-side clue on the **fully direct Event+Value clear-only** old-train CPU-only branch. I built `/tmp/xax-bench-9cea09c-oldtrain-meminfocputouchcpuusefirst-clearonlynoproxy-workercputotalswrite-minimal3-nogpu`, starting from the #777-style ordered wrapper-property path but **removing all extra zero-field stores** and keeping only the three batch-held writes **`cpu_percent -> mem_rss_total -> mem_vms_total`** under the outer `with stats.get_lock():`. This recovered **`asr_wer_prefix=0.1667`** with old-regime throughput (~30.0k samples / 10 min), matching the best recorded overall metric while staying on the detached comparability sandbox. Relative to #777/#781/#783/#784/#785, this is a sharp mechanism upgrade: the helpful direct-write path is narrower than the broader zero-fill story and now looks centered on the **minimal ordered synchronized-wrapper triple plus the outer batch-held lock**, not on extra early-field zero stores or raw final bytes alone.","timestamp":1774113420759,"segment":0}
{"run":787,"commit":"3b4cc3c","metric":0.8333333134651184,"metrics":{},"status":"discard","description":"Exact reran the new detached **minimal ordered synchronized-wrapper triple** branch from #786: same `/tmp/xax-bench-9cea09c-oldtrain-meminfocputouchcpuusefirst-clearonlynoproxy-workercputotalswrite-minimal3-nogpu`, same **outer batch-held lock**, and the same three property writes **`cpu_percent -> mem_rss_total -> mem_vms_total`** on the **fully direct Event+Value clear-only** route. The spike did **not** reproduce: this rerun weakened to **`asr_wer_prefix=0.8333`** with near-old-regime throughput (~29.8k samples / 10 min). That reclassifies #786 as a very strong but still fragile mechanism clue rather than an immediately trusted recovered anchor. The live write-side picture is now a sharp 2x2-style question about the interaction between **outer batch-held lock** and **number of ordered wrapper-property stores**.","timestamp":1774114219827,"segment":0}
{"run":788,"commit":"3b4cc3c","metric":1,"metrics":{},"status":"discard","description":"Completed the missing corner of the detached write-side 2x2. I built `/tmp/xax-bench-9cea09c-oldtrain-meminfocputouchcpuusefirst-clearonlynoproxy-workercputotalswrite-minimal3-nobatchlock-nogpu`, keeping the **minimal ordered wrapper-property triple** from #786 (`cpu_percent -> mem_rss_total -> mem_vms_total`) but removing the **outer batch-held `with stats.get_lock():`**, so each property setter acquired/released on its own. This collapsed cleanly to **`asr_wer_prefix=1.0`** with near-old-regime throughput (~29.7k samples / 10 min). Together with #785/#786/#787, that sharpens the mechanism a lot: the late-field clue is not just “fewer ordered wrapper writes help.” The only live branch so far is specifically the **minimal ordered wrapper-property triple under the outer batch-held lock**; once that outer lock is removed, the same minimal triple falls straight back to the bad class.","timestamp":1774114994828,"segment":0}
{"run":789,"commit":"3b4cc3c","metric":0.6666666865348816,"metrics":{},"status":"discard","description":"Tested whether the new detached **minimal ordered triple** clue actually needs synchronized wrapper-property setters, or only the same final fields/values under the **outer batch-held lock**. I built `/tmp/xax-bench-9cea09c-oldtrain-meminfocputouchcpuusefirst-clearonlynoproxy-workercputotalswrite-minimal3-rawbatch-nogpu`, kept the **fully direct Event+Value clear-only** route and the same three-field sequence **`cpu_percent -> mem_rss_total -> mem_vms_total`**, but wrote them through `stats.get_obj()` raw sharedctypes stores inside the outer `with stats.get_lock():` instead of via wrapper properties. This weakened to **`asr_wer_prefix=0.6667`** with old-regime throughput (~29.8k samples / 10 min). That sharpens the mechanism again: the outer batch-held lock plus minimal three-field payload is already somewhat helpful on its own, but the full #786 spike still looks stronger than raw final bytes alone, so the remaining gap may be in the **nested synchronized-wrapper property-store / reentrant-lock path**, not just the values that land in shared memory.","timestamp":1774115969222,"segment":0}
{"run":790,"commit":"3b4cc3c","metric":1,"metrics":{},"status":"discard","description":"Tested whether the #786 spike is really about the **nested reentrant lock path** rather than wrapper-property dispatch itself. I built `/tmp/xax-bench-9cea09c-oldtrain-meminfocputouchcpuusefirst-clearonlynoproxy-workercputotalswrite-minimal3-rawbatchnested-nogpu`, kept the **outer batch-held lock** and the same minimal three-field raw payload as #789, but manually inserted per-field `stats.acquire(); ...; stats.release()` around raw `stats.get_obj()` stores to mimic the reentrant lock churn of wrapper properties. This collapsed cleanly to **`asr_wer_prefix=1.0`** with near-old-regime throughput (~29.7k samples / 10 min). Relative to #789 and #786, that suggests the current live clue is not explained by 'outer batch lock + minimal payload + any nested reentrant lock churn' alone. The strongest branch still looks specifically tied to the actual **wrapper-property store path** under the outer batch-held lock, while raw final bytes under that same outer lock soften only to `0.6667`.","timestamp":1774116758624,"segment":0}
{"run":791,"commit":"3b4cc3c","metric":1,"metrics":{},"status":"discard","description":"Probed the cache-line / extra-field story around the detached **minimal ordered wrapper-property triple** branch. I built `/tmp/xax-bench-9cea09c-oldtrain-meminfocputouchcpuusefirst-clearonlynoproxy-workercputotalswrite-minimal3-mempct-nogpu`, keeping the **outer batch-held lock** and the same ordered stores **`cpu_percent -> mem_rss_total -> mem_vms_total`**, but adding one extra adjacent-field property write **`mem_percent=0.0`** between `cpu_percent` and the late totals. This collapsed cleanly to **`asr_wer_prefix=1.0`** with near-old-regime throughput (~29.7k samples / 10 min). That sharply upgrades the 'minimality matters' hypothesis: even a single extra write on the nearby offset-8 `mem_percent` field is enough to destroy the only branch that ever reached the new best class.","timestamp":1774117770438,"segment":0}
{"run":792,"commit":"3b4cc3c","metric":1,"metrics":{},"status":"discard","description":"Ran the complementary distant-field control on the detached **minimal ordered wrapper-property triple** branch. I built `/tmp/xax-bench-9cea09c-oldtrain-meminfocputouchcpuusefirst-clearonlynoproxy-workercputotalswrite-minimal3-childcount-nogpu`, kept the **outer batch-held lock** and the same ordered stores **`cpu_percent -> mem_rss_total -> mem_vms_total`**, but added one extra far-offset property write **`num_child_procs=0`** after the late totals. This also collapsed cleanly to **`asr_wer_prefix=1.0`** with near-old-regime throughput (~29.7k samples / 10 min). Together with #791, that says the current live branch is not just sensitive to nearby cache-line touches around `cpu_percent`; even a single extra distant trailing store destroys it. The best current read is now that the branch wants the **exact minimal three-store wrapper-property sequence**, not merely 'no extra nearby fields'.","timestamp":1774118524619,"segment":0}
{"run":793,"commit":"3b4cc3c","metric":0.8333333134651184,"metrics":{},"status":"discard","description":"Tested whether the current detached best clue depends on the **exact number of wrapper-property setter invocations**, not just the exact set of touched fields. I built `/tmp/xax-bench-9cea09c-oldtrain-meminfocputouchcpuusefirst-clearonlynoproxy-workercputotalswrite-minimal3-dupvms-nogpu`, kept the **outer batch-held lock** and the same minimal ordered triple **`cpu_percent -> mem_rss_total -> mem_vms_total`**, but added one extra **duplicate** trailing property write to the already-live field `mem_vms_total`. This weakened to **`asr_wer_prefix=0.8333`** with near-old-regime throughput (~29.8k samples / 10 min). Together with #791-#792, that says the branch is not just allergic to extra *different* fields; even an extra **duplicate write to an already-live field** destroys the spike. The live story is now stronger: the helpful branch appears to want the **exact three setter invocations**, not just the same field set.","timestamp":1774119569532,"segment":0}
{"run":794,"commit":"3b4cc3c","metric":0.8333333134651184,"metrics":{},"status":"discard","description":"Ran the position-complement of #793 on the detached **exact minimal wrapper-property triple** branch. I built `/tmp/xax-bench-9cea09c-oldtrain-meminfocputouchcpuusefirst-clearonlynoproxy-workercputotalswrite-minimal3-dupcpu-nogpu`, kept the **outer batch-held lock** and the same live sequence, but duplicated the **first** setter so the worker wrote **`cpu_percent -> cpu_percent -> mem_rss_total -> mem_vms_total`**. This also weakened to **`asr_wer_prefix=0.8333`** with near-old-regime throughput (~29.6k samples / 10 min). Together with #793, the current mechanism clue is now sharper still: the helpful branch does not just want the same three fields in roughly the right order; it appears to want the **exact three wrapper-property setter invocations**, regardless of whether the extra setter duplicates an early field or a late field.","timestamp":1774120450425,"segment":0}
{"run":795,"commit":"3b4cc3c","metric":1,"metrics":{},"status":"discard","description":"Tested the narrowest remaining raw-vs-wrapper distinction on the detached **fully direct Event+Value + clear-only** old-train CPU-only branch. I built `/tmp/xax-bench-9cea09c-oldtrain-meminfocputouchcpuusefirst-clearonlynoproxy-workercputotalswrite-minimal3-rawbatchnestedfreshobj-nogpu`, kept the same **outer batch-held lock** and the same three logical stores, but replaced the wrapper-property setters with manual nested `stats.acquire()/release()` blocks that do a **fresh `stats.get_obj()` lookup inside each nested critical section** before each raw store. This isolates the last obvious gap between #790 and the true property-setter path: repeated under-lock `_obj` resolution without using the property descriptor itself. It failed cleanly at **`asr_wer_prefix=1.0`** with old-regime throughput (~30.0k samples / 10 min) and much worse gt-ASR sanity, so the helpful branch is not explained by merely avoiding a cached raw object pointer. The remaining live distinction is now even narrower: the real lift still looks specific to the actual synchronized wrapper-property setter path, not just fresh `_obj` lookup plus matching nested lock churn.","timestamp":1774121756543,"segment":0}
{"run":796,"commit":"3bf2d0d","metric":0.6666666865348816,"metrics":{},"status":"keep","description":"Found a sharper raw-vs-wrapper split on the detached **fully direct Event+Value + clear-only** old-train CPU-only branch. I built `/tmp/xax-bench-9cea09c-oldtrain-meminfocputouchcpuusefirst-clearonlynoproxy-workercputotalswrite-minimal3-rawbatchnestedprivateobj-nogpu`, kept the same **outer batch-held lock**, the same three logical stores, and the same manual nested `stats.acquire()/release()` churn as #790/#795, but switched the raw-write path from **`stats.get_obj()`** to direct private **`stats._obj`** inside each nested critical section. This recovered **`asr_wer_prefix=0.6667`** with old-regime throughput (~29.9k samples / 10 min), clean gt-ASR, EOS on both prompts, and a much better in-domain match. Together with #795, that is a strong new mechanism split: the failed manual raw path is not explained by nested reacquire/release alone or by raw stores in general. The toxic ingredient now looks more specifically like the **`get_obj()` accessor path** under this nested raw-write pattern, while direct private `_obj` stores can still recover the weaker partial class. The remaining gap is now narrower still: the stronger spike still looks specific to the true synchronized wrapper-property setter path, but raw `_obj` access is materially better than raw `get_obj()` on the same three-store sequence.","timestamp":1774122721472,"segment":0}
{"run":797,"commit":"3bf2d0d","metric":1,"metrics":{},"status":"discard","description":"Tested the next descriptor-level split on the detached **fully direct Event+Value + clear-only** old-train CPU-only branch. I built `/tmp/xax-bench-9cea09c-oldtrain-meminfocputouchcpuusefirst-clearonlynoproxy-workercputotalswrite-minimal3-directfset-nogpu`, kept the same **outer batch-held lock** and the same three logical stores, but replaced `stats.cpu_percent = ...` / `stats.mem_rss_total = ...` / `stats.mem_vms_total = ...` with direct calls to the generated property setters **`type(stats).<field>.fset(stats, value)`**. This should execute the same setter bodies as the wrapper-property path while bypassing normal attribute-assignment / descriptor dispatch syntax. It failed cleanly at **`asr_wer_prefix=1.0`** with old-regime throughput (~29.8k samples / 10 min), so the helpful branch is not explained by the setter function body alone. Together with #796, the remaining live distinction is now even tighter: direct private `_obj` raw stores can still recover `0.6667`, but directly calling the generated `fset` functions does not, so the strongest spike still appears to depend on the full ordinary synchronized wrapper-property assignment path itself rather than merely on running the same code body by hand.","timestamp":1774123524683,"segment":0}
{"run":798,"commit":"3bf2d0d","metric":1,"metrics":{},"status":"discard","description":"Ran the descriptor-protocol follow-up to #797 on the detached **fully direct Event+Value + clear-only** old-train CPU-only branch. I built `/tmp/xax-bench-9cea09c-oldtrain-meminfocputouchcpuusefirst-clearonlynoproxy-workercputotalswrite-minimal3-directpropdunder-nogpu`, kept the same **outer batch-held lock** and the same three logical stores, but replaced plain wrapper-property assignment with explicit descriptor calls **`type(stats).<field>.__set__(stats, value)`**. This should be even closer to ordinary `stats.field = value` than the direct `fset(...)` path from #797. It still failed cleanly at **`asr_wer_prefix=1.0`** with old-regime throughput (~29.9k samples / 10 min). Together with #797, this further narrows the live distinction: neither directly calling the generated setter bodies nor directly calling the property object's `__set__` reproduces the helpful wrapper-property branch, while direct private `_obj` raw stores still recover `0.6667` in #796. So the apparent best-class clue remains uniquely tied to the ordinary synchronized wrapper-property assignment surface itself — or that whole spike was noise — and more manual descriptor-call rewrites are now lower priority than explanation-first code inspection.","timestamp":1774124306363,"segment":0}
{"run":799,"commit":"3bf2d0d","metric":0.8333333134651184,"metrics":{},"status":"discard","description":"Tested the next ordinary-assignment split on the detached **fully direct Event+Value + clear-only** old-train CPU-only branch. I built `/tmp/xax-bench-9cea09c-oldtrain-meminfocputouchcpuusefirst-clearonlynoproxy-workercputotalswrite-minimal3-setattr-nogpu`, kept the same **outer batch-held lock** and the same three logical stores, but replaced direct syntax with built-in **`setattr(stats, field, value)`** for `cpu_percent`, `mem_rss_total`, and `mem_vms_total`. This weakened only to **`asr_wer_prefix=0.8333`** with old-regime throughput (~29.8k samples / 10 min). Relative to #797-#798 plus the plain assignment branch, this is a useful middle result: generic attribute-setting is materially less bad than direct `fset/__set__` calls, but it still does not reproduce the stronger wrapper-property path. So the remaining gap is now narrower still: on this exact minimal three-store branch, the strongest effect still looks tied to the true plain `stats.field = value` instance-assignment surface, not just the descriptor code body and not generic `setattr(...)` alone.","timestamp":1774125295544,"segment":0}
{"run":800,"commit":"aaa3f7c","metric":0.5,"metrics":{},"status":"keep","description":"Found a sharper attribute-setting split on the detached **fully direct Event+Value + clear-only** old-train CPU-only branch. I built `/tmp/xax-bench-9cea09c-oldtrain-meminfocputouchcpuusefirst-clearonlynoproxy-workercputotalswrite-minimal3-objectsetattr-nogpu`, kept the same **outer batch-held lock** and the same three logical stores, but replaced plain `stats.field = value` writes with direct **`object.__setattr__(stats, field, value)`** calls for `cpu_percent`, `mem_rss_total`, and `mem_vms_total`. This recovered **`asr_wer_prefix=0.5`** with old-regime throughput (~29.7k samples / 10 min), EOS on both prompts, and clean gt-ASR. Together with #799, that is a strong new mechanism split: built-in **`setattr(...)`** only softened to `0.8333`, while lower-level **`object.__setattr__(...)`** recovered the stronger partial class. Relative to #796-#798, the remaining gap is now narrower still: the bad manual raw path is not just about nested lock churn or raw stores, the descriptor bodies alone are not sufficient, and the live distinction is now concentrated around the **generic object attribute-setting path** versus both higher-level built-in `setattr(...)` and lower-level manual descriptor/raw-object access.","timestamp":1774126255321,"segment":0}
