{"run":801,"commit":"aaa3f7c","metric":1,"metrics":{},"status":"discard","description":"Exact-reran the new `object.__setattr__(...)` branch from #800 on the detached **fully direct Event+Value + clear-only** old-train CPU-only route. I reused `/tmp/xax-bench-9cea09c-oldtrain-meminfocputouchcpuusefirst-clearonlynoproxy-workercputotalswrite-minimal3-objectsetattr-nogpu`, keeping the same **outer batch-held lock** and the same three `object.__setattr__(stats, field, value)` calls for `cpu_percent`, `mem_rss_total`, and `mem_vms_total`. The rerun collapsed cleanly back to **`asr_wer_prefix=1.0`** with near-old-regime throughput (~29.7k samples / 10 min). So #800 is now downgraded from a possible stable partial rescue to a sharper but still noisy mechanism clue. The attribute-setting hierarchy is still informative — `fset/__set__` failed, `setattr(...)` only softened to `0.8333`, and `object.__setattr__(...)` at least once reached `0.5` — but the `object.__setattr__` path is not yet a recovered anchor.","timestamp":1774127032722,"segment":0}
{"run":802,"commit":"aaa3f7c","metric":1,"metrics":{},"status":"discard","description":"Tested the outer-lock acquisition path itself on the detached **fully direct Event+Value + clear-only** old-train CPU-only branch. I built `/tmp/xax-bench-9cea09c-oldtrain-meminfocputouchcpuusefirst-clearonlynoproxy-workercputotalswrite-minimal3-manualouter-nogpu`, kept the exact same three plain wrapper-property assignments `cpu_percent -> mem_rss_total -> mem_vms_total`, but replaced the outer batch-held `with stats.get_lock():` with direct wrapper-bound `stats.acquire(); ...; stats.release()`. This failed cleanly at **`asr_wer_prefix=1.0`** with near-old-regime throughput (~29.7k samples / 10 min). So the live branch is narrower again: even when the inner writes stay as ordinary `stats.field = value`, the outer lock-acquisition surface itself matters. The helpful path is not just 'same lock held, same fields, same order'; it still looks tied specifically to the original `with stats.get_lock():` + ordinary instance-assignment combination.","timestamp":1774128071526,"segment":0}
{"run":803,"commit":"aaa3f7c","metric":0.8333333134651184,"metrics":{},"status":"discard","description":"Tested the wrapper-context variant of the detached **fully direct Event+Value + clear-only** old-train CPU-only minimal triple. I built `/tmp/xax-bench-9cea09c-oldtrain-meminfocputouchcpuusefirst-clearonlynoproxy-workercputotalswrite-minimal3-withwrapper-nogpu`, kept the exact same three plain wrapper-property assignments, but changed the outer batch hold from `with stats.get_lock():` to **`with stats:`**. This softened only to **`asr_wer_prefix=0.8333`** with near-old-regime throughput (~29.7k samples / 10 min). Together with #802, that narrows the outer-lock story: the helpful branch is not just 'same lock held somehow'. Direct `stats.acquire()/release()` collapses to `1.0`, and even the wrapper's own context-manager path weakens to `0.8333`; the strongest clue still points specifically at the original **`with stats.get_lock():` + plain instance-assignment triple**.","timestamp":1774128852024,"segment":0}
{"run":804,"commit":"aaa3f7c","metric":1,"metrics":{},"status":"discard","description":"Tested whether ordinary instance assignment still helps when moved out of the worker code object on the detached **fully direct Event+Value + clear-only** old-train CPU-only minimal-triple branch. I built `/tmp/xax-bench-9cea09c-oldtrain-meminfocputouchcpuusefirst-clearonlynoproxy-workercputotalswrite-minimal3-helperassign-nogpu`, kept the same **outer `with stats.get_lock():`** hold and the same three logical writes, but moved the actual `stats.cpu_percent = ...; stats.mem_rss_total = ...; stats.mem_vms_total = ...` sequence into a module-level helper `_write_minimal_totals_via_helper(...)` called inside that lock. This failed cleanly at **`asr_wer_prefix=1.0`** with near-old-regime throughput (~29.7k samples / 10 min). That is a sharp new split: the live branch is not just 'any normal STORE_ATTR property assignment under the same outer lock'. Moving the same three ordinary assignments into a helper code object is already enough to lose the effect, which further concentrates the surviving clue around the exact inline worker-side assignment surface under `with stats.get_lock():`.","timestamp":1774129835187,"segment":0}
{"run":805,"commit":"4db4306","metric":0.6666666865348816,"metrics":{},"status":"keep","description":"Found a sharper outer-lock-hold split on the detached **fully direct Event+Value + clear-only** old-train CPU-only minimal-triple branch. I built `/tmp/xax-bench-9cea09c-oldtrain-meminfocputouchcpuusefirst-clearonlynoproxy-workercputotalswrite-minimal3-withlocallock-nogpu`, kept the exact same three plain wrapper-property assignments, but changed the outer hold from inline `with stats.get_lock():` to a prebound raw lock context: `lock = stats.get_lock(); with lock:`. This recovered **`asr_wer_prefix=0.6667`** with near-old-regime throughput (~29.6k samples / 10 min), clean gt-ASR, and EOS on both prompts. Relative to #802-#803, that is a sharp new outer-lock split: the stronger partial class survives when the held object is still the **raw lock context manager**, but not when using the wrapper's own `with stats:` path and not when using wrapper-bound `stats.acquire()/release()`. So the remaining gap is now concentrated even more narrowly around the exact **raw lock context-manager surface**, with the original inline `with stats.get_lock():` branch still the only one that ever reached the best class.","timestamp":1774130617334,"segment":0}
{"run":806,"commit":"4db4306","metric":0.8333333134651184,"metrics":{},"status":"discard","description":"Exact-reran the new prebound raw-lock context branch from #805 on the detached **fully direct Event+Value + clear-only** old-train CPU-only minimal-triple route. I reused `/tmp/xax-bench-9cea09c-oldtrain-meminfocputouchcpuusefirst-clearonlynoproxy-workercputotalswrite-minimal3-withlocallock-nogpu`, keeping the exact same plain assignment triple and the same outer `lock = stats.get_lock(); with lock:` hold. The rerun weakened to **`asr_wer_prefix=0.8333`** with near-old-regime throughput (~29.6k samples / 10 min). So #805 is now downgraded from a possible stable partial rescue to a sharper but still noisy outer-lock clue: a prebound raw-lock context is materially better than `with stats:` and much better than wrapper-bound `acquire()/release()`, but it is not yet a recovered anchor, and the original inline `with stats.get_lock():` path remains uniquely strong.","timestamp":1774131401196,"segment":0}
{"run":807,"commit":"0f4c31b","metric":0.5,"metrics":{},"status":"keep","description":"Found a sharper STORE_ATTR-target split on the detached **fully direct Event+Value + clear-only** old-train CPU-only minimal-triple branch. I built `/tmp/xax-bench-9cea09c-oldtrain-meminfocputouchcpuusefirst-clearonlynoproxy-workercputotalswrite-minimal3-localstats-nogpu`, kept the original inline worker code object, the original outer `with stats.get_lock():` surface, and the same three plain assignments, but first rebound the synchronized wrapper to a local alias (`s = stats`) and then wrote `s.cpu_percent`, `s.mem_rss_total`, and `s.mem_vms_total` inside that original lock hold. This recovered **`asr_wer_prefix=0.5`** with old-regime throughput (~29.9k samples / 10 min), clean gt-ASR, and EOS on both prompts. Relative to #804-#806, that is a useful new split: moving the writes into another helper code object fully kills the branch, prebinding only the raw lock weakens to `0.6667 -> 0.8333`, but rebinding only the wrapper object while keeping the original inline `with stats.get_lock():` surface still reaches the stronger partial class. So the remaining gap is narrower still: the helpful effect is not tied to the literal local name `stats` in the STORE_ATTR sites, and the sharper distinctions now concentrate around the exact inline code object plus the original `with stats.get_lock():` surface versus helper-call relocation and noisier outer-lock substitutions.","timestamp":1774132750756,"segment":0}
{"run":808,"commit":"0f4c31b","metric":0.8333333134651184,"metrics":{},"status":"discard","description":"Exact-reran the new local-wrapper-alias branch from #807 on the detached **fully direct Event+Value + clear-only** old-train CPU-only minimal-triple route. I reused `/tmp/xax-bench-9cea09c-oldtrain-meminfocputouchcpuusefirst-clearonlynoproxy-workercputotalswrite-minimal3-localstats-nogpu`, keeping the same inline code object, the same original outer `with stats.get_lock():` hold, and the same alias-based stores through `s = stats`. The rerun weakened to **`asr_wer_prefix=0.8333`** with old-regime throughput (~29.9k samples / 10 min) and no EOS on the main prompt. So #807 is downgraded from a possible stable partial rescue to a sharper but still noisy STORE_ATTR-target clue: aliasing the wrapper object does not inherently kill the branch, but it is not a recovered anchor, and the original inline minimal-triple story remains fragile.","timestamp":1774133519016,"segment":0}
{"run":809,"commit":"0f4c31b","metric":0.8333333134651184,"metrics":{},"status":"discard","description":"Tested whether the local-wrapper alias from #807 stays helpful once the outer lock lookup also moves onto that alias. I built `/tmp/xax-bench-9cea09c-oldtrain-meminfocputouchcpuusefirst-clearonlynoproxy-workercputotalswrite-minimal3-localstatsgetlock-nogpu`, kept the same inline code object and the same three plain stores through `s = stats`, but changed the outer hold from `with stats.get_lock():` to `with s.get_lock():`. This weakened to **`asr_wer_prefix=0.8333`** with old-regime throughput (~30.0k samples / 10 min). Relative to #807, that points the next distinction more tightly at the **get_lock receiver/call surface** rather than the STORE_ATTR target name alone: aliasing the wrapper for stores can still reach the stronger partial class, but moving the `get_lock()` lookup onto that alias weakens back toward the broader noisy class.","timestamp":1774134451172,"segment":0}
{"run":810,"commit":"dc63664","metric":0.6666666865348816,"metrics":{},"status":"keep","description":"Found a sharper get-lock-receiver split on the detached **fully direct Event+Value + clear-only** old-train CPU-only minimal-triple branch. I built `/tmp/xax-bench-9cea09c-oldtrain-meminfocputouchcpuusefirst-clearonlynoproxy-workercputotalswrite-minimal3-getlockaliasonly-nogpu`, kept the same inline code object, kept the original plain `stats.cpu_percent / stats.mem_rss_total / stats.mem_vms_total` stores, but introduced only `s = stats` for the outer hold and changed `with stats.get_lock():` to `with s.get_lock():`. This recovered **`asr_wer_prefix=0.6667`** with old-regime throughput (~29.8k samples / 10 min), clean gt-ASR, and EOS on both prompts. Together with #807 and #809, that sharpens the latest mechanism split: aliasing the STORE_ATTR target alone can still reach the stronger partial class, aliasing both the lock receiver and store target weakens back to `0.8333`, but aliasing only the **`get_lock()` receiver** still reaches the weaker `0.6667` class. So the remaining gap is now concentrated even more tightly around the interaction between the exact inline `with stats.get_lock():` surface and the exact synchronized-wrapper assignment surface, not the literal local variable name alone.","timestamp":1774135220419,"segment":0}
{"run":811,"commit":"dc63664","metric":0.6666666865348816,"metrics":{},"status":"discard","description":"Exact-reran the new get-lock-receiver alias branch from #810 on the detached **fully direct Event+Value + clear-only** old-train CPU-only minimal-triple route. I reused `/tmp/xax-bench-9cea09c-oldtrain-meminfocputouchcpuusefirst-clearonlynoproxy-workercputotalswrite-minimal3-getlockaliasonly-nogpu`, keeping the same inline code object, the same plain `stats.*` stores, and only `s = stats; with s.get_lock():` for the outer hold. It matched the first run at **`asr_wer_prefix=0.6667`** with old-regime throughput (~29.9k samples / 10 min). That makes this a more credible stable partial class than the noisier `0.5 -> 0.8333` local-store-alias branch: moving only the `get_lock()` receiver onto a local alias weakens the original surface, but it does so reproducibly into the `0.6667` class rather than collapsing to `1.0`.","timestamp":1774135991770,"segment":0}
{"run":812,"commit":"dc63664","metric":0.6666666865348816,"metrics":{},"status":"discard","description":"Tested a narrower method-binding variant of the detached **fully direct Event+Value + clear-only** old-train CPU-only minimal-triple branch. I built `/tmp/xax-bench-9cea09c-oldtrain-meminfocputouchcpuusefirst-clearonlynoproxy-workercputotalswrite-minimal3-getlockmethodlocal-nogpu`, kept the same inline code object and the same plain `stats.*` stores, but prebound only the bound method (`get_lock = stats.get_lock`) and then used `with get_lock():`. This also landed at **`asr_wer_prefix=0.6667`** with old-regime throughput (~29.9k samples / 10 min). Together with #810-#811, that says the weaker stable partial class survives more than one rewrite of the `get_lock()` call surface: moving the call off the literal `stats.get_lock()` syntax weakens the original surface, but it still reproducibly stays in the `0.6667` class rather than collapsing to `1.0`.","timestamp":1774136783636,"segment":0}
{"run":813,"commit":"dc63664","metric":0.8333333134651184,"metrics":{},"status":"discard","description":"Tested whether the inline minimal-triple branch depends on computing the two late totals **inside** the original outer lock hold. I built `/tmp/xax-bench-9cea09c-oldtrain-meminfocputouchcpuusefirst-clearonlynoproxy-workercputotalswrite-minimal3-precomputeoutside-nogpu`, precomputed `mem_rss_total = int(mem_info.rss)` and `mem_vms_total = int(mem_info.vms)` before entering the original `with stats.get_lock():`, then kept the same three stores inside the lock. This weakened to **`asr_wer_prefix=0.8333`** with old-regime throughput (~29.9k samples / 10 min). So the surviving effect is narrower than just the three final field stores and their order: pulling both `int(mem_info.rss/vms)` evaluations out of the lock weakens the branch, which points to the lock-held expression/evaluation surface itself as part of the live clue.","timestamp":1774137575033,"segment":0}
{"run":814,"commit":"dc63664","metric":1,"metrics":{},"status":"discard","description":"Tested a one-sided lock-held-expression split on the detached **fully direct Event+Value + clear-only** old-train CPU-only minimal-triple branch. I built `/tmp/xax-bench-9cea09c-oldtrain-meminfocputouchcpuusefirst-clearonlynoproxy-workercputotalswrite-minimal3-precomputevmsoutside-nogpu`, kept the original inline `with stats.get_lock():` and the original three store order, but precomputed only the **last** late value `mem_vms_total = int(mem_info.vms)` before entering the lock while still computing `int(mem_info.rss)` inside the lock. This collapsed cleanly to **`asr_wer_prefix=1.0`** with old-regime throughput (~29.8k samples / 10 min). Relative to #813, that says the lock-held expression surface is not just generically helpful: moving only the **final `mem_vms_total` value computation** out of the lock is already enough to destroy the branch.","timestamp":1774138352387,"segment":0}
{"run":815,"commit":"dc63664","metric":0.6666666865348816,"metrics":{},"status":"discard","description":"Ran the complementary one-sided lock-held-expression split on the detached **fully direct Event+Value + clear-only** old-train CPU-only minimal-triple branch. I built `/tmp/xax-bench-9cea09c-oldtrain-meminfocputouchcpuusefirst-clearonlynoproxy-workercputotalswrite-minimal3-precomputerssoutside-nogpu`, kept the original inline `with stats.get_lock():` and store order, but precomputed only the **middle** late value `mem_rss_total = int(mem_info.rss)` before entering the lock while still computing the **final** `int(mem_info.vms)` inside the lock. This recovered **`asr_wer_prefix=0.6667`** with old-regime throughput (~29.9k samples / 10 min). Together with #814, that is a sharp new asymmetry: moving the final `mem_vms_total` value computation out of the lock kills the branch, while moving only the earlier `mem_rss_total` value computation out of the lock still preserves the weaker `0.6667` class.","timestamp":1774139125475,"segment":0}
{"run":816,"commit":"dc63664","metric":1,"metrics":{},"status":"discard","description":"Tested whether the last-field lock-held-expression effect comes mainly from the final `int(...)` call or from the underlying `mem_info.vms` attribute load staying inside the lock. I built `/tmp/xax-bench-9cea09c-oldtrain-meminfocputouchcpuusefirst-clearonlynoproxy-workercputotalswrite-minimal3-preloadvmsattr-nogpu`, preloaded only `mem_vms = mem_info.vms` before the original `with stats.get_lock():`, then still executed `stats.mem_vms_total = int(mem_vms)` inside the lock. This still collapsed cleanly to **`asr_wer_prefix=1.0`** with old-regime throughput (~29.9k samples / 10 min). Relative to #814, that says the final-field sensitivity is already triggered by moving the **`mem_info.vms` attribute access** out of the lock; keeping an `int(...)` call inside the lock is not enough to preserve the branch.","timestamp":1774139902207,"segment":0}
{"run":817,"commit":"dc63664","metric":1,"metrics":{},"status":"discard","description":"Tested the middle-field attribute-load split on the detached **fully direct Event+Value + clear-only** old-train CPU-only minimal-triple branch. I built `/tmp/xax-bench-9cea09c-oldtrain-meminfocputouchcpuusefirst-clearonlynoproxy-workercputotalswrite-minimal3-preloadrssattr-nogpu`, preloaded only `mem_rss = mem_info.rss` before the original `with stats.get_lock():`, then still executed `stats.mem_rss_total = int(mem_rss)` inside the lock while leaving the final `int(mem_info.vms)` fully inline. This also collapsed cleanly to **`asr_wer_prefix=1.0`** with old-regime throughput (~29.9k samples / 10 min). Together with #815, that creates a sharper middle-field asymmetry: precomputing the full integer `mem_rss_total = int(mem_info.rss)` outside the lock can still preserve the weaker `0.6667` class, but moving only the underlying `mem_info.rss` attribute load out of the lock while keeping `int(...)` inside is already enough to destroy the branch.","timestamp":1774140687971,"segment":0}
{"run":818,"commit":"dc63664","metric":0.6666666865348816,"metrics":{},"status":"discard","description":"Tested whether the middle-field asymmetry is specifically about assigning a precomputed local versus running `int(...)` inside the lock on that local. I built `/tmp/xax-bench-9cea09c-oldtrain-meminfocputouchcpuusefirst-clearonlynoproxy-workercputotalswrite-minimal3-precomputedoubleint-rss-nogpu`, precomputed `mem_rss_total = int(mem_info.rss)` before the original `with stats.get_lock():`, then still executed `stats.mem_rss_total = int(mem_rss_total)` inside the lock while leaving the final `int(mem_info.vms)` fully inline. This still recovered **`asr_wer_prefix=0.6667`** with old-regime throughput (~29.9k samples / 10 min). Together with #815 and #817, that narrows the middle-field story: for `mem_rss_total`, moving the raw `mem_info.rss` attribute load out while keeping `int(...)` inside is harsh, but once the pre-lock local already holds the fully computed integer, re-wrapping it with `int(...)` inside the lock is still compatible with the weaker `0.6667` class.","timestamp":1774141457940,"segment":0}
{"run":819,"commit":"dc63664","metric":1,"metrics":{},"status":"discard","description":"Completed the final-field counterpart to #818 on the detached **fully direct Event+Value + clear-only** old-train CPU-only minimal-triple branch. I built `/tmp/xax-bench-9cea09c-oldtrain-meminfocputouchcpuusefirst-clearonlynoproxy-workercputotalswrite-minimal3-precomputedoubleint-vms-nogpu`, precomputed `mem_vms_total = int(mem_info.vms)` before the original `with stats.get_lock():`, then still executed `stats.mem_vms_total = int(mem_vms_total)` inside the lock while leaving `stats.mem_rss_total = int(mem_info.rss)` fully inline. This still collapsed cleanly to **`asr_wer_prefix=1.0`** with old-regime throughput (~29.8k samples / 10 min). Together with #818, that sharpens the new field asymmetry further: once the middle-field pre-lock local already holds the fully computed integer, re-wrapping it with `int(...)` inside the lock is still compatible with `0.6667`, but the analogous final-field `mem_vms_total` path remains harsh even with the same double-`int(...)` pattern.","timestamp":1774142356294,"segment":0}
