{"run":294,"commit":"1d3afab","metric":1,"metrics":{},"status":"discard","description":"Retuned the tokenizer-aligned four-head future-Q0 baseline by lowering `semantic_eos_weight` from 2.0 to 1.0, aiming to keep the new EOS-emitting regime while delaying premature stopping. EOS still fired on both prompts with short generations (~42/40 frames), but the primary metric regressed to asr_wer_prefix=1.0, so the alignment-fix gain does not survive simply weakening EOS pressure.","timestamp":1773649999656,"segment":0}
{"run":295,"commit":"1d3afab","metric":1,"metrics":{},"status":"discard","description":"Transferred the tokenizer/model-vocab alignment fix onto the reintroduced exact-last grouped transition (`text_source=both`, two future-Q0 heads at weight 0.5, `semantic_self_condition_prob=0.5`, first 12 semantic tokens grouped, `semantic_block_decode_exact_last_token=true`, EOS weight 2.0, p95-style cap). The aligned branch still emitted EOS on both prompts and shortened generation to ~39/37 frames, but the primary metric regressed to asr_wer_prefix=1.0, so exact-last does not immediately combine with the alignment fix.","timestamp":1773650769331,"segment":0}
{"run":296,"commit":"1d3afab","metric":1,"metrics":{},"status":"discard","description":"Revisited the future-head distillation idea after fixing the tokenizer/model-vocab alignment bug: each grouped future-Q0 head was softly distilled toward the exact next-token Q0 distribution at the corresponding future position (`semantic_future_prediction_distill_weight=0.25`) on the aligned original grouped-prefix winner (`text_source=both`, two future-Q0 heads at weight 0.5, `semantic_self_condition_prob=0.5`, first 12 semantic tokens grouped, EOS weight 2.0, p95-style cap). It now ran cleanly and still emitted EOS on both prompts, but the primary metric regressed to asr_wer_prefix=1.0 with worse CER 0.909, so this first soft exact-head distillation objective does not rescue the aligned grouped-prefix branch.","timestamp":1773651653731,"segment":0}
{"run":297,"commit":"1d3afab","metric":0.8333333134651184,"metrics":{},"status":"discard","description":"Transferred the earlier fuller LoRA target-set clue onto the tokenizer-aligned four-head future-Q0 baseline by adding the MLP down projection to the default targets (`lora_targets=[q_proj,k_proj,v_proj,o_proj,gate,up,down]`) while keeping future steps 4, future weight 0.5, `semantic_self_condition_prob=0.5`, EOS weight 2.0, and the p95-style cap. The aligned branch still emitted EOS on both prompts and again reached only tie-level asr_wer_prefix=0.8333, with in-domain WER 0.556 but weaker CER 0.864 and even shorter generations (~31/35 frames). So the fuller LoRA target set remains only a noisy side clue on top of the alignment fix rather than a new keeper.","timestamp":1773652606700,"segment":0}
{"run":298,"commit":"1d3afab","metric":1,"metrics":{},"status":"discard","description":"Retried the old mixed-text clue on top of the tokenizer-aligned four-head future-Q0 baseline (`text_source=both`, future steps 4, future weight 0.5, `semantic_self_condition_prob=0.5`, EOS weight 2.0, p95-style cap). Unlike the aligned normalized-text branch, this lost the new EOS behavior on the OOD prompt, went back to the full 53-frame cap there, and regressed cleanly to asr_wer_prefix=1.0 even though in-domain WER stayed decent at 0.556. So mixed normalized+raw text still does not transfer cleanly to the robust four-head branch, even after fixing tokenizer/model-vocab alignment.","timestamp":1773653356150,"segment":0}
{"run":299,"commit":"1d7f2f9","metric":0.6666666865348816,"metrics":{},"status":"keep","description":"Transferred the old grouped-prefix inference idea onto the tokenizer-aligned four-head future-Q0 baseline: keep four future heads in training (`semantic_future_prediction_steps=4`, weight 0.5, `semantic_self_condition_prob=0.5`, EOS weight 2.0, aligned tokenizer/audio ids), but decode only the first 12 semantic tokens in 3-token grouped steps before falling back to exact decoding. This materially improved the aligned branch to asr_wer_prefix=0.6667 with CER 0.636 while still emitting EOS on both prompts and keeping generations short (~36/37 frames). It ties the historical robust best `2bf02f5`, but now on top of the tokenizer/model-vocab alignment fix and with healthier EOS behavior, so this is worth keeping as the new live aligned mainline.","timestamp":1773654128681,"segment":0}
{"run":300,"commit":"1d7f2f9","metric":0.6666666865348816,"metrics":{},"status":"discard","description":"Exact reran the new live aligned four-head grouped-prefix mainline (`semantic_future_prediction_steps=4`, future weight 0.5, `semantic_self_condition_prob=0.5`, EOS weight 2.0, tokenizer/model-vocab alignment fix, and 3-token grouped decoding for the first 12 semantic tokens). It held the same primary metric at asr_wer_prefix=0.6667 while improving CER further to 0.545, still emitting EOS on both prompts and shortening the OOD generation to ~30 frames. This confirms the new aligned grouped-prefix branch is much more reproducible than the old fragile grouped winner, even though the primary metric itself was unchanged on the rerun.","timestamp":1773654923105,"segment":0}
{"run":301,"commit":"1d7f2f9","metric":1,"metrics":{},"status":"discard","description":"Tried reintroducing the exact-last grouped transition on top of the new live aligned four-head grouped-prefix mainline (`semantic_block_decode_exact_last_token=true` with first 12 semantic tokens grouped, future steps 4, future weight 0.5, `semantic_self_condition_prob=0.5`, EOS weight 2.0, tokenizer/model-vocab alignment fix). Unlike the plain aligned grouped-prefix branch, this regressed to asr_wer_prefix=1.0 despite still emitting EOS on both prompts and keeping generations short (~32/36 frames). So the alignment-fix gain currently combines with plain grouped-prefix decoding, not with the exact-last grouped transition.","timestamp":1773655713576,"segment":0}
{"run":302,"commit":"1d7f2f9","metric":1,"metrics":{},"status":"discard","description":"Retuned the new live aligned four-head grouped-prefix mainline by lengthening the grouped prefix from 12 to 15 semantic tokens (`semantic_block_decode_max_grouped_tokens=15`) while keeping future steps 4, future weight 0.5, `semantic_self_condition_prob=0.5`, EOS weight 2.0, and the tokenizer/model-vocab alignment fix. The shorter aligned 12-token grouped prefix had tied the robust best twice, but this longer grouped window regressed cleanly to asr_wer_prefix=1.0 despite still emitting EOS on both prompts. So the aligned four-head grouped clue already looks localized around the old 12-token cutoff rather than favoring a longer grouped prefix.","timestamp":1773656482997,"segment":0}
{"run":303,"commit":"1d7f2f9","metric":0.8333333134651184,"metrics":{},"status":"discard","description":"Transferred the late-boundary schedule clue onto the new aligned four-head grouped branch by replacing the plain 12-token grouped prefix with `semantic_block_decode_schedule=3,3,3,1,2` while keeping future steps 4, future weight 0.5, `semantic_self_condition_prob=0.5`, EOS weight 2.0, and the tokenizer/model-vocab alignment fix. This preserved the nice post-fix EOS behavior and kept generations short (~32/33 frames), but it regressed the primary metric to asr_wer_prefix=0.8333 with weaker CER 0.727. So on the aligned four-head branch, the simple late exact-bridge schedule is still weaker than the plain 12-token grouped-prefix cutoff.","timestamp":1773657563729,"segment":0}
{"run":304,"commit":"1d7f2f9","metric":0.8333333134651184,"metrics":{},"status":"discard","description":"Transferred the old late-boundary schedule clue onto the tokenizer-aligned version of the original grouped-prefix winner family (`text_source=both`, `semantic_future_prediction_steps=2`, future weight 0.5, `semantic_self_condition_prob=0.5`, EOS weight 2.0, `semantic_block_decode_schedule=3,3,3,1,2`). With the alignment fix this branch now emitted EOS on both prompts and recovered decent in-domain WER 0.444, but the primary metric still reached only asr_wer_prefix=0.8333 with CER 0.773 and ~40/41 generated frames. So the post-fix late-boundary schedule remains only a weak side clue on the old grouped family and still does not rival either the historical 0.5 outlier or the new aligned four-head grouped mainline at 0.6667.","timestamp":1773658307702,"segment":0}
{"run":305,"commit":"1570c6b","metric":0.3333333432674408,"metrics":{},"status":"keep","description":"Transferred the old mixed-text clue onto the new aligned four-head grouped-prefix mainline: `text_source=both` plus four future-Q0 heads at weight 0.5, `semantic_self_condition_prob=0.5`, EOS weight 2.0, tokenizer/model-vocab alignment fix, and 3-token grouped decoding for the first 12 semantic tokens before exact fallback. This is the new best result so far: asr_wer_prefix improved to 0.3333, CER improved sharply to 0.318, EOS fired on both prompts, gt-ASR sanity stayed perfect, and generations remained short (~34/40 frames). So mixed normalized+raw text does combine very well with the aligned four-head grouped-prefix branch, even though it had failed on the aligned four-head exact-decoding baseline.","timestamp":1773659074256,"segment":0}
{"run":306,"commit":"1570c6b","metric":0.8333333134651184,"metrics":{},"status":"discard","description":"Exact reran the new aligned mixed-text four-head grouped mainline (`text_source=both`, future steps 4, future weight 0.5, `semantic_self_condition_prob=0.5`, EOS weight 2.0, tokenizer/model-vocab alignment fix, and 3-token grouped decoding for the first 12 semantic tokens). The first run had reached a new best `asr_wer_prefix=0.3333`, but this exact rerun fell back to `0.8333` even though EOS still fired on both prompts, gt-ASR sanity stayed good, and generations remained short (~33/39 frames). So the new mixed-text aligned grouped branch is highly promising, but its first win is still fragile and needs more stabilization or confirmation.","timestamp":1773659821406,"segment":0}
{"run":307,"commit":"1570c6b","metric":1,"metrics":{},"status":"discard","description":"Tried to stabilize the new mixed-text aligned four-head grouped branch by replacing the plain 12-token grouped prefix with the old late-boundary schedule `semantic_block_decode_schedule=3,3,3,1,2` while keeping `text_source=both`, future steps 4, future weight 0.5, `semantic_self_condition_prob=0.5`, EOS weight 2.0, and the tokenizer/model-vocab alignment fix. This regressed cleanly to asr_wer_prefix=1.0 even though EOS still fired on both prompts and in-domain WER improved to 0.333. So the late exact-bridge schedule does not stabilize the new mixed-text aligned grouped clue; the current win prefers the plain 12-token grouped cutoff.","timestamp":1773660688574,"segment":0}
{"run":308,"commit":"1570c6b","metric":0.6666666865348816,"metrics":{},"status":"discard","description":"Tested whether broader LoRA adaptation stabilizes the new mixed-text aligned four-head grouped branch by adding `lora_targets=[q_proj,k_proj,v_proj,o_proj,gate,up,down]` on top of `text_source=both`, future steps 4, future weight 0.5, `semantic_self_condition_prob=0.5`, EOS weight 2.0, tokenizer/model-vocab alignment fix, and the 12-token 3-way grouped prefix. This held decent behavior — asr_wer_prefix=0.6667, CER 0.409, EOS on both prompts, and short generations (~30/39 frames) — but it still did not reproduce or beat the new `0.3333` winner. So the fuller LoRA target set may be a mild stabilizer on the mixed-text aligned grouped branch, but it is not yet a better mainline than the plain grouped recipe.","timestamp":1773661519598,"segment":0}
{"run":309,"commit":"1570c6b","metric":1,"metrics":{},"status":"discard","description":"Transferred the exact-last grouped transition onto the new mixed-text aligned four-head grouped mainline (`text_source=both`, future steps 4, future weight 0.5, `semantic_self_condition_prob=0.5`, EOS weight 2.0, tokenizer/model-vocab alignment fix, first 12 semantic tokens grouped, `semantic_block_decode_exact_last_token=true`). Unlike the plain mixed-text aligned grouped cutoff that hit the new 0.3333 best once, this regressed cleanly to asr_wer_prefix=1.0 despite still emitting EOS on both prompts, keeping gt-ASR sanity perfect, and preserving decent in-domain WER 0.444. So mixed-text does not rescue the exact-last grouped transition on the aligned four-head branch; the live win still prefers the plain grouped-prefix cutoff.","timestamp":1773662481425,"segment":0}
{"run":310,"commit":"1570c6b","metric":1,"metrics":{},"status":"discard","description":"Transferred the cheap targeted early-prefix train/infer-match idea onto the new mixed-text aligned four-head grouped mainline by enabling inference-policy scheduled sampling only for the first grouped-prefix window and restricting replacement to speculative grouped slots (`semantic_self_condition_use_inference_policy=true`, `semantic_self_condition_match_early_grouped_prefix=true`, `semantic_self_condition_match_grouped_future_slots_only=true`, `semantic_self_condition_inference_policy_prob=0.0`) on top of `text_source=both`, future steps 4, future weight 0.5, `semantic_self_condition_prob=0.5`, EOS weight 2.0, tokenizer/model-vocab alignment fix, and the 12-token 3-way grouped prefix. Throughput stayed normal enough (~20.1k samples / 10 min) and in-domain WER improved sharply to 0.111, but the OOD primary metric still regressed cleanly to asr_wer_prefix=1.0 with weaker gt-ASR sanity 0.15. So this cheap early-prefix future-slot matching path does not stabilize the new mixed-text aligned grouped winner and currently looks like another in-domain-only side effect.","timestamp":1773663227180,"segment":0}
{"run":311,"commit":"1570c6b","metric":0.6666666865348816,"metrics":{},"status":"discard","description":"Exact reran the fuller-LoRA transfer on the mixed-text aligned four-head grouped branch (`text_source=both`, future steps 4, future weight 0.5, `semantic_self_condition_prob=0.5`, EOS weight 2.0, tokenizer/model-vocab alignment fix, 12-token 3-way grouped prefix, `lora_targets=[q_proj,k_proj,v_proj,o_proj,gate,up,down]`). It again landed at asr_wer_prefix=0.6667, this time with CER 0.591, perfect gt-ASR sanity, EOS on both prompts, and very strong in-domain WER 0.111. So the fuller LoRA target set still does not beat the fragile 0.3333 winner, but it now looks like a genuinely more reproducible fallback on the mixed-text aligned grouped branch rather than a one-off tie.","timestamp":1773664042516,"segment":0}
{"run":312,"commit":"1570c6b","metric":0.8333333134651184,"metrics":{},"status":"discard","description":"Ran a second fresh rerun of the new mixed-text aligned four-head grouped mainline (`text_source=both`, future steps 4, future weight 0.5, `semantic_self_condition_prob=0.5`, EOS weight 2.0, tokenizer/model-vocab alignment fix, and 3-token grouped decoding for the first 12 semantic tokens). After the original `0.3333` win and an earlier exact rerun that fell back to `0.8333`, this fresh rerun again landed at `0.8333` with CER 0.636, EOS on both prompts, and shorter generations (~31/40), but much worse gt-ASR sanity 0.353. So the plain mixed-text aligned grouped recipe now looks clearly fragile: it can spike to a new best, but the more repeatable behavior is still far weaker than the one-off 0.3333 result.","timestamp":1773664810653,"segment":0}
{"run":313,"commit":"1570c6b","metric":0.8333333134651184,"metrics":{},"status":"discard","description":"Implemented keyed LoRA-dropout plumbing through the LLM training path (`apply_linear`, `_apply_linear_batched`, transformer/LLM forward passes, and stage-1 training calls now pass PRNG keys so `lora_dropout` is finally active), then tested it on the most plausible branch: the mixed-text aligned four-head grouped fallback with broader LoRA targets (`text_source=both`, future steps 4, future weight 0.5, `semantic_self_condition_prob=0.5`, EOS weight 2.0, 12-token 3-way grouped prefix, `lora_targets=[q_proj,k_proj,v_proj,o_proj,gate,up,down]`, `lora_dropout=0.05`). This ran cleanly but throughput collapsed catastrophically to only 436 steps / 3.5k samples in 10 minutes, in-domain EOS disappeared, and the primary metric regressed to asr_wer_prefix=0.8333. So the first real keyed LoRA-dropout implementation is currently far too expensive and does not help this branch at `lora_dropout=0.05`. We should only keep pursuing this if a no-dropout control shows the plumbing itself is neutral or if a much cheaper keyed implementation is found.","timestamp":1773666428760,"segment":0}
{"run":314,"commit":"1570c6b","metric":1,"metrics":{},"status":"discard","description":"Ran the no-dropout control for the new keyed LoRA-dropout plumbing on the same mixed-text aligned four-head grouped fallback (`text_source=both`, future steps 4, future weight 0.5, `semantic_self_condition_prob=0.5`, EOS weight 2.0, 12-token 3-way grouped prefix, `lora_targets=[q_proj,k_proj,v_proj,o_proj,gate,up,down]`, `lora_dropout=0.0`). This was meant to check whether the plumbing itself was neutral, but it was not: throughput still dropped heavily to only 2216 steps / 17.7k samples in 10 minutes, the OOD metric regressed all the way to asr_wer_prefix=1.0, and the OOD generation stretched back out to 51 frames. So the current keyed LoRA-dropout implementation is not just making `lora_dropout=0.05` expensive — the whole keyed training path is presently harmful even at dropout 0, and should be reverted unless reimplemented much more cheaply.","timestamp":1773667214150,"segment":0}
{"run":315,"commit":"1570c6b","metric":1,"metrics":{},"status":"discard","description":"Tried a broader plain grouped-prefix decoder that actually uses all four future-Q0 heads during inference on the new mixed-text aligned branch: `text_source=both`, future steps 4, future weight 0.5, `semantic_self_condition_prob=0.5`, EOS weight 2.0, tokenizer/model-vocab alignment fix, `semantic_block_decode_size=5`, and grouped only for the first 10 semantic tokens (two 5-token grouped steps, then exact fallback). This preserved EOS on both prompts and even hit perfect in-domain WER 0.0, but the OOD primary metric regressed cleanly to asr_wer_prefix=1.0 with worse CER 0.864. So using all four future heads in a broader plain grouped step looks like another in-domain-only side effect rather than a better transition for the aligned mixed-text branch.","timestamp":1773668224817,"segment":0}
{"run":316,"commit":"1570c6b","metric":1,"metrics":{},"status":"discard","description":"Benchmarked the broader plain grouped-step idea on the tokenizer-aligned four-head grouped backbone without mixed-text conditioning: future steps 4, future weight 0.5, `semantic_self_condition_prob=0.5`, EOS weight 2.0, `semantic_block_decode_size=5`, and grouped only for the first 10 semantic tokens so all four future heads are used during inference in two large grouped steps before exact fallback. Like the mixed-text transfer, this kept EOS on both prompts and had perfect gt-ASR sanity, but the OOD primary metric still regressed cleanly to asr_wer_prefix=1.0. So broader plain grouped steps that consume all four future heads now look stale on both the aligned normalized-text backbone and the mixed-text transfer branch.","timestamp":1773669016811,"segment":0}
{"run":317,"commit":"1570c6b","metric":0,"metrics":{},"status":"crash","description":"Tried a fresh structural transfer onto the current best branch by swapping to the larger Stage-1 LM on the aligned mixed-text four-head grouped recipe (`llm_repo=QWEN3_1_7B`, `batch_size=4`, `text_source=both`, future steps 4, future weight 0.5, `semantic_self_condition_prob=0.5`, EOS weight 2.0, tokenizer/model-vocab alignment fix, 12-token 3-way grouped prefix). The run crashed before training because the required `train` / `unpadded` dataset caches for this tokenizer/config hash were not prebuilt under the aligned setup. This is a setup crash rather than a model failure; if the larger-LM transfer still looks worth probing, the 1.7B dataset caches need to be regenerated first.","timestamp":1773669135115,"segment":0}
{"run":318,"commit":"1570c6b","metric":1,"metrics":{},"status":"discard","description":"After regenerating the required dataset caches for the aligned 1.7B tokenizer/config hash, retried a fresh larger-LM transfer onto the current best branch: `llm_repo=QWEN3_1_7B`, `batch_size=4`, `text_source=both`, future steps 4, future weight 0.5, `semantic_self_condition_prob=0.5`, EOS weight 2.0, tokenizer/model-vocab alignment fix, and the 12-token 3-way grouped prefix. This ran cleanly but still regressed to asr_wer_prefix=1.0 with CER 0.818, despite emitting EOS on both prompts. So the larger-LM path still does not transfer to the new aligned mixed-text four-head grouped mainline; it remains a stale/noisy side branch rather than a robust extension of the current winner.","timestamp":1773669945186,"segment":0}
