{"run":643,"commit":"6c343f1","metric":1,"metrics":{},"status":"discard","description":"Tested whether the wrapper surface's **GPU-monitor-only** failure from #641 is specifically about a **spawned manager** versus the GPU monitor worker itself. I used the direct exec-real wrapper with the old-overlay **forked manager + CPU disabled** surface (`/tmp/xaxpkg-oldexact-forkmgr-nocpu`), so the manager is created under `fork` while the GPU stats monitor remains the only active monitor subprocess. This still failed cleanly at **`asr_wer_prefix=1.0`** with old-regime throughput (~29.6k samples / 10 min), EOS on both prompts, and mild gt-ASR drift (`asr_wer_gt=0.1`). So on the exec-real wrapper surface, the harsher **GPU monitor** damage is **not** explained away by the manager being spawned; the GPU-monitor path itself remains sufficient to keep the run in the bad class.","timestamp":1773985696829,"segment":0}
{"run":644,"commit":"e8fca0d","metric":0.6666666865348816,"metrics":{},"status":"keep","description":"Tested the key wrapper-side hypothesis directly: keep the **direct exec-real wrapper** surface, keep the **GPU monitor as the only active monitor subprocess** (CPU disabled), but force that **GPU monitor worker itself off spawn** by combining the fork-manager + CPU-disabled overlay with the all-fork GPUStats patch. This rescued the wrapper surface from the previous GPU-only `1.0` failures (#641, #643) down to **`asr_wer_prefix=0.6667`** with old-regime throughput (~29.7k samples / 10 min), EOS on both prompts, clean gt-ASR, and much better in-domain prompt match (`asr_wer_prefix_in_domain=0.111`). So the wrapper-side GPU-monitor damage is now shown to be **materially tied to the GPU worker's spawned bootstrap itself**, not just to GPU monitoring logic or manager choice in the abstract.","timestamp":1773986661039,"segment":0}
{"run":645,"commit":"e8fca0d","metric":0.8333333134651184,"metrics":{},"status":"discard","description":"Isolated how much of the wrapper-side GPU-monitor rescue from #644 comes from **forcing the GPU worker off spawn itself** versus also moving the manager off spawn. I used the direct exec-real wrapper with **CPU disabled**, but this time kept the default spawned manager from the `nocpu` overlay and only replaced `gpu_stats.py` so the **GPU monitor worker** uses `fork`. That improved the raw GPU-only wrapper failure from `1.0` down to **`asr_wer_prefix=0.8333`** with old-regime throughput (~29.7k samples / 10 min), EOS on both prompts, and clean gt-ASR — but it was still clearly worse than #644’s **`0.6667`** when both the manager and the GPU worker were off spawn. So on the exec-real wrapper surface, forcing the GPU worker off spawn is a real rescue by itself, but the strongest recovery still appears to need **both** a non-spawn manager and a non-spawn GPU monitor worker.","timestamp":1773987471771,"segment":0}
{"run":646,"commit":"e8fca0d","metric":0.8333333134651184,"metrics":{},"status":"discard","description":"Completed the wrapper-side symmetry check for the **CPU monitor path**. I used the direct exec-real wrapper with the old-overlay **forked manager + GPU disabled + CPU worker forced to `fork`** surface (`/tmp/xaxpkg-oldexact-forkmgr-forkcpu-nogpu`). This landed at **`asr_wer_prefix=0.8333`** with old-regime throughput (~29.4k samples / 10 min), EOS on both prompts, and clean gt-ASR — essentially no better than the earlier wrapper-side CPU-only spawn case (`#642`). So unlike the harsher GPU path in #644/#645, the wrapper-side **CPU monitor** damage does **not** look strongly tied to its spawn bootstrap; forcing that worker off spawn does not materially improve the wrapper surface.","timestamp":1773988256218,"segment":0}
{"run":647,"commit":"e8fca0d","metric":0.6666666865348816,"metrics":{},"status":"discard","description":"Added direct **wrapper-side GPU bootstrap instrumentation** by patching the old-overlay `gpu_stats.py` on the **GPU-monitor-only** wrapper surface (`/tmp/xaxpkg-oldexact-nocpu-gpudebug`) and reran the canonical direct exec-real-wrapper benchmark. The metric itself was **noisy** — this probe unexpectedly tied the rescued class at **`asr_wer_prefix=0.6667`** with old-regime throughput (~29.9k samples / 10 min), EOS on both prompts, and clean gt-ASR — but the important result is the child dump: the spawned **GPU stats worker** does **not** come up as the wrapper file. It bootstraps with **`argv0=/tmp/current_ljspeech_copy.py`**, **`main_file=/tmp/current_ljspeech_copy.py`**, `main_name=__mp_main__`, `main_spec=null`, and `sys.path[0]=/tmp`, with the old overlays immediately after. So unlike the earlier bad symlinked CPU/manager children, the wrapper-side GPU worker already sees the **copied benchmark path** as `__main__`. This materially weakens the idea that the wrapper-side GPU-monitor harm is driven by the same wrong-`__main__` child identity mechanism; the remaining wrapper-specific GPU issue now looks more like a parent/bootstrap or non-`__main__` spawn-surface interaction.","timestamp":1773989768595,"segment":0}
{"run":648,"commit":"e8fca0d","metric":0.6666666865348816,"metrics":{},"status":"discard","description":"Added the complementary **wrapper-side manager-child bootstrap probe** by reusing the old-overlay `/tmp/xaxpkg-oldexact-managerdebug-nostats` (manager instrumentation + both stats monitors disabled) under the direct exec-real-wrapper surface. The metric again tied **`asr_wer_prefix=0.6667`** with old-regime throughput (~29.9k samples / 10 min), so this remained a diagnostic rather than a new quality gain. The key dump is that the spawned **manager child** also comes up with **`argv0=/tmp/current_ljspeech_copy.py`**, **`main_file=/tmp/current_ljspeech_copy.py`**, `main_name=__mp_main__`, and `sys.path[0]=/tmp`, with the old overlays immediately after. Combined with #647, this means that on the exec-real-wrapper surface **both** child types now inspected there — the **GPU monitor worker** and the **manager child** — already see the **copied benchmark path** as `__main__`, unlike the earlier bad symlinked CPU/manager children. So the remaining wrapper-specific harm is now even less consistent with a simple wrong-`__main__` spawned-child identity story; the live explanation should shift toward the parent/bootstrap surface or some other non-`__main__` spawn-state difference that still couples strongly to the monitor layer.","timestamp":1773990564131,"segment":0}
{"run":649,"commit":"e8fca0d","metric":0.8333333134651184,"metrics":{},"status":"discard","description":"Ran the complementary **true copied-script control** for the new wrapper-side GPU bootstrap dump: I reused the same GPU-only debug overlay (`/tmp/xaxpkg-oldexact-nocpu-gpudebug`) but launched the benchmark directly from `/tmp/current_ljspeech_copy.py` instead of through the exec-real wrapper. This landed at **`asr_wer_prefix=0.8333`** with old-regime throughput (~29.8k samples / 10 min), EOS on both prompts, and clean gt-ASR. The important part is the child dump: the spawned **GPU worker** on the true copied-script surface had an **effectively identical bootstrap payload** to the wrapper probe in #647 — same `argv0=/tmp/current_ljspeech_copy.py`, same `main_file=/tmp/current_ljspeech_copy.py`, same `main_name=__mp_main__`, `main_spec=null`, `main_loader=null`, and the same `sys.path` prefix. So the wrapper-vs-copy split is **not** explained by a different spawned GPU-worker `__main__`/loader/spec payload; the remaining wrapper-specific harm now looks even more like a **parent/bootstrap or other spawn-preparation difference outside the child's visible `__main__` state**.","timestamp":1773991598040,"segment":0}
{"run":650,"commit":"e8fca0d","metric":0.8333333134651184,"metrics":{},"status":"discard","description":"Ran the matching **true copied-script control** for the wrapper-side manager-child probe by launching `/tmp/current_ljspeech_copy.py` directly with the old-overlay `/tmp/xaxpkg-oldexact-managerdebug-nostats` (manager bootstrap dump + both stats monitors disabled). This landed at **`asr_wer_prefix=0.8333`** with old-regime throughput (~29.9k samples / 10 min), EOS on both prompts, and clean gt-ASR. The key dump is that the spawned **manager child** on the true copied-script surface had an **effectively identical payload** to the wrapper probe in #648 — same `argv0=/tmp/current_ljspeech_copy.py`, same `main_file=/tmp/current_ljspeech_copy.py`, same `main_name=__mp_main__`, `main_spec=null`, and the same `sys.path` prefix. Together with #649, this rules out not just wrong-`__main__` path identity but also any obvious visible child bootstrap difference for the two wrapper-inspected subprocesses. The wrapper-vs-copy gap now looks even more concentrated in some **parent/bootstrap or hidden spawn-preparation state** that is not exposed in the child's basic `__main__`/`sys.path` payload.","timestamp":1773992363847,"segment":0}
{"run":651,"commit":"e8fca0d","metric":1,"metrics":{},"status":"discard","description":"Added a new **parent/child spawn-preparation probe** using a temp `sitecustomize.py` patch (`/tmp/spawnprepdebug/sitecustomize.py`) that dumps `multiprocessing.spawn.get_preparation_data(...)` in the parent and `multiprocessing.spawn.prepare(...)` in the child. I ran it on the **direct exec-real wrapper** with the old-overlay **GPU-only** surface (`/tmp/xaxpkg-oldexact-nocpu`). Quality itself was poor here (**`asr_wer_prefix=1.0`**, old-regime throughput ~29.7k / 10 min), but the diagnostic payload is the point: for both **`SyncManager-1`** and **`xax-gpu-stats`**, the wrapper-side parent prep data already used **`init_main_from_path=/tmp/current_ljspeech_copy.py`**, `sys_argv[0]=/tmp/current_ljspeech_copy.py`, the expected overlay `sys_path`, and even reported `start_method='fork'` in the prep payload; the matching child `prepare(...)` dumps echoed the same visible fields. So at least at the level of **visible `multiprocessing.spawn` prep data**, the wrapper surface already looks like the copied-script path, which weakens the hypothesis that the remaining wrapper harm is explained by a simple prep-data mismatch.","timestamp":1773994165355,"segment":0}
{"run":652,"commit":"e8fca0d","metric":1,"metrics":{},"status":"discard","description":"Ran the matching **true copied-script control** for the new `multiprocessing.spawn` prep-data probe, again using `/tmp/spawnprepdebug/sitecustomize.py` and the same old-overlay **GPU-only** surface (`/tmp/xaxpkg-oldexact-nocpu`), but launching `/tmp/current_ljspeech_copy.py` directly instead of via the exec-real wrapper. This also landed at **`asr_wer_prefix=1.0`** with old-regime throughput (~29.8k / 10 min). The key comparison is that the copied-script parent `get_preparation_data(...)` dumps for both **`SyncManager-1`** and **`xax-gpu-stats`**, plus the child `prepare(...)` dumps, were **effectively identical** to the wrapper probe in #651 apart from run-specific values like authkey / run_dir. They used the same **`init_main_from_path=/tmp/current_ljspeech_copy.py`**, the same `sys_argv`, the same overlay `sys_path`, and the same visible `start_method='fork'`. So the wrapper-vs-copy gap is now **not** explained by any obvious visible `multiprocessing.spawn` preparation-data difference either. That concentrates the remaining wrapper-specific harm even more tightly in some **deeper parent/bootstrap or hidden spawn-launch state** beyond the fields exposed by `get_preparation_data(...)` / `prepare(...)`.","timestamp":1773994175596,"segment":0}
{"run":653,"commit":"e8fca0d","metric":0.5,"metrics":{},"status":"discard","description":"Added a deeper **spawn-launch probe** via `/tmp/spawnlaunchdebug/sitecustomize.py`, patching `multiprocessing.popen_spawn_posix.Popen._launch`, `spawn.get_command_line`, `util.spawnv_passfds`, and `reduction.dump` so the parent logs launch metadata for each spawned subprocess. I ran it on the **direct exec-real wrapper** with the old-overlay **GPU-only** surface (`/tmp/xaxpkg-oldexact-nocpu`). The metric itself unexpectedly improved to **`asr_wer_prefix=0.5`** with old-regime throughput (~29.8k / 10 min), EOS on both prompts, and clean gt-ASR, but the main point is the new launch dump: for the wrapper-side spawned **manager** process, the parent saw `process_class=SpawnProcess`, target `multiprocessing.managers.BaseManager._run_server`, a normal `spawn_main(...)` command line under the project Python, `passfds=[8,6,10,9]`, and a process-object pickle size of `1891` bytes; a second launch captured the wrapper-side **GPU worker** similarly. So we now have the deeper parent-side launch metadata needed for the wrapper-vs-copy comparison, beyond the already-matched visible child `__main__` and visible `spawn` prep-data fields.","timestamp":1773995276433,"segment":0}
{"run":654,"commit":"e8fca0d","metric":0.5,"metrics":{},"status":"discard","description":"Ran the matching **true copied-script control** for the deeper parent-side launch probe (`/tmp/spawnlaunchdebug/sitecustomize.py`) on the same old-overlay **GPU-only** surface (`/tmp/xaxpkg-oldexact-nocpu`). This also landed at **`asr_wer_prefix=0.5`** with old-regime throughput (~29.8k / 10 min), EOS on both prompts, and clean gt-ASR. The crucial comparison is that the copied-script launch metadata matched the wrapper probe in #653 at the deeper parent-launch level too: same **`SpawnProcess`** manager target (`multiprocessing.managers.BaseManager._run_server`), same `spawn_main(...)` command line under the project Python, same manager process-object pickle size (**`1891` bytes**), and the same GPU-worker launch shape and `passfds` pattern — differing only in run-specific fields like PIDs and run_dir. So the wrapper-vs-copy gap is now **not** explained by any obvious visible child payloads, visible `multiprocessing.spawn` prep data, or this deeper visible `Popen._launch` / `spawnv_passfds` metadata either. The remaining wrapper-specific mechanism now looks pushed further into **still-hidden parent/bootstrap state or run-to-run noise**, not into the launch metadata surfaces inspected so far.","timestamp":1773996072745,"segment":0}
{"run":655,"commit":"e8fca0d","metric":0.8333333134651184,"metrics":{},"status":"discard","description":"Revisited the **old-train-cache-only** recovery route on the fully local detached old-worktree surface: `/tmp/xax-bench-9cea09c` forced onto `PYTHONPATH`, older HF overlay (`/tmp/xax-overlay-hf452`), and the config/data surface from `/tmp/xaxrc-oldtrain-hf452-local/config.yml` that contains only the old `train/a009c9c8eee13c4a_e4146c08` payload. The canonical aligned normalized 4-head grouped diagnostic landed at **`asr_wer_prefix=0.8333`** with old-regime throughput (~29.7k samples / 10 min), EOS on both prompts, and clean gt-ASR. So the old-train-only path is still alive enough to avoid the clean `1.0` dead class, but it remains unstable and bimodal rather than a reliable recovery: the sequence is now **`0.8333 -> 0.3333 -> 1.0 -> 1.0 -> 0.8333`**.","timestamp":1773997040993,"segment":0}
{"run":656,"commit":"64d633d","metric":0.3333333432674408,"metrics":{},"status":"keep","description":"Built a deeper **manager-child inspect** overlay (`/tmp/xaxpkg-oldexact-managerinspect-nostats`) on the bad **symlink-to-copy** current-script surface, starting from the old no-stats / manager-debug patch and extending the spawned manager dump with `inspect.getfile(...)`, loader/package/cached fields, `_path_to_module_name(...)`, resolved-path comparisons, and sample function `co_filename` / `inspect.getmodule(...)` data. On that same old-HF + aliased-old-cache split-overlay surface, the spawn-manager-only diagnostic unexpectedly improved sharply to **`asr_wer_prefix=0.3333`** with old-regime throughput (~30.0k samples / 10 min), EOS on both prompts, and clean gt-ASR. The new child dump matters: even though the spawned manager still comes up with **`main_file=/tmp/current-copy-link.py`** and `inspect.getfile(__main__)` also points at the symlink path, `_path_to_module_name(Path(main_file))` already resolves to **`current_ljspeech_copy`**, `examples.ljspeech` is absent from `sys.modules`, and sampled functions defined in the main module still retain **`co_filename=/tmp/current-copy-link.py`** while imported helpers point into the old overlay modules. So the bad-symlink mechanism still looks more like a **main-module code-object / bootstrap identity** issue than a simple module-name-resolution issue.","timestamp":1773998343114,"segment":0}
{"run":657,"commit":"64d633d","metric":1,"metrics":{},"status":"discard","description":"Ran the **true copied-script control** for the new deeper manager-child inspect overlay (`/tmp/xaxpkg-oldexact-managerinspect-nostats`) on the same old-HF + aliased-old-cache split-overlay **spawn-manager-only** surface. This landed back at **`asr_wer_prefix=1.0`** with the same old-regime throughput (~30.1k samples / 10 min), EOS on both prompts, and clean gt-ASR. The control dump is the important comparison against #656: `_path_to_module_name(Path(main_file))` still resolved to **`current_ljspeech_copy`**, `examples.ljspeech` was still absent from `sys.modules`, `sys.path` matched, and the manager child was still just `__main__/__mp_main__`. The materially different fields were the raw main-script identity itself — `main_file` / `inspect.getfile(__main__)` changed from **`/tmp/current-copy-link.py`** to **`/tmp/current_ljspeech_copy.py`** — and the sampled main-defined function `weighted_text_sample_bucket` changed its **`co_filename`** in lockstep from the symlink path to the copied path. So the new control strengthens the current explanation: on this symlink-vs-copy manager surface, the remaining live difference is now concentrated even more tightly in the **raw main-module / code-object filename identity**, not in module-name resolution, visible `sys.path`, or visible child import-set differences.","timestamp":1773999117051,"segment":0}
{"run":658,"commit":"64d633d","metric":1,"metrics":{},"status":"discard","description":"Ablated the new #656 clue on the bad **symlink-to-copy spawn-manager-only** surface by building a minimal manager-child overlay (`/tmp/xaxpkg-oldexact-managertouch-nostats`) that does almost nothing beyond touching one main-defined function, `weighted_text_sample_bucket`, and recording its `__code__.co_filename`. This was meant to test whether the #656 rescue was simply caused by accessing a main-function code object in the spawned manager child. It did **not** reproduce: the metric stayed at **`asr_wer_prefix=1.0`** with old-regime throughput (~29.9k samples / 10 min), even though the child dump confirmed the expected symlinked identity (`main_file=/tmp/current-copy-link.py`, `weighted_text_sample_bucket_code_file=/tmp/current-copy-link.py`). So the #656 improvement is **not** explained by merely touching one main-defined function's code filename in the manager child. That prunes the simplest \"any code-object touch rescues the bad symlinked manager surface\" story; if #656 was mechanistic rather than noise, it depends on a broader introspection/import side effect than this minimal touch.","timestamp":1774000112874,"segment":0}
{"run":659,"commit":"64d633d","metric":1,"metrics":{},"status":"discard","description":"Exact reran the full **manager-child inspect** overlay from #656 (`/tmp/xaxpkg-oldexact-managerinspect-nostats`) on the same bad **symlink-to-copy spawn-manager-only** surface. This cleanly collapsed back to **`asr_wer_prefix=1.0`** with old-regime throughput (~29.7k samples / 10 min), EOS on both prompts, and only mild gt-ASR drift. So the headline `0.3333` from #656 is **not reproducible** as-is. That sharply weakens the idea that the full manager-inspect overlay itself is a stable mechanistic repair; in combination with #658, the best reading now is that #656 was either a noise spike or depended on some subtler broad side effect that is not robust enough to chase directly.","timestamp":1774001094013,"segment":0}
{"run":660,"commit":"64d633d","metric":0.8333333134651184,"metrics":{},"status":"discard","description":"Tested whether the lingering **old-train-cache-only** bimodality is materially driven by the same `ProcessMixin` child layer that hurts the mixed current-script surfaces. I kept the fully local detached `9cea09c` worktree on `PYTHONPATH`, the older HF overlay, and the config/data surface from `/tmp/xaxrc-oldtrain-hf452-local/config.yml` that contains only the old `train/a009c9c8eee13c4a_e4146c08` payload — but added **`disable_multiprocessing=true`** to remove the manager + monitor subprocess layer entirely. This landed at **`asr_wer_prefix=0.8333`** with old-regime throughput (~29.8k samples / 10 min), EOS on both prompts, and clean gt-ASR. So on the old-train-only detached-worktree route, removing multiprocessing does **not** look like a strong rescue lever by itself; it stayed in the same weak-live class as several ordinary old-train-only runs rather than recovering the `0.3333` spike or stabilizing the surface.","timestamp":1774001893333,"segment":0}
{"run":661,"commit":"64d633d","metric":1,"metrics":{},"status":"discard","description":"Tested whether the **old-train-cache-only** detached-worktree route is specifically sensitive to the old `ProcessMixin` **spawn** context rather than just to cache/data provenance. I kept the fully local detached `9cea09c` worktree on `PYTHONPATH`, the older HF overlay, and the old-train-only data surface, but changed only **`multiprocessing_context=fork`**. This fell cleanly to **`asr_wer_prefix=1.0`** with old-regime throughput (~29.7k samples / 10 min), EOS on both prompts, and clean gt-ASR. Combined with #660, that weakens the idea that the detached old-train-only bimodality is mainly driven by the manager/monitor child layer: neither removing multiprocessing entirely nor merely moving it to `fork` produced a strong rescue there.","timestamp":1774002674042,"segment":0}
