{"run":683,"commit":"847d9d5","metric":0.6666666865348816,"metrics":{},"status":"discard","description":"Started splitting the new detached **old-train-cache-only** no-stats rescue by reintroducing only the **GPU monitor**: built `/tmp/xax-bench-9cea09c-oldtrain-nocpu` (fully local `9cea09c` worktree with the CPU monitor disabled but GPU monitor left active) and reran the same older-HF + old-train-only canonical probe. This landed at **`asr_wer_prefix=0.6667`** with old-regime throughput (~29.8k samples / 10 min), EOS on both prompts, and acceptable gt-ASR — weaker than the new no-stats branch's `0.6667 -> 0.5 -> 0.5`. So on the detached old-train-only route too, putting the **GPU monitor** back already seems sufficient to erase the stronger `0.5` class, which points in the same direction as the copied/wrapper monitor asymmetry.","timestamp":1774021147815,"segment":0}
{"run":684,"commit":"847d9d5","metric":1,"metrics":{},"status":"discard","description":"Completed the first old-train-only monitor split by reintroducing only the **CPU monitor**: built `/tmp/xax-bench-9cea09c-oldtrain-nogpu` (fully local `9cea09c` worktree with the GPU monitor disabled but CPU monitor left active) and reran the same older-HF + old-train-only canonical probe. This collapsed cleanly to **`asr_wer_prefix=1.0`** with old-regime throughput (~29.8k samples / 10 min), EOS on both prompts, and acceptable gt-ASR. Combined with #680-#683, the detached old-train-only monitor picture is now much sharper: **no-stats** gives `0.6667 -> 0.5 -> 0.5`, **GPU-only** weakens only to `0.6667`, but **CPU-only** falls all the way back to `1.0`. So unlike the copied/wrapper mixed surfaces, the detached old-train-only route currently looks more like the earlier bad-symlink fork-manager split: the **CPU monitor path** is the harsher degradant here.","timestamp":1774021906831,"segment":0}
{"run":685,"commit":"847d9d5","metric":0.8333333134651184,"metrics":{},"status":"discard","description":"Exact reran the detached **old-train-cache-only + GPU-only monitor** split from #683 on the same fully local `/tmp/xax-bench-9cea09c-oldtrain-nocpu` surface with the older-HF stack and `/tmp/xaxrc-oldtrain-hf452-local/config.yml`. It weakened further to **`asr_wer_prefix=0.8333`** with old-regime throughput (~29.9k samples / 10 min), EOS on both prompts, and acceptable gt-ASR. So the detached historical old-train-only monitor split is now: **no-stats** `0.6667 -> 0.5 -> 0.5`, **GPU-only** `0.6667 -> 0.8333`, and **CPU-only** `1.0`. That keeps the qualitative asymmetry intact — the **CPU monitor** still looks materially harsher than the **GPU monitor** on this route — but downgrades the GPU-only `0.6667` as a stable midpoint.","timestamp":1774022877576,"segment":0}
{"run":686,"commit":"1675acf","metric":0.8333333134651184,"metrics":{},"status":"keep","description":"Tested whether the detached **old-train-cache-only + CPU-only** failure is specifically tied to the **CPU worker's spawned bootstrap** by building `/tmp/xax-bench-9cea09c-oldtrain-forkcpu-nogpu` (fully local `9cea09c` worktree with GPU monitor disabled and the CPU stats worker itself forced to `fork`, while leaving the broader process surface otherwise unchanged) and rerunning the same older-HF + old-train-only canonical probe. This improved cleanly from the raw CPU-only `1.0` in #684 down to **`asr_wer_prefix=0.8333`** with old-regime throughput (~29.8k samples / 10 min), EOS on both prompts, and acceptable gt-ASR. So on the detached historical old-train-only route too, the **CPU monitor** damage is at least partly tied to its **spawned bootstrap**, not just to CPU-monitor logic in the abstract.","timestamp":1774023796605,"segment":0}
{"run":687,"commit":"1675acf","metric":0.8333333134651184,"metrics":{},"status":"discard","description":"Exact reran the detached **old-train-cache-only + CPU-only + forked CPU worker** split from #686 on the same fully local `/tmp/xax-bench-9cea09c-oldtrain-forkcpu-nogpu` surface with the older-HF stack and `/tmp/xaxrc-oldtrain-hf452-local/config.yml`. It held **`asr_wer_prefix=0.8333`** again with old-regime throughput (~29.6k samples / 10 min), EOS on both prompts, and clean gt-ASR. Even though the primary metric is unchanged and therefore logged as discard, this materially strengthens the mechanism result: on the detached historical old-train-only route, forcing the **CPU worker** off spawn reproducibly improves the raw **CPU-only** surface from `1.0` to `0.8333`, so the harsher CPU-monitor damage there is indeed tied in part to the worker's **spawned bootstrap**.","timestamp":1774024561863,"segment":0}
{"run":688,"commit":"1675acf","metric":1,"metrics":{},"status":"discard","description":"Tested the detached **old-train-cache-only + CPU-only** split with the **manager forced to fork** but the CPU worker left on its default spawned bootstrap by building `/tmp/xax-bench-9cea09c-oldtrain-forkmgr-nogpu` (fully local `9cea09c` worktree, GPU monitor disabled, forked manager only) and rerunning the same older-HF + old-train-only canonical probe. This failed cleanly at **`asr_wer_prefix=1.0`** with old-regime throughput (~29.5k samples / 10 min), EOS on both prompts, and acceptable gt-ASR. So on the detached historical old-train-only route, the harsher **CPU-only** damage does **not** look mainly like a manager-spawn problem; combined with #686-#687, the stronger live lever is the **CPU worker's own spawned bootstrap** rather than manager creation.","timestamp":1774025338796,"segment":0}
{"run":689,"commit":"1675acf","metric":1,"metrics":{},"status":"discard","description":"Tested the detached **old-train-cache-only + GPU-only** split with the **GPU worker itself forced off spawn** but the broader process surface otherwise unchanged by building `/tmp/xax-bench-9cea09c-oldtrain-nocpu-forkgpu` (fully local `9cea09c` worktree, CPU monitor disabled, GPU worker forced to `fork`) and rerunning the same older-HF + old-train-only canonical probe. This failed cleanly at **`asr_wer_prefix=1.0`** with old-regime throughput (~29.7k samples / 10 min), EOS on both prompts, and acceptable gt-ASR. So unlike the detached old-train-only **CPU-only** branch, simply moving the **GPU worker** off spawn is **not** an obvious rescue on this route; the sharper live lever remains the CPU-monitor side.","timestamp":1774026122725,"segment":0}
{"run":690,"commit":"ca32442","metric":0.3333333432674408,"metrics":{},"status":"keep","description":"Completed the missing detached **old-train-cache-only + CPU-only + forked manager + forked CPU worker** split by building `/tmp/xax-bench-9cea09c-oldtrain-forkmgr-forkcpu-nogpu` (fully local `9cea09c` worktree with GPU monitor disabled, manager forced to `fork`, and CPU stats worker also forced to `fork`) and rerunning the same older-HF + old-train-only canonical probe. This improved sharply to **`asr_wer_prefix=0.3333`** with near-old-regime throughput (~29.5k samples / 10 min), EOS on both prompts, and clean gt-ASR. Relative to #684 and #686-#688, this cleanly completes the detached old-train-only CPU split: raw **CPU-only** was `1.0`, **forked manager only** stayed `1.0`, **forked CPU worker only** improved reproducibly to `0.8333`, and moving **both manager and CPU worker off spawn** now reaches `0.3333`. So on this detached historical surface, the CPU-monitor damage still routes mainly through the **CPU worker's spawned bootstrap**, but the strongest recovery appears to benefit from taking the **manager** off spawn too.","timestamp":1774027059706,"segment":0}
{"run":691,"commit":"ca32442","metric":0.8333333134651184,"metrics":{},"status":"discard","description":"Exact reran the fresh detached **old-train-cache-only + CPU-only + forked manager + forked CPU worker** branch from #690 on the same fully local `/tmp/xax-bench-9cea09c-oldtrain-forkmgr-forkcpu-nogpu` surface with the older-HF stack and `/tmp/xaxrc-oldtrain-hf452-local/config.yml`. It weakened sharply from `0.3333` back to **`asr_wer_prefix=0.8333`** with near-old-regime throughput (~29.5k samples / 10 min), EOS on both prompts, and clean gt-ASR. So the new detached old-train-only CPU all-fork rescue is **not reproducible as-is**; it remains a strong mechanistic clue, but for now the semi-stable old-train-only anchor is still the broader **no-stats** route at `0.6667 -> 0.5 -> 0.5`, not the more surgical CPU-only all-fork branch.","timestamp":1774027960432,"segment":0}
{"run":692,"commit":"ca32442","metric":1,"metrics":{},"status":"discard","description":"Tested whether the semi-stable detached **old-train-cache-only + no-stats** branch benefits from moving the remaining **manager** off spawn by building `/tmp/xax-bench-9cea09c-oldtrain-forkmgr-nostats` (fully local `9cea09c` worktree with both stats monitors disabled and the manager forced to `fork`) and rerunning the same older-HF + old-train-only canonical probe. This failed cleanly at **`asr_wer_prefix=1.0`** with old-regime throughput (~29.7k samples / 10 min), EOS on both prompts, and clean gt-ASR. So on the detached historical old-train-only route, the stronger **no-stats** branch does **not** want a forked manager; the semi-stable `0.6667 -> 0.5 -> 0.5` anchor appears to depend on the default manager surface, which sharpens the route-specific split from the CPU-only branch where taking both the manager and CPU worker off spawn improved once.","timestamp":1774028752361,"segment":0}
{"run":693,"commit":"ca32442","metric":0.8333333134651184,"metrics":{},"status":"discard","description":"Exact fourth probe of the detached **old-train-cache-only + no-stats** route from #680-#682 on the same fully local `/tmp/xax-bench-9cea09c-oldtrain-nostats` surface with the older-HF stack and `/tmp/xaxrc-oldtrain-hf452-local/config.yml`. It weakened sharply from the earlier `0.5 -> 0.5` pair back to **`asr_wer_prefix=0.8333`** with near-old-regime throughput (~29.5k samples / 10 min), EOS on both prompts, and clean gt-ASR. So the semi-stable-looking old-train-only no-stats anchor is **less stable than it looked**; it is still clearly better than the raw `1.0` class some of the time, but it should now be treated as another noisy branch rather than a recovered baseline.","timestamp":1774029528047,"segment":0}
{"run":694,"commit":"d95b4ca","metric":0.6666666865348816,"metrics":{},"status":"keep","description":"Tested the fully detached **old-train-cache-only** route with **all three child paths moved off spawn** by building `/tmp/xax-bench-9cea09c-oldtrain-allfork` (fully local `9cea09c` worktree with the manager forced to `fork` plus both CPU and GPU monitor workers forced to `fork`) and rerunning the same older-HF + old-train-only canonical probe. This improved cleanly to **`asr_wer_prefix=0.6667`** with near-old-regime throughput (~29.3k samples / 10 min), EOS on both prompts, and clean gt-ASR. Relative to #684-#689 and #692-#693, this suggests the detached historical old-train-only route does have a real broader child-bootstrap component beyond the CPU-only split: fully moving **manager + CPU worker + GPU worker** off spawn is materially better than the raw `1.0` class, even though the more surgical branches remain noisy.","timestamp":1774030330341,"segment":0}
{"run":695,"commit":"d95b4ca","metric":0.6666666865348816,"metrics":{},"status":"discard","description":"Exact reran the new detached **old-train-cache-only + all-fork** branch from #694 on the same fully local `/tmp/xax-bench-9cea09c-oldtrain-allfork` surface with the older-HF stack and `/tmp/xaxrc-oldtrain-hf452-local/config.yml`. It held **`asr_wer_prefix=0.6667`** again with near-old-regime throughput (~29.3k samples / 10 min), EOS on both prompts, and acceptable gt-ASR. Even though the primary metric is unchanged and therefore logged as discard, this materially strengthens the branch: the detached historical **all-fork** route is now `0.6667 -> 0.6667`, making it more credible than the fresher `0.3333 -> 0.8333` CPU-only all-fork spike and more controlled than the recently weakened no-stats path.","timestamp":1774031172042,"segment":0}
{"run":696,"commit":"d95b4ca","metric":1,"metrics":{},"status":"discard","description":"Exact third probe of the detached **old-train-cache-only + all-fork** branch from #694-#695 on the same fully local `/tmp/xax-bench-9cea09c-oldtrain-allfork` surface with the older-HF stack and `/tmp/xaxrc-oldtrain-hf452-local/config.yml`. It collapsed from `0.6667 -> 0.6667` back to **`asr_wer_prefix=1.0`** with near-old-regime throughput (~29.5k samples / 10 min), EOS on both prompts, and clean gt-ASR. So the detached historical all-fork route is **not** a stable recovered surface either; it is now another noisy but real process-layer clue rather than a trustworthy anchor.","timestamp":1774031947176,"segment":0}
{"run":697,"commit":"d95b4ca","metric":1,"metrics":{},"status":"discard","description":"Tested the fully detached **old-train-cache-only** route with only the **CPU worker** forced off spawn while leaving the manager and GPU monitor on their default surfaces by building `/tmp/xax-bench-9cea09c-oldtrain-forkcpu` and rerunning the same older-HF + old-train-only canonical probe. This failed cleanly at **`asr_wer_prefix=1.0`** with near-old-regime throughput (~29.5k samples / 10 min), EOS on both prompts, and clean gt-ASR. So on the full detached historical old-train-only route, the CPU worker change by itself is **not** enough; the stronger effect seen on the CPU-only split does not transfer directly once the rest of the child layer stays active.","timestamp":1774032740931,"segment":0}
{"run":698,"commit":"da4f8ab","metric":0.6666666865348816,"metrics":{},"status":"keep","description":"Tested the fully detached **old-train-cache-only** route with the two CPU-side levers applied together but **GPU monitor left on its default spawned path** by building `/tmp/xax-bench-9cea09c-oldtrain-forkmgr-forkcpu` (fully local `9cea09c` worktree with the manager forced to `fork` and the CPU worker forced to `fork`, while the GPU monitor remains active) and rerunning the same older-HF + old-train-only canonical probe. This improved cleanly to **`asr_wer_prefix=0.6667`** with near-old-regime throughput (~29.5k samples / 10 min), EOS on both prompts, clean gt-ASR, and much stronger in-domain match (`0.2222`). Combined with #697 and #694, this suggests the detached historical route does **not** need the GPU worker moved off spawn to escape the raw `1.0` class; the stronger lever is the **CPU-side pair** of non-spawn manager plus non-spawn CPU worker.","timestamp":1774033503868,"segment":0}
{"run":699,"commit":"da4f8ab","metric":1,"metrics":{},"status":"discard","description":"Exact reran the detached **old-train-cache-only + forked manager + forked CPU worker** full-route branch from #698 on the same fully local `/tmp/xax-bench-9cea09c-oldtrain-forkmgr-forkcpu` surface with the older-HF stack and `/tmp/xaxrc-oldtrain-hf452-local/config.yml`. It collapsed back to **`asr_wer_prefix=1.0`** with near-old-regime throughput (~29.3k samples / 10 min), EOS on both prompts, and acceptable gt-ASR. So this CPU-side full-route rescue is **not reproducible as-is**; like the all-fork and CPU-only all-fork branches, it remains a real mechanistic clue but not a stable recovered surface.","timestamp":1774034267459,"segment":0}
{"run":700,"commit":"da4f8ab","metric":1,"metrics":{},"status":"discard","description":"Tested whether the detached **old-train-cache-only + CPU-only** failure is mainly due to the CPU monitor's *ongoing sampling load* rather than its bootstrap surface by keeping the raw CPU-only overlay (`/tmp/xax-bench-9cea09c-oldtrain-nogpu`) but slowing the monitor cadence from the default `cpu_stats.ping_interval=1` to **`10`** seconds. This still failed cleanly at **`asr_wer_prefix=1.0`** with near-old-regime throughput (~29.6k samples / 10 min), EOS on both prompts, and clean gt-ASR. So just polling the CPU monitor less often is **not** an obvious rescue; that weakens the “steady-state monitor load” story and keeps the sharper explanation on the detached historical route centered on the **CPU worker's spawned bootstrap / startup surface**.","timestamp":1774035054547,"segment":0}
{"run":701,"commit":"da4f8ab","metric":1,"metrics":{},"status":"discard","description":"Tested the fully detached **old-train-cache-only** route with only the **manager** forced off spawn while leaving both CPU and GPU monitor workers on their default spawned paths by building `/tmp/xax-bench-9cea09c-oldtrain-forkmgr` and rerunning the same older-HF + old-train-only canonical probe. This failed cleanly at **`asr_wer_prefix=1.0`** with near-old-regime throughput (~29.6k samples / 10 min), EOS on both prompts, and acceptable gt-ASR. So on the full detached historical route, **manager-fork alone is not enough**; escaping the raw `1.0` class seems to require additional worker-side changes, not just moving the manager off spawn.","timestamp":1774035838419,"segment":0}
{"run":702,"commit":"cbf2682","metric":0.5,"metrics":{},"status":"keep","description":"Tested the fully detached **old-train-cache-only** route with **both monitor workers** moved off spawn but the **manager left on its default surface** by building `/tmp/xax-bench-9cea09c-oldtrain-forkworkers` (fully local `9cea09c` worktree with CPU and GPU stats workers forced to `fork`, while `ProcessMixin` still uses its default manager creation) and rerunning the same older-HF + old-train-only canonical probe. This improved cleanly to **`asr_wer_prefix=0.5`** with near-old-regime throughput (~29.5k samples / 10 min), EOS on both prompts, and clean gt-ASR. Combined with #694, #698, and #701, this is a strong new split on the detached historical route: moving the **workers** off spawn matters more consistently than moving the **manager** off spawn, and the manager may even be unnecessary or harmful on some branches.","timestamp":1774036609791,"segment":0}
{"run":703,"commit":"cbf2682","metric":1,"metrics":{},"status":"discard","description":"Exact reran the new detached **old-train-cache-only + forked CPU worker + forked GPU worker** branch from #702 on the same fully local `/tmp/xax-bench-9cea09c-oldtrain-forkworkers` surface with the older-HF stack and `/tmp/xaxrc-oldtrain-hf452-local/config.yml`. It collapsed back to **`asr_wer_prefix=1.0`** with near-old-regime throughput (~29.5k samples / 10 min), EOS on both prompts, and clean gt-ASR. So the worker-only non-spawn branch is **not reproducible as-is**; like the other old-train-only process splits, it remains a real mechanistic clue but not a stable recovered surface.","timestamp":1774037375438,"segment":0}
{"run":704,"commit":"cbf2682","metric":1,"metrics":{},"status":"discard","description":"Tested the fully detached **old-train-cache-only** route with the **manager** and **GPU worker** moved off spawn while leaving only the **CPU worker** on its default spawned path by building `/tmp/xax-bench-9cea09c-oldtrain-forkmgr-forkgpu` and rerunning the same older-HF + old-train-only canonical probe. This still failed at **`asr_wer_prefix=1.0`** with near-old-regime throughput (~29.3k samples / 10 min), EOS on both prompts, and clean gt-ASR. So on the detached historical route, leaving the **CPU worker** as the only remaining spawned child is enough to keep the full surface in the bad class; that materially strengthens the hypothesis that the CPU monitor's spawned bootstrap is the harsher route-local actor.","timestamp":1774038150041,"segment":0}
{"run":705,"commit":"4df3387","metric":0.8333333134651184,"metrics":{},"status":"keep","description":"Completed the missing full-route worker matrix corner by testing the detached **old-train-cache-only** surface with only the **GPU worker** forced off spawn while leaving both the **manager** and the **CPU worker** on their default spawned surfaces, using `/tmp/xax-bench-9cea09c-oldtrain-forkgpu`. This improved to **`asr_wer_prefix=0.8333`** with near-old-regime throughput (~29.4k samples / 10 min), EOS on both prompts, and clean gt-ASR. That is still much weaker than the better worker-side combinations, but it usefully completes the matrix: on the full detached historical route, **GPU-only** off-spawn can soften the raw `1.0` class a bit, but the **CPU worker** remains the sharper actor and the best results still come from changing the CPU side too.","timestamp":1774039051460,"segment":0}
{"run":706,"commit":"4df3387","metric":1,"metrics":{},"status":"discard","description":"Tested whether the detached **old-train-cache-only + CPU-only** failure is specifically tied to the **very early training-start timing** of the spawned CPU monitor by building `/tmp/xax-bench-9cea09c-oldtrain-delaycpu-nogpu`, keeping the raw CPU-only surface (GPU monitor disabled, default manager, default spawned CPU worker) but delaying `CPUStatsMonitor.start()` by **120 seconds** so the spawned CPU child comes up well after the initial training/bootstrap phase. This still failed cleanly at **`asr_wer_prefix=1.0`** with near-old-regime throughput (~29.8k samples / 10 min), EOS on both prompts, and acceptable gt-ASR. So the harsher detached-route CPU-monitor effect is **not** just about the monitor spawning during the first moments of training; delaying its creation deep into the run does not reproduce the earlier CPU-worker-off-spawn rescue. That weakens the narrow 'only early-start bootstrap timing' story and points back toward a broader **spawned CPU-worker process identity / runtime interaction** rather than just startup timing.","timestamp":1774040399840,"segment":0}
