{"run":87,"commit":"2bf02f5","metric":1,"metrics":{},"status":"discard","description":"Shortened the inference cap on the strongest matched grouped-blockwise branch by reducing semantic_length_heuristic_factor from 1.0 to 0.9 (53 -> 48 frames) while keeping text_source=both, two future-Q0 heads, and three-token blockwise decoding. This over-shortened the grouped path: asr_wer_prefix regressed to 1.0, so the 53-frame cap still appears to be the best regime.","timestamp":1773462442534,"segment":0}
{"run":88,"commit":"2bf02f5","metric":1,"metrics":{},"status":"discard","description":"Ablated scheduled sampling from the current four-head future-Q0 winner, keeping semantic_future_prediction_steps=4, weight=0.5, semantic_eos_weight=2.0, and the p95-style 53-frame cap. The generated-prefix auxiliary alone was not enough: throughput rose to ~30k samples in 10 minutes, but asr_wer_prefix regressed to 1.0 and in-domain WER also returned to 1.0.","timestamp":1773463460828,"segment":0}
{"run":89,"commit":"2bf02f5","metric":1,"metrics":{},"status":"discard","description":"Retested the strongest matched grouped-blockwise branch with less scheduled sampling pressure: text_source=both, two future-Q0 heads in training, three-token blockwise decoding at inference, but semantic_self_condition_prob reduced from 0.5 to 0.25. The grouped path still needs the stronger exposure-bias fix: asr_wer_prefix regressed to 1.0 even though CER stayed decent at 0.727.","timestamp":1773464253388,"segment":0}
{"run":90,"commit":"2bf02f5","metric":1,"metrics":{},"status":"discard","description":"Tested mild stage-2 robustness on top of the current four-head future-Q0 winner by adding q0_corruption_prob=0.05 and residual_semantic_hidden_dropout_prob=0.05 while keeping scheduled sampling, EOS weighting, and the 53-frame cap. This did not stack with the best recipe: asr_wer_prefix regressed to 1.0, so simple residual-robustness noise also looks stale in the stronger structural regime.","timestamp":1773465021338,"segment":0}
{"run":91,"commit":"cf0f36a","metric":0.5,"metrics":{},"status":"keep","description":"Added a hybrid grouped/ungrouped Stage-1 decode path: on the strongest matched grouped recipe (text_source=both, two future-Q0 heads, weight=0.5, semantic_self_condition_prob=0.5, 53-frame cap), decode only the first 12 new semantic tokens in three-token blockwise groups, then fall back to one-at-a-time decoding for the rest. This beat the previous best: final asr_wer_prefix improved to 0.5, asr_cer improved to 0.591, while keeping both GPUs active and generations capped at 53 frames.","timestamp":1773465949365,"segment":0}
{"run":92,"commit":"cf0f36a","metric":1,"metrics":{},"status":"discard","description":"Shortened the new hybrid grouped/ungrouped decode schedule from 12 early grouped semantic tokens to 9 on the matched two-head text_source=both recipe. That lost the new gain completely: asr_wer_prefix fell back to 1.0 and CER worsened, so the grouped prefix needs to be longer than three blockwise steps.","timestamp":1773466697555,"segment":0}
{"run":93,"commit":"cf0f36a","metric":1,"metrics":{},"status":"discard","description":"Extended the new hybrid grouped/ungrouped decode schedule from 12 early grouped semantic tokens to 15 on the matched two-head text_source=both recipe. That also regressed sharply to asr_wer_prefix=1.0, so the new win appears to live in a narrow grouped-prefix sweet spot rather than improving monotonically with longer grouped decoding.","timestamp":1773467439952,"segment":0}
{"run":94,"commit":"cf0f36a","metric":1,"metrics":{},"status":"discard","description":"Exact reran the new best hybrid grouped/ungrouped decode schedule (12 early grouped semantic tokens, then one-at-a-time) on the matched two-head text_source=both recipe. The strong 0.5 result did not reproduce in this rerun: asr_wer_prefix returned to 1.0, so the new grouped-prefix win currently looks fragile and needs either confirmation or a more robust neighboring design.","timestamp":1773468194826,"segment":0}
{"run":95,"commit":"cf0f36a","metric":1,"metrics":{},"status":"discard","description":"Tested whether the new early-grouped-prefix idea transfers to the original four-head future-Q0 winner by using three-token blockwise decoding only for the first 12 semantic tokens, then falling back to one-at-a-time decoding. It did not: asr_wer_prefix stayed at 1.0, so the hybrid grouped-prefix effect currently appears specific to the matched two-head grouped branch rather than the broader four-head recipe.","timestamp":1773468940859,"segment":0}
{"run":96,"commit":"cf0f36a","metric":0.8333333134651184,"metrics":{},"status":"discard","description":"Made the hybrid grouped-prefix transition more explicit by allowing an exact partial final grouped block, then tested a shorter exact cutoff of 11 initial semantic tokens on the matched two-head text_source=both recipe. This was better than the failed 9/15-token hard cutoffs but still worse than the recorded 0.5 win: asr_wer_prefix reached 0.8333, suggesting a two-token transitional block may retain some benefit without stabilizing the branch.","timestamp":1773469860033,"segment":0}
{"run":97,"commit":"cf0f36a","metric":1,"metrics":{},"status":"discard","description":"Kept the new exact-transition grouped-prefix decoder and tested a longer partial schedule with semantic_block_decode_max_grouped_tokens=14 on the matched two-head text_source=both recipe. This recovered some good secondary signals (CER 0.636, in-domain WER 0.556) but still failed on the primary metric at asr_wer_prefix=1.0, so a partial final grouped block alone does not robustly stabilize the 12-token win.","timestamp":1773470597280,"segment":0}
{"run":98,"commit":"cf0f36a","metric":0.8333333134651184,"metrics":{},"status":"discard","description":"Added a tapered late-stage decode schedule to the hybrid grouped-prefix branch: after the first 12 semantic tokens are decoded in three-token groups, keep using smaller two-token blocks instead of falling all the way back to token-by-token decoding. This preserved some of the grouped-prefix clue but did not beat the best run: asr_wer_prefix reached 0.8333, so a simple 3->2 taper is still weaker than the recorded 12-token 3->1 switch.","timestamp":1773471383061,"segment":0}
{"run":99,"commit":"cf0f36a","metric":1,"metrics":{},"status":"discard","description":"Tested a corrective grouped-prefix boundary by re-decoding the last 1 grouped token exactly after a 12-token three-at-a-time grouped prefix on the matched two-head text_source=both recipe. This overlap schedule was too costly and did not stabilize the branch: throughput dropped sharply and asr_wer_prefix regressed to 1.0.","timestamp":1773472385833,"segment":0}
{"run":100,"commit":"cf0f36a","metric":1,"metrics":{},"status":"discard","description":"Strengthened the corrective grouped-prefix boundary by re-decoding the last 2 grouped tokens exactly after a 12-token three-at-a-time grouped prefix on the matched two-head text_source=both recipe. This was even worse than overlap=1: throughput stayed poor and OOD free-running collapsed badly, with asr_wer_prefix back at 1.0 and CER exploding to 2.73.","timestamp":1773473141607,"segment":0}
{"run":101,"commit":"cf0f36a","metric":0.8333333134651184,"metrics":{},"status":"discard","description":"Tried strengthening the matched hybrid grouped-prefix branch with a third Stage-1 future-Q0 auxiliary head in training (semantic_future_prediction_steps=3, weight=0.5) while keeping the 12-token three-at-a-time grouped prefix and the 53-frame cap. This was somewhat alive but worse than the best run: asr_wer_prefix reached 0.8333, so extra future depth beyond the matched two-head setup still looks more noisy than helpful in the early-grouped-prefix regime.","timestamp":1773473936712,"segment":0}
{"run":102,"commit":"cf0f36a","metric":1,"metrics":{},"status":"discard","description":"Tried matching training to the fragile hybrid grouped-prefix inference schedule by applying the two-head future-Q0 auxiliary only to the first 12 early semantic target positions on the matched text_source=both grouped recipe (12-token three-at-a-time grouped prefix, then exact decode). This was too restrictive: asr_wer_prefix regressed to 1.0, so simply truncating the auxiliary to the early grouped prefix does not stabilize the win.","timestamp":1773476359450,"segment":0}
{"run":103,"commit":"cf0f36a","metric":1,"metrics":{},"status":"discard","description":"Tried a stronger train/infer match for the hybrid grouped-prefix branch by applying the two-head future-Q0 auxiliary only on early anchor positions spaced every 3 Q0 tokens (matching the three-token grouped decode steps) on the matched text_source=both recipe. This also failed cleanly at asr_wer_prefix=1.0, so naive early-anchor masking of the future auxiliary now looks stale too.","timestamp":1773476363145,"segment":0}
{"run":104,"commit":"cf0f36a","metric":0.8333333134651184,"metrics":{},"status":"discard","description":"Added a no-second-pass corrective grouped decoder that verifies each extra token in a 3-token grouped prefix against the exact next-token head before accepting it, on the matched two-head text_source=both 12-token grouped-prefix recipe. This was somewhat alive but too conservative and slow: asr_wer_prefix reached 0.8333, still worse than the recorded 0.5 win.","timestamp":1773477398999,"segment":0}
{"run":105,"commit":"cf0f36a","metric":1,"metrics":{},"status":"discard","description":"Tried a lighter no-second-pass corrective decoder that verifies only the last extra token of each three-token grouped step on the matched two-head 12-token grouped-prefix recipe. This was still too slow and did not stabilize the branch: asr_wer_prefix regressed to 1.0 and gt-ASR sanity worsened.","timestamp":1773478228838,"segment":0}
{"run":106,"commit":"cf0f36a","metric":1,"metrics":{},"status":"discard","description":"Tried an even more targeted no-second-pass boundary check on the hybrid grouped-prefix branch by verifying only the final extra token of the final grouped step before switching back to exact decoding. This still failed to stabilize the branch: asr_wer_prefix stayed at 1.0 despite decent in-domain WER 0.556, so simple one-step transition verification now looks stale too.","timestamp":1773479074380,"segment":0}
{"run":107,"commit":"cf0f36a","metric":0.8333333134651184,"metrics":{},"status":"discard","description":"Ablated mixed normalized+raw text from the current hybrid grouped-prefix winner while keeping the matched two-head 12-token grouped prefix, scheduled sampling, EOS weighting, and 53-frame cap. Unlike the original 0.5 run, the normalized-only variant reached only asr_wer_prefix=0.8333, though CER stayed strong at 0.636, so mixed text still looks important for the best grouped-prefix regime.","timestamp":1773479830830,"segment":0}
{"run":108,"commit":"cf0f36a","metric":1,"metrics":{},"status":"discard","description":"Tested whether the hybrid grouped-prefix idea transfers to the smaller matched grouped branch by training one future-Q0 head and decoding two semantic tokens at a time for only the first 8 generated tokens (four grouped steps), with text_source=both, scheduled sampling, EOS weighting, and the 53-frame cap. This did not carry over: asr_wer_prefix stayed at 1.0, so the current grouped-prefix win appears specific to the stronger two-head / three-token matched branch.","timestamp":1773480747729,"segment":0}
{"run":109,"commit":"cf0f36a","metric":1,"metrics":{},"status":"discard","description":"Ran a second exact rerun of the current recorded best hybrid grouped-prefix recipe (text_source=both, two future-Q0 heads, weight=0.5, semantic_self_condition_prob=0.5, three-token grouped decoding for the first 12 semantic tokens, then exact decoding, 53-frame cap). It again failed to reproduce and returned asr_wer_prefix=1.0, strengthening the evidence that the recorded 0.5 result is currently a high-variance outlier rather than a robust new baseline.","timestamp":1773481519582,"segment":0}
{"run":110,"commit":"cf0f36a","metric":1,"metrics":{},"status":"discard","description":"Tested a more aggressive early-grouped-prefix variant by training three future-Q0 heads and decoding four semantic tokens at a time only for the first 12 generated tokens before falling back to exact decoding. This did not help: asr_wer_prefix stayed at 1.0, so larger early groups also look stale for the grouped-prefix branch.","timestamp":1773482328058,"segment":0}
{"run":111,"commit":"cf0f36a","metric":1,"metrics":{},"status":"discard","description":"Added confidence-gated grouped-prefix decoding: each extra future token in a grouped stage-1 decode step is appended only if its future-head greedy probability clears a minimum threshold, allowing the 3-token grouped prefix to shrink dynamically without a second exact decode pass. Testing the matched two-head / 12-token grouped-prefix recipe with text_source=both and a 0.1 minimum future-token probability still returned asr_wer_prefix=1.0, though in-domain WER recovered to 0.556. So simple per-token confidence gating alone did not stabilize the fragile grouped-prefix win.","timestamp":1773483519738,"segment":0}
{"run":112,"commit":"cf0f36a","metric":0.8333333134651184,"metrics":{},"status":"discard","description":"Added a richer train/infer-match variant for the grouped-prefix branch: softly decay the Stage-1 future-Q0 auxiliary across semantic target positions so earlier positions get more weight while later positions stay exact-decoding-oriented, with per-sample normalization to keep the mean future-loss weight fixed. On the matched two-head / 12-token grouped-prefix recipe with text_source=both, semantic_future_prediction_position_decay=0.97 improved the recent 1.0 collapses to asr_wer_prefix=0.8333 and asr_cer=0.682, but it still did not beat the stronger baselines. This suggests soft early-position emphasis is more promising than hard future-loss masks, but the 0.97 decay is too strong or incomplete.","timestamp":1773484366034,"segment":0}
{"run":113,"commit":"cf0f36a","metric":1,"metrics":{},"status":"discard","description":"Retuned the new soft early-position future-loss weighting to a milder decay, keeping the matched two-head grouped-prefix recipe but setting semantic_future_prediction_position_decay=0.99. This regressed badly to asr_wer_prefix=1.0 with exploded CER 2.73, so the promising signal from the 0.97 run does not extend to a weaker near-uniform decay.","timestamp":1773485117891,"segment":0}
{"run":114,"commit":"cf0f36a","metric":1,"metrics":{},"status":"discard","description":"Tested whether the new soft early-position future-loss weighting generalizes back to the plain four-head future-Q0 baseline (the reproducible 2bf02f5-style recipe) by setting semantic_future_prediction_position_decay=0.97 without grouped decoding. It did not: asr_wer_prefix stayed at 1.0, so this position-decay idea does not look like a generic upgrade to the generated-prefix objective and currently appears, at best, narrowly specific to the grouped-prefix branch.","timestamp":1773485862734,"segment":0}
{"run":115,"commit":"cf0f36a","metric":1,"metrics":{},"status":"discard","description":"Added a new intra-block transition design for the grouped-prefix branch: during the early grouped prefix with block_decode_size=3, predict the first two semantic tokens with the exact next-token head and use only the first future-Q0 head for the third token (an exact-middle / future-last block). On the matched two-head / 12-token grouped-prefix recipe with text_source=both, this still returned asr_wer_prefix=1.0 and slowed throughput, so this hybrid intra-block transition looks stale.","timestamp":1773487001852,"segment":0}
{"run":116,"commit":"cf0f36a","metric":1,"metrics":{},"status":"discard","description":"Pivoted away from grouped-prefix micro-tweaks and added a new semi-parallel Stage-1.5 Q0 refiner: a lightweight bidirectional transformer trained on the stage-1 model's own teacher-forced greedy Q0 predictions plus semantic hidden states, then applied once at inference before Stage 2. Testing it on the strong four-head future-Q0 baseline with semantic_q0_refiner_loss_weight=0.5 did not help: asr_wer_prefix stayed at 1.0 and in-domain generation remained poor, so this first one-pass Q0-refinement prototype is not yet a competitive pivot.","timestamp":1773488223096,"segment":0}
{"run":117,"commit":"cf0f36a","metric":1,"metrics":{},"status":"discard","description":"Tested the new one-pass Stage-1.5 Q0 refiner on the fragile grouped-prefix mainline instead of the plain four-head baseline: text_source=both, two future-Q0 heads, three-token grouped decoding for the first 12 semantic tokens, scheduled sampling, EOS weighting, 53-frame cap, plus the auxiliary Q0 refiner at loss weight 0.5. This also failed to improve the primary metric and stayed at asr_wer_prefix=1.0, so the first Q0-refiner prototype does not currently rescue either the reproducible four-head recipe or the grouped-prefix branch.","timestamp":1773488973134,"segment":0}
{"run":118,"commit":"cf0f36a","metric":1,"metrics":{},"status":"discard","description":"Reworked the Stage-1.5 Q0 refiner to train on the actual Q0 stream seen by Stage 1 — including scheduled-sampling/self-conditioned suffix tokens — instead of teacher-forced next-token logits, then applied it once before Stage 2. On the reproducible four-head future-Q0 baseline (semantic_future_prediction_steps=4, weight=0.5, semantic_self_condition_prob=0.5, semantic_q0_refiner_loss_weight=0.5, 53-frame cap), this still failed on the primary metric: asr_wer_prefix stayed at 1.0, though in-domain WER recovered to 0.556. So a realistic-input refiner is a better-matched pivot than the first prototype, but not yet a winning one.","timestamp":1773490178758,"segment":0}
{"run":119,"commit":"cf0f36a","metric":1,"metrics":{},"status":"discard","description":"Applied the reworked realistic-input Stage-1.5 Q0 refiner to the fragile grouped-prefix mainline (text_source=both, two future-Q0 heads, three-token grouped decoding for the first 12 semantic tokens, scheduled sampling, EOS weighting, 53-frame cap). This still missed on the primary metric and stayed at asr_wer_prefix=1.0, but in-domain WER improved to 0.444. So the more realistic refiner target does look somewhat better matched to grouped/free-running errors than the first prototype, yet it still does not stabilize the grouped-prefix branch.","timestamp":1773490926783,"segment":0}
{"run":120,"commit":"cf0f36a","metric":1,"metrics":{},"status":"discard","description":"Retuned the realistic-input Stage-1.5 Q0 refiner downward on the grouped-prefix mainline by reducing semantic_q0_refiner_loss_weight from 0.5 to 0.25. This lost the earlier secondary-signal gain and still returned asr_wer_prefix=1.0, so the current realistic-input refiner branch does not look robust enough to justify more small weight retunes.","timestamp":1773491680763,"segment":0}
{"run":121,"commit":"cf0f36a","metric":1,"metrics":{},"status":"discard","description":"Added per-head weighting for the Stage-1 future-Q0 auxiliary and tested near-head emphasis on the matched grouped-prefix mainline by setting semantic_future_prediction_head_decay=0.7, which weights the first future head more than the second while keeping the mean auxiliary scale fixed. On the text_source=both two-head / three-token grouped-prefix recipe, this regressed to asr_wer_prefix=1.0, so simply down-weighting the farther grouped token does not stabilize the fragile win.","timestamp":1773492663180,"segment":0}
{"run":122,"commit":"cf0f36a","metric":1,"metrics":{},"status":"discard","description":"Retested the new per-head future-Q0 weighting on the matched grouped-prefix mainline in the opposite direction by emphasizing the farther grouped token instead of the nearer one (semantic_future_prediction_head_decay=1.5, so the second future head gets more weight than the first). This failed even more sharply: asr_wer_prefix stayed at 1.0 and CER exploded to 8.0, so simple per-head weighting of the two grouped future heads now looks stale in both directions.","timestamp":1773493411399,"segment":0}
{"run":123,"commit":"cf0f36a","metric":0.6666666865348816,"metrics":{},"status":"discard","description":"Added a richer grouped-prefix transition design that ends each grouped step on an exact token: for block_decode_size=3 during the early grouped prefix, decode token 1 exactly, predict token 2 with the first future-Q0 head, then feed that speculative middle token and decode token 3 exactly before the next grouped step. On the text_source=both matched two-head / 12-token grouped-prefix recipe, this reached asr_wer_prefix=0.6667 with a very strong asr_cer=0.591, making it the first new transition design since cf0f36a to recover the old 2bf02f5-level primary metric. It still did not beat the current best 0.5 and had weak in-domain/gt secondary metrics, so discard for now, but this exact-last-token grouped transition looks meaningfully more alive than the previously tried micro-variants.","timestamp":1773494394549,"segment":0}
{"run":124,"commit":"cf0f36a","metric":1,"metrics":{},"status":"discard","description":"Tested the new exact-last-token grouped transition with a shorter grouped prefix, cutting the hybrid schedule from 12 grouped semantic tokens down to 9 while keeping text_source=both, two future-Q0 heads, scheduled sampling, EOS weighting, and the 53-frame cap. Unlike the promising 12-token run, this collapsed back to asr_wer_prefix=1.0 with very poor CER 2.73, so the exact-last-token variant also looks highly localized rather than broadly robust.","timestamp":1773495183638,"segment":0}
