{"run":762,"commit":"77648de","metric":0.8333333134651184,"metrics":{},"status":"discard","description":"Tested whether the reproduced `0.5 -> 0.5` **fully direct clear-only** branch really needs the worker to perform sharedctypes field stores, or whether simple writer-side synchronization is enough. I built `/tmp/xax-bench-9cea09c-oldtrain-meminfocputouchcpuusefirst-clearonlynoproxy-workerlockonly-nogpu`, which keeps the fully direct `context.Event()` + `context.Value(...)` clear-only consumer from #752-#753, but changes the worker to do only `memory_info()`, `cpu_percent()`, second `cpu_percent()`, then `with stats.get_lock(): pass` before raising the event. This landed at **`asr_wer_prefix=0.8333`** with near-old-regime throughput (~29.8k samples / 10 min). So writer-side synchronized-wrapper/lock touch alone is **not** enough to recover the strong branch. Combined with #761, this sharpens the write-side story materially: the fully direct clear-only `0.5` class appears to need **actual direct sharedctypes field writes**, not just the absence of manager proxies and not just worker-side lock acquisition.","timestamp":1774092290000,"segment":0}
{"run":763,"commit":"77648de","metric":0.8333333134651184,"metrics":{},"status":"discard","description":"Ran the next write-side split on the **fully direct Event+Value clear-only** branch: does it need changing sharedctypes payload writes, or are any field stores equivalent? I built `/tmp/xax-bench-9cea09c-oldtrain-meminfocputouchcpuusefirst-clearonlynoproxy-workerzerowrite-nogpu`, which keeps the worker's `memory_info()`, `cpu_percent()`, second `cpu_percent()` sequence and the clear-only direct consumer from #752-#753, but overwrites the direct sharedctypes struct with all-zero fields every interval instead of the real psutil-derived payload. This still landed at **`asr_wer_prefix=0.8333`** with near-old-regime throughput (~29.9k samples / 10 min). Together with #762, that narrows the write-side story again: the strong `0.5` branch is not recovered by writer-side lock touch alone and not by trivial constant field stores either. The helpful direct path still appears to need the worker doing the **full real direct sharedctypes payload write**, not just any synchronized store.","timestamp":1774093085000,"segment":0}
{"run":764,"commit":"77648de","metric":0.6666666865348816,"metrics":{},"status":"discard","description":"Ran the next direct-write split on the **fully direct Event+Value clear-only** branch to ask whether the worker needs the *real* psutil-derived payload, or merely some changing sharedctypes writes. I built `/tmp/xax-bench-9cea09c-oldtrain-meminfocputouchcpuusefirst-clearonlynoproxy-workercounterwrite-nogpu`, which keeps the worker's `memory_info()`, `cpu_percent()`, second `cpu_percent()` sequence and the same clear-only direct consumer as #752-#753, but instead of writing the real payload it writes a changing synthetic counter pattern into every sharedctypes field each interval. This improved materially to **`asr_wer_prefix=0.6667`** with near-old-regime throughput (~29.9k samples / 10 min), clean gt-ASR, and EOS on both prompts. That is a useful new split: the strong direct path is **not** all-or-nothing on 'real payload' vs 'no payload'. Writer-side lock-only and constant-zero writes both stayed at `0.8333` (#762-#763), while changing direct sharedctypes writes recover a stronger `0.6667` class. The full reproduced `0.5` branch still seems to need the **actual psutil-derived direct payload writes**, but a meaningful part of the lift now looks tied to the worker performing **changing direct shared-memory stores**, not merely any synchronized touch.","timestamp":1774093895000,"segment":0}
{"run":765,"commit":"77648de","metric":1,"metrics":{},"status":"discard","description":"Tested whether the write-side gain on the **fully direct Event+Value clear-only** branch comes merely from sharedctypes values changing across intervals. I built `/tmp/xax-bench-9cea09c-oldtrain-meminfocputouchcpuusefirst-clearonlynoproxy-workertogglewrite-nogpu`, which keeps the same worker `memory_info(); cpu_percent(); cpu_percent()` calls and clear-only direct consumer as #752-#753, but writes a minimal alternating all-fields pattern (every float/int field flips between 0 and 1 each interval). This failed cleanly at **`asr_wer_prefix=1.0`** with near-old-regime throughput (~29.8k samples / 10 min). So the new write-side story sharpens again: the improvement from #764 is **not** explained by values merely changing between intervals. Constant stores (#763) are not enough, and tiny two-state changing stores are not enough either. Whatever helps in the direct branch seems to depend on a richer write pattern than simple toggling.","timestamp":1774094914369,"segment":0}
{"run":766,"commit":"77648de","metric":1,"metrics":{},"status":"discard","description":"Tested whether the `0.6667` synthetic-write lift from #764 comes from monotonic growth alone, independent of per-field structure. I built `/tmp/xax-bench-9cea09c-oldtrain-meminfocputouchcpuusefirst-clearonlynoproxy-workersamecounterwrite-nogpu`, which keeps the same worker `memory_info(); cpu_percent(); cpu_percent()` calls and clear-only direct consumer as #752-#753, but writes the **same increasing counter value** into every sharedctypes field each interval instead of the richer offset-per-field counter pattern from #764. This failed on the primary metric at **`asr_wer_prefix=1.0`** with near-old-regime throughput (~29.6k samples / 10 min), though raw WER softened to `0.8333`. So the current write-side picture sharpens again: simple monotonic change is still not enough. The helpful synthetic branch now appears to require a **richer per-field write pattern**, not merely changing values and not merely increasing values over time.","timestamp":1774095703052,"segment":0}
{"run":767,"commit":"77648de","metric":1,"metrics":{},"status":"discard","description":"Ran the missing quadrant on the synthetic write-side map for the **fully direct Event+Value clear-only** branch: constant but per-field-distinct stores. I built `/tmp/xax-bench-9cea09c-oldtrain-meminfocputouchcpuusefirst-clearonlynoproxy-workerconstpatternwrite-nogpu`, which keeps the worker `memory_info(); cpu_percent(); cpu_percent()` calls and the clear-only direct consumer from #752-#753, but writes a fixed heterogeneous pattern into the sharedctypes struct every interval (`1.0, 2.0, 3, 4, ...`) instead of either zeroes (#763) or the time-varying counter pattern from #764). This failed cleanly at **`asr_wer_prefix=1.0`** with near-old-regime throughput (~29.8k samples / 10 min). Together with #764-#766, the write-side picture is now sharper: **per-field heterogeneity alone is not enough**, and **time variation alone is not enough**. The only synthetic branch that still recovers `0.6667` is the one combining both — the richer changing per-field counter pattern from #764.","timestamp":1774096494234,"segment":0}
{"run":768,"commit":"77648de","metric":1,"metrics":{},"status":"discard","description":"Exact-reran the only synthetic write-side branch that had looked alive under the **fully direct Event+Value clear-only** route: `/tmp/xax-bench-9cea09c-oldtrain-meminfocputouchcpuusefirst-clearonlynoproxy-workercounterwrite-nogpu`, where the worker writes a changing per-field counter pattern into every sharedctypes field while the training loop does clear-only consumption. The rerun collapsed from the earlier `0.6667` (#764) back to a clean **`asr_wer_prefix=1.0`** with near-old-regime throughput (~29.7k samples / 10 min). That sharply downgrades the synthetic-counter branch from 'promising mechanism clue' to another likely noise-prone side effect. Current write-side read: lock-only and constant stores are bad, simple toggles are bad, same-counter-everywhere is bad, and even the richer per-field changing synthetic pattern is now not reproducible. The strongest surviving clue remains the original **real psutil-derived direct sharedctypes writes** on the fully direct clear-only branch.","timestamp":1774097473828,"segment":0}
{"run":769,"commit":"77648de","metric":1,"metrics":{},"status":"discard","description":"Tested a sharper real-payload subset on the **fully direct Event+Value clear-only** branch: keep the worker's real `memory_info(); cpu_percent(); cpu_percent()` psutil sequence, but write only the **real memory-info-derived fields** (`mem_rss`, `mem_vms`, `mem_shared`, `mem_rss_total`, `mem_vms_total`) into sharedctypes while zeroing the rest. This failed cleanly at **`asr_wer_prefix=1.0`** with near-old-regime throughput (~29.7k samples / 10 min). So real memory-info writes alone are **not** sufficient to recover the strong direct branch. That weakens the simple transfer from the older `memory_info()`-only worker clue into the newer direct-write story: on the clear-only direct branch, the remaining lift appears to depend on a broader combination than just the real memory fields.","timestamp":1774098268073,"segment":0}
{"run":770,"commit":"77648de","metric":1,"metrics":{},"status":"discard","description":"Completed the complementary real-payload subset on the **fully direct Event+Value clear-only** branch: keep the worker's real `memory_info(); cpu_percent(); cpu_percent()` psutil sequence, but write only the **real `cpu_percent` field** into sharedctypes while zeroing all memory/child fields. This also failed cleanly at **`asr_wer_prefix=1.0`** with near-old-regime throughput (~29.8k samples / 10 min). Together with #769, this closes a useful split: neither the real memory-info fields alone nor the real cpu-percent field alone is sufficient on the direct clear-only branch. The remaining helpful write-side effect appears to require a broader real payload combination than either side in isolation.","timestamp":1774099044342,"segment":0}
{"run":771,"commit":"77648de","metric":1,"metrics":{},"status":"discard","description":"Tested a writer-side code-path hypothesis on the **fully direct Event+Value clear-only** branch: whether the apparent benefit depends on going through the synchronized wrapper's per-field property setters, not just ending up with the same final bytes. I built `/tmp/xax-bench-9cea09c-oldtrain-meminfocputouchcpuusefirst-clearonlynoproxy-rawwrite-nogpu`, which keeps the full real `memory_info(); cpu_percent(); cpu_percent()` worker sequence and the same clear-only direct consumer as #752-#753, but under the outer `with stats.get_lock():` writes directly to `stats.get_obj()` instead of assigning through the synchronized wrapper properties. This failed cleanly at **`asr_wer_prefix=1.0`** with near-old-regime throughput (~29.6k samples / 10 min). That is a new code-level split: on this direct branch, simply producing the same raw field values through `get_obj()` is not enough. The helpful path may depend on the synchronized-wrapper/property-setter route itself — e.g. its per-field wrapper semantics / nested lock traffic — not just the final sharedctypes payload bytes.","timestamp":1774100089401,"segment":0}
{"run":772,"commit":"77648de","metric":1,"metrics":{},"status":"discard","description":"Contemporaneous control rerun of the original **fully direct Event+Value clear-only** branch from #752-#753, after the newer write-side subset and raw-write probes. This exact rerun also failed cleanly at **`asr_wer_prefix=1.0`** with near-old-regime throughput (~29.7k samples / 10 min). That materially weakens the immediate causal read from #771: the raw-`get_obj()` write failure is no longer clean evidence that wrapper-property writes are uniquely helpful, because the original wrapper-property branch itself did not reproduce in the same phase. Current best read is narrower and more conservative: the historical `0.5 -> 0.5` full-real direct branch remains the strongest clue on the board, but it is currently unreproduced, and the recent subset/synthetic/raw-write ablations are better treated as mechanism hints than as stable repairs.","timestamp":1774100835186,"segment":0}
{"run":773,"commit":"77648de","metric":1,"metrics":{},"status":"discard","description":"Tested the next real-field combination on the **fully direct Event+Value clear-only** branch: keep the worker's real `memory_info()` fields and also write a real `mem_percent`, but leave `cpu_percent` zero. I built `/tmp/xax-bench-9cea09c-oldtrain-meminfocputouchcpuusefirst-clearonlynoproxy-workermeminfomempctrealwrite-nogpu`, using `memory_info(); memory_percent(); cpu_percent(); cpu_percent()` in the worker and writing only the real memory-derived fields plus `mem_percent`. This still failed cleanly at **`asr_wer_prefix=1.0`** with near-old-regime throughput (~29.7k samples / 10 min). So adding real `mem_percent` is not enough to rescue the memory-only subset. The surviving write-side clue remains a broader real-field combination than memory-side values alone.","timestamp":1774101832081,"segment":0}
{"run":774,"commit":"77648de","metric":0.8333333134651184,"metrics":{},"status":"discard","description":"Tested the complementary real-field subset on the **fully direct Event+Value clear-only** branch: keep a real `cpu_percent` and a real `mem_percent`, but zero all memory-info fields. I built `/tmp/xax-bench-9cea09c-oldtrain-meminfocputouchcpuusefirst-clearonlynoproxy-workercpumempctrealwrite-nogpu`, using `memory_info(); memory_percent(); cpu_percent(); cpu_percent()` in the worker and writing only the real cpu/mem-percent scalars. This softened to **`asr_wer_prefix=0.8333`** with near-old-regime throughput (~29.5k samples / 10 min), but still did not recover the stronger direct branch. Together with #773, that says real `mem_percent` does add some lift, but neither side-plus-`mem_percent` combination is sufficient on its own: **memory-info + mem_percent** still failed at `1.0`, while **cpu_percent + mem_percent** only weakened to `0.8333`.","timestamp":1774102629646,"segment":0}
{"run":775,"commit":"77648de","metric":1,"metrics":{},"status":"discard","description":"Tested the broader real-field combination on the **fully direct Event+Value clear-only** branch: write the full real `memory_info` fields plus real `cpu_percent` **and** real `mem_percent` each interval. I built `/tmp/xax-bench-9cea09c-oldtrain-meminfocputouchcpuusefirst-clearonlynoproxy-workerfullrealwithmempct-nogpu`, using `memory_info(); memory_percent(); cpu_percent(); cpu_percent()` in the worker and writing all those real values into sharedctypes. This still failed cleanly at **`asr_wer_prefix=1.0`** with near-old-regime throughput (~29.5k samples / 10 min). That is a useful negative control: simply adding real `mem_percent` to the original full-real direct payload does **not** recover the historical strong branch. The surviving clue stays the same — some aspect of the earlier full-real direct route mattered, but it is not explained merely by including `mem_percent` among the written fields.","timestamp":1774103419170,"segment":0}
{"run":776,"commit":"77648de","metric":1,"metrics":{},"status":"discard","description":"Tested a sharper real-field subset on the **fully direct Event+Value clear-only** branch: keep the original real `memory_info(); cpu_percent(); cpu_percent()` worker sequence, but write only the real `cpu_percent + mem_rss + mem_vms + mem_shared` fields while zeroing the duplicated total fields (`mem_rss_total`, `mem_vms_total`) and all child fields. I built `/tmp/xax-bench-9cea09c-oldtrain-meminfocputouchcpuusefirst-clearonlynoproxy-workercpumemcorewrite-nogpu`. This failed cleanly at **`asr_wer_prefix=1.0`** with old-regime throughput (~30.0k samples / 10 min). So the historical strong `cpu_percent + memory_info` direct branch is not carried by the non-duplicated memory-info core alone; if that branch is real, it likely depends on the broader write pattern that includes the duplicated total-field stores as well, not just the basic `rss/vms/shared` values.","timestamp":1774104640309,"segment":0}
{"run":777,"commit":"a754af1","metric":0.5,"metrics":{},"status":"keep","description":"Found a sharper real-field subset on the **fully direct Event+Value clear-only** branch. I built `/tmp/xax-bench-9cea09c-oldtrain-meminfocputouchcpuusefirst-clearonlynoproxy-workercputotalswrite-nogpu`, keeping the original worker call sequence `memory_info(); cpu_percent(); cpu_percent()` and the same direct clear-only consumer, but writing only the real **`cpu_percent + mem_rss_total + mem_vms_total`** fields while zeroing `mem_rss`, `mem_vms`, `mem_shared`, `mem_percent`, and all child fields. This recovered **`asr_wer_prefix=0.5`** with old-regime throughput (~30.0k samples / 10 min). Together with #776, that is a sharp write-side split: the historical direct-branch lift is **not** carried by the non-duplicated `rss/vms/shared` memory-info core, but it **does** survive when the worker keeps only the duplicated total-field writes. So the live clue is now much narrower: on the direct clear-only branch, the strongest remaining helpful payload seems centered on **`cpu_percent` plus the later `mem_rss_total` / `mem_vms_total` stores**, not the earlier `mem_rss` / `mem_vms` / `mem_shared` fields.","timestamp":1774105427981,"segment":0}
{"run":778,"commit":"a754af1","metric":0.6666666865348816,"metrics":{},"status":"discard","description":"Sharpened the new totals-field clue on the **fully direct Event+Value clear-only** branch by testing whether the recovered `0.5` from #777 needs both later total fields or just one. I built `/tmp/xax-bench-9cea09c-oldtrain-meminfocputouchcpuusefirst-clearonlynoproxy-workercpursstotalwrite-nogpu`, keeping the same worker call sequence and clear-only direct consumer, but writing only real **`cpu_percent + mem_rss_total`** while zeroing `mem_vms_total` and all earlier memory fields. This weakened to **`asr_wer_prefix=0.6667`** with near-old-regime throughput (~29.9k samples / 10 min). So the new write-side picture sharpens further: a single later total-field store still helps materially, but it does **not** match the stronger `cpu_percent + mem_rss_total + mem_vms_total` pair from #777. The live clue now looks like a real **pair/offset pattern** in those later total fields, not just 'any one late real memory total write'.","timestamp":1774106325750,"segment":0}
{"run":779,"commit":"a754af1","metric":0.6666666865348816,"metrics":{},"status":"discard","description":"Ran the complementary one-total-field split on the **fully direct Event+Value clear-only** branch to separate the new `cpu_percent + mem_rss_total + mem_vms_total` clue. I built `/tmp/xax-bench-9cea09c-oldtrain-meminfocputouchcpuusefirst-clearonlynoproxy-workercpuvmstotalwrite-nogpu`, keeping the same worker call sequence and clear-only direct consumer, but writing only real **`cpu_percent + mem_vms_total`** while zeroing `mem_rss_total` and all earlier memory fields. This also weakened to **`asr_wer_prefix=0.6667`** with near-old-regime throughput (~29.9k samples / 10 min). Together with #778, that is a clean new split: **either single later total field alone** is enough to recover the weaker `0.6667` class, but the **pair together** is what recovered `0.5` in #777. The live write-side clue is now sharper still: the helpful direct branch looks tied to a real two-field late-offset pattern in `mem_rss_total` + `mem_vms_total`, not to the earlier memory-info core and not to either total field alone.","timestamp":1774107123390,"segment":0}
{"run":780,"commit":"a754af1","metric":1,"metrics":{},"status":"discard","description":"Tested whether the new late-total-fields clue on the **fully direct Event+Value clear-only** branch actually needs a real `cpu_percent`, or whether the two later total fields carry the effect by themselves. I built `/tmp/xax-bench-9cea09c-oldtrain-meminfocputouchcpuusefirst-clearonlynoproxy-workertotalsonlywrite-nogpu`, keeping the same worker call sequence and clear-only direct consumer, but zeroing `cpu_percent` and writing only real **`mem_rss_total + mem_vms_total`**. This failed cleanly at **`asr_wer_prefix=1.0`** with near-old-regime throughput (~29.9k samples / 10 min). So the new `#777` clue is genuinely combinational: the helpful branch is not just 'late total fields matter'. It specifically needs the combination of a real **`cpu_percent`** with the paired later **`mem_rss_total` / `mem_vms_total`** stores.","timestamp":1774107897080,"segment":0}
{"run":781,"commit":"a754af1","metric":1,"metrics":{},"status":"discard","description":"Tested the cleanest code-path split enabled by the new `#777` clue: keep the same successful real-field subset **`cpu_percent + mem_rss_total + mem_vms_total`** on the **fully direct Event+Value clear-only** branch, but write it through `stats.get_obj()` raw field stores under one outer lock instead of via the synchronized wrapper properties. I built `/tmp/xax-bench-9cea09c-oldtrain-meminfocputouchcpuusefirst-clearonlynoproxy-rawwritepair-nogpu`. This failed cleanly at **`asr_wer_prefix=1.0`** with near-old-regime throughput (~29.9k samples / 10 min). That is a strong new mechanism clue, though it still wants a contemporaneous wrapper control: for this sharpened late-total-fields subset, simply ending up with the same bytes through `get_obj()` was not enough. The helpful path may depend on the wrapper-property setter route itself — i.e. per-field synchronized-wrapper/store semantics — not just the final sharedctypes payload.","timestamp":1774108846291,"segment":0}
