{"run":319,"commit":"1570c6b","metric":0.8333333134651184,"metrics":{},"status":"discard","description":"Added explicit text-variant marker tokens so the mixed-text branch can tell normalized vs raw transcripts apart (`text_source_markers=true` adds learned `<|text_normalized|>` / `<|text_raw|>` tokens ahead of the text segment), rebuilt the text_source=both dataset caches, and tested that idea on the current aligned four-head grouped mainline using the raw-style eval marker (`eval_text_source_variant=raw`) with the usual future steps 4, future weight 0.5, `semantic_self_condition_prob=0.5`, EOS weight 2.0, tokenizer/model-vocab alignment fix, and 12-token 3-way grouped prefix. This ran cleanly and preserved EOS on both prompts with perfect gt-ASR sanity, but the primary metric only reached asr_wer_prefix=0.8333 and the OOD utterance length stretched back out to 55 frames. So variant markers do not immediately stabilize the mixed-text grouped winner in the raw-eval form, though the idea is still plausible enough to warrant checking the normalized eval marker before pruning it.","timestamp":1773671433586,"segment":0}
{"run":320,"commit":"1570c6b","metric":1,"metrics":{},"status":"discard","description":"Retested the new mixed-text text-variant-marker idea on the same aligned four-head grouped mainline but switched the eval prompt marker from raw to normalized (`text_source_markers=true`, `eval_text_source_variant=normalized`; training still prepends learned normalized/raw marker tokens to the duplicated text_source=both data). This was worse than the raw-marker run: asr_wer_prefix fell cleanly to 1.0 with CER 0.818, despite EOS on both prompts and perfect gt-ASR sanity. So explicit normalized/raw variant markers now look stale for the aligned mixed-text grouped branch in both obvious eval-marker choices; they do not stabilize the fragile 0.3333 win and should be pruned unless a substantially richer use of text variants appears.","timestamp":1773672179316,"segment":0}
{"run":321,"commit":"1570c6b","metric":1,"metrics":{},"status":"discard","description":"Added a new mixed-text dataset mode `text_source=both_balanced` that keeps only one transcript variant per audio example (alternating normalized/raw by utterance index) so the branch still mixes both text styles without doubling the dataset size, then rebuilt the caches and tested it on the aligned four-head grouped mainline with future steps 4, future weight 0.5, `semantic_self_condition_prob=0.5`, EOS weight 2.0, tokenizer/model-vocab alignment fix, and the 12-token 3-way grouped prefix. This did buy many more optimizer steps (3812 / 30.5k samples versus the doubled mixed-text branch’s lower-step regime), but the primary metric still regressed cleanly to asr_wer_prefix=1.0 and gt-ASR sanity weakened, even though EOS fired on both prompts and the OOD utterance shortened to 27 frames. So the mixed-text gain does not come simply from preserving both text styles while keeping the original dataset size; this first balanced one-variant-per-audio formulation now looks stale.","timestamp":1773673238451,"segment":0}
{"run":322,"commit":"1570c6b","metric":1,"metrics":{},"status":"discard","description":"Retested the new `text_source=both_balanced` dataset mode under the only live stabilizer on the mixed-text aligned grouped branch by adding fuller LoRA targets (`lora_targets=[q_proj,k_proj,v_proj,o_proj,gate,up,down]`) on top of the aligned four-head grouped recipe. Even with the stronger LoRA fallback and the higher-step balanced mixed-text dataset (3650 steps / 29.2k samples), the primary metric still regressed cleanly to asr_wer_prefix=1.0, though CER stayed moderate at 0.727 and EOS fired on both prompts. So the balanced one-variant-per-audio mixed-text formulation is now stale even when paired with the reproducible fuller-LoRA fallback; it should be reverted and pruned.","timestamp":1773674016754,"segment":0}
{"run":323,"commit":"1570c6b","metric":1,"metrics":{},"status":"discard","description":"Added a new cheap grouped->exact transition flag (`semantic_block_decode_overlap_last_boundary_token=true`) that makes the final token of the last grouped step provisional: it is written into the sequence but not committed to the cache, so the first exact fallback step overwrites that same boundary token. This was meant to realize the long-lived ‘corrective overlap without a full second pass’ idea on the aligned mixed-text four-head grouped mainline (`text_source=both`, future steps 4, future weight 0.5, `semantic_self_condition_prob=0.5`, EOS weight 2.0, tokenizer/model-vocab alignment fix, 12-token 3-way grouped prefix). The run stayed fast enough, preserved EOS on both prompts, and kept short OOD length (~34 frames), but the primary metric still regressed cleanly to asr_wer_prefix=1.0 with weak gt-ASR sanity. So this first one-token boundary-overlap implementation looks stale and should be reverted unless a richer corrective-overlap design is tried later.","timestamp":1773674950295,"segment":0}
{"run":324,"commit":"1570c6b","metric":0.8333333134651184,"metrics":{},"status":"discard","description":"Tested whether broader LoRA adaptation can rescue the tokenizer-aligned mixed-text grouped branch after shrinking Stage-1 future depth back down to the old two-head grouped setup: `text_source=both`, `lora_targets=[q_proj,k_proj,v_proj,o_proj,gate,up,down]`, `semantic_future_prediction_steps=2`, future weight 0.5, `semantic_self_condition_prob=0.5`, EOS weight 2.0, tokenizer/model-vocab alignment fix, and the 12-token 3-way grouped prefix. This recovered some life at asr_wer_prefix=0.8333 with perfect gt-ASR sanity and short OOD generations, but it stayed well below both the fragile 0.3333 winner and the reproducible 0.6667 fuller-LoRA four-head fallback, while in-domain EOS disappeared and the in-domain utterance stretched back to the 53-frame cap. So fuller LoRA does not revive the older two-head grouped family on the aligned mixed-text branch; the stronger live fallback still wants four future heads.","timestamp":1773675758172,"segment":0}
{"run":325,"commit":"1570c6b","metric":1,"metrics":{},"status":"discard","description":"Tested whether the fragile mixed-text aligned four-head grouped winner is update-limited by lowering `batch_size` from the default to 4 while keeping `text_source=both`, future steps 4, future weight 0.5, `semantic_self_condition_prob=0.5`, EOS weight 2.0, tokenizer/model-vocab alignment fix, and the 12-token 3-way grouped prefix. This did raise the step count to 3293 in 10 minutes, but because throughput dropped it only processed 13.2k samples and the primary metric still regressed cleanly to asr_wer_prefix=1.0 with worse CER 0.818. So simply buying more optimizer updates does not stabilize the mixed-text aligned grouped branch; this path is another stale local retune rather than a hidden step-limited win.","timestamp":1773676628700,"segment":0}
{"run":326,"commit":"1570c6b","metric":1,"metrics":{},"status":"discard","description":"Added back a stricter train/infer-match future-head supervision flag (`semantic_future_prediction_match_block_decode=true`) and tested it for the first time on the aligned mixed-text four-head grouped mainline, where inference only consumes the first two future heads on every third early-Q0 position. The run kept `text_source=both`, future steps 4, future weight 0.5, `semantic_self_condition_prob=0.5`, EOS weight 2.0, tokenizer/model-vocab alignment fix, and the 12-token 3-way grouped prefix, but masked future-head training down to the grouped-step source positions and head offsets actually used by that plain grouped decode policy. This preserved EOS on both prompts and perfect gt-ASR sanity, but the primary metric still regressed cleanly to asr_wer_prefix=1.0 with CER 0.727. So the stricter grouped-step-matched future-head mask is now stale on the aligned four-head grouped backbone too; keeping all four future heads active as a broader auxiliary still looks better than literally matching the plain grouped inference uses.","timestamp":1773713788756,"segment":0}
{"run":327,"commit":"1570c6b","metric":1,"metrics":{},"status":"discard","description":"Retried the new grouped-step-matched future-head supervision mask on the aligned mixed-text four-head grouped mainline (`semantic_future_prediction_match_block_decode=true` with `text_source=both`, future steps 4, future weight 0.5, `semantic_self_condition_prob=0.5`, EOS weight 2.0, tokenizer/model-vocab alignment fix, 12-token 3-way grouped prefix). The rerun confirmed the first result was not a fluke in the good direction: it again landed at asr_wer_prefix=1.0, this time with worse CER 0.909, OOD EOS disappearing, and the OOD utterance stretching back to the 53-frame cap despite very strong in-domain WER 0.111. So the stricter grouped-step-matched future-head mask is now clearly stale/noisy on the aligned four-head grouped backbone and should be reverted rather than treated as a live stabilizer.","timestamp":1773714549368,"segment":0}
{"run":328,"commit":"1570c6b","metric":1,"metrics":{},"status":"discard","description":"Retuned the fragile mixed-text aligned four-head grouped mainline to a shorter plain grouped prefix by reducing `semantic_block_decode_max_grouped_tokens` from 12 down to 9 while keeping `text_source=both`, future steps 4, future weight 0.5, `semantic_self_condition_prob=0.5`, EOS weight 2.0, tokenizer/model-vocab alignment fix, and `semantic_block_decode_size=3`. This was a clean check of whether the live branch prefers exactly three grouped steps before exact fallback rather than four, but it still regressed cleanly to asr_wer_prefix=1.0 despite preserving EOS on both prompts, perfect gt-ASR sanity, and short generations. So the aligned mixed-text grouped branch does not simply want a shorter 9-token grouped window; the good behavior remains tightly localized elsewhere.","timestamp":1773715337805,"segment":0}
{"run":329,"commit":"1570c6b","metric":1,"metrics":{},"status":"discard","description":"Tried a fresh future-head architecture change on the aligned four-head grouped backbone: `semantic_future_prediction_use_shared_audio_head=true` makes each future-Q0 head predict a transformed hidden state, then reuses the shared Stage-1 audio LM head to map that state to Q0 logits instead of having each future head own a separate direct CODEBOOK-size output matrix. On the tokenizer-aligned grouped mainline (future steps 4, future weight 0.5, `semantic_self_condition_prob=0.5`, EOS weight 2.0, 12-token 3-way grouped prefix), this ran cleanly and kept EOS on both prompts, but the primary metric regressed cleanly to asr_wer_prefix=1.0 with worse CER 0.864. So this first shared-audio-head future-prediction design looks stale on the reproducible aligned grouped backbone rather than like a cheaper or better speculative-token head.","timestamp":1773716295880,"segment":0}
{"run":330,"commit":"1570c6b","metric":1,"metrics":{},"status":"discard","description":"Tested whether a text-prefix LM preservation loss can stabilize the fragile mixed-text aligned four-head grouped winner by adding `text_loss_weight=0.1` on top of `text_source=both`, future steps 4, future weight 0.5, `semantic_self_condition_prob=0.5`, EOS weight 2.0, tokenizer/model-vocab alignment fix, and the 12-token 3-way grouped prefix. This ran cleanly but throughput dropped heavily to only 1725 steps / 13.8k samples in 10 minutes, and the primary metric regressed all the way to asr_wer_prefix=1.0 with worse CER 0.909. So the simple text-prefix LM anchor does not rescue the aligned mixed-text grouped branch either; it should now be treated as stale on this newer branch too, not just on the older baselines.","timestamp":1773717082295,"segment":0}
{"run":331,"commit":"1570c6b","metric":1,"metrics":{},"status":"discard","description":"Tested whether protecting the fragile mixed-text aligned grouped semantic branch from Stage-2 feedback helps by setting `detach_semantic_hidden_for_stage2=true` on top of `text_source=both`, future steps 4, future weight 0.5, `semantic_self_condition_prob=0.5`, EOS weight 2.0, tokenizer/model-vocab alignment fix, and the 12-token 3-way grouped prefix. This regressed cleanly to asr_wer_prefix=1.0, OOD EOS disappeared, the OOD utterance stretched back to the 53-frame cap, and CER worsened to 0.955. So simple Stage-2 gradient detachment is now stale on the aligned mixed-text grouped branch too; it does not stabilize the current live win.","timestamp":1773717838656,"segment":0}
{"run":332,"commit":"1570c6b","metric":1,"metrics":{},"status":"discard","description":"Tested whether emphasizing Stage 1 can improve the most reproducible mixed-text aligned grouped fallback by combining the fuller LoRA target set (`lora_targets=[q_proj,k_proj,v_proj,o_proj,gate,up,down]`) with `semantic_loss_weight=2.0` and `acoustic_loss_weight=0.5` on top of `text_source=both`, future steps 4, future weight 0.5, `semantic_self_condition_prob=0.5`, EOS weight 2.0, tokenizer/model-vocab alignment fix, and the 12-token 3-way grouped prefix. This failed cleanly at asr_wer_prefix=1.0: OOD EOS disappeared, the OOD utterance hit the 53-frame cap again, gt-ASR sanity weakened, and in-domain WER worsened badly. So simple Stage-1 upweighting / Stage-2 downweighting is now stale on the aligned mixed-text fuller-LoRA fallback too; it is not a good stabilizer for the current live branch.","timestamp":1773718613776,"segment":0}
{"run":333,"commit":"1570c6b","metric":1,"metrics":{},"status":"discard","description":"Tried a new future-head architecture on the reproducible tokenizer-aligned four-head grouped backbone: `semantic_future_prediction_residual_audio_head=true` makes each future-Q0 head predict a residual hidden-state delta, then reuses the shared Stage-1 audio LM head on hidden+delta instead of giving each future head an independent direct CODEBOOK-size logit matrix. On the aligned 12-token 3-way grouped mainline (future steps 4, future weight 0.5, `semantic_self_condition_prob=0.5`, EOS weight 2.0, p95-style cap), this ran cleanly and stayed reasonably fast at 2246 steps / 18.0k samples, but the primary metric still regressed to asr_wer_prefix=1.0 with CER 0.727. So this first residual-audio-head future prediction design looks stale on the aligned grouped backbone too; tying future heads more tightly to the exact audio head did not rescue the grouped-prefix branch.","timestamp":1773719866406,"segment":0}
{"run":334,"commit":"1570c6b","metric":0,"metrics":{},"status":"crash","description":"Added a new mixed-text ratio experiment path `text_source=both_plus_normalized`, which keeps both transcript variants but oversamples normalized text 2:1 over raw on the aligned four-head grouped mainline. The first benchmark attempt crashed before training because this new `text_source` invalidated the cached `train` / `unpadded` datasets and `./autoresearch.sh` requires them to be pre-generated with `--launcher dataset` first. Need to build the new dataset caches, then rerun the actual benchmark before judging whether this weighted mixed-text ratio is live or stale.","timestamp":1773720070567,"segment":0}
{"run":335,"commit":"a495690","metric":0.5,"metrics":{},"status":"keep","description":"Added a new weighted mixed-text dataset mode `text_source=both_plus_normalized`, which keeps both transcript variants but oversamples normalized text 2:1 over raw instead of the old 1:1 doubled mixture. On the tokenizer-aligned four-head grouped-prefix branch (future steps 4, future weight 0.5, `semantic_self_condition_prob=0.5`, EOS weight 2.0, 12-token 3-way grouped prefix, p95-style cap), this materially improved over the strongest reproducible 0.6667 backbone: final asr_wer_prefix reached 0.5 with strong CER 0.409, EOS on both prompts, short generations (~30/40 frames), and much higher training throughput at 3795 steps / 30.4k samples in 10 minutes. This still does not beat the fragile 0.3333 mixed-text outlier, but it is a new live middle ground between normalized-only stability and the noisier 1:1 mixed-text branch, so it is worth keeping and rerunning.","timestamp":1773720894440,"segment":0}
{"run":336,"commit":"a495690","metric":1,"metrics":{},"status":"discard","description":"Exact reran the new weighted mixed-text branch `text_source=both_plus_normalized` on the tokenizer-aligned four-head grouped-prefix setup (future steps 4, future weight 0.5, `semantic_self_condition_prob=0.5`, EOS weight 2.0, 12-token 3-way grouped prefix, p95-style cap). The promising first run at asr_wer_prefix=0.5 did not hold: the rerun fell all the way back to asr_wer_prefix=1.0 with CER 0.727, even though EOS still fired on both prompts and throughput stayed very high at 3818 steps / 30.5k samples. So the 2:1 normalized/raw mix is now a live but clearly fragile clue rather than a new reproducible backbone; it needs stabilization just like the earlier 1:1 mixed-text spike.","timestamp":1773721649150,"segment":0}
{"run":337,"commit":"a495690","metric":0.8333333134651184,"metrics":{},"status":"discard","description":"Tested whether broader LoRA adaptation can stabilize the new weighted mixed-text branch by combining `text_source=both_plus_normalized` with the reproducible fuller target set `lora_targets=[q_proj,k_proj,v_proj,o_proj,gate,up,down]` on the aligned four-head grouped-prefix recipe (future steps 4, future weight 0.5, `semantic_self_condition_prob=0.5`, EOS weight 2.0, 12-token 3-way grouped prefix, p95-style cap). This stayed fairly fast at 3642 steps / 29.1k samples and preserved EOS on both prompts, but the primary metric only reached asr_wer_prefix=0.8333. So fuller LoRA does not stabilize the new 2:1 normalized/raw mix; it remains worse than the old reproducible 0.6667 fuller-LoRA fallback on the 1:1 mixed-text branch.","timestamp":1773722408330,"segment":0}
{"run":338,"commit":"a495690","metric":1,"metrics":{},"status":"discard","description":"Mapped the weighted mixed-text ratio in the opposite direction by adding `text_source=both_plus_raw`, which oversamples raw transcripts 2:1 over normalized on the aligned four-head grouped-prefix recipe (future steps 4, future weight 0.5, `semantic_self_condition_prob=0.5`, EOS weight 2.0, 12-token 3-way grouped prefix, p95-style cap). Unlike the new 2:1 normalized-heavy mix clue, this raw-heavy variant failed cleanly at asr_wer_prefix=1.0 with weaker gt-ASR sanity and only middling CER 0.864. So the live weighted-mix direction is specifically toward *more normalized than raw*, not more raw; the `both_plus_raw` path should be pruned.","timestamp":1773723297533,"segment":0}
{"run":339,"commit":"14352ef","metric":0.5,"metrics":{},"status":"keep","description":"Generalized the new weighted mixed-text clue into a reusable `text_source=both_weighted` path with explicit repeat counts, then tested a milder 3:1 normalized/raw mixture (`text_source_weighted_normalized_repeats=3`, `text_source_weighted_raw_repeats=1`) on the tokenizer-aligned four-head grouped-prefix recipe (future steps 4, future weight 0.5, `semantic_self_condition_prob=0.5`, EOS weight 2.0, 12-token 3-way grouped prefix, p95-style cap). This again improved over the reproducible 0.6667 backbone, landing at asr_wer_prefix=0.5 with EOS on both prompts, short generations (~32/37 frames), and high throughput at 3812 steps / 30.5k samples in 10 minutes. It still does not beat the fragile 0.3333 outlier, but it suggests the live weighted-mix direction may extend beyond the hardcoded 2:1 normalized/raw branch, so this generic weighted-text infrastructure is worth keeping and rerunning.","timestamp":1773724286538,"segment":0}
{"run":340,"commit":"14352ef","metric":0.8333333134651184,"metrics":{},"status":"discard","description":"Exact reran the new generic weighted-text branch at a 3:1 normalized/raw mix (`text_source=both_weighted`, normalized repeats 3, raw repeats 1) on the aligned four-head grouped-prefix recipe. The promising first run at asr_wer_prefix=0.5 did not fully hold: the rerun dropped to asr_wer_prefix=0.8333 with CER 0.727, though it still preserved EOS on both prompts, short generations, and high throughput at 3816 steps / 30.5k samples. So the 3:1 weighted mix is still another fragile mixed-text clue rather than a reproducible new backbone, but it may be slightly less catastrophic on rerun than the earlier hardcoded 2:1 mix, which fell all the way back to 1.0.","timestamp":1773725054912,"segment":0}
{"run":341,"commit":"14352ef","metric":0.6666666865348816,"metrics":{},"status":"discard","description":"Swept the new generic weighted-text branch further toward normalized text by testing a 4:1 normalized/raw mixture (`text_source=both_weighted`, normalized repeats 4, raw repeats 1) on the aligned four-head grouped-prefix recipe. This landed at asr_wer_prefix=0.6667 with CER 0.591: better than the recent 1.0 collapses, but only back at the old reproducible baseline rather than above it. So pushing the weighted mix too far toward normalized text seems to wash out the extra mixed-text gain; the more interesting live region still looks closer to the 2:1–3:1 normalized/raw range.","timestamp":1773725900593,"segment":0}
{"run":342,"commit":"14352ef","metric":1,"metrics":{},"status":"discard","description":"Tested whether broader LoRA adaptation can stabilize the new generic weighted-text branch by combining the 3:1 normalized/raw mix (`text_source=both_weighted`, normalized repeats 3, raw repeats 1) with the fuller target set `lora_targets=[q_proj,k_proj,v_proj,o_proj,gate,up,down]` on the aligned four-head grouped-prefix recipe. This stayed reasonably fast at 3657 steps / 29.3k samples and preserved EOS on both prompts, but the primary metric collapsed to asr_wer_prefix=1.0 with CER 1.0. So fuller LoRA is not the right stabilizer for the 3:1 weighted-text branch either; the generic weighted mix clue still does not combine well with the old reproducible LoRA fallback.","timestamp":1773726670188,"segment":0}
