{"run":407,"commit":"913252f","metric":0.6666666865348816,"metrics":{},"status":"keep","description":"Extended the new fixed-duplicate same-ratio mass sweep by pushing `text_source=both_weighted` from repeats `6/2` up to `9/3` while keeping the aligned four-head grouped-prefix recipe and the same 3:1 normalized/raw ratio. This improved again to asr_wer_prefix=0.6667 with CER 0.682, EOS on both prompts, short generations (~33/41 frames), and full throughput (~30.2k samples / 10 min). So the fixed-duplicate weighted branch does not just tolerate more total mass; at least in this first probe it actually recovers back to the robust 0.6667 level at higher same-ratio duplicate mass. That makes the fixed-duplicate family look materially broader in total-mass space than the sampled branch, and it raises the live question of whether the old `3/1` 0.5 hits came from a sharper duplicate-mass sweet spot somewhere above four total copies rather than exactly at it.","timestamp":1773783892077,"segment":0}
{"run":408,"commit":"913252f","metric":1,"metrics":{},"status":"discard","description":"Exact reran the new higher-mass fixed-duplicate 3:1 weighted branch (`text_source=both_weighted`, repeats `9/3`) on the aligned four-head grouped-prefix recipe after its first 0.6667 hit. It collapsed back to asr_wer_prefix=1.0 with OOD EOS disappearing, the utterance stretching to 51 frames, and even one invalid Q0 token appearing in the OOD sample. So the larger-mass fixed-duplicate branch is real but still noisy; the new 9/3 mass level does not immediately become a reproducible upgrade over the older 3/1 branch.","timestamp":1773784655797,"segment":0}
{"run":409,"commit":"913252f","metric":1,"metrics":{},"status":"discard","description":"Extended the fixed-duplicate same-ratio 3:1 mass sweep one step further by pushing `text_source=both_weighted` to repeats `12/4` on the aligned four-head grouped-prefix recipe after the new `6/2` and `9/3` life. This time it failed cleanly at asr_wer_prefix=1.0 despite full throughput (~30.4k samples / 10 min), EOS on both prompts, short generations (~31/39 frames), and very strong in-domain WER 0.333. So the duplicate-mass family is broader than the sampled branch, but it is not monotonically improving with more total 3:1 mass; by `12/4` the branch has already flipped into another short-EOS wrong-content failure mode rather than the older long/no-EOS collapse.","timestamp":1773786083147,"segment":0}
{"run":410,"commit":"913252f","metric":1,"metrics":{},"status":"discard","description":"Exact reran the earlier fixed-duplicate same-ratio 3:1 weighted mass retune at repeats `6/2` on the aligned four-head grouped-prefix recipe after the newer `9/3` and `12/4` mapping. It also collapsed to asr_wer_prefix=1.0 despite full throughput (~30.6k samples / 10 min), EOS on both prompts, short generations (~32/38 frames), and decent in-domain WER 0.444. So the apparent broader duplicate-mass family is still high-variance across at least `6/2`, `9/3`, and `12/4`; even the milder 6/2 point does not yet show reproducible stability and its failures can happen in the same short-EOS wrong-content mode as 12/4 rather than only as long/no-EOS collapses.","timestamp":1773786838070,"segment":0}
{"run":411,"commit":"913252f","metric":1,"metrics":{},"status":"discard","description":"Tested whether the old fragile 1:1 mixed-text grouped win can be recovered or stabilized by using the generic fixed-duplicate weighted path at equal normalized/raw mass but higher total duplicate count: `text_source=both_weighted` with repeats `2/2` on the aligned four-head grouped-prefix recipe. It failed cleanly at asr_wer_prefix=1.0 despite full throughput (~30.5k samples / 10 min), EOS on both prompts, short generations (~28/38 frames), and decent CER 0.682. So the earlier `text_source=both` spike does not seem to generalize to a broader equal-ratio fixed-duplicate family; simply adding more total 1:1 duplicate mass is stale and lands in the same short-EOS wrong-content failure mode as several recent weighted misses.","timestamp":1773787677407,"segment":0}
{"run":412,"commit":"2b66ee6","metric":0.8333333134651184,"metrics":{},"status":"keep","description":"Tested whether the older normalized-heavy 2:1 clue broadens in duplicate-mass space the same way the 3:1 family does by raising the generic fixed-duplicate weighted branch from repeats `2/1` to `4/2` while keeping the aligned four-head grouped-prefix recipe. This recovered sub-1.0 life at asr_wer_prefix=0.8333 with CER 0.682, EOS on both prompts, very strong in-domain WER 0.111, and full throughput (~30.6k samples / 10 min), though gt-ASR sanity slipped to 0.333. So the 2:1 normalized/raw family is not completely dead outside the old hardcoded spike; higher total duplicate mass can keep it alive even if it still does not recover the old 0.5 result. This makes the broader picture more symmetric: both the 2:1 and 3:1 fixed-duplicate families have some real mass sensitivity, while the sampled branch remains much narrower and more geometry-fragile.","timestamp":1773788599606,"segment":0}
{"run":413,"commit":"2b66ee6","metric":1,"metrics":{},"status":"discard","description":"Exact reran the new higher-mass 2:1 fixed-duplicate weighted branch (`text_source=both_weighted`, repeats `4/2`) on the aligned four-head grouped-prefix recipe after its first 0.8333 hit. It collapsed back to asr_wer_prefix=1.0 with EOS still firing on both prompts, short generations (~32/39 frames), and middling in-domain WER 0.556. So the 2:1 family now mirrors the 3:1 family's recent behavior: duplicate-mass retunes can produce real first-run life, but they are still noisy and can fail in the same short-EOS wrong-content mode rather than through the older long/no-EOS collapse.","timestamp":1773789349219,"segment":0}
{"run":414,"commit":"eaf012b","metric":0.6666666865348816,"metrics":{},"status":"keep","description":"Tested a new optimizer-side stabilizer on the most promising higher-mass fixed-duplicate weighted branch by lowering the global learning rate from `3e-4` to `2e-4` on `text_source=both_weighted` repeats `9/3` with the aligned four-head grouped-prefix recipe. This recovered asr_wer_prefix=0.6667 with EOS on the OOD prompt and 39 OOD frames, so the higher-mass 3:1 branch is not tied to the default LR. But the tradeoff was ugly: throughput collapsed to only ~18.1k samples / 10 min, the in-domain utterance hit the 53-frame cap with missing EOS, and gt-ASR sanity slipped to 0.125. So a lower global LR is a real live knob on this branch, but right now it looks more like a noisy throughput-costly side path than a clean stabilizer.","timestamp":1773790343857,"segment":0}
{"run":415,"commit":"eaf012b","metric":1,"metrics":{},"status":"discard","description":"Exact reran the lower-learning-rate high-mass 3:1 weighted branch (`text_source=both_weighted`, repeats `9/3`, `learning_rate=2e-4`) after its first 0.6667 hit. It collapsed back to asr_wer_prefix=1.0 with EOS on both prompts, short generations (~35/38 frames), and only middling in-domain WER 0.667. So lowering the global LR does not stabilize the higher-mass 3:1 branch; like the recent mass sweeps it is another noisy first-run side path rather than a reproducible upgrade.","timestamp":1773791095640,"segment":0}
{"run":416,"commit":"eaf012b","metric":1,"metrics":{},"status":"discard","description":"Tested a post-alignment transfer of the older broader exact-last clue onto the tokenizer-aligned grouped backbone by combining `text_source=normalized`, `semantic_future_prediction_steps=2`, `semantic_block_decode_size=4`, `semantic_block_decode_exact_last_token=true`, and the future-slots-only cheap early-prefix match (`semantic_self_condition_use_inference_policy=true`, `semantic_self_condition_match_early_grouped_prefix=true`, `semantic_self_condition_match_grouped_future_slots_only=true`, `semantic_self_condition_inference_policy_prob=0.0`) with the 12-token grouped window and EOS weight 2.0. It failed cleanly at asr_wer_prefix=1.0 with only 16.8k samples / 10 min and no primary upside despite decent CER 0.727. So the older block_size=4 exact/future/future/exact matched-training clue does not transfer cleanly onto the aligned normalized grouped backbone; post-alignment it mostly looks like another slow stale side path rather than a successor to the plain grouped-prefix mainline.","timestamp":1773791899043,"segment":0}
{"run":417,"commit":"c067b12","metric":0.6666666865348816,"metrics":{},"status":"keep","description":"Tested a simple global optimizer retune on the tokenizer-aligned reproducible grouped-prefix backbone by lowering `learning_rate` from `3e-4` to `2e-4` while keeping `text_source=normalized`, four future-Q0 heads, scheduled sampling 0.5, EOS weight 2.0, and the 12-token grouped prefix. It tied the robust 0.6667 level again with slightly better CER 0.636, EOS on both prompts, short generations (~31/35 frames), and full throughput (~30.4k samples / 10 min). So unlike the noisy weighted-branch transfer, lower global LR may actually be a viable stabilizer on the plain aligned grouped backbone and is worth exact rerun before treating it as stale.","timestamp":1773792674564,"segment":0}
{"run":418,"commit":"c067b12","metric":1,"metrics":{},"status":"discard","description":"Exact reran the lower-learning-rate aligned grouped backbone (`text_source=normalized`, `learning_rate=2e-4`, four future-Q0 heads, 12-token grouped prefix) after its first tie-level 0.6667 result. It collapsed back to asr_wer_prefix=1.0 with EOS on both prompts, normal throughput (~30.4k samples / 10 min), and no compensating secondary upside. So lowering the global LR on the plain aligned grouped backbone now looks just like the weighted-branch transfer: another noisy first-run side path rather than a reproducible stabilizer.","timestamp":1773793437201,"segment":0}
{"run":419,"commit":"c067b12","metric":1,"metrics":{},"status":"discard","description":"Tested a softer Stage-2-preserving optimizer split on the aligned grouped backbone by lowering only `residual_learning_rate` to `2e-4` while keeping the global / semantic rate at the default `3e-4` on `text_source=normalized`, four future-Q0 heads, scheduled sampling 0.5, EOS weight 2.0, and the 12-token grouped prefix. It failed cleanly at asr_wer_prefix=1.0 while throughput collapsed to only ~16.0k samples / 10 min, despite EOS on both prompts and short generations. So simply slowing Stage 2 through a lower residual LR is stale in this regime; it behaves more like the bad low-LR side paths than like a stabilizer.","timestamp":1773794396239,"segment":0}
{"run":420,"commit":"c067b12","metric":1,"metrics":{},"status":"discard","description":"Tested a post-alignment Stage-1 denoising retune on the aligned grouped backbone by adding `semantic_q0_corruption_prob=0.05` to `text_source=normalized`, four future-Q0 heads, scheduled sampling 0.5, EOS weight 2.0, and the 12-token grouped prefix. It failed cleanly at asr_wer_prefix=1.0 while total coverage dropped to only ~17.8k samples / 10 min, despite EOS on both prompts and decent in-domain WER 0.444. So mild Stage-1 token corruption now looks stale on the aligned grouped backbone too; it behaves more like another throughput-costly side path than an exposure-bias fix.","timestamp":1773795163790,"segment":0}
{"run":421,"commit":"c067b12","metric":0,"metrics":{},"status":"crash","description":"Tried a more targeted EOS-floor retune on the fragile mixed-text aligned grouped winner by setting `semantic_gen_min_new_tokens=24` on `text_source=both`, four future-Q0 heads, scheduled sampling 0.5, EOS weight 2.0, and the 12-token grouped prefix. The run crashed before training because this inference-only generation setting invalidated the current dataset cache key and `./autoresearch.sh` was launched without a pre-generated dataset cache for the new config. So moderate `semantic_gen_min_new_tokens` remains unjudged; like the earlier residual-generation sampling probe, it first needs a `--launcher dataset` prebuild even though it only changes eval-time generation behavior.","timestamp":1773795369487,"segment":0}
{"run":422,"commit":"04bdb1f","metric":0.6666666865348816,"metrics":{},"status":"keep","description":"Retested the fragile mixed-text aligned grouped branch with a more targeted EOS-floor retune by prebuilding caches and then setting `semantic_gen_min_new_tokens=24` on `text_source=both`, four future-Q0 heads, scheduled sampling 0.5, EOS weight 2.0, and the 12-token grouped prefix. This recovered asr_wer_prefix=0.6667 with EOS on both prompts, stronger in-domain WER 0.333, and moderate generation lengths (~42/40 frames), though throughput dropped to only ~22.9k samples / 10 min. So the earlier blunt 48-token floor was too aggressive, but a moderate minimum-length floor may be a real stabilizer candidate for the mixed-text aligned branch rather than pure stale EOS forcing.","timestamp":1773796170821,"segment":0}
{"run":423,"commit":"04bdb1f","metric":1,"metrics":{},"status":"discard","description":"Exact reran the mixed-text aligned grouped branch with the targeted EOS floor (`text_source=both`, `semantic_gen_min_new_tokens=24`) after its first 0.6667 recovery. It collapsed back to asr_wer_prefix=1.0 while keeping EOS on both prompts, restoring full throughput (~30.2k samples / 10 min), and even improving CER to 0.591. So a moderate minimum-length floor is not yet a reproducible stabilizer for the mixed-text branch; like several recent local retunes, it may be another noisy first-run side path rather than a robust fix for the short-EOS failure mode.","timestamp":1773796926030,"segment":0}
{"run":424,"commit":"04bdb1f","metric":1,"metrics":{},"status":"discard","description":"Mapped the lower side of the new mixed-text EOS-floor clue by rerunning the aligned grouped `text_source=both` branch with `semantic_gen_min_new_tokens=16` instead of `24`, after reusing the prebuilt cache family for that config hash. It failed cleanly at asr_wer_prefix=1.0 with EOS on both prompts, ~22.9k samples / 10 min, and no secondary upside. So the moderate minimum-length-floor idea does not obviously broaden downward from 24; at least so far it looks like another narrow local spike rather than a robust mixed-text stabilizer family.","timestamp":1773797733872,"segment":0}
{"run":425,"commit":"04bdb1f","metric":0.6666666865348816,"metrics":{},"status":"discard","description":"Tested whether the new moderate EOS-floor clue broadens when stacked onto the reproducible mixed-text fuller-LoRA fallback by combining `semantic_gen_min_new_tokens=24` with `text_source=both`, four future-Q0 heads, scheduled sampling 0.5, EOS weight 2.0, the 12-token grouped prefix, and `lora_targets=[q_proj,k_proj,v_proj,o_proj,gate,up,down]`. It tied the fallback at asr_wer_prefix=0.6667 with EOS on both prompts, CER 0.636, very strong in-domain WER 0.222, and shorter generations (~37/38 frames), but throughput again dropped to only ~22.0k samples / 10 min. So the moderate minimum-length floor can coexist with the fuller-LoRA fallback, but so far it does not improve the primary metric beyond the already-reproducible 0.6667 branch.","timestamp":1773799437399,"segment":0}
{"run":426,"commit":"04bdb1f","metric":1,"metrics":{},"status":"discard","description":"Tested whether the new moderate EOS-floor clue transfers to the broader fixed-duplicate weighted family by prebuilding caches and then setting `semantic_gen_min_new_tokens=24` on the aligned grouped 3:1 normalized/raw branch (`text_source=both_weighted`, repeats 3/1, four future-Q0 heads, scheduled sampling 0.5, EOS weight 2.0, 12-token grouped prefix). It failed cleanly at asr_wer_prefix=1.0 while keeping EOS on both prompts, full throughput (~30.5k samples / 10 min), and short generations (~30/39 frames). So the moderate minimum-length floor does not rescue the live fixed-duplicate weighted branch; this family's failures are not just early-EOS truncation either.","timestamp":1773800307048,"segment":0}
{"run":427,"commit":"04bdb1f","metric":1,"metrics":{},"status":"discard","description":"Tested whether the moderate EOS-floor clue transfers to the live sampled stochastic-mass branch by setting `semantic_gen_min_new_tokens=24` on the aligned grouped 2-pass sampled 3:1 recipe (`text_source=both_weighted_sampled`, normalized/raw weights 3/1, `text_source_weighted_sampled_passes=2`, four future-Q0 heads, scheduled sampling 0.5, EOS weight 2.0, 12-token grouped prefix). It failed cleanly at asr_wer_prefix=1.0 while keeping EOS on both prompts, full throughput (~30.5k samples / 10 min), and short generations (~32/40 frames), though CER held at 0.500. So the moderate minimum-length floor also does not rescue the sampled weighted branch; like the fixed-duplicate branch, its failures are not explained by simple early-EOS truncation.","timestamp":1773801074656,"segment":0}
{"run":428,"commit":"04bdb1f","metric":1,"metrics":{},"status":"discard","description":"Implemented and tested a richer corrective-overlap grouped decoder on the aligned normalized grouped backbone: added `semantic_block_decode_overlap_last_grouped_token=true`, which makes the final token of every grouped step provisional and leaves it out of the KV cache so the next decode step overwrites that same boundary token exactly. Tested the first plausible transfer with `semantic_block_decode_size=4` and a 12-token grouped prefix, so each overlap step still commits an effective 3-token rhythm while using one extra future head before the exact overwrite. It failed cleanly at asr_wer_prefix=1.0 with EOS on both prompts, short generations (~31/39 frames), and only ~23.1k samples / 10 min. So this richer per-step overlap design does not rescue the aligned grouped backbone either; the corrective-overlap family looks even weaker than the simpler exact-last / late-bridge clues.","timestamp":1773802190038,"segment":0}
{"run":429,"commit":"04bdb1f","metric":0.8333333134651184,"metrics":{},"status":"discard","description":"Transferred the new per-step corrective-overlap decoder to the fragile mixed-text aligned grouped branch by keeping `text_source=both`, four future-Q0 heads, scheduled sampling 0.5, EOS weight 2.0, and the grouped-prefix recipe but switching to `semantic_block_decode_size=4` plus `semantic_block_decode_overlap_last_grouped_token=true` so each grouped step commits an effective 3-token rhythm while overwriting the last boundary token exactly on the next step. This recovered only weak life at asr_wer_prefix=0.8333 with EOS on both prompts, short generations (~31/39 frames), and full throughput (~30.3k samples / 10 min), but it stayed far below the reproducible 0.6667 backbone and the earlier mixed-text spikes. So this richer overlap-every-step design is at best another weak mixed-text side clue, not a successor to the plain grouped-prefix mainline.","timestamp":1773802985186,"segment":0}
{"run":430,"commit":"04bdb1f","metric":1,"metrics":{},"status":"discard","description":"Tested whether the late-boundary schedule clue transfers to the live sampled stochastic-mass branch by running the aligned grouped 2-pass sampled 3:1 recipe with `semantic_block_decode_schedule=3,3,3,1,2` instead of the plain 12-token grouped cutoff (`text_source=both_weighted_sampled`, normalized/raw weights 3/1, `text_source_weighted_sampled_passes=2`, four future-Q0 heads, scheduled sampling 0.5, EOS weight 2.0). It failed cleanly at asr_wer_prefix=1.0 while keeping EOS on both prompts, full throughput (~30.3k samples / 10 min), and short generations (~32/37 frames). So the sampled branch does not seem to want the old late-boundary bridge+taper clue either; its remaining life still looks tied to the plain grouped-prefix transition rather than to explicit schedule smoothing.","timestamp":1773803930158,"segment":0}
{"run":431,"commit":"4de9b7b","metric":0.6666666865348816,"metrics":{},"status":"keep","description":"Tested whether the old exact-last grouped transition transfers to the live sampled stochastic-mass branch by running the aligned 2-pass sampled 3:1 recipe with `semantic_block_decode_exact_last_token=true` (`text_source=both_weighted_sampled`, normalized/raw weights 3/1, `text_source_weighted_sampled_passes=2`, four future-Q0 heads, scheduled sampling 0.5, EOS weight 2.0, 12-token grouped prefix). Unlike the stale late-boundary sampled schedule, this recovered real life at asr_wer_prefix=0.6667 with strong CER 0.545, EOS on both prompts, short generations (~30/38 frames), and full throughput (~30.0k samples / 10 min), though in-domain WER stayed weak at 0.889. So the sampled branch is not tied strictly to the plain grouped-prefix transition after all: exact-last is now a live sampled-side clue worth exact rerun.","timestamp":1773804779863,"segment":0}
{"run":432,"commit":"0963536","metric":0.1666666716337204,"metrics":{},"status":"keep","description":"Exact reran the new sampled exact-last transition clue on the aligned 2-pass sampled 3:1 recipe (`text_source=both_weighted_sampled`, normalized/raw weights 3/1, `text_source_weighted_sampled_passes=2`, four future-Q0 heads, scheduled sampling 0.5, EOS weight 2.0, 12-token grouped prefix, `semantic_block_decode_exact_last_token=true`). Instead of collapsing, the rerun jumped to a new best recorded result: asr_wer_prefix=0.1667 with excellent CER 0.091, EOS on both prompts, and short generations (~28/38 frames), though gt-ASR sanity weakened to 0.263 and in-domain WER stayed only moderate at 0.556. So the sampled branch is not just a text-assignment spike after all: the exact-last transition has now become the strongest live sampled-side clue and the new best overall recipe, despite still looking potentially noisy.","timestamp":1773805547324,"segment":0}
