{"run":744,"commit":"de9387a","metric":1,"metrics":{},"status":"discard","description":"Ran the next minimal direct-shared-memory touch split on the detached old-train CPU-only route. I built `/tmp/xax-bench-9cea09c-oldtrain-meminfocputouchcpuusefirst-attrlocknoproxy-nogpu`, where the training loop does **clear the event** and then only touches `monitor._cpu_stats_smem._lock` directly — with no `get_lock()` call, no lock acquisition, and no payload reads. The worker still emitted the first post-`memory_info()` `cpu_percent()` value. This still failed cleanly at **`asr_wer_prefix=1.0`** with near-old-regime throughput (~29.7k samples / 10 min), EOS on both prompts, and clean gt-ASR. So the harsh direct shared-memory path is now narrower still: after consuming the event, even a **bare attribute touch** on the synchronized shared-value wrapper is enough to keep the route in the bad class. That pushes the live mystery below payload decode and below lock acquisition itself, toward the combination of **event clear + any subsequent shared-wrapper touch**.","timestamp":1774075154366,"segment":0}
{"run":745,"commit":"de9387a","metric":1,"metrics":{},"status":"discard","description":"Tested the complementary bare-attribute direct-shared-memory touch on the detached old-train CPU-only route. I built `/tmp/xax-bench-9cea09c-oldtrain-meminfocputouchcpuusefirst-attrlocknoclearnoproxy-nogpu`, where the training loop only touches `monitor._cpu_stats_smem._lock` directly and does **not** clear the event first, with no `get_lock()` call, no lock acquisition, and no payload reads. The worker still emitted the first post-`memory_info()` `cpu_percent()` value. This also failed cleanly at **`asr_wer_prefix=1.0`** with near-old-regime throughput (~29.7k samples / 10 min), EOS on both prompts, and clean gt-ASR. So the new direct-shared-memory picture is sharper but also slightly branchier than the earlier lock-acquire split: a **bare synchronized-wrapper touch** can already be enough to keep the bad class even **without** prior clear, while the weaker `0.8333` branches seem to require touching the lock through the earlier acquire/ordering variants (#741-#742). That further downgrades the idea that the remaining direct path is about payload copying; it is now centered on which exact shared-wrapper touch occurs after the worker emits that first CPU value.","timestamp":1774075936671,"segment":0}
{"run":746,"commit":"de9387a","metric":1,"metrics":{},"status":"discard","description":"Tested whether the harsh direct-shared-memory path after event clear is specific to lock-related wrapper touches. I built `/tmp/xax-bench-9cea09c-oldtrain-meminfocputouchcpuusefirst-attrobjnoproxy-nogpu`, where the training loop does **clear the event** and then only touches `monitor._cpu_stats_smem._obj` directly — no lock access, no payload reads, no decode, no cached-state update, and no logging. The worker still emitted the first post-`memory_info()` `cpu_percent()` value. This still failed cleanly at **`asr_wer_prefix=1.0`** with near-old-regime throughput (~29.7k samples / 10 min), EOS on both prompts, and clean gt-ASR. So the direct shared-memory mystery is now sharper still: after consuming the event, even a **non-lock wrapper attribute touch** is enough to keep the route in the bad class. That points away from lock acquisition specifically and toward a broader **clear-then-touch synchronized wrapper** mechanism.","timestamp":1774076921088,"segment":0}
{"run":747,"commit":"de9387a","metric":1,"metrics":{},"status":"discard","description":"Ran the complementary non-lock shared-wrapper-touch control on the detached old-train CPU-only route. I built `/tmp/xax-bench-9cea09c-oldtrain-meminfocputouchcpuusefirst-attrobjnoclearnoproxy-nogpu`, where the training loop only touches `monitor._cpu_stats_smem._obj` directly and does **not** clear the event first, with no lock access, no payload reads, no decode, and no logging. The worker still emitted the first post-`memory_info()` `cpu_percent()` value. This also failed cleanly at **`asr_wer_prefix=1.0`** with near-old-regime throughput (~29.6k samples / 10 min), EOS on both prompts, and clean gt-ASR. Together with #746, that upgrades the direct-shared-memory read-side picture again: the remaining harsh path is no longer plausibly lock-specific. Even a **bare `_obj` wrapper-attribute touch** is enough to keep the bad class, with or without prior clear. The mystery is now centered on which synchronized-wrapper touches are intrinsically toxic on this detached route, not on payload copying or lock acquisition.","timestamp":1774077703829,"segment":0}
{"run":748,"commit":"de9387a","metric":1,"metrics":{},"status":"discard","description":"Tested the missing no-clear `get_lock()` corner on the detached old-train CPU-only direct-shared-memory route. I built `/tmp/xax-bench-9cea09c-oldtrain-meminfocputouchcpuusefirst-getlocknoclearnoproxy-nogpu`, where the training loop does **not** clear the event and only calls `monitor._cpu_stats_smem.get_lock()` — no acquire, no payload reads, no decode/cached-state update, and no logging. The worker still emitted the first post-`memory_info()` `cpu_percent()` value. This still failed cleanly at **`asr_wer_prefix=1.0`** with near-old-regime throughput (~29.8k samples / 10 min). That closes an important gap in the direct shared-memory map: the softer `0.8333` no-clear branch from #741 was **not** due to merely touching `get_lock()` or the lock object. It depended on the later lock-acquire/release path itself. Direct shared memory now looks even stranger: on the no-clear branch, **`get_lock()` alone is harsher than actually acquiring the lock**, and the remaining mechanism is centered on very small synchronized-wrapper/lock-object touch distinctions rather than payload reads or lock acquisition alone.","timestamp":1774078954269,"segment":0}
{"run":749,"commit":"de9387a","metric":1,"metrics":{},"status":"discard","description":"Tested whether the softer no-clear lock-only branch from #741 survives if we avoid `get_lock()` entirely and use the synchronized wrapper's bound lock methods directly. I built `/tmp/xax-bench-9cea09c-oldtrain-meminfocputouchcpuusefirst-acquirenoclearnoproxy-nogpu`, where the training loop does **not** clear the event and only calls `monitor._cpu_stats_smem.acquire(); monitor._cpu_stats_smem.release()` — no payload reads, no decode/cached-state update, and no logging. The worker still emitted the first post-`memory_info()` `cpu_percent()` value. This still failed cleanly at **`asr_wer_prefix=1.0`** with near-old-regime throughput (~29.9k samples / 10 min). That sharpens the direct shared-memory picture again: the weaker `0.8333` no-clear branch from #741 is not a generic consequence of lock acquisition. It appears specific to the `with monitor._cpu_stats_smem.get_lock(): ...` path, while direct wrapper-bound `acquire()/release()` remains in the harsh class.","timestamp":1774080734709,"segment":0}
{"run":750,"commit":"de9387a","metric":1,"metrics":{},"status":"discard","description":"Tested whether the softer no-clear direct-shared-memory branch from #741 transfers from `with monitor._cpu_stats_smem.get_lock(): ...` to the synchronized wrapper's own context-manager path. I built `/tmp/xax-bench-9cea09c-oldtrain-meminfocputouchcpuusefirst-withwrappernoclearnoproxy-nogpu`, where the training loop does **not** clear the event and only executes `with monitor._cpu_stats_smem: pass` — no payload reads, no decode/cached-state update, and no logging. The worker still emitted the first post-`memory_info()` `cpu_percent()` value. This also failed cleanly at **`asr_wer_prefix=1.0`** with near-old-regime throughput (~29.7k samples / 10 min). Together with #749, this says the softer `0.8333` no-clear branch from #741 is even more specific than expected: it does **not** transfer to direct wrapper-bound `acquire()/release()`, and it does **not** transfer to the wrapper's own `with wrapper:` context-manager path. The only softened lock-touch path still on the map is the exact `with monitor._cpu_stats_smem.get_lock(): ...` route.","timestamp":1774081524501,"segment":0}
{"run":751,"commit":"de9387a","metric":1,"metrics":{},"status":"discard","description":"Exact-reran the only remaining softened no-clear direct-shared-memory lock-touch corner from #741. I reused `/tmp/xax-bench-9cea09c-oldtrain-meminfocputouchcpuusefirst-locknoclearnoproxy-nogpu`, where the training loop does **not** clear the event and only executes `with monitor._cpu_stats_smem.get_lock(): pass` — no payload reads, no decode/cached-state update, and no logging. The worker still emitted the first post-`memory_info()` `cpu_percent()` value. This rerun failed cleanly at **`asr_wer_prefix=1.0`** with near-old-regime throughput (~29.7k samples / 10 min). That strongly downgrades the last apparent special no-clear softened branch: the earlier `0.8333` from #741 now looks much more like noise than a real surviving mechanism. Together with #748-#750, the detached direct-shared-memory picture is now cleanly pruned: no-clear lock/wrapper touches are not a live benchmark repair family, and the next move should be code inspection / cheap repro rather than more tiny lock-touch reruns.","timestamp":1774082521970,"segment":0}
{"run":752,"commit":"77648de","metric":0.5,"metrics":{},"status":"keep","description":"Exact-reran the strongest surviving detached direct-shared-memory consumer branch on the old-train CPU-only route. I reused `/tmp/xax-bench-9cea09c-oldtrain-meminfocputouchcpuusefirst-clearonlynoproxy-nogpu`, where the training loop does **only event clear** under direct `context.Event()` + shared `context.Value(...)` transport — **no payload read**, no decode/cached-state update, and no logging — while the worker still emits the first post-`memory_info()` `cpu_percent()` value. This rerun improved from the earlier `0.6667` to **`asr_wer_prefix=0.5`** with near-old-regime throughput (~29.7k samples / 10 min), EOS on both prompts, a much closer main prompt transcript (`\"Oh, I'm a test model.\"`), and only mild gt-ASR drift. Together with #751 collapsing the last apparent no-clear softened lock-touch branch back to `1.0`, this sharply re-upgrades the detached direct-shared-memory story: the only direct consumer branch that still looks genuinely alive is now simply **clear-only**. That further prunes the no-clear wrapper-touch family and strengthens the mechanism read that the harsh direct path depends on **touching shared state after emission**, not on event clear alone.","timestamp":1774083529839,"segment":0}
{"run":753,"commit":"77648de","metric":0.5,"metrics":{},"status":"discard","description":"Exact-reran the detached old-train CPU-only **direct shared-memory clear-only** branch again to test whether the new `0.5` from #752 was just a one-off. I reused `/tmp/xax-bench-9cea09c-oldtrain-meminfocputouchcpuusefirst-clearonlynoproxy-nogpu`, where the training loop does only event clear under direct `context.Event()` + shared `context.Value(...)` transport — no payload read, no decode/cached-state update, and no logging — while the worker still emits the first post-`memory_info()` `cpu_percent()` value. This matched the new best at **`asr_wer_prefix=0.5`** again with near-old-regime throughput (~29.7k samples / 10 min), EOS on both prompts, clean gt-ASR, and improved in-domain WER (`0.3333`). So the direct-shared-memory picture is now materially stronger: **clear-only** is no longer just a one-off `0.6667` clue, but a reproduced `0.5`-class branch (`0.6667 -> 0.5 -> 0.5`). Status is discard only because the primary metric tied the current best, not because the branch weakened.","timestamp":1774084315169,"segment":0}
{"run":754,"commit":"77648de","metric":1,"metrics":{},"status":"discard","description":"Ran the matching manager-proxy control against the now-reproduced direct-shared-memory clear-only branch. I reused `/tmp/xax-bench-9cea09c-oldtrain-meminfocputouchcpuusefirst-clearonly-nogpu`, where the training loop consumes the CPU monitor by **only `is_set()/clear()` on the manager Event proxy** — no `ValueProxy.get()`, no stats decode/cached-state update, and no logging — while the worker still emits the first post-`memory_info()` `cpu_percent()` value. This failed cleanly at **`asr_wer_prefix=1.0`** with near-old-regime throughput (~29.6k samples / 10 min), EOS on both prompts, and clean gt-ASR. That is a strong new transport comparison: the same clear-only consumer that now reproduces at `0.5 -> 0.5` under direct `context.Event()` + shared `context.Value(...)` does **not** transfer to the manager-proxy path. So the new live direct-shared-memory clue is not just “event clear alone is sufficient” in the abstract. The stronger branch now seems specific to the **direct shared-memory clear-only transport**, while manager clear-only remains in the bad class on this rerun.","timestamp":1774085091675,"segment":0}
{"run":755,"commit":"77648de","metric":1,"metrics":{},"status":"discard","description":"Tested whether the new direct-shared-memory clear-only rescue is carried by the **direct Event transport** alone. I built `/tmp/xax-bench-9cea09c-oldtrain-meminfocputouchcpuusefirst-clearonly-mixevent-nogpu`, which keeps the manager-backed `ValueProxy` write path from the old clear-only manager branch but swaps both monitor events to direct `context.Event()` objects. The training loop still does only clear-only consumption — no payload read, no decode/cached-state update, and no logging — while the worker still emits the first post-`memory_info()` `cpu_percent()` value. This still failed cleanly at **`asr_wer_prefix=1.0`** with near-old-regime throughput (~29.7k samples / 10 min). That is a sharp new transport isolation: **direct Event alone is not enough**. The reproduced `0.5 -> 0.5` clear-only branch from #752-#753 therefore appears to depend on the **direct shared-value transport** (or the full direct Event+Value combination), not merely on avoiding the manager Event proxy.","timestamp":1774085890399,"segment":0}
{"run":756,"commit":"77648de","metric":0.6666666865348816,"metrics":{},"status":"discard","description":"Ran the complementary clear-only mixed-transport split to ask whether the new direct-shared-memory clear-only rescue is carried mainly by the **direct shared-value transport**. I built `/tmp/xax-bench-9cea09c-oldtrain-meminfocputouchcpuusefirst-clearonly-mixvalue-nogpu`, which keeps the direct shared `context.Value(...)` path from the successful clear-only branch but swaps both monitor events back to manager Event proxies. The training loop still does only clear-only consumption — no payload read, no decode/cached-state update, and no logging — while the worker still emits the first post-`memory_info()` `cpu_percent()` value. This improved materially to **`asr_wer_prefix=0.6667`** with near-old-regime throughput (~29.6k samples / 10 min), EOS on both prompts, and clean gt-ASR, but it did not match the reproduced direct-direct clear-only `0.5` class. Together with #754, this is a sharp transport split: **direct Event alone is not enough**, but **direct shared-value transport alone already helps a lot**. The current best read is now that the clear-only rescue is driven primarily by the **direct Value/sharedctypes path**, with the direct Event path providing an additional improvement from `0.6667` up to `0.5`.","timestamp":1774086670142,"segment":0}
{"run":757,"commit":"77648de","metric":0.8333333134651184,"metrics":{},"status":"discard","description":"Exact-reran the mixed clear-only transport branch from #756 to test whether the new **manager Event + direct Value** route was a stable transport clue. I reused `/tmp/xax-bench-9cea09c-oldtrain-meminfocputouchcpuusefirst-clearonly-mixvalue-nogpu`, where the training loop still does only clear-only consumption — no payload read, no decode/cached-state update, and no logging — while events come from the manager but the shared-value path stays on direct `context.Value(...)`. This weakened from `0.6667` to **`asr_wer_prefix=0.8333`** with near-old-regime throughput (~29.6k samples / 10 min), though it did hit a perfect in-domain transcript. So the transport picture is now: direct Value still looks materially helpful relative to the full manager clear-only `1.0` class, but the mixed branch is noisy and is not yet a stable substitute for the fully direct clear-only route that held `0.5 -> 0.5`.","timestamp":1774087436109,"segment":0}
{"run":758,"commit":"77648de","metric":0.8333333134651184,"metrics":{},"status":"discard","description":"Ran the next transport isolation on the detached clear-only branch to ask whether the extra lift beyond the mixed manager-Event/direct-Value route comes from the **monitor Event** specifically or only from the fully direct combo. I built `/tmp/xax-bench-9cea09c-oldtrain-meminfocputouchcpuusefirst-clearonly-mixmonitorevent-nogpu`, which keeps the direct shared `context.Value(...)` path but makes only `monitor_event` direct while leaving `start_event` manager-backed. The training loop still does only clear-only consumption — no payload read, no decode/cached-state update, and no logging. This landed at **`asr_wer_prefix=0.8333`** with near-old-regime throughput (~29.7k samples / 10 min). Together with #756-#757, that says the extra `0.5`-class lift is not cleanly explained by the monitor Event alone on first probe. The sharp transport story remains: direct Value is clearly the main helpful leg, direct Event alone is not enough, and the stronger fully direct clear-only branch is either genuinely combinational or still somewhat noisy.","timestamp":1774088409211,"segment":0}
{"run":759,"commit":"77648de","metric":0.8333333134651184,"metrics":{},"status":"discard","description":"Tested whether the manager-backed shared-value write path itself is the main reason the **direct-Event + manager-Value clear-only** branch stayed at `1.0`. I built `/tmp/xax-bench-9cea09c-oldtrain-meminfocputouchcpuusefirst-clearonly-mixevent-nowrite-nogpu`, which keeps the mixed transport from #755 but removes the worker-side `stats.set(...)` call entirely: the worker still does `memory_info()`, `cpu_percent()`, second `cpu_percent()`, and then only raises the direct `monitor_event`. The training loop still does clear-only consumption with no payload read/logging. This improved from `1.0` only to **`asr_wer_prefix=0.8333`** with near-old-regime throughput (~29.6k samples / 10 min). So manager `ValueProxy.set(...)` RPC does matter, but removing it is **not** enough to recover the strong direct-direct clear-only branch. The current transport read stays the same: the main helpful leg is the **direct shared-value/sharedctypes path**, while direct event-only signaling without direct shared-value writes still does not rescue the route.","timestamp":1774089408788,"segment":0}
{"run":760,"commit":"77648de","metric":0.8333333134651184,"metrics":{},"status":"discard","description":"Ran the complementary no-write split on the **manager-Event + direct-Value clear-only** branch to ask whether the gain from #756-#757 depends on the worker performing actual direct sharedctypes writes, or merely on avoiding the manager `ValueProxy` path. I built `/tmp/xax-bench-9cea09c-oldtrain-meminfocputouchcpuusefirst-clearonly-mixvalue-nowrite-nogpu`, which keeps manager Event proxies and a direct `context.Value(...)` object, but removes the worker-side shared-value writes entirely; the worker now only does `memory_info()`, `cpu_percent()`, second `cpu_percent()`, and raises the event. The training loop still does clear-only consumption with no payload read/logging. This landed at **`asr_wer_prefix=0.8333`** with near-old-regime throughput (~29.4k samples / 10 min), essentially matching the weaker end of the earlier mixed branch. So the current transport read sharpens a bit more: on the mixed route, the main gain seems to come more from **avoiding manager ValueProxy writes/reads at all** than from the worker performing actual direct sharedctypes writes. The strong `0.5` branch still appears to need the fully direct Event+Value combination.","timestamp":1774090290391,"segment":0}
{"run":761,"commit":"77648de","metric":0.8333333134651184,"metrics":{},"status":"discard","description":"Tested whether the reproduced `0.5 -> 0.5` **fully direct clear-only** branch actually needs the worker's direct sharedctypes writes, or whether the win comes just from staying off the manager proxy surface. I built `/tmp/xax-bench-9cea09c-oldtrain-meminfocputouchcpuusefirst-clearonlynoproxy-nowrite-nogpu`, which keeps the fully direct `context.Event()` + `context.Value(...)` transport from #752-#753 but removes the worker-side shared-value writes entirely; the worker now only does `memory_info()`, `cpu_percent()`, second `cpu_percent()`, and raises the event. The training loop still does clear-only consumption with no payload read/logging. This weakened sharply to **`asr_wer_prefix=0.8333`** with near-old-regime throughput (~29.5k samples / 10 min). That is a strong new split: the `0.5` direct-direct clear-only branch does **not** come merely from avoiding manager proxies. It appears to need the worker performing the **actual direct sharedctypes writes** as well. Together with #760, the current transport read is now much sharper: on mixed routes, avoiding manager ValueProxy traffic helps somewhat even without direct writes, but the strongest branch seems to require the full combination of **direct event + direct sharedctypes value + actual direct writes**.","timestamp":1774091087645,"segment":0}
