{"run":519,"commit":"9cea09c","metric":0.8333333134651184,"metrics":{},"status":"discard","description":"Tested whether the newer width-matched plain grouped 2-head decoder can turn pure raw-text conditioning into a real branch by running `text_source=raw`, `semantic_future_prediction_steps=2`, plain `semantic_block_decode_size=3`, future weight 0.5, scheduled sampling 0.5, EOS weight 2.0, the p95-style cap, and a 12-token grouped prefix. After prebuilding the aligned raw-text caches, this recovered only weak life at asr_wer_prefix=0.8333 with CER 0.864, in-domain WER 0.778, EOS on both prompts, perfect gt-ASR sanity, short generations (~29/43 frames), and much lower effective coverage (~18.5k samples / 10 min). So on the current grouped 2-head decoder, raw-only text is not the explanation for the mixed-text gains: it is clearly weaker than both the normalized grouped backbone and the noisier mixed-text `text_source=both` side branch, while also paying a big throughput cost from the longer raw-token sequences.","timestamp":1773876406718,"segment":0}
{"run":520,"commit":"9cea09c","metric":1,"metrics":{},"status":"discard","description":"Mapped another grouped-window neighbor of the live diff-targeted sampled grouped clue by shortening its grouped prefix from 12 tokens down to `semantic_block_decode_max_grouped_tokens=9` while keeping `text_source=both_weighted_sampled_diff`, normalized/raw weights 3/1, `text_source_weighted_sampled_passes=2`, `semantic_future_prediction_steps=2`, plain `semantic_block_decode_size=3`, future weight 0.5, scheduled sampling 0.5, EOS weight 2.0, and the p95-style cap. This failed cleanly at asr_wer_prefix=1.0 with CER 0.773, in-domain WER 0.444, EOS on both prompts, perfect gt-ASR sanity, and full throughput (~31.4k samples / 10 min). So the diff-targeted grouped branch does not broaden toward the intermediate 9-token window either; like the plain sampled 2-head backbone and the mixed-text 2-head grouped family, it now looks even more tightly centered on the original 12-token grouped prefix.","timestamp":1773877197210,"segment":0}
{"run":521,"commit":"9cea09c","metric":0.8333333134651184,"metrics":{},"status":"discard","description":"Mapped the longer grouped-window neighbor of the live diff-targeted sampled grouped clue by extending its grouped prefix from 12 tokens up to `semantic_block_decode_max_grouped_tokens=15` while keeping `text_source=both_weighted_sampled_diff`, normalized/raw weights 3/1, `text_source_weighted_sampled_passes=2`, `semantic_future_prediction_steps=2`, plain `semantic_block_decode_size=3`, future weight 0.5, scheduled sampling 0.5, EOS weight 2.0, and the p95-style cap. This recovered only weak life at asr_wer_prefix=0.8333 with strong CER 0.545, in-domain WER 0.556, EOS on both prompts, gt-ASR sanity 0.158, and full throughput (~31.3k samples / 10 min), still well below the original 12-token `0.5` clue. So the diff-targeted grouped branch does not broaden cleanly toward a longer grouped window either; taken together with the earlier 6-token and new 9-token failures, it now looks tightly centered on the original 12-token grouped prefix.","timestamp":1773877995274,"segment":0}
{"run":522,"commit":"9cea09c","metric":1,"metrics":{},"status":"discard","description":"Tested whether the aligned normalized width-matched 2-head branch actually needs grouped-prefix inference by ablating grouped decoding entirely and running `text_source=normalized`, `semantic_future_prediction_steps=2`, future weight 0.5, scheduled sampling 0.5, EOS weight 2.0, and the p95-style cap with exact token-by-token generation. This failed cleanly at asr_wer_prefix=1.0 with CER 0.727, in-domain WER 0.667, EOS on both prompts, perfect gt-ASR sanity, short generations (~35/37 frames), and full throughput (~31.4k samples / 10 min). So the aligned normalized 2-head clue is grouped-prefix-specific too: width matching by itself does not produce a useful exact-decoding successor, and the gains of the normalized 2-head family come from the grouped transition rather than from future-depth matching alone.","timestamp":1773878815257,"segment":0}
{"run":523,"commit":"9cea09c","metric":0.6666666865348816,"metrics":{},"status":"discard","description":"Mapped a grouped-window neighbor of the aligned normalized width-matched exact-last 2-head clue by shortening its grouped prefix from 12 tokens down to `semantic_block_decode_max_grouped_tokens=9` while keeping `text_source=normalized`, `semantic_future_prediction_steps=2`, plain `semantic_block_decode_size=3`, `semantic_block_decode_exact_last_token=true`, future weight 0.5, scheduled sampling 0.5, EOS weight 2.0, and the p95-style cap. This stayed alive at asr_wer_prefix=0.6667 with very strong CER 0.409, in-domain WER 0.222, perfect gt-ASR sanity, EOS on both prompts, short generations (~28/37 frames), and solid throughput (~30.9k samples / 10 min), but it still fell short of the branch's first-run 0.5 result at the original 12-token cutoff. So the aligned normalized 2-head exact-last family has some real 9-token life, but at least on the primary metric it still looks weaker than the original 12-token center rather than like a broader improvement.","timestamp":1773879619096,"segment":0}
{"run":524,"commit":"9cea09c","metric":0.6666666865348816,"metrics":{},"status":"discard","description":"Exact reran the 9-token neighbor of the aligned normalized width-matched exact-last 2-head branch (`text_source=normalized`, `semantic_future_prediction_steps=2`, plain `semantic_block_decode_size=3`, `semantic_block_decode_exact_last_token=true`, `semantic_block_decode_max_grouped_tokens=9`, future weight 0.5, scheduled sampling 0.5, EOS weight 2.0, p95-style cap). Unlike the noisier 12-token 0.5 clue, this rerun held the same asr_wer_prefix=0.6667 with the same very strong CER 0.409, EOS on both prompts, and solid coverage (~30.9k samples / 10 min), though in-domain WER softened to 0.778 and gt-ASR sanity to 0.071. So the aligned normalized 2-head exact-last family now looks broader than several other recent 2-head grouped branches: the 9-token neighbor appears to be a reproducible tie-level side path even though it still does not beat the original 12-token first-run 0.5 result.","timestamp":1773880382119,"segment":0}
{"run":525,"commit":"9cea09c","metric":1,"metrics":{},"status":"discard","description":"Mapped the longer grouped-window neighbor of the aligned normalized width-matched exact-last 2-head clue by extending its grouped prefix from 12 tokens up to `semantic_block_decode_max_grouped_tokens=15` while keeping `text_source=normalized`, `semantic_future_prediction_steps=2`, plain `semantic_block_decode_size=3`, `semantic_block_decode_exact_last_token=true`, future weight 0.5, scheduled sampling 0.5, EOS weight 2.0, and the p95-style cap. This failed cleanly at asr_wer_prefix=1.0 with CER 0.818, in-domain WER 0.778, EOS on both prompts, perfect gt-ASR sanity, and much lower coverage (~22.4k samples / 10 min). So the aligned normalized 2-head exact-last family does not broaden cleanly toward a longer grouped window either: unlike the reproducible 9-token tie-level side path, the 15-token extension is stale and too slow.","timestamp":1773881131071,"segment":0}
{"run":526,"commit":"9cea09c","metric":1,"metrics":{},"status":"discard","description":"Mapped the shorter grouped-window neighbor of the aligned normalized width-matched exact-last 2-head clue by reducing its grouped prefix from 12 tokens down to `semantic_block_decode_max_grouped_tokens=6` while keeping `text_source=normalized`, `semantic_future_prediction_steps=2`, plain `semantic_block_decode_size=3`, `semantic_block_decode_exact_last_token=true`, future weight 0.5, scheduled sampling 0.5, EOS weight 2.0, and the p95-style cap. This failed cleanly at asr_wer_prefix=1.0 with CER 0.727, in-domain WER 0.444, EOS on both prompts, perfect gt-ASR sanity, and much lower coverage (~22.4k samples / 10 min). So the aligned normalized 2-head exact-last family is not broadly short-window-stable either: unlike the reproducible 9-token tie-level side path, the 6-token version is stale and too slow.","timestamp":1773881885810,"segment":0}
{"run":527,"commit":"9cea09c","metric":1,"metrics":{},"status":"discard","description":"Mapped the plain grouped-window neighbor of the aligned normalized width-matched 2-head family by shortening its grouped prefix from 12 tokens down to `semantic_block_decode_max_grouped_tokens=9` while keeping `text_source=normalized`, `semantic_future_prediction_steps=2`, plain `semantic_block_decode_size=3`, future weight 0.5, scheduled sampling 0.5, EOS weight 2.0, and the p95-style cap. Unlike the exact-last 9-token side path, the plain grouped 9-token variant failed cleanly at asr_wer_prefix=1.0 with CER 0.727, in-domain WER 0.889, EOS on both prompts, perfect gt-ASR sanity, and full throughput (~31.2k samples / 10 min). So the new reproducible 9-token normalized side clue really is specific to the exact-last transition, not a general property of shrinking the normalized 2-head grouped prefix.","timestamp":1773882843436,"segment":0}
{"run":528,"commit":"9cea09c","metric":0.8333333134651184,"metrics":{},"status":"discard","description":"Tested whether the aligned normalized width-matched exact-last 2-head family prefers a shorter partial-final-block transition between the reproducible 9-token side path and the noisy 12-token original by replacing the fixed grouped cutoff with `semantic_block_decode_schedule=3,3,3,2` while keeping `text_source=normalized`, `semantic_future_prediction_steps=2`, `semantic_block_decode_size=3`, `semantic_block_decode_exact_last_token=true`, future weight 0.5, scheduled sampling 0.5, EOS weight 2.0, and the p95-style cap. This recovered only weak life at asr_wer_prefix=0.8333 with CER 0.773, in-domain WER 0.667, EOS on both prompts, perfect gt-ASR sanity, and lower coverage (~22.2k samples / 10 min). So the normalized exact-last 2-head side branch does not broaden cleanly through the obvious 9-to-12 partial-final-block bridge either; the reproducible 9-token path still looks like the better local neighbor.","timestamp":1773883613717,"segment":0}
{"run":529,"commit":"9cea09c","metric":1,"metrics":{},"status":"discard","description":"Tested a clean post-alignment transfer of the broader two-head exact/future/future/exact decoder onto the aligned normalized width-matched family by running `text_source=normalized`, `semantic_future_prediction_steps=2`, `semantic_block_decode_size=4`, `semantic_block_decode_exact_last_token=true`, future weight 0.5, scheduled sampling 0.5, EOS weight 2.0, the p95-style cap, and a 12-token grouped prefix, without any cheap train/infer-match objective. This failed cleanly at asr_wer_prefix=1.0 with CER 0.682, in-domain WER 0.333, EOS on both prompts, perfect gt-ASR sanity, and full coverage (~30.5k samples / 10 min). So on the aligned normalized 2-head family, the cleaner live signal remains the narrow 3-token exact-last transition; the broader 4-token exact/future/future/exact path is stale even without the earlier train/infer-match stack.","timestamp":1773884385990,"segment":0}
{"run":530,"commit":"9cea09c","metric":1,"metrics":{},"status":"discard","description":"Exact reran the weaker 9-token width-matched sampled exact-last side clue (`text_source=both_weighted_sampled`, normalized/raw weights 3/1, `text_source_weighted_sampled_passes=2`, `semantic_future_prediction_steps=2`, plain `semantic_block_decode_size=3`, `semantic_block_decode_exact_last_token=true`, `semantic_block_decode_max_grouped_tokens=9`, future weight 0.5, scheduled sampling 0.5, EOS weight 2.0, p95-style cap) after its earlier 0.6667 first run. This collapsed cleanly back to asr_wer_prefix=1.0 with CER 0.727, in-domain WER 0.444, EOS on both prompts, and degraded gt-ASR sanity 0.389. So unlike the aligned normalized exact-last 9-token branch, the sampled exact-last 2-head 9-token clue does not reproduce; it should now be treated as another stale sampled exact-last local spike rather than a credible reproducible side path.","timestamp":1773885292790,"segment":0}
{"run":531,"commit":"9cea09c","metric":0.6666666865348816,"metrics":{},"status":"discard","description":"Tested whether the narrow 9-token grouped-window side clue on the aligned mixed-text width-matched 2-head family becomes more credible when paired with the exact-last transition by running `text_source=both`, `semantic_future_prediction_steps=2`, plain `semantic_block_decode_size=3`, `semantic_block_decode_exact_last_token=true`, `semantic_block_decode_max_grouped_tokens=9`, future weight 0.5, scheduled sampling 0.5, EOS weight 2.0, and the p95-style cap. This recovered tie-level life at asr_wer_prefix=0.6667 with CER 0.591, EOS on both prompts, gt-ASR sanity 0.167, and full throughput (~30.8k samples / 10 min), but in-domain WER stayed weak at 0.778. So the mixed-text 2-head family does have some 9-token exact-last life after all, but for now it only climbs back to the old reproducible 0.6667 level rather than reviving the original 0.5-class clue.","timestamp":1773886087425,"segment":0}
{"run":532,"commit":"9cea09c","metric":1,"metrics":{},"status":"discard","description":"Exact reran the new 9-token exact-last neighbor of the aligned mixed-text width-matched 2-head family (`text_source=both`, `semantic_future_prediction_steps=2`, plain `semantic_block_decode_size=3`, `semantic_block_decode_exact_last_token=true`, `semantic_block_decode_max_grouped_tokens=9`, future weight 0.5, scheduled sampling 0.5, EOS weight 2.0, p95-style cap) after its first tie-level 0.6667 result. This collapsed cleanly back to asr_wer_prefix=1.0 with CER 0.636, in-domain WER 0.778, EOS on both prompts, and perfect gt-ASR sanity. So the mixed-text 2-head family's 9-token exact-last neighbor is another non-reproducible side spike rather than a stable broadening of the original 12-token grouped clue.","timestamp":1773886842352,"segment":0}
{"run":533,"commit":"9cea09c","metric":0.8333333134651184,"metrics":{},"status":"discard","description":"Tested whether the reproducible aligned normalized 2-head exact-last 9-token side branch benefits from the cheap future-slots-only early-prefix train/infer match by enabling `semantic_self_condition_use_inference_policy=true`, `semantic_self_condition_match_early_grouped_prefix=true`, `semantic_self_condition_match_grouped_future_slots_only=true`, and `semantic_self_condition_inference_policy_prob=0.0` on top of `text_source=normalized`, `semantic_future_prediction_steps=2`, `semantic_block_decode_size=3`, `semantic_block_decode_exact_last_token=true`, `semantic_block_decode_max_grouped_tokens=9`, future weight 0.5, scheduled sampling 0.5, EOS weight 2.0, and the p95-style cap. This recovered only weak life at asr_wer_prefix=0.8333 with CER 0.682, both EOS flags preserved, perfect gt-ASR sanity, short generations (~34/39 frames), but very weak in-domain WER 1.111 and much lower effective coverage (~18.3k samples / 10 min). So the normalized exact-last 9-token clue does not stabilize under the cheap early-prefix train/infer match either; on this family too that objective looks throughput-costly and stale rather than like the missing exact-last stabilizer.","timestamp":1773888356556,"segment":0}
{"run":534,"commit":"9cea09c","metric":1,"metrics":{},"status":"discard","description":"Tested whether the stronger-but-noisy diff-targeted sampled grouped 2-head clue benefits from the cheap future-slots-only early-prefix train/infer match by enabling `semantic_self_condition_use_inference_policy=true`, `semantic_self_condition_match_early_grouped_prefix=true`, `semantic_self_condition_match_grouped_future_slots_only=true`, and `semantic_self_condition_inference_policy_prob=0.0` on top of `text_source=both_weighted_sampled_diff`, normalized/raw weights 3/1, `text_source_weighted_sampled_passes=2`, `semantic_future_prediction_steps=2`, plain `semantic_block_decode_size=3`, future weight 0.5, scheduled sampling 0.5, EOS weight 2.0, the p95-style cap, and the original 12-token grouped prefix. This failed cleanly at asr_wer_prefix=1.0 with CER 0.727, both EOS flags preserved, short generations (~32/42 frames), still-solid gt-ASR sanity 0.083, and healthy coverage (~23.5k samples / 10 min), but no primary upside. So the cheap early-prefix train/infer-match path does not stabilize the diff-targeted sampled grouped clue either; that branch too now looks incompatible with this objective.","timestamp":1773889170651,"segment":0}
{"run":535,"commit":"9cea09c","metric":1,"metrics":{},"status":"discard","description":"Tested whether the noisy aligned normalized 2-head exact-last 12-token branch can be stabilized by the fuller LoRA target set by adding `lora_targets=[q_proj,k_proj,v_proj,o_proj,gate,up,down]` on top of `text_source=normalized`, `semantic_future_prediction_steps=2`, `semantic_block_decode_size=3`, `semantic_block_decode_exact_last_token=true`, `semantic_block_decode_max_grouped_tokens=12`, future weight 0.5, scheduled sampling 0.5, EOS weight 2.0, and the p95-style cap. This failed cleanly at asr_wer_prefix=1.0 with CER 0.818, EOS on both prompts, perfect gt-ASR sanity, short generations (~30/36 frames), only middling in-domain WER 0.444, and reduced coverage (~21.2k samples / 10 min). So fuller LoRA does not stabilize the aligned normalized exact-last family either; on this branch too it looks like another throughput-costly dead end rather than the missing bridge from the noisy 12-token 0.5 hit to a reproducible successor.","timestamp":1773890033991,"segment":0}
{"run":536,"commit":"9cea09c","metric":1,"metrics":{},"status":"discard","description":"Exact reran the aligned normalized width-matched plain grouped 2-head branch (`text_source=normalized`, `semantic_future_prediction_steps=2`, plain `semantic_block_decode_size=3`, `semantic_block_decode_max_grouped_tokens=12`, future weight 0.5, scheduled sampling 0.5, EOS weight 2.0, p95-style cap) after its earlier tie-level 0.6667 result. It collapsed cleanly back to asr_wer_prefix=1.0 with still-strong CER 0.545, EOS on both prompts, perfect gt-ASR sanity, short generations (~27/38 frames), and healthy coverage (~23.8k samples / 10 min), but no primary upside. So the aligned normalized plain grouped 2-head branch is not a reproducible backbone after all; unlike the sampled grouped 2-head family and the aligned normalized exact-last 9-token side path, this simpler width-matched normalized grouped transfer now looks like another one-off tie-level side clue rather than a stable branch.","timestamp":1773891001098,"segment":0}
{"run":537,"commit":"9cea09c","metric":1,"metrics":{},"status":"discard","description":"Tested whether the reproducible aligned normalized exact-last 9-token side branch actually wants its training target width matched all the way down to the single speculative slot by shrinking it to `semantic_future_prediction_steps=1` while keeping `text_source=normalized`, `semantic_block_decode_size=3`, `semantic_block_decode_exact_last_token=true`, `semantic_block_decode_max_grouped_tokens=9`, future weight 0.5, scheduled sampling 0.5, EOS weight 2.0, and the p95-style cap. This failed cleanly at asr_wer_prefix=1.0 with CER 0.818, both EOS flags preserved, short generations (~31/38 frames), decent in-domain WER 0.333, and still-solid gt-ASR sanity 0.091. So even on the only reproducible normalized exact-last side path, collapsing future depth to a single matched speculative slot is too aggressive; this family's tie-level life depends on the broader 2-head training target rather than on exact train/infer width matching.","timestamp":1773891777045,"segment":0}
{"run":538,"commit":"9cea09c","metric":1,"metrics":{},"status":"discard","description":"Exact reran the more normalized-heavy `4:1` neighbor of the diff-targeted sampled grouped family (`text_source=both_weighted_sampled_diff`, `text_source_weighted_normalized_repeats=4`, `text_source_weighted_raw_repeats=1`, `text_source_weighted_sampled_passes=2`, `semantic_future_prediction_steps=2`, plain `semantic_block_decode_size=3`, `semantic_block_decode_max_grouped_tokens=12`, future weight 0.5, scheduled sampling 0.5, EOS weight 2.0, p95-style cap) after its earlier tie-level 0.6667 result. It collapsed cleanly to asr_wer_prefix=1.0 with CER 0.864, both EOS flags preserved, perfect gt-ASR sanity, full throughput (~31.3k samples / 10 min), and even perfect in-domain WER 0.0. So the apparent 4:1 diff-targeted sampled side clue does not reproduce; the ratio axis in this family is narrower than it first looked, and the original 3:1 diff-targeted recipe remains the only real signal there.","timestamp":1773892678998,"segment":0}
{"run":539,"commit":"9cea09c","metric":1,"metrics":{},"status":"discard","description":"Exact reran the transfer of the diff-targeted sampled text mix onto the older aligned 4-head grouped-prefix backbone (`text_source=both_weighted_sampled_diff`, normalized/raw weights 3/1, `text_source_weighted_sampled_passes=2`, `semantic_future_prediction_steps=4`, plain `semantic_block_decode_size=3`, `semantic_block_decode_max_grouped_tokens=12`, future weight 0.5, scheduled sampling 0.5, EOS weight 2.0, p95-style cap) after its earlier tie-level 0.6667 result. It collapsed cleanly to asr_wer_prefix=1.0 with CER 0.636, both EOS flags preserved, perfect gt-ASR sanity, short generations (~26/35 frames), and healthy coverage (~22.7k samples / 10 min), but no primary upside. So the diff-targeted sampled text geometry does not transfer reproducibly beyond the plain sampled grouped 2-head path; on the older aligned 4-head grouped backbone it is now just another one-off tie-level side clue rather than a broader grouped-family upgrade.","timestamp":1773893461396,"segment":0}
