{"run":159,"commit":"cf0f36a","metric":1,"metrics":{},"status":"discard","description":"Combined the reintroduced exact-last-token grouped decoder with the strongest explicit late-boundary schedule clue on the matched two-head text_source=both branch, using semantic_block_decode_schedule=3,3,2,1,2. This failed cleanly at asr_wer_prefix=1.0 and lost the earlier strong in-domain signal, so the late-bridge schedule does not stack with exact-last in this simple form.","timestamp":1773535031625,"segment":0}
{"run":160,"commit":"cf0f36a","metric":0.8333333134651184,"metrics":{},"status":"discard","description":"Combined the reintroduced exact-last-token grouped decoder with the other surviving late-boundary schedule clue on the matched two-head text_source=both branch, using semantic_block_decode_schedule=3,3,3,1,2. This recovered some life at asr_wer_prefix=0.8333, but it was no better than the plain reintroduced exact-last 12-token cutoff and still far below the 0.6667/0.5 best results. So this simple exact-last + late-bridge combo remains, at best, a weak noisy clue rather than a new baseline.","timestamp":1773535781383,"segment":0}
{"run":161,"commit":"cf0f36a","metric":1,"metrics":{},"status":"discard","description":"Tested a shorter optimizer warmup on the strongest reproducible four-head future-Q0 baseline by reducing warmup_steps from 100 to 25 while keeping semantic_future_prediction_steps=4, weight=0.5, semantic_self_condition_prob=0.5, semantic_eos_weight=2.0, and the 53-frame cap. This did not improve fast convergence: final asr_wer_prefix stayed at 1.0, in-domain WER regressed to 1.0, and gt-ASR sanity slipped to 0.125.","timestamp":1773536564451,"segment":0}
{"run":162,"commit":"cf0f36a","metric":1,"metrics":{},"status":"discard","description":"Tested an exact-last-token partial final grouped block on the matched two-head text_source=both branch by using semantic_block_decode_schedule=3,3,3,2 with semantic_block_decode_exact_last_token=true — effectively an 11-token grouped prefix before falling back to exact decoding. This failed at asr_wer_prefix=1.0 with only middling secondaries, so the old partial-final-block clue does not carry over cleanly to the reintroduced exact-last decoder.","timestamp":1773537420799,"segment":0}
{"run":163,"commit":"cf0f36a","metric":1,"metrics":{},"status":"discard","description":"Tested a longer exact-last-token partial final grouped block on the matched two-head text_source=both branch by using semantic_block_decode_schedule=3,3,3,3,2 with semantic_block_decode_exact_last_token=true — effectively a 14-token grouped prefix before falling back to exact decoding. This also failed at asr_wer_prefix=1.0, though in-domain WER recovered to 0.333, so the old partial-final-block clue still does not transfer cleanly to the reintroduced exact-last decoder.","timestamp":1773538184897,"segment":0}
{"run":164,"commit":"cf0f36a","metric":1,"metrics":{},"status":"discard","description":"Tested a larger global batch on the strongest reproducible four-head future-Q0 baseline by overriding batch_size from 8 to 12 while keeping semantic_future_prediction_steps=4, weight=0.5, semantic_self_condition_prob=0.5, semantic_eos_weight=2.0, and the 53-frame cap. This increased processed samples to about 26.0k in 10 minutes but still failed on the primary metric: asr_wer_prefix stayed at 1.0, in-domain WER stayed at 1.0, and gt-ASR sanity slipped to 0.091.","timestamp":1773538933324,"segment":0}
{"run":165,"commit":"cf0f36a","metric":1,"metrics":{},"status":"discard","description":"Tested a smaller, prior-preserving attention-only LoRA subset on the strongest reproducible four-head future-Q0 baseline by restricting LoRA targets to `[q_proj,v_proj]` while keeping semantic_future_prediction_steps=4, weight=0.5, semantic_self_condition_prob=0.5, semantic_eos_weight=2.0, and the 53-frame cap. This trained a bit faster with fewer optimizer params (~39.8M) but failed on quality: asr_wer_prefix stayed at 1.0, CER worsened to 0.909, and in-domain WER stayed at 1.0.","timestamp":1773539905197,"segment":0}
{"run":166,"commit":"cf0f36a","metric":1,"metrics":{},"status":"discard","description":"Tested a broader attention-only LoRA subset on the strongest reproducible four-head future-Q0 baseline by restricting LoRA targets to `[q_proj,k_proj,v_proj,o_proj]` while keeping semantic_future_prediction_steps=4, weight=0.5, semantic_self_condition_prob=0.5, semantic_eos_weight=2.0, and the 53-frame cap. This also failed at asr_wer_prefix=1.0, with worse CER 0.909 and no in-domain recovery, so simply trimming LoRA to attention-only targets does not rescue the fast-convergence regime.","timestamp":1773540632711,"segment":0}
{"run":167,"commit":"cf0f36a","metric":0.6666666865348816,"metrics":{},"status":"discard","description":"Tested a fuller LoRA adaptation on the strongest reproducible four-head future-Q0 baseline by adding the MLP down projection to the default LoRA target set (`lora_targets=[q_proj,k_proj,v_proj,o_proj,gate,up,down]`) while keeping semantic_future_prediction_steps=4, weight=0.5, semantic_self_condition_prob=0.5, semantic_eos_weight=2.0, and the 53-frame cap. This tied the robust best primary metric at asr_wer_prefix=0.6667 and matched the best CER seen on this baseline family at 0.591, with in-domain WER 0.444. It is not a strict improvement, but it is the first LoRA-target retune to show real life rather than a clean regression.","timestamp":1773541548569,"segment":0}
{"run":168,"commit":"cf0f36a","metric":1,"metrics":{},"status":"discard","description":"Tested whether mixed normalized+raw text stacks with the new fuller LoRA target set on the strongest reproducible four-head future-Q0 baseline: `lora_targets=[q_proj,k_proj,v_proj,o_proj,gate,up,down]` plus `text_source=both`, with semantic_future_prediction_steps=4, weight=0.5, semantic_self_condition_prob=0.5, semantic_eos_weight=2.0, and the 53-frame cap. It did not: asr_wer_prefix fell back to 1.0 even though throughput was high (~29.4k samples in 10 min), so the fuller LoRA-target clue does not combine with mixed-text conditioning in a simple way.","timestamp":1773542313770,"segment":0}
{"run":169,"commit":"cf0f36a","metric":0,"metrics":{},"status":"crash","description":"Tried adding LoRA dropout (`lora_dropout=0.05`) on top of the new fuller LoRA target set (`lora_targets=[q_proj,k_proj,v_proj,o_proj,gate,up,down]`) with the strongest reproducible four-head future-Q0 recipe, but the run crashed immediately because the current LLM forward path does not thread a PRNG key into LoRA layers. So LoRA dropout is not currently supported in this training path without code changes.","timestamp":1773542432621,"segment":0}
{"run":170,"commit":"cf0f36a","metric":1,"metrics":{},"status":"discard","description":"Retuned the new fuller LoRA target set downward by keeping `lora_targets=[q_proj,k_proj,v_proj,o_proj,gate,up,down]` but shrinking LoRA rank/alpha to 8/8 on the strongest reproducible four-head future-Q0 recipe. This lost the tie-level signal: asr_wer_prefix fell back to 1.0, CER worsened to 0.818, and gt-ASR sanity degraded to 0.12, so the fuller LoRA-target clue does not survive a simple smaller-rank retune.","timestamp":1773543199134,"segment":0}
{"run":171,"commit":"cf0f36a","metric":1,"metrics":{},"status":"discard","description":"Tested whether the new fuller LoRA target set could rescue the old four-head grouped-prefix transfer failure by combining `lora_targets=[q_proj,k_proj,v_proj,o_proj,gate,up,down]` with the strongest structural transfer candidate on that branch: an early 12-token exact-last-token grouped decode (`semantic_block_decode_size=3`, `semantic_block_decode_max_grouped_tokens=12`, `semantic_block_decode_exact_last_token=true`) on the four-head future-Q0 baseline. It still failed cleanly at asr_wer_prefix=1.0, so the fuller LoRA-target clue does not make the grouped-prefix idea transfer to the old four-head recipe in this simple form.","timestamp":1773543970158,"segment":0}
{"run":172,"commit":"cf0f36a","metric":1,"metrics":{},"status":"discard","description":"Retuned the new fuller LoRA target-set clue upward by keeping `lora_targets=[q_proj,k_proj,v_proj,o_proj,gate,up,down]` but increasing LoRA alpha from 16 to 32 on the strongest reproducible four-head future-Q0 recipe. This overcooked the adaptation: asr_wer_prefix fell back to 1.0, in-domain WER regressed to 1.0, and gt-ASR sanity slipped to 0.04. So the fuller LoRA-target clue is narrow and does not survive a simple stronger-scaling retune.","timestamp":1773544730137,"segment":0}
{"run":173,"commit":"cf0f36a","metric":1,"metrics":{},"status":"discard","description":"Retuned the new fuller LoRA target-set clue downward in scale while keeping full rank by setting `lora_alpha=8` (with `lora_rank=16`) on `lora_targets=[q_proj,k_proj,v_proj,o_proj,gate,up,down]` for the strongest reproducible four-head future-Q0 recipe. This also regressed to asr_wer_prefix=1.0 with CER 0.909 and in-domain WER 0.889, so the fuller LoRA-target clue now looks tightly localized around the original alpha=16 setting.","timestamp":1773545516310,"segment":0}
{"run":174,"commit":"cf0f36a","metric":1,"metrics":{},"status":"discard","description":"Exact reran the new fuller LoRA target-set clue on the strongest reproducible four-head future-Q0 baseline (`lora_targets=[q_proj,k_proj,v_proj,o_proj,gate,up,down]` with the usual four-head future-Q0, scheduled sampling, EOS weighting, and 53-frame cap). The earlier tie at asr_wer_prefix=0.6667 did not reproduce: this rerun fell back to 1.0 with in-domain WER 0.889, so the fuller LoRA-target clue now also looks noisy rather than a robust baseline upgrade.","timestamp":1773546305302,"segment":0}
{"run":175,"commit":"cf0f36a","metric":1,"metrics":{},"status":"discard","description":"Implemented an optional grouped self-conditioning path that replaces the random Q0 suffix with a free-running blockwise decode matching inference (`semantic_self_condition_use_inference_policy=true`), including grouped-step boundary snapping for the keep prefix, and tested it on the original matched grouped-prefix recipe (`text_source=both`, 2 future-Q0 heads, weight=0.5, self_condition_prob=0.5, EOS weight 2.0, 12-token grouped prefix, 53-frame cap). It failed badly: asr_wer_prefix stayed at 1.0, CER worsened to 0.909, gt-ASR slipped to 0.048, and throughput collapsed catastrophically to only 49 steps / 392 samples in 10 minutes. So this free-running grouped scheduled-sampling idea is far too expensive in its current per-example form and does not help the primary metric.","timestamp":1773547943495,"segment":0}
{"run":176,"commit":"cf0f36a","metric":1,"metrics":{},"status":"discard","description":"Tested a more surgical LoRA target subset on the strongest reproducible four-head future-Q0 baseline: keep attention projections plus the newly interesting MLP down projection, but drop the default MLP gate/up targets (`lora_targets=[q_proj,k_proj,v_proj,o_proj,down]`). This cleanly regressed to asr_wer_prefix=1.0 with CER 0.864 and in-domain WER 0.889, so the earlier noisy life from the full `...+down` target set does not come from a simple attention+down subset.","timestamp":1773548726437,"segment":0}
{"run":177,"commit":"cf0f36a","metric":1,"metrics":{},"status":"discard","description":"Tested an MLP-only LoRA subset on the strongest reproducible four-head future-Q0 baseline (`lora_targets=[gate,up,down]`) to see whether the earlier noisy `...+down` signal was really about adapting the feed-forward path while preserving attention priors. It also failed cleanly at asr_wer_prefix=1.0 with CER 0.773 and no in-domain recovery, so the fuller target-set clue does not reduce to a simple MLP-only adaptation either.","timestamp":1773549455162,"segment":0}
{"run":178,"commit":"cf0f36a","metric":1,"metrics":{},"status":"discard","description":"Retuned the auxiliary text-prefix LM anchor on the strongest reproducible four-head future-Q0 baseline to an intermediate weight (`text_loss_weight=0.05`) between the earlier 0.1 weak clue and the 0.02 collapse. This also failed badly: asr_wer_prefix stayed at 1.0, throughput still fell to only 14.3k samples, and the transcript quality exploded (WER 5.33, CER 2.73). So the simple text-loss clue does not improve under an intermediate-weight retune either.","timestamp":1773550212965,"segment":0}
{"run":179,"commit":"cf0f36a","metric":1,"metrics":{},"status":"discard","description":"Refined the earlier free-running grouped self-conditioning idea into a cheaper hybrid: add `semantic_self_condition_grouped_prefix_only=true` so only the remaining early grouped-prefix window is decoded with the inference-matched blockwise policy, while the later suffix falls back to the usual cheap one-step predictions. Tested on the original matched grouped-prefix recipe (`text_source=both`, 2 future-Q0 heads, weight=0.5, self_condition_prob=0.5, 12-token grouped prefix, EOS weight 2.0, 53-frame cap). This still failed badly: asr_wer_prefix stayed at 1.0, CER was 0.909, and throughput remained catastrophically low at only 104 steps / 832 samples in 10 minutes. So even the grouped-prefix-only hybrid is too expensive in its current per-example form and does not help.","timestamp":1773551373379,"segment":0}
{"run":180,"commit":"cf0f36a","metric":1,"metrics":{},"status":"discard","description":"Tested whether the noisy fuller LoRA target-set clue transfers to the original matched grouped-prefix winner by adding `lora_targets=[q_proj,k_proj,v_proj,o_proj,gate,up,down]` on top of the nominal best grouped recipe (`text_source=both`, 2 future-Q0 heads, weight=0.5, self_condition_prob=0.5, EOS weight 2.0, 12-token grouped prefix, 53-frame cap). It regressed cleanly to asr_wer_prefix=1.0 with CER 0.818, so the fuller LoRA-target clue does not rescue or stabilize the grouped-prefix branch in this direct form either.","timestamp":1773552138411,"segment":0}
{"run":181,"commit":"cf0f36a","metric":1,"metrics":{},"status":"discard","description":"Tested whether a text-prefix LM anchor can stabilize the original matched grouped-prefix winner by adding `text_loss_weight=0.1` on top of the nominal best grouped recipe (`text_source=both`, 2 future-Q0 heads, weight=0.5, self_condition_prob=0.5, EOS weight 2.0, 12-token grouped prefix, 53-frame cap). It failed cleanly at asr_wer_prefix=1.0, lost in-domain WER entirely, and still cut throughput to only 14.7k samples, so a simple text-prefix LM loss does not rescue the plain grouped-prefix mainline either.","timestamp":1773552898545,"segment":0}
{"run":182,"commit":"cf0f36a","metric":1,"metrics":{},"status":"discard","description":"Combined the two remaining weak side clues on the reproducible four-head future-Q0 baseline: fuller LoRA targets (`lora_targets=[q_proj,k_proj,v_proj,o_proj,gate,up,down]`) plus a text-prefix LM anchor (`text_loss_weight=0.1`) on top of the usual 4-head future-Q0, scheduled sampling, EOS weighting, and 53-frame cap. This also failed cleanly at asr_wer_prefix=1.0 with CER 0.818 and in-domain WER 0.889 while throughput fell to only 13.6k samples, so these two weak clues do not stack into a stronger baseline.","timestamp":1773553719331,"segment":0}
{"run":183,"commit":"cf0f36a","metric":1,"metrics":{},"status":"discard","description":"Added a mixed train/infer-match scheduled-sampling variant by introducing `semantic_self_condition_inference_policy_prob=0.1`, so only a small fraction of self-conditioned examples use the expensive grouped-prefix-only free-running decode while the rest stay on the usual cheap one-step path. Tested on the original matched grouped-prefix recipe with `semantic_self_condition_use_inference_policy=true` and `semantic_self_condition_grouped_prefix_only=true`. This still failed badly: asr_wer_prefix stayed at 1.0, CER was 0.864, and throughput remained catastrophically low at only 109 steps / 872 samples in 10 minutes. So even sparse mixing of the expensive inference-matched branch does not rescue this family in its current implementation.","timestamp":1773555170011,"segment":0}
{"run":184,"commit":"cf0f36a","metric":1,"metrics":{},"status":"discard","description":"Tried a new structural pivot by swapping the stage-1 base LM from `QWEN3_600M` to `QWEN3_1_7B` on the strongest reproducible four-head future-Q0 baseline, using `batch_size=4` to fit the larger model while keeping the usual future-Q0, scheduled-sampling, EOS-weighting, and 53-frame-cap recipe. This did not pay off within the 10-minute budget: asr_wer_prefix stayed at 1.0, CER worsened to 0.955, and throughput dropped sharply to only 8.8k samples. So simply using a larger text LM prior is not a free win for fast convergence on the plain four-head baseline.","timestamp":1773556132504,"segment":0}
{"run":185,"commit":"cf0f36a","metric":1,"metrics":{},"status":"discard","description":"Tried the larger base LM pivot on the original matched grouped-prefix winner: `llm_repo=QWEN3_1_7B` with `batch_size=4`, `text_source=both`, two future-Q0 heads, scheduled sampling 0.5, EOS weight 2.0, the 12-token grouped prefix, and the 53-frame cap. It still failed cleanly at asr_wer_prefix=1.0, though CER improved to 0.773 relative to the plain 1.7B four-head run. So simply swapping in a larger text LM prior does not rescue the fragile grouped-prefix mainline within the 10-minute budget either.","timestamp":1773556930695,"segment":0}
{"run":186,"commit":"cf0f36a","metric":0.6666666865348816,"metrics":{},"status":"discard","description":"Tested a larger-LM grouped transition pivot: `llm_repo=QWEN3_1_7B` with `batch_size=4` on the matched two-head grouped branch, using the strongest surviving transition design (`text_source=both`, 12-token grouped prefix, `semantic_block_decode_exact_last_token=true`, future weight 0.5, scheduled sampling 0.5, EOS weight 2.0, 53-frame cap). This recovered real life: asr_wer_prefix tied the robust best at 0.6667 and asr_cer tied the four-head robust baseline at 0.636. It is not a strict improvement and in-domain/gt secondaries were poor, but this is the first larger-base-LM grouped run to show a credible primary-metric signal rather than a clean regression.","timestamp":1773557703065,"segment":0}
{"run":187,"commit":"cf0f36a","metric":1,"metrics":{},"status":"discard","description":"Ablated mixed normalized+raw text from the new larger-LM exact-last grouped clue by rerunning `llm_repo=QWEN3_1_7B` / `batch_size=4` / 12-token exact-last grouped prefix with the default normalized text only instead of `text_source=both`. This failed badly: asr_wer_prefix fell back to 1.0 and transcript quality exploded (WER 5.33, CER 2.73), even though throughput improved to 12.3k samples. So mixed text appears important for the only larger-LM grouped setting that has shown life so far.","timestamp":1773558462692,"segment":0}
{"run":188,"commit":"cf0f36a","metric":1,"metrics":{},"status":"discard","description":"Exact reran the new larger-LM exact-last grouped clue (`llm_repo=QWEN3_1_7B`, `batch_size=4`, `text_source=both`, two future-Q0 heads, 12-token exact-last grouped prefix, scheduled sampling 0.5, EOS weight 2.0, 53-frame cap). The earlier tie-level signal at asr_wer_prefix=0.6667 did not reproduce: this rerun collapsed to 1.0 with exploding WER/CER and only weak gt-ASR sanity. So the larger-LM exact-last grouped clue currently looks noisy rather than a robust new branch.","timestamp":1773559238913,"segment":0}
{"run":189,"commit":"cf0f36a","metric":1,"metrics":{},"status":"discard","description":"Tested whether the larger-LM four-head pivot benefits from the same fuller LoRA-target clue as the 600M baseline by combining `llm_repo=QWEN3_1_7B` and `batch_size=4` with `lora_targets=[q_proj,k_proj,v_proj,o_proj,gate,up,down]` on the usual four-head future-Q0, scheduled-sampling, EOS-weighting, 53-frame-cap recipe. It still failed cleanly at asr_wer_prefix=1.0 with CER 0.818 and no in-domain recovery, so the noisy fuller LoRA-target clue does not transfer to the larger-LM plain baseline either.","timestamp":1773560020520,"segment":0}
{"run":190,"commit":"cf0f36a","metric":1,"metrics":{},"status":"discard","description":"Tried a distinct larger-LM structural pivot on the old fast non-AR Stage-1 path instead of the autoregressive branch: `llm_repo=QWEN3_1_7B`, `batch_size=4`, `use_lora=false`, `semantic_non_ar=true`, `text_source=both`, `semantic_loss_weight=2.0`, `acoustic_loss_weight=0.5`, and the p95-style 53-frame cap. It fit and still trained reasonably fast (~17.1k samples / 10 min), but the primary metric stayed at asr_wer_prefix=1.0 with CER 0.864 and no in-domain recovery. So simply giving the frozen non-AR upsampler a larger text LM prior does not revive that branch either.","timestamp":1773561101872,"segment":0}
{"run":191,"commit":"cf0f36a","metric":0.8333333134651184,"metrics":{},"status":"discard","description":"Tested whether the fuller LoRA-target clue can rescue the stronger two-head exact-last grouped transition by adding `lora_targets=[q_proj,k_proj,v_proj,o_proj,gate,up,down]` on top of the 600M matched grouped branch (`text_source=both`, 2 future-Q0 heads, scheduled sampling 0.5, EOS weight 2.0, 12-token exact-last grouped prefix, 53-frame cap). This recovered some life at asr_wer_prefix=0.8333, but it stayed well below both the robust 0.6667 baseline and the noisy larger-LM grouped tie, with only middling CER/in-domain metrics. So fuller LoRA does not obviously stabilize the two-head exact-last grouped branch either.","timestamp":1773561881611,"segment":0}
