{"run":662,"commit":"64d633d","metric":0,"metrics":{},"status":"crash","description":"Tried a new **symlink-surface code-object canonicalization** probe by launching a symlinked temp script (`/tmp/current-canoncode-link.py`) whose startup patch rewrites `__main__.__file__` / `argv0` to `/tmp/current_ljspeech_copy.py` and, just before launch, rewrites top-level function / method `co_filename` values to that same copied-script path. This was meant to test whether the bad symlinked spawn-manager-only surface can be rescued by canonicalizing the **raw main-file + code-object filename identity** while keeping the actual symlinked outer launch surface. The run did not reach training: the modified script changed the dataset-function hash and immediately invalidated caches, erroring with `RuntimeError: ... dataset which has not yet been generated ... Run with --launcher dataset`. So this is a **cache-surface crash**, not yet evidence for or against the co-filename hypothesis; the next step is to prebuild the temp script's datasets and rerun the benchmark on the same surface.","timestamp":1774003189256,"segment":0}
{"run":663,"commit":"ac9ac70","metric":0.8333333134651184,"metrics":{},"status":"keep","description":"After prebuilding the invalidated datasets from #662, reran the new **symlink-surface code-object canonicalization** probe on the same bad **spawn-manager-only** mixed surface (old HF + split old overlays + aliased old-full-cache config). This launches a **symlinked temp script** (`/tmp/current-canoncode-link.py`) that keeps the outer symlink entry surface but rewrites `__main__.__file__` / `argv0` to **`/tmp/current_ljspeech_copy.py`** and, just before launch, rewrites top-level function / method **`co_filename`** values to that same copied-script path. It improved the raw bad-symlink `1.0` class to **`asr_wer_prefix=0.8333`** with old-regime throughput (~29.6k samples / 10 min), EOS on both prompts, and only mild gt-ASR drift. This is only a **partial and confounded** rescue — because the modified script also forced a freshly rebuilt temp-script `unpadded/train` cache surface — but it is still the first new result after #656's collapse that makes the **raw main-file / code-object filename consumer** hypothesis look at least somewhat actionable again. The next clean control is to run the **same temp script directly (not via symlink)** on the same rebuilt cache surface, so the only remaining difference is the outer symlink launch itself.","timestamp":1774004078360,"segment":0}
{"run":664,"commit":"ac9ac70","metric":1,"metrics":{},"status":"discard","description":"Ran the key control for #663 by launching the **same temp canonicalizing script directly** (`/tmp/current_ljspeech_copy_canoncode.py`) on the **same rebuilt temp-script cache surface** and the same old-HF + split-old-overlays **spawn-manager-only** setup. So the only intended difference from #663 was the **outer launch form** itself: direct temp file vs symlinked temp file. This fell cleanly back to **`asr_wer_prefix=1.0`** with old-regime throughput (~29.7k samples / 10 min), EOS on both prompts, and clean gt-ASR. That makes #663 much more informative and much less explainable as a simple code-object/canonicalization rescue: with the same script content and same rebuilt caches, the **symlinked outer launch** was actually the stronger surface (`0.8333`) while the direct temp-file launch reverted to the bad class. So the remaining live mechanism is still not reducible to just canonicalized `__main__.__file__` / `argv0` / `co_filename`; some broader **outer launch-surface identity or interaction with the rebuilt cache surface** is still materially in play.","timestamp":1774004844869,"segment":0}
{"run":665,"commit":"ac9ac70","metric":1,"metrics":{},"status":"discard","description":"Exact reran the **symlinked temp-script code-object canonicalization** surface from #663 (`/tmp/current-canoncode-link.py`) on the same rebuilt temp-script cache surface, same old-HF + split-old-overlays **spawn-manager-only** setup. It cleanly collapsed back to **`asr_wer_prefix=1.0`** with old-regime throughput (~29.7k samples / 10 min), EOS on both prompts, and clean gt-ASR. Together with #664, this sharply downgrades the whole temp-script canonicalization branch: the apparent `0.8333` rescue from #663 was not reproducible, and neither the symlinked nor direct launch of that same canonicalizing script now looks like a stable fix. So the temp-script code-object canonicalization path should be treated as another **noise-prone side clue**, not as a reliable consumer-level repair.","timestamp":1774005623080,"segment":0}
{"run":666,"commit":"ac9ac70","metric":1,"metrics":{},"status":"discard","description":"Exact reran the previously best **hard-copied current-script + `disable_multiprocessing=true`** surface from #608: `/tmp/current_ljspeech_copy.py` under the same split-old-overlays (`/tmp/xaxpkg-oldexact:/tmp/oldexamplesonly`), older HF overlay, aliased old-full-cache config, and no-repo-root mixed surface. This cleanly collapsed from the earlier `0.5` to **`asr_wer_prefix=1.0`** while keeping the same old-regime throughput (~30.0k samples / 10 min), EOS on both prompts, clean gt-ASR, and short generations (27/35 frames). That sharply downgrades the copied-script `disable_multiprocessing` branch as a reproducible rescue: it is not just weaker than hoped, it now joins the broader class of monitor/bootstrap interventions that can show one strong run and then revert to the raw bad class on exact rerun. So the copied current-script no-multiprocessing path should be treated as another **noise-prone side clue**, not a trustworthy quality surface.","timestamp":1774007004666,"segment":0}
{"run":667,"commit":"ac9ac70","metric":1,"metrics":{},"status":"discard","description":"Exact reran the earlier **direct exec-real wrapper + `disable_multiprocessing=true`** rescue from #638 on the same split-old-overlays / older-HF / aliased-old-full-cache mixed surface. So this kept the outer wrapper/bootstrap identity (`/tmp/current_ljspeech_execreal_wrapper.py`) but removed the full manager+monitor child layer, exactly as in the prior `0.5` run. It cleanly collapsed back to **`asr_wer_prefix=1.0`** with the same old-regime throughput (~29.8k samples / 10 min), EOS on both prompts, and only mild gt-ASR drift. Together with #666, this strongly downgrades the broader **no-multiprocessing rescue class** on current-script mixed surfaces: both the plain copied-script and exec-real-wrapper `disable_multiprocessing=true` branches now look like one-off spikes rather than trustworthy better-than-`0.6667` surfaces. The remaining work should treat them as pruned/noise-prone clues, not as stable benchmark anchors.","timestamp":1774007771577,"segment":0}
{"run":668,"commit":"f9e4d1c","metric":0.8333333134651184,"metrics":{},"status":"keep","description":"Exact reran the **direct exec-real wrapper + no-stats** surface from #640, using `/tmp/current_ljspeech_execreal_wrapper.py` with the old-overlay `/tmp/xaxpkg-oldexact-nostats` patch (both CPU and GPU monitor subprocesses disabled, but the broader manager/process layer still present), plus the same split-old-overlays / older-HF / aliased-old-full-cache mixed surface. This did **not** reproduce the earlier `0.6667`, but it still improved cleanly to **`asr_wer_prefix=0.8333`** with old-regime throughput (~29.9k samples / 10 min), EOS on both prompts, clean gt-ASR, and materially better in-domain match (`0.5556`). Combined with #667, this keeps the no-stats wrapper branch somewhat alive while further pruning the broader no-multiprocessing story: removing the monitor subprocesses still looks meaningfully better than the raw wrapper `1.0` class, but the stronger `0.6667` rescue is not yet stable and should not be trusted as a restored surface.","timestamp":1774008545694,"segment":0}
{"run":669,"commit":"e184d5b","metric":0.6666666865348816,"metrics":{},"status":"keep","description":"Ran the missing **hard-copied current-script + no-stats** control on the same split-old-overlays / older-HF / aliased-old-full-cache mixed surface, using `/tmp/current_ljspeech_copy.py` with the old-overlay `/tmp/xaxpkg-oldexact-nostats` patch so both CPU and GPU monitor subprocesses are disabled while the broader manager/process layer remains. This improved cleanly to **`asr_wer_prefix=0.6667`** with old-regime throughput (~30.0k samples / 10 min), EOS on both prompts, and clean gt-ASR. That sharpens the post-#666/#668 picture in a useful way: the **no-stats** intervention is not wrapper-specific, and it now looks materially stronger than the broader `disable_multiprocessing=true` class on current-script mixed surfaces. So the best live monitor-layer clue is no longer “remove multiprocessing entirely”; it is more specifically **remove the CPU/GPU monitor subprocesses while keeping the manager/process surface intact**.","timestamp":1774009329106,"segment":0}
{"run":670,"commit":"e184d5b","metric":0.8333333134651184,"metrics":{},"status":"discard","description":"Exact reran the new **hard-copied current-script + no-stats** control from #669 on the same split-old-overlays / older-HF / aliased-old-full-cache mixed surface. It weakened from the first run's `0.6667` to **`asr_wer_prefix=0.8333`** while keeping old-regime throughput (~29.8k samples / 10 min), EOS on both prompts, and only mild gt-ASR drift. So the copied-script no-stats branch is clearly more alive than the broader `disable_multiprocessing=true` class, but it is **not yet stable at `0.6667`**; current picture is `0.6667 -> 0.8333`. That keeps the monitor-subprocess explanation live while pruning any claim that this copied no-stats surface is already a reproducible restored benchmark anchor.","timestamp":1774010089904,"segment":0}
{"run":671,"commit":"e184d5b","metric":0.8333333134651184,"metrics":{},"status":"discard","description":"Tested the missing **hard-copied current-script + GPU-only monitor** control on the same split-old-overlays / older-HF / aliased-old-full-cache mixed surface by using `/tmp/xaxpkg-oldexact-nocpu` (CPU monitor disabled, GPU monitor still active) with `/tmp/current_ljspeech_copy.py`. This landed at **`asr_wer_prefix=0.8333`** with old-regime throughput (~29.8k samples / 10 min), EOS on both prompts, and clean gt-ASR. Relative to #669-#670, that means the copied-script surface loses the stronger `0.6667` no-stats class as soon as the **GPU monitor** is put back, but it does **not** collapse all the way to the wrapper GPU-only `1.0` class. So the GPU monitor is still a real degradant on copied surfaces too, but the harsher wrapper-side failure remains a distinct stronger interaction than the plain copied-script case.","timestamp":1774011027265,"segment":0}
{"run":672,"commit":"8bafbda","metric":0.5,"metrics":{},"status":"keep","description":"Completed the copied-surface monitor-asymmetry split by running the missing **hard-copied current-script + CPU-only monitor** control on the same split-old-overlays / older-HF / aliased-old-full-cache mixed surface, using `/tmp/xaxpkg-oldexact-nogpu` so the **GPU monitor is disabled but the CPU monitor remains active**. This improved sharply to **`asr_wer_prefix=0.5`** with old-regime throughput (~29.7k samples / 10 min), EOS on both prompts, clean gt-ASR, and much better in-domain match (`0.2222`). Combined with #669-#671, this is a strong new asymmetry result on the copied current-script surface itself: **GPU-only** monitor degrades it to `0.8333`, **no-stats** reached `0.6667`, and **CPU-only** reaches `0.5`. So the copied-surface monitor story now matches the wrapper-side direction qualitatively too — the **GPU monitor path is the harsher degradant**, while the CPU monitor alone can still preserve a materially stronger quality class.","timestamp":1774011834253,"segment":0}
{"run":673,"commit":"8bafbda","metric":1,"metrics":{},"status":"discard","description":"Exact reran the fresh **hard-copied current-script + CPU-only monitor** surface from #672 on the same split-old-overlays / older-HF / aliased-old-full-cache mixed surface, using `/tmp/xaxpkg-oldexact-nogpu` so the **GPU monitor stays disabled while the CPU monitor remains active**. It cleanly collapsed from the first run's `0.5` back to **`asr_wer_prefix=1.0`** with old-regime throughput (~29.7k samples / 10 min), EOS on both prompts, and only mild gt-ASR drift. That sharply downgrades the copied-surface CPU-only branch as a stable rescue: the qualitative asymmetry against GPU-only still looks real, but the stronger `0.5` class is not reproducible as-is. So the copied-surface monitor split remains mechanistically useful, but the CPU-only surface itself should now be treated as another **noise-prone side clue** rather than a trustworthy quality anchor.","timestamp":1774012766736,"segment":0}
{"run":674,"commit":"19905a4","metric":0.8333333134651184,"metrics":{},"status":"keep","description":"Tested the copied-surface analogue of wrapper probe #643 by running the **hard-copied current-script + GPU-only monitor** surface with a **forked manager** (`/tmp/xaxpkg-oldexact-forkmgr-nocpu`) on the same split-old-overlays / older-HF / aliased-old-full-cache mixed setup. It landed at **`asr_wer_prefix=0.8333`** with old-regime throughput (~29.8k samples / 10 min), EOS on both prompts, and clean gt-ASR — essentially the same class as the copied GPU-only default-manager run in #671. So on the copied current-script surface too, **forking the manager alone does not materially rescue the GPU-only degradation**. That usefully matches the wrapper-side picture from #643: the stronger remaining copied/wrapper split is not mainly about manager spawn by itself, and the copied-surface GPU harm now looks more concentrated in the **GPU monitor worker path** than in manager creation.","timestamp":1774013564252,"segment":0}
{"run":675,"commit":"dc0fbe0","metric":0.6666666865348816,"metrics":{},"status":"keep","description":"Tested the copied-surface analogue of wrapper rescue #644 by running the **hard-copied current-script + GPU-only monitor** surface with **both** a **forked manager** and the **GPU monitor worker itself forced off spawn** (`/tmp/xaxpkg-oldexact-forkmgr-nocpu-forkgpu`) on the same split-old-overlays / older-HF / aliased-old-full-cache mixed setup. This improved cleanly to **`asr_wer_prefix=0.6667`** with old-regime throughput (~29.7k samples / 10 min), EOS on both prompts, and perfect in-domain match (`0.0`). Combined with #671 and #674, this is a strong new copied-surface mechanism result: **GPU-only** monitor sits at `0.8333`, **GPU-only + forked manager** stays at `0.8333`, but moving the **GPU worker itself** off spawn on top of that recovers the stronger `0.6667` class. So the copied-surface GPU degradation, like the wrapper-side one, now looks materially tied to the **GPU worker's spawned bootstrap**, not to manager spawn alone.","timestamp":1774014341391,"segment":0}
{"run":676,"commit":"dc0fbe0","metric":1,"metrics":{},"status":"discard","description":"Exact reran the fresh **hard-copied current-script + GPU-only monitor + forked manager + GPU worker forced off spawn** surface from #675 on the same split-old-overlays / older-HF / aliased-old-full-cache mixed setup. It cleanly collapsed from `0.6667` back to **`asr_wer_prefix=1.0`** with old-regime throughput (~29.7k samples / 10 min), EOS on both prompts, and only mild gt-ASR drift. So the copied-surface analogue of wrapper rescue #644 is **not reproducible as-is**. That downgrades this branch from “likely copied-surface repair” to a noisier mechanistic clue: moving the copied-surface GPU worker off spawn can still matter, but the stronger `0.6667` class is not yet stable enough to treat as a recovered surface.","timestamp":1774015110492,"segment":0}
{"run":677,"commit":"dc0fbe0","metric":1,"metrics":{},"status":"discard","description":"Tested the copied-surface analogue of wrapper probe #645 by creating `/tmp/xaxpkg-oldexact-nocpu-forkgpu` so the **hard-copied current-script + GPU-only monitor** surface keeps the default spawned manager but forces only the **GPU monitor worker itself** off spawn. On the same split-old-overlays / older-HF / aliased-old-full-cache mixed setup, this failed cleanly at **`asr_wer_prefix=1.0`** with old-regime throughput (~29.8k samples / 10 min), EOS on both prompts, and clean gt-ASR. So on the copied current-script surface, **forcing only the GPU worker off spawn is not enough by itself** — and after #674-#676, the stronger copied-side picture is that manager-spawn alone also is not enough. That leaves the copied-surface GPU branch as noisy overall, with no stable simple rescue yet.","timestamp":1774015961539,"segment":0}
{"run":678,"commit":"dc0fbe0","metric":1,"metrics":{},"status":"discard","description":"Tested a cleaner **hard-copied current-script + no-stats** control by replacing the split old overlays with a single unified old root overlay (`/tmp/xax-bench-9cea09c-nostats` = detached `9cea09c` worktree plus the no-stats `cpu_stats.py`/`gpu_stats.py` patches) while keeping the same older-HF / aliased-old-full-cache mixed surface. This failed cleanly at **`asr_wer_prefix=1.0`** with old-regime throughput (~30.0k samples / 10 min), EOS on both prompts, and clean gt-ASR. So the earlier copied no-stats `0.6667 -> 0.8333` behavior does **not** transfer to the cleaner unified-old-root surface, which downgrades “split overlay cleanup” as a near-term rescue and makes the copied no-stats branch look even more tied to the specific split-overlay mixed surface rather than to a broadly cleaner apples-to-apples import surface.","timestamp":1774017238448,"segment":0}
{"run":679,"commit":"dc0fbe0","metric":1,"metrics":{},"status":"discard","description":"Tested whether the copied-surface **no-stats** clue survives on the narrower **old-train-cache-only** data surface by rerunning the hard-copied current script with `/tmp/xaxpkg-oldexact-nostats` plus `/tmp/oldexamplesonly`, but switching from the aliased old-full-cache config to `/tmp/xaxrc-currentalias-oldtrain-hf452/config.yml`. This failed cleanly at **`asr_wer_prefix=1.0`** with old-regime throughput (~29.9k samples / 10 min), EOS on both prompts, and clean gt-ASR. So on the mixed current-script surface, the earlier copied no-stats `0.6667 -> 0.8333` class does **not** extend to the narrower old-train-only cache route; that suggests the copied no-stats clue still depends on the broader aliased old-full-cache surface and is not a straightforward bridge to the detached old-train-only simplification path.","timestamp":1774018043412,"segment":0}
{"run":680,"commit":"384dcbe","metric":0.6666666865348816,"metrics":{},"status":"keep","description":"Tested the sharper monitor-layer intervention on the detached **old-train-cache-only** route by building `/tmp/xax-bench-9cea09c-oldtrain-nostats` (fully local `9cea09c` worktree plus the no-stats `cpu_stats.py`/`gpu_stats.py` patches) and rerunning the canonical aligned normalized 4-head grouped probe with the older-HF stack and `/tmp/xaxrc-oldtrain-hf452-local/config.yml`. This improved cleanly to **`asr_wer_prefix=0.6667`** with old-regime throughput (~29.8k samples / 10 min), EOS on both prompts, strong in-domain match (`0.3333`), and clean gt-ASR. This is materially stronger than the detached old-train-only controls that only tried broad `disable_multiprocessing=true` (`0.8333`, #660) or `multiprocessing_context=fork` (`1.0`, #661). So the old-train-only route is **not** exhausted as a process-layer story after all: the narrower **no-stats** intervention looks meaningfully more alive there than the broader multiprocessing toggles.","timestamp":1774018817727,"segment":0}
{"run":681,"commit":"847d9d5","metric":0.5,"metrics":{},"status":"keep","description":"Exact reran the new detached **old-train-cache-only + no-stats** route from #680 — same fully local `/tmp/xax-bench-9cea09c-oldtrain-nostats` worktree, same older-HF stack, same `/tmp/xaxrc-oldtrain-hf452-local/config.yml`, same canonical aligned normalized 4-head grouped probe. It improved further to **`asr_wer_prefix=0.5`** with old-regime throughput (~29.9k samples / 10 min), EOS on both prompts, and clean gt-ASR. This is now the strongest controlled result seen on the detached old-train-only route since the earlier one-off `0.3333` spike: the sequence for this narrower no-stats variant is **`0.6667 -> 0.5`** so far, materially stronger than the earlier broad multiprocessing controls. That makes the **monitor-subprocess layer** newly live on the old-train-only route too, though it still needs another exact rerun before being trusted as a stable recovered surface.","timestamp":1774019585146,"segment":0}
{"run":682,"commit":"847d9d5","metric":0.5,"metrics":{},"status":"discard","description":"Exact third probe of the detached **old-train-cache-only + no-stats** route from #680-#681 — same fully local `/tmp/xax-bench-9cea09c-oldtrain-nostats` worktree, same older-HF stack, same `/tmp/xaxrc-oldtrain-hf452-local/config.yml`, same canonical aligned normalized 4-head grouped probe. It held **`asr_wer_prefix=0.5`** again with old-regime throughput (~29.8k samples / 10 min), EOS on both prompts, and clean gt-ASR. Even though the primary metric is unchanged and therefore logged as discard, this materially upgrades the branch's credibility: the new **old-train-only + no-stats** sequence is now **`0.6667 -> 0.5 -> 0.5`**, which is much stronger and more stable than the earlier broad process toggles on this route (`#660-#661`) and looks like the first monitor-layer intervention that may actually stabilize part of the old-train-only surface.","timestamp":1774020344422,"segment":0}
